用户,是否看过,评分,评论时间,有用数,评论
caecs,看过,推荐,2019-09-30 19:01:34,18281,咱也不知道关晓彤是干啥来的 咱也不敢问啊
cccddw,看过,还行,2019-09-28 22:29:52,0,"事故发生时的紧张感重现得很好，惊心动魄。

所以不建议近期要坐飞机的人看。

有些地方还是略显煽情，不过最后危险解除，张涵予拿起广播话筒的时候，以为他就要大煽特煽了，结果只是简单地道了下歉。这个处理好评。"
凌睿,看过,较差,2019-09-30 00:13:38,4633,"开拍前刘伟强第一时间去洛杉矶找了当初给《萨利机长》做特效的公司，就是为了避免被当成山寨版《萨利机长》。
态度是端正的，但是力不从心，拍出来比《萨利机长》差太多了。
《中国机长》就是一部灾难片，没有剧情，没有深度，除了特效什么都没有。
《萨利机长》空难只占了电影很小一部分，更多的是空难背后的故事，探讨制度和人性。
《中国机长》唯一的“空难背后的故事”，就是航天爱好者对空难的反应，但是这段剧情太多余了，没有任何意义，去掉也不会有任何影响。
当然，《中国机长》也不是一无是处，当初就很敬佩刘传健等机组人员，看了电影更敬佩他们了。
但正是因为他们如此专业，更加显得这部电影配不上他们。
原型人物这么牛逼，原型事件这么牛逼，你们就拍了一部中规中矩的特效大片，你们对得起他们吗？"
Evangelion_7,看过,推荐,2019-09-30 18:58:48,12748,关晓彤的戏份真是多余……
加斯珀哥哥,看过,力荐,2019-09-28 21:18:02,3321,好几个演员李现 焦俊艳等坐着演完了这部电影。
Peter Cat,看过,很差,2019-10-07 23:07:42,159,一个天然适合做类型片标准模板的素材，本是一次极好全民科普航空常识，且可以做的非常有技术含量的电影……结果是，水分鸡汤含量高达60%以上的灾难片，扎堆明星，释放下情绪，潦草圈钱片。导演毫无追求犬儒至此，那也就一星为敬吧。
渡口无边,看过,还行,2019-09-28 20:56:32,10635,真实事件本身从起飞到备降仅仅42分钟，而电影化的展开明显提现了编剧的黔驴技穷，用非常中国式的煽情和新闻联播脸谱化的配角群像去努力拼凑时间。其实用纪实性手段去还原事件本身就能足够震撼（开篇一些很专业的行业术语其实就很恰当），但非要加入雷暴这种完全不符科学常理的奇观设计，完全是在画蛇添足，更别说关晓彤这种每一秒钟都能剪掉的支线。原本事件的真实感被削弱殆尽，成了一个编剧主导的类型片，可惜了真实题材。
潇潇🐰,看过,推荐,2019-09-30 19:04:18,9172,关晓彤的戏份可以没有，完全没必要啊
阿暖,看过,较差,2019-09-28 17:35:00,2371,一直感觉这部电影缺乏高潮，前后都太冗长，全片都在强调民航的专业素养，真正到了过雷雨的猛戏，居然不拍机长的神操作 ，反而开始用爱发电了？？回来一查真实事件，原来就这部分是虚构的……好的，露怯了……打扰了。
不良生,看过,还行,2019-09-28 22:33:12,6912,袁泉的眼睛里真的有一种柔韧、硬净、清定的光。
Alex.V,看过,还行,2019-09-30 18:56:02,5976,张天爱尬，关晓彤尬，关晓彤还推了别人一把，笑死了，台词最后很尬
张秀才味羊汤面,看过,力荐,2019-09-28 21:15:24,1027,点映场坐满了人。完成度很高，这种政治正确类型片就怕煽情过分引发不适。不过看下来还好，有刻意煽情，但都被张涵予和袁泉的演技盖住了，台词功底太好了，姜还是老的辣啊！Angelababy一哭，下一段立马就剪一段惊心动魄的客舱内部的镜头，以掩饰演技的尴尬——演技不够，剪辑来凑，必须给剪辑师加鸡腿了！没有看演员名单，开头觉得演张涵予老婆的好像陈数啊，结尾出演员表才知道，噢，就是陈数。
飞侠式拼搏,看过,还行,2019-09-30 00:09:22,4279,"“怎么这么牛啊”，台词是牛。大多都是通过外界去表现机长的厉害，倒还不如正面也去好好刻画机长在危机时刻是如何力挽狂澜的。
前面控制得还算可以，后面节奏就出了问题。一个劲儿地煽情，明显太过了。而结尾的处理更是让人有些无法理解。
如此好的题材，结果拍成这样，真的就是白白浪费掉了。
袁泉前面铺垫了那么多，暗指有感情戏，结果到最后却又什么都没有解释。
请杨颖担任哭戏，这是来给片子制造笑点的吧。
至于关晓彤那条线，请问又是什么操作？完全不明白这条线存在的意义所在。
杜江饰演的第二机长随意出来搭讪撩妹，副驾驶欧豪也撩妹，乘务员坐在乘客腿上……槽点真的太多了，确定这不是在黑川航吗？
川航3U8633备降成都事件是民航史上的奇迹，刘传健机长是大家的英雄。导演你就给我们交份这样的答卷，请问你对得起我们的英雄吗？"
豆友199030760,看过,推荐,2019-09-30 21:24:31,8378,本来挺好的 但为什么一定要加关晓彤那一段傻屌剧情
清水沟,看过,推荐,2019-09-30 07:44:44,5908,关晓彤在里面干嘛。。。
冰镇西瓜橘子水,看过,推荐,2019-09-29 08:07:07,3059,三星半 想给袁泉跪下唱征服 hold全场 高光时刻多到不行 大屏幕有这样的演员是我们观众的幸福
掉线,看过,还行,2019-09-30 00:12:25,3013,【C】如果说作为一部安全教育科普片，它很好。但作为电影，不行。首先空难情节没写好，比如飞机速度太快降落有危险， 气氛那叫一个紧张……结果因为运气好降落成功了！空姐倒在地上晕过去了，群众那叫一个揪心……结果她自己醒了起来了！这种例子比比皆是，上一秒紧迫的要命，下一秒危机随时间自然而然解决，机组该有的智慧和勇敢，因为编剧的偷懒完全体现不到位（除了张涵予俯冲飞机那一招还不错），只好用一遍遍的喊口号来弥补。而且台词写的实在是太不生活化了，好多对话和镜头，我怀疑自己在看央视的公益广告。真实感不是靠说一堆高大上的航空名词就有的，真实事例伟大不伟大和电影好不好，也不是一回事儿。《中国机长》就像机场通道张贴的一幅大型宣传海报，看着宏大却全无共鸣。最后我想吐槽一下，张涵予您作为机长，这眉毛画的是真浓。
羊仔,看过,还行,2019-09-30 23:44:30,2137,关晓彤和杨颖戏份真的多余...
一位少男,看过,推荐,2019-09-21 16:41:54,2365,不错，大龙燚或成最大赢家，关晓彤的出现没有任何意义。
风间隼,看过,还行,2019-09-28 21:43:22,1211,商业包装的主旋律。袁泉、张涵予、张天爱都好。刘伟强的水准尚在，开场的职业奇观铺陈到位，登机到空难前的一段，平行剪辑小市民生活，紧凑生动。可这拍的什么剧情啊？飞机遇险，境外势力率先发难，心理失衡的边缘人图谋不轨。有人问得好啊：“难道我们没有知情权吗？”大难当前，你知情来干嘛？大难不死，你还知情来有啥用？英雄出手，大家都跟健忘症一样点赞、谢恩就好了嘛！追究责任、防患未然……这些事情我们根本不配知道。
大奇特(Grinch),看过,还行,2019-09-28 15:07:36,921,两星半，事件本身其实拍得还挺标准，在国内这类片里拔尖了。可是无论是对比《萨利机长》还是《迫降航班》，中国机长的人物塑造都趋于扁平了，为撑时长前后加了不少交代群像和结果的戏，显得又散又长。这就是硬件达标软件废，指望刘伟强拍成《萨利机长》是不可能的，他参照最多的应该是《国际机场1970》。不过这样的影片对广大人民群众了解民航各岗位职能，还能对航空安全起到普及作用，这点比机上的安全须知管用。
王食欲,看过,还行,2019-09-28 22:52:26,957,人物都很扁平。
呵呵倩,看过,还行,2019-09-30 18:14:51,611,事实证明，于东说不想让大家觉得这是中国版萨利机长的说法，是提前给打预防针啊，因为两者差距实在有点大。片子全程紧张是紧张，但结局太平了，还有关晓彤那条线是硬加的吗？？？
团小纸,看过,推荐,2019-09-29 00:21:26,702,现在中国电影太懂我的泪点在哪了，我没觉得自己该哭，但就是眼泪止不住的流，我对大飞机向来有偏爱，这种人类战胜命运的事情多少次看我都会哭。袁泉真的是女神，狭小空间的演技秒杀一切。
二十二岛主,看过,较差,2019-09-30 00:03:02,1397,只能算是半出好戏，优点和缺点都很明显。迫降戏拍的很刺激，可惜占比太少；演员表演不错，可惜部分角色设计实在太刻意脸谱化；就连灾难片的主题也被打擦边球地变成了“民航英雄赞歌”。花了大量的篇幅和笔墨来展现民航人的一天，还好拍的比较轻松扎实，不然简直和民航工作人员纪录片没有区别。“中国骄傲”这三部曲有一个通病，就是非要把伟光正的人物生活化，偏偏加入的很多生活戏非常鸡肋，使得人物形象更加拧巴，比如这部中机长的家庭线真是冗长又无趣，最该展现的他身处难中时家人们的反应倒是一笔带过。除此之外，袁泉等主要人物线索中断、乘客们完全成为道具、欧豪受伤后还能油腔滑调地插科打诨等bug比比皆是。如果最后真能逆袭成为国庆档冠军，也没什么值得骄傲的。
影志,看过,推荐,2019-09-26 01:00:13,418,原来登机前机组人员有这么多检查和准备工作，低估了空姐“端茶送水”的日常。全方位的乘机流程、空中和地勤服务展现，的确是新鲜又亲切的体验，有序规范的全配套操作和细节流程，看的好舒爽。毕竟曾经也梦想过做飞机餐饮收纳工作，哈哈哈…40分钟后的空中险情，对于经历颠簸都心有余悸的人来说，简直就是接近纪实的灾难还原。贴身体验和观赏性是它最吸引人的地方。映前贴片增加的“角色、故事经过戏剧化处理”也算聪明之举。敬畏生命、职责和规章，后半段好几处戳中泪点。最后机长和乘务长在机舱内享受片刻的安静，跟前面的备降危机形成巨大落差和对比，反而达到情绪顶峰…机组人员的临危不惧、沉着冷静和认真负责，更让人心疼。“当你认为没有错的时候，错就会来找你”
斯齊佐飛力尼克,看过,还行,2019-09-28 20:56:31,555,主要是感到惋惜，典型的画蛇添足，好好的题材非要把刀架在脖子上让你喊口号。刘伟强想要描画众生相，但这导演水准把众生相的展示几乎沦为填充时长的黑心棉了。
王大根,看过,较差,2019-09-30 17:45:12,1025,110分钟时长=35分钟登机发饭上厕所+45分钟飞机遇难机长带领机组成功返航+30分钟热烈庆祝劫后余生，而中间那45分钟有35分钟=15分钟乘客摇摇晃晃好恐慌+15分钟地面人员满脸担忧但是毫无用处地望着屏幕+5分钟以关晓彤为代表的航空爱好者不知道出来干什么，所以你算算看留着塑造机长这个人物的时间还有多少长……千言万语只能汇成一句：《萨利机长》真是部好电影啊！
一口吃掉小蛋糕,看过,力荐,2019-09-27 18:07:32,891,袁泉也太好了吧！最惊险的就是欧豪那部分了看着肉疼。就是完全搞不懂，关晓彤是干嘛的，以及一句台词都没有的AB是P上去的吗？还是用来凑片长的？？？最后大合唱突然变成同期声是什么鬼，不能降噪吗？太不协调了。
冥想高潮,看过,还行,2019-09-29 08:07:26,563,30分钟的版本应该还不错
西楼尘,看过,较差,2019-09-28 01:22:42,760,机舱仿佛被女儿施了平安的魔法，云层如同被上帝切了重生的裂缝。只有他们知道，平安从来不是靠魔法，而是日复一日的训练。重生并不能只靠上帝，还要有所敬畏的专业。当你相信没有错的时候，风挡玻璃却突然开裂。当错找上门的时候，除了讴歌和煽情，是不是可以多一点思辨，多一点追问，少一点自我陶醉。
不知道叫什么,看过,较差,2019-09-30 07:59:02,728,张涵予和袁泉演技不错，情节就很一般，还不如去看事件原型纪录片。
谢谢你们的鱼,看过,较差,2019-09-28 20:55:13,612,别说紧张感了，就连电影感都没有，大部分时间拍得就和室内小品一样，人物形象模糊、故事单薄、群戏松散、煽情刻意甚至连基本的叙事节奏都没有，大量无聊又尴尬的台词更是让整个观影过程让人感到煎熬。刘伟强一个摄影出身的导演居然连基本的视听语言都这么生疏了，本片别说和《萨利机长》比了，连《紧急迫降》都不如！
直,看过,还行,2019-09-30 02:17:56,384,少一些煽情会更好一些
章鱼,看过,还行,2019-09-29 00:26:32,311,中规中矩，好在摒弃了中国主旋律最容易犯的无逻辑尬吹，平庸在对于事件前和事件后的笔墨用了太多，而真正精彩的事故发生和处理过程草草带过。对乘客的刻画简直就趋近于零。
Luc,看过,推荐,2019-09-30 12:17:29,438,袁泉声音真好听～
Otomen,看过,还行,2019-09-28 20:24:45,266,2.5  观影神经是紧绷的，但是除去机组人员的优秀操作，你很难体会到更多。试图表达的情绪会稍显刻意，群戏支线太杂太无用，和萨利机长的差距太明显了  【空姐群戏也好过机长们】
月照沟渠,看过,较差,2019-09-29 09:00:21,534,"如果把这片子的体量压缩到《我和我的祖国》里一个短片的时间，我给五星。
拖拉且没内容，生硬拖时间，埋线没下文，两个小时没把人物立起来，除了徐克等少数人，香港导演拍主旋律真的不行。"
二月鸟语,看过,推荐,2019-09-28 22:39:50,332,平凡而伟大！即使知道结局也依然看得惊心动魄！而印象最深刻的其实是结局管理局高官巡视一遍面不改色的说：怎么这么牛啊，这句话其实就是片子的内核。本片其实和《萨利机长》是两部完全不同风格的作品，虽然都是还原那一天的真相，一部是对法律严谨度的拷问，而本片是对一份职业的敬畏，刘伟强从人性出发，在生死边缘徘徊的时刻，让你去经历真实和考验。制作在水准之上，情节铺排有序，表演松弛有度，袁泉不愧是舞台剧磨砺出来的，一个眼神足以盖过其他女性。唯一的遗憾在于对群像刻画过多而导致对机长的人物刻画少了很多维度，也可能是没看够。总之，应该去电影院向这群民航人致敬。
木卫二,看过,较差,2019-09-30 18:26:02,255,根据川航真实事件改编，香江快刀手刘伟强控场，机师帅、空乘靓，乘客各怀私心，地面坚守岗位，好像没什么大错误——但建议可以精剪一番，浓缩下与天斗的精华，替代文牧野在《我和我的祖国》的工作指标。而传说中，刘伟强牛掰上青云的手持去哪里了，只有机身在抖动嘛。细节上的处理，让空姐趴地上一群人喊”站起来”，让乘客暴起、推车冲撞，一堆人不停地比心点赞，真的很抖音很公益广告、抒情MV，难以理解。同样的奇怪细节处理，也发生在杜江身上，剧情需要他离开驾驶舱怎么顺便就四姑娘了起来，差点吸出窗全程补挂票的欧豪怎么落地后瞬间切换泡妞模式且被开除出乘客礼赞对象行列。
奥特曼和小怪兽,看过,较差,2019-09-28 21:37:15,142,一个真实事件愣给拍成个假的。剧本，镜头，表演，布景，灯光，CG，配乐都是灾难级的。本来抱着很大的期待，失望透顶。这片子的周期太短了，成片拼凑感极强。刘伟强拍建军大业中毒了吧，一堆明星出镜卖脸，制造不少废线。即使票房爆了，也是刘传建们的功劳。
降落伞,看过,还行,2019-09-29 01:05:15,126,属于合格完成任务的电影。但是故事本身值得歌颂和竖大拇指。
乌鸦火堂,看过,推荐,2019-09-26 20:25:49,91,刘伟强来还是适合这样的片子，从起飞筹备事无巨细的展现，相当有职业氛围，事件发生后空中与地面的紧张营造，摄影出身的气氛营造和节奏调度一气呵成，“敞篷飞机”紧张感十足。偏于写实风格，除了穿越云层等点到为止的艺术加工外，整体追求真实感，故事平铺、角色深度欠奉，关晓彤多余。电影把侧重点放在群像特写上，从机长、空乘、地面塔台、社会各界等多个角度，让观众全方位体会了这场世界民航史上的奇迹。PS，张涵予、袁泉真好，AB只是纯客串，李现不是酱油，戏份很重哦！
已注销,看过,较差,2019-09-30 04:00:13,140,水了太多内容，全员没有几个演技在线。
张日飞,看过,还行,2019-09-30 14:53:44,124,前半段很好，后半段强行加戏。发动机受损，雷暴天气，擦雪山飞过还没触发TAWS告警。可能后边实在没什么可讲的了，编剧只能强行加了。另外，空地对话语速实在是太慢了
胤祥,看过,还行,2019-10-01 15:30:28,38,对民航各种细节的展示构成的奇观感大概是本片唯一有趣的地方。以职人电影/行业电影入手，加上天然的灾难片和大部分的Real Time Film两个可供利用的路径，这么拍相当之稳妥也相当之乏味（更别提“爸爸回家了”这种恶俗的叙事了，再说对所谓乘客众生相的展示简直集恶俗之大成……）。这种真实事件改编题材固然有上限，但是自己把天花板设计得太低了就别怪别人了……
冰拿铁不加糖,看过,力荐,2019-09-30 08:44:06,179,有些客串的太尴尬了吧！！！为袁泉爆灯！！！爆烂一百个！！！
同志亦凡人中文站,看过,较差,2019-12-03 16:18:57,57,实名diss废物编剧，剧情不够新闻联播来凑，连正常对话也不会写。明明是一个比“萨利机长”凶险百倍的真实故事，结果尬得我想吐，唯一值得看的特效还是好莱坞代工的！所以，每个角色都过目即忘是怎么做到的？
粒粒酱,看过,较差,2019-09-30 23:28:55,117,职业的加持也没办法让我给这部片子打五分。多好的题材啊拍成这样？！强行中国式煽情+混乱的发展线削弱了故事的真实性，关晓彤干嘛来的？！等云裂？！原型机长同意这么拍？！完全没有想哭的冲动，甚至和飞行员相视笑出了声。就希望大众看了这部片子对灾难能有点畏惧感，调座椅靠背、打开遮光板这些最起码的安全规定能麻溜儿的做到，别特么让乘务员再费口了（今天飞到抖音红人，十分钟三个乘务员去劝了她五次才把座椅调直）
瓦力,看过,较差,2019-09-28 21:40:21,98,《中国机长》从角度选取上就输给《萨利机长》了，前者只展现灾难及化险为夷的过程，后者侧重事件对当事人影响及探讨制度与人性，因此没必要做更多不合适的比对。本片过度依赖特效、声效和镜头晃动营造紧张氛围填补故事层面的孱弱无趣，看上去很紧张刺激实则拖沓注水废戏超多，如果没有袁泉实力撑场估计只会更无聊。除技术层面有进步，还不如19年前同样改编自航空史上奇迹的《紧急迫降》。
嗷呜呜,看过,较差,2019-09-30 23:31:13,124,一星给真实事件，一星给袁泉。
阿朽,看过,较差,2019-09-27 20:23:44,117,烂片 前半小时后半小时都是尿点 不能压缩点吗 乘客群像完全没个人特色 各位空乘的脸我都分不出是谁  而且摄影谁弄的啊 就是各种晃 超级烂啊 特效别提了 上海堡垒同款水平  但最大问题还是剧本 不说人话 为袁泉挽尊加一星
隐,看过,力荐,2019-09-18 22:42:12,155,张涵予袁泉各顶半边天，刘伟强拿出了全部功力，一口气下来没泄气，节奏与情绪调动俱佳，紧张刺激，值得鼓掌。
神枪沙子龙,看过,还行,2019-09-28 19:51:18,111,邵兵成了张涵予，徐帆成了袁泉，黄奕池华琼们成了李沁张天爱，我却遗憾的发现，中国机长拍得还不如二十年前的紧急迫降。
七海,看过,较差,2019-09-28 22:23:32,111,扑克脸张涵予是来拍画报的，欧豪是来耍宝扮酷的，杜江莫名其妙勾靓妹，张天爱李沁走了一趟T台，保守来算，袁泉贡献了本片唯一演技值，另 导演是把新闻联播的台本直接拿过来念了嘛?
翌嘉,看过,还行,2019-09-30 23:09:11,107,本片再一次证明了一个普通的剧本多好的演员都拯救不了，真是浪费题材。电影还有一众献礼片的通病，大大小小的配角都有叫的上名的明星出演，然后就一个一个完成任务似的给镜头，刷脸，真的很多余。没看以前我以为最多余的是杨颖，看了之后才知道关晓彤才是最多余，直到现在我也没想明白她那一部分故事和其他人物有什么关系，个人觉得她大概代表吃瓜观众。ps：我要为袁泉老师打call，她站在那里就告诉观众——我是毕男，一名乘务长。
dj,看过,还行,2019-09-29 06:50:10,96,为真实事件致敬。电影一般般啦
昭和惊弓鸟,看过,较差,2019-09-28 22:15:38,82,后半小时管弦乐一奏，眼光凝重心系祖国，然后再往观众脸上抹一脸的意识形态，这也就成了。核心的机长形象扁平而工具性，为了凑片长塞了太多无趣而廉价的群像冲突，裹着事件的皮下面却也没有什么细节。
爱尔兰的天空,看过,推荐,2019-09-28 21:36:34,106,想说的都写在影评里了，我想多说一句，虽然影片仍有瑕疵，但一个新的分类——中国灾难片，仍让我们激动不已。
what'swilliam,看过,还行,2019-09-30 00:15:39,74,意外水准之上的商业片，国庆要逆袭。3.7星。1.全程节奏流畅，废章屈指可数，喜剧成分点到为止，欧豪油腻得刚好。2.配乐出彩耐听。3.成为杜江路人粉，演技工整自带憨厚真诚，好感度up。4.泪点：看战友的爷爷说“他们比你还小呢”。4.给本片拖后腿的两人：AB大宝贝和关晓彤，尤其后者，大宝贝不要哭，关晓彤请不要开口，这个角色存在的意义是什么？没有。5.某些段落刻意追求煽情，多了会拖节奏。比如袁泉后半段对乘客的大段演说。6.有陈情令的温情？李现一露脸影厅响起花痴声。杜江亲AB观众笑嘻嘻。7.如果硬要和萨利机长比，输在深度余味，赢在惊险节奏。
晚不安,看过,还行,2019-09-28 21:06:21,69,18年的新闻不到一年半以后上映，电影界也终于「中国速度」了一回。剧本从早到晚把一整天复盘一遍，外加各部门、社会各界反应，没有任何惊喜，也没有什么重大失误，除了那些肉眼可见的照顾普通观众情绪的段落。立项之初就知道不可能有《萨利机长》的角度，就冲着树立英雄典型去的，写成扁平人物也在意料之中。当创作没有任何障碍的时候，最容易、最顺畅的那条路，往往也是最无趣、最危险的。你知道自己会被飞机的颠簸吓到，但绝不会留下任何心理阴影——这就是本片的失败之处。朱亚文的压轴亮相最是精彩，领导装扮、复杂神情，厚黑学呼之欲出。我还找到几秒钟《攀登者》彩蛋。
Wisteria,看过,还行,2019-09-30 19:09:16,67,情节很好，激动人心很感人... 但是有一些side story的安排不仅不能丰富主线，反而尴尬的要死... 比如关晓彤的那一队航空爱好者，我的妈呀... 救命
Young,看过,力荐,2019-09-28 21:11:19,92,看完点映，必须要打五颗星。整个片子动静节奏把握相当好，除了关格格那段感觉有点累赘，不过戏份少也不影响。可以说是全程高能，小人物的刻画不多，但很真实，回家的藏族母子，看望战友的老兵，打工带娃夫妻，在面临死亡时表白带娃小年轻……哎，我大川航真的牛啊
张大水,看过,还行,2019-10-02 21:59:43,43,关晓彤一把把路人推倒时，我还以为她要开始唱你XX了！
michaelchao_cc,看过,较差,2019-12-08 00:02:39,1,在春晚现场搞预热，造势是一流的！但本片的效果....  拍出人定胜天的感觉，飞机在夹缝中穿过积雨云那不是和《圣经》摩西把红海分开一样么？拍出了航空公司宣传片，飞机起飞时地勤、塔台、乘务组需要干什么   尽管本片很好地复原了3U8633的部分紧急状态，但是过多的无辜群众反应镜头，全民关注的反应镜头。。鸡肋又浪费时间，真的是把本片拉掉价了。以至于本片甚至是换了个壳的《紧急迫降》。
黄青蕉,看过,较差,2019-10-08 21:34:31,27,空难全靠晃，看完出来我要呕了…是因为原型只开了42分钟才硬水那么多奇奇怪怪的视角只为撑够时长吗？可是萨利机长原型才开了六分钟啊！
真费劲啊,看过,还行,2019-09-30 18:55:48,73,确实是好编剧好演员太少了。电影没有表现出机长到底厉害在哪，反而给我感觉他只是在赌运气喊口号。中间男主想象给女儿过生日的情节，感觉有点水时长。原型人物确实很厉害，只是那个情节可能不足以拍成两个小时的电影，再加上中国的好编剧又不多……
