用户,是否看过,评分,评论时间,有用数,评论
安德烈大叔,看过,较差,2019-10-02 17:27:51,45,那种最不想看的“行活”作品，受制于电影之外的因素太多，创作者似乎没有耐心与意愿去突破那层纱。剧作很对付，人物扁平无血肉，情节尽是顺拐，而真实事件之外的留白发挥处则大面积注水。私认为拯救该片的唯一办法就是剪成30分钟，并入成为《我和我的祖国》的第八个故事。
sillygirl,看过,较差,2019-09-28 21:05:52,45,刘伟强拍的也太差了，浪费故事。
成欢,看过,推荐,2019-09-30 12:57:11,133,三星半。为李现加半星哈哈哈哈。感觉是导演认真拍但没费劲儿拍的作品，叙事流畅、调度游刃有余。能力远不止于此吧。/ 为拍出专业人员的专业和群众的群众鼓掌。（虽然依然是香港导演而不是内地导演拍的…）感情戏都有点太煽情和尴尬了。/ 朱亚文一个配角居然存在感这么强…“怎么这么牛啊。”这才像句真的会存在的台词嘛。/ 袁泉太美了。美得铁骨铮铮又有收敛锋芒的态度。/ 焦俊艳身上也有极强的职业感。爱了。/ 李现演得怎么说呢，仿佛是素人来客串的哈哈哈哈哈哈哈哈哈 人家都是在演戏，就他仿佛就是那个监管员小罗。可以，很方法派了。
丑奴儿,看过,还行,2019-09-30 22:40:41,69,题材是好题材，但剧本糟蹋了这个题材。有些人物形象不丰满的角色，完全没有出来的必要，他们出来就是为了增加影片的时常吗？
MolllllllloN,看过,力荐,2019-09-28 22:24:30,72,观影前我的手里准备好了纸巾 因为当初事件发生的时候我就被刘机长伟大的事迹深深感动到了  我想 电影可能不能完全体现出当时恶劣糟糕得状况 毕竟事实就是事实 没有亲身经历过又怎么能完全的复原以及体会呢  由于历史上曾经有过类似空难的发生 结果令人惋惜 而我们的机长创造了奇迹 朱亚文那一句“太牛了”是真的太牛x了！过硬得心理素质挽救了一百多位生命 一百多个家庭 为我们的中国机长点赞 👍四川8633 欢迎平安回家
tk_7.7,看过,推荐,2019-09-30 22:11:48,120,一直很爱袁泉，她有一双亮晶晶的眼睛。看了电影后，开始迷上她的皱纹，喜欢她镇静冷冽的气质，喜欢她眼里的星星✨
不是梨是pearl,看过,推荐,2019-09-30 19:09:01,121,我能理解导演拍关晓彤那条线的意义 更丰满一些嘛 但事实就是非常减分…故事讲的确实不够完整。
中森,看过,力荐,2019-09-30 19:06:53,85,"对于机长来说惊心动魄用一句话概括就是：飞机坏了，晚点打给你。
没有多余的解释只是：
敬畏生命，敬畏职责，敬畏规章。
'我爱祖国的蓝天'，结尾是祖国给的安全感。"
xslidian,看过,推荐,2019-09-24 22:42:28,87,中规中矩 降落后的戏略多余  欧豪的镜头太快看不清 等正版上线暂停看  幸好博纳主导OneCool后期 电影感没丢 如果是中影做就惨咯（亲密旅行大开眼界）
LOD,看过,推荐,2019-09-30 11:36:24,81,"优缺点都很明显的电影，主演演技很给力，尤其是袁泉，特效什么的也很真实，很多航空相关的内容都很专业的感觉，至少外行人看着还是挺惊奇的，飞机出事那一段拍的很惊险。
缺点是客串名演员太多，除了陈数和军方长官其他人演的大都浮于表面，给关晓彤差评，太出戏了，然后人物塑造重点不明，温情牌打太多啦，飞机上打飞机下也在打，飞机外的人基本都一个表现，飞机上倒是都不一样但是刻画的也太浅了，根本没想好好刻画任何一个乘客吧，几乎所有乘客都是只匆匆刻画两句就下线了，结尾平淡的情节太多了，而且对伤员的表现也很奇怪，伤重的欧豪都没人看一眼。"
夏奈,看过,推荐,2019-09-28 21:51:57,86,大型川航硬广，片子本身就三星吧，全片演技在线的大概只有袁泉，其他全部用力过度却还哭不出来；过度的煽情和太多闲杂人等，关晓彤的线有事吗？不过还是推荐去看的，看看乘客上机前的预备工作和机场幕后工作人员的辛劳也好。
浅浅快跑,看过,推荐,2019-09-30 22:01:21,90,有点流水账，不过遇险过程还是很惊心动魄的。落地之后比较拖沓，还有关晓彤那一趴是什么鬼？感觉完全可以剪掉，另外这些航空爱好者是怎么看到各种航线图和听到塔台的各种指令的？
时间之葬,看过,推荐,2019-09-28 09:45:58,49,"因为真实，有一种过去的空难片里罕见的临场感和震撼力，对一系列危机高度写实的表现，就像是开启了一次灾难片现场的恐怖直播，最终有力地衬托出机组成员和地勤工作人员临危不乱的专业能力和坚守职责。

张涵予和袁泉的角色给人印象最深刻，尤其是后者的表演，都是在不露痕迹之处见功夫，外柔内刚，临危不惧，极好地诠释了这个容易被轻视的重要人物。在这个高度契合袁泉本人气质的角色身上，也体现了影片最核心的要旨——敬畏生命，敬畏职责，敬畏规章。"
徐若风,看过,还行,2019-09-30 16:51:07,23,2.5  还没《烈火英雄》好看，场面完全不够...作为国内少见的空难片，前半部节奏和调度上够“行货”水准，但之后却慢慢崩坏。编剧放弃深挖事件的可能，拖时间废戏、煽情尬戏成堆，主题空泛。况且，也没体现出张涵予哪牛了，我怎么感觉还是杜江功劳大呢？空姐团们也slay全场，怎么不改名叫《中国机组》呢？演员们倒是普遍卯足了劲，尤其袁泉，摆出各种“狠抓细节”的演法，至少能让人看得下来吧。
ZeonGin Sou,看过,还行,2019-09-29 08:10:32,66,中国电影题材新拼图。我们终于有了自己的空难电影。全片是对中国航空业工作流程的科普，更突出中国体系下“一方有难八方支援整体调度”的联动体系，展现70年长足的进步。各种大气的建筑内部终于不是N十年前的简陋。初出茅庐，有粗糙之处难免——机长心理活动生硬还不如没、李沁角色原型明明无敌可塑性爆炸但偏偏细节缺失、废线没错说的就是关晓彤莫名其妙的爱好者女儿机舱小天使什么鬼浪费时间破坏节奏影响沉浸感。
陈优雅,看过,还行,2019-09-30 19:11:19,62,"大型超长川航宣传片不建议近期乘飞机出行人士观看"
SebMia,看过,还行,2019-10-01 01:15:04,46,关晓彤那条故事线简直就是放了一个很有仪式感的闷屁。
刘在石的妈妈粉,看过,力荐,2019-09-28 21:09:17,61,"先说三个缺点：①敢安排安哥拉大宝贝客串哭戏，导演真是个爷们儿🤙
②电影里欧豪角色存在作用比较鸡肋。
③中间部分飞机外各种无谓煽情戏过多，如关晓彤毫无意义，影响主线节奏，也尴尬，明显为了硬凑时长…
除以上问题外几乎完美。本片恐怕是国庆档最佳，毫无疑问大片风范，全程紧张刺激，即明知HE，我还是不禁悬着心脏于半空。
演技、特效、配乐、镜头调度，都配得上这项人类伟大奇迹！
享受杜比全景声实在不能更震撼。
最重要是，群众的角色塑造与表演也全程在线。它没有沦为张涵予的英雄独角戏，也没有太主旋律，反而机组配角和群众的戏份更加重要，是他们支撑了整部电影。杂而不乱，导演对密闭空间群戏的掌控可谓完美~
（get到张天爱颜值）
全中国应该没有比张涵予更适合演机长形象的演员了。
最后在安静的机舱里那张侧脸，完美。"
迷失东京,看过,还行,2019-09-30 23:22:52,62,本以为是中国版《萨利机长》，看完发现完全不是一类片，《萨利机长》把重点放在了事故后的调查上，而《中国机长》拍的是这个惊心动魄的故事，更像《聚焦》这类型的电影，都是原原本本将一次重大事件还原……其实把时长缩减到90分钟，砍掉那些非必要的情节，把故事更加集中到事故发生到反应到结束这个过程，更干脆利落的话，评分估计会上一个档次。
晚晚,看过,还行,2019-10-01 01:48:43,48,想知道挡风玻璃为什么会碎掉
萨库拉,看过,较差,2019-09-30 12:26:27,33,跟《攀登者》一样，类型都没有完成。原故事那么精彩，却不知道怎么在灾难本身做戏，用大量无谓的周边反应填充。机长人物完全没有建立，智慧、人性、危机下的选择统统欠奉，最后竟然靠打鸡血冲出云层，还不如欧豪这个角色有戏剧性。
猴子kyle,看过,还行,2019-09-30 21:22:17,36,很明显 导演和编剧在真实事件的前提下想要通过各种途径使电影更充实 但是很可惜失败了 显得电影既冗长又平淡 (袁泉好美～)
海角七号,看过,较差,2019-09-28 21:05:48,52,流水账一样的剧情
法兰西胶片,看过,推荐,2019-09-30 20:17:44,30,刘伟强自《头文字D》后最好的创作，开篇乘务组检查飞机的段落对我而言和风挡破碎后的一小时同等猎奇，基于导演早年纪实摄影的爱好，信手拈来。其实灾难发生后驾驶舱内的动作属性是非常低的，甚至压缩了表演空间，但整部电影的节奏感却一直没有垮塌，天上地下甭管在干嘛，彼此接力棒传得挺好，在紧张度上是比当年《紧急迫降》要顶的。
True,看过,较差,2019-09-30 06:56:51,48,台词略尴尬，某些场景略尴尬。为了把半个小时搞定了的事拍成一个半小时加入的戏剧化的成分太多了……反正作为业内人士看就觉得特别假
沧海一小生,看过,还行,2019-09-30 23:23:31,38,太喜欢袁泉的表演，她太适合乘务长这个角色了，内敛却气场强大，不知不觉间被吸引，即使眼神的流露都让人记忆犹新！
heekuma,看过,推荐,2019-09-30 21:23:51,53,如果一些可有可无的人物可以不出现就更好了
伽兰,看过,还行,2019-09-30 21:26:02,48,四星，关晓彤扣一分
梅花野老,看过,较差,2019-09-28 20:57:08,41,单位组织观影，博纳影城。勉强及格水平，平庸且煽情，大量的煽情情节暴露出编剧黔驴技穷，且不说煽情情节注水，更是影响叙事节奏，使得电影拖沓冗长。我是真的一直在等演职人员表出现。没想到几个空姐，还是袁泉最漂亮。
逐鹿,看过,还行,2019-09-30 10:43:54,37,电影像春晚一样热闹
懒猫戏花枝,看过,较差,2019-09-29 01:09:43,33,不懂该片的意义，更不懂刘伟强的意义。
赫恩曼尼,看过,还行,2019-12-08 17:12:03,26,一旦电影名和“中国”挂钩，就注定了这部电影的走向和手法：一定是以情绪渲染、烘托英雄人物、褒奖航空配合的主旋律题材。为什么和《萨利机长》相比，这样的方式在呈现力度和感染力上反而大打折扣呢？因为它吞没了人的选择、恐惧、痛苦、挣扎。而真正打动人的，永远不会是意义说教、空洞赞美，而是一个人在面临危难时无法抵抗命运的脆弱。我不相信这种脆弱只能通过空姐披头散发、带着哭腔的播报、机长想象给女儿过生日、副局长竖起大拇指这样的直白动作来表达。
JC,看过,较差,2019-09-30 09:13:46,43,这是个四川航空宣传片吧，情绪渲染和转场全靠配乐+说话，剧本刻画点有点跑偏感觉，铺垫在了没用的地方……不知怎么了人物就都哭了。哎，电影应该说的是一个故事，而不是把片段拼起来，只能当宣传片了……低于预期，有落差。
孤岛影者,看过,较差,2019-09-28 21:36:06,42,首先剧情是非常标准的三幕结构：第一幕像是航空宣传片外加人民群像展现，第二幕是标准通过故事内外人物描写呈现的灾难片，第三幕是如张涵予见面会般等待的致敬以及英雄回归生活。其次想要向剪辑师致敬，平均2-3秒一个剪辑，他不累我都看累了，而所有人物走向都是生死经历后的感恩与感动，那前头蒙太奇所捕捉的人设也就毫无意义了。然后再到剧情槽点，实在是无力吐槽，如果有带本子可以记得抬不起头，但仔细想想这是献礼片那就这样吧（？？？）。最后再说回群像：机上乘客就是“56个民族56朵花”，隔壁航班机长就是“众志成城众口铄金”，以及航天爱好者等这样的“一方有难八方支援”（啊，真的不是在讽刺吗？）。看到鼻青脸肿的欧豪以及一脸蒙蔽的朱亚文，观众都笑了。
まさき,看过,还行,2019-09-28 21:57:01,44,流水账叙述，燃点是风挡碎了到穿越风暴这段，缺点是机长女儿的剧情太尬了，优点是袁泉带队的空乘组，拍的比机长组更让人感动。
奇妙能力哥,看过,还行,2019-09-30 21:18:10,51,题材很好 拍的很烂 以上
Rachell,看过,推荐,2019-09-28 21:10:42,33,紧张的地方真的紧张。看到其他行业的场景。煽情的地方就太尬了。为袁泉加一颗星。
SleepWalker,看过,还行,2019-09-28 20:37:33,37,就别跟《萨利机长》比了，落脚点就不一样，前者是人物塑造＋事件还原，这个只是单纯事件还原，所以张涵予演得再拼命也没什么用，角色的剧作功能就限制死了。各路明星走马观花串场咱也不说什么毕竟多少还有点用，但强势插入关晓彤那段纯废戏是什么意思？看来博纳预算充足到没地方花了。事故前的众生相拍得算不错，几个群众演员存在感还挺强。回过头来，这片的片名起的真实操蛋，把“长”换成“组”就好很多，崇尚个人英雄主义不是美利坚那套吗，我们不是向来集体至上的吗？
松田龙平新女友,看过,还行,2019-09-30 21:50:09,45,很一般的电影……明明是很惊险的事 但太多民航其他的部门的人事出镜了 导致机上发生的事一直被分割 毫无刺激可言 而且黄志忠（李现领导）哭的那一刻真的是太好笑了……
okkkkkeai,看过,力荐,2019-09-30 23:21:48,43,袁泉真的好棒
晼晚,看过,还行,2019-09-28 21:55:42,39,能不能好好聚焦于机长、机组在危难时刻的表现？东一榔头西一棒槌的表现形式，将好不容易营造的紧张感消磨殆尽。脸谱化的人物，廉价的煽情，使这个本可以优秀的川航故事落后了隔壁萨利机长三十个紧急迫降。
ooops.,看过,还行,2019-09-30 23:30:37,33,充分认识到了艺术来源于生活而高于生活了……加那么多明星 某些演员就只需要做做表情就行了 真的很尴尬 最后副机长都那样了 都不需要上救护车的…好在过程的艰险还拍的可以
兔小兔,看过,还行,2019-09-28 21:54:29,41,好故事，没讲好。感觉铺了好多线，反而盖住了主角光环。。想到一个老片《紧急迫降》，全片看完就记住邵兵演的机长多么厉害。看，这就是效果。普通老百姓根本看不懂那些飞行数据，副线就得解释。可并没有……可惜了。已不是无间道和雏菊 伤城时期的刘伟强了
I’mAppalled,看过,还行,2019-09-30 23:29:24,33,"影片前半段可以给四星，但是后半段两星不能再多了。
另外大喊一声：
我爱袁泉！！！（超大声！破音！！）"
不脱袜子同学,看过,还行,2019-09-28 21:26:26,38,3星半吧，真实质感做的还是不错，中规中矩，故事就那样（“小正大”——小人物正能量大情怀），跟新闻报道区别不大，还是比《烈火英雄》强上不少，虽然某些大特写镜头和口号还是让人略感不适。对于川航太熟悉了，每次回家过秦岭基本都会遇上气流，空姐是真的漂亮，表示女演员都选长成那样的，没毛病：）
有有,看过,还行,2019-09-30 08:29:35,36,整体故事比较完整，中间过程不是很精彩，有些情节硬凑，最后迫降挺紧张的，袁泉气质真好，李沁是真的很漂亮
西帕克,看过,较差,2019-10-01 12:44:07,21,拖沓煽情，乘客戏多的可以凑一部《迷失》了。有英雄和庆功，但连飞机出了什么问题都没说。想想一场空难，也许只是为了虐一下欧豪？
小A,看过,推荐,2019-09-28 20:18:06,24,全明星阵容。和《紧急迫降》一样是全景视角，机组成员、各行各业各阶层乘客多角度还原灾难历史。Mike Leigh《彼铁卢》也是全景视角，可以相互比比有什么优劣。虽然张涵予很英勇，但实际上剧作的转折点在杜江身上，从客舱艰难走到驾驶舱，把副驾驶拉回来，自己戴上氧气面罩再给两个人戴上，三个人才算反客为主。“小潘”张磊戏不少。还有很多熟脸叫不上名，哪儿能看全部演员阵容吗？
天一久,看过,较差,2019-09-30 22:38:02,49,#中国机长#可能是期望太高……这是什么神仙剧本(╯‵□′)╯︵┻━┻没有好题材你拍不出东西就算了，现在硬件软件都齐了你就给我看这种故事？？？？这是什么老土到掉渣的审美和5毛抠图特效啊！你，告诉我为什么控制中心和塔台都搞的跟40年前奥特曼地球防卫中心似得？你看过20年前的紧急迫降嘛？！你看人家是怎么讲故事的！你告诉我2019年你拿这种东西出来你好意思吗？！莫名其妙大道理，莫名其妙煽情，真心太难看了……更是塞了一堆莫名其妙的演员进来，完全没有一个人物立得住。如坐针毡面无表情看完……我要再看一遍紧急迫降，萨利机长甚至更鬼扯的烈火凌云拯救我的血压【可惜了好题材……向真实事件中的相关人员致敬！！】——仅针对电影本身。【这片和烈火英雄一样，都是好题材，渣剧本，甚至渣的无比相似，仿佛出自一人之手，手动再见
我说文小博,看过,较差,2019-10-02 23:29:09,38,作为一个四川人，这件事从头到尾四川人民都非常清楚并且引以为豪，怎么拍得这么平！！刘机长下来的时候整只手都无法动弹直接送进医院，根本不是什么还能磨磨唧唧半天自己走回家，其实导演还原真实事件就好了，我泪点这么低的人，硬是一点没感动出来！可不可以跪求重拍！
Zzz,看过,还行,2020-01-06 16:57:59,0,现在看完了我已经快吐了，莫名其妙的感情戏，十分业余的航空act
深夜声噎,看过,力荐,2019-09-28 21:49:55,34,总算有部好看不错的，毕竟刘伟强，最美乘务长男姐超美棒哭!(片尾的原版也好美)，加一星，这才是正确的振奋人心方式，把牛做出来给大家看就对了，别老逼逼喊一堆口号，没有对比没有伤害，对比之下怒加一星，即使没有资格举手，也不打算生二胎，一刷杜比全景声厅，应该会是唯一二刷的国庆片，再刷个巨幕或IMAX版。李现是挺帅的。
舫原,看过,还行,2019-10-01 01:39:48,25,终于安全降落之后的戏份拖得太长了，要是那些后台的工作再加一些就好了，什么塔台啦控制室啦……毕竟，很少见到。演员是真养眼，男帅女靓，袁泉也太棒了！
Pluto,看过,还行,2019-09-30 20:15:48,27,优点是前半部分对机舱准备工作进行细致交代，有职业剧的范儿，有港片导演的节奏。明显的缺点是太平铺直叙，戏剧冲突根本不够，编剧真还不如若干年前的紧急迫降。袁泉气场到位，只是别的角色都交代了生活部分，怎么对她就虎头蛇尾了呢？张涵予气质符合，但只立了一个表面英雄形象，没有人味。
Pardon Me,看过,还行,2019-09-30 21:22:52,35,美女们让我移不开眼，还有杜江请求他一直演主旋律片我都能看下去。
无耻不混蛋,看过,较差,2019-10-02 15:20:33,23,半部好片，明明一小时就能“结束战斗”，硬硬撑成了将近两小时。掐成去尾，也就高空遇难部分能看，冲出云层后几乎都是废戏，只剩下没完没了的强煽情，对机长的塑造，既空洞又单薄，说机长牛只剩下竖大拇指。要不是袁泉、张涵予演技好，讲真，这电影跟《上海堡垒》半斤八两，离《萨利机长》中间差了10部《紧急迫降》。
谋杀游戏机,看过,2019-09-28 14:25:06, ,24,首先能看出来的是这片受到民航部门很多支持，对内部运营情况进行了细致和严谨的取材。其实对我个人来说，我最大的兴趣点是科普，坐飞机几百次也不会有机会了解飞行员和空乘到底是怎么工作的，为什么起飞降落要有那么繁琐的要求，这片是一个了解的入口。然后就是故事讲得还是挺真实的，没有虚构商业类型片那些花里胡哨的东西，不强行煽动情绪。《中国机长》这片名有一定代表性——它讲的不止是刘长健机长一个人的故事，而是这个系统里所有中国机长、空乘人员能最大化保障安全的原因。演员都不错，本人亲证川航空姐确实超美，哈。
Samueeeeeeel,看过,较差,2019-09-30 23:28:15,34,"我慢慢学着不再结合一部电影背后的真实故事去评价一部电影的优劣。如果真实事件足够震撼电影却拍的一塌糊涂，那不是对英雄更加的不尊敬，对观众更加的不真实吗？

多的不想说了，跟《萨利机长》相比，大概差了一百部《烈火英雄》吧。"
兜兜~,看过,较差,2019-09-30 22:35:34,46,这是什么……我最想看的情节那么短？我不想看太多家长里短好吗？做的决定那么简单？一堆人坐在屏幕面前紧张一下就是剧情张力了？关晓彤那帮子人是吃屎的吗？那么多空管部门也不解释一下……仓促了点吧朋友
酒酒,看过,2019-12-28 13:45:26, ,3,“四川8633，成都在叫你，听到请回答”
女神的秋裤,看过,推荐,2019-09-28 21:17:59,24,整体可以，目测能打。虽然还是有剧情台词刻意的问题，重复单一的镜头凸显出视角和机位的匮乏，个别支线有点奇怪，但整体基本呈现出一个完整惊现和感人的故事。
托尼·王大拿,看过,很差,2019-10-21 21:15:01,12,“灾难”大电影，废戏一货舱。
王壬土,看过,还行,2019-09-30 21:46:52,35,张涵予有多man   几个硬加戏的和几段煽情的  就有多尬
张凌岛,看过,较差,2019-09-30 21:39:00,29,原型挺好，最商业最广谱的题材拍成这个样子刘伟强不行！前半小时无事发生后半小时拖拖拉拉。ab和关晓彤怎么也没个预警。
soarla,看过,还行,2019-09-28 20:52:40,35,去看电影之前看了面对面对包括机长刘传建和乘务长毕楠在内的机组人员的采访以及网上川航8633遭遇事故前后的录音，觉得刘机长真的很牛，也很为整个机组人员相互之间的信任和完美的配合感动和敬佩。但是电影有点太刻意煽情，而且剧情有点过于平面化和脸谱化了。只能说一般。最后希望事故的原因调查早日出结果，挡风玻璃为何会突然碎掉导致128条生命于危难之中飘摇，尽快给公众一个交代，这个才是最重要且不能被淡忘的。
麻绳,看过,较差,2019-10-01 20:13:35,14,当初知道这个事要拍电影就奇怪该怎么拍，本来就是一个发生故障后按照常规操作坚持到安全返航的事故，既不传奇也不灾难。看了以后才知道，靠的是兑水。110分钟的电影，展现事故的也就40分钟吧，还一多半放在了空姐和地面指挥上，并没有中国机长多少事。飞机着陆了之后还有半小时才结束，漫长的垃圾时间。
法棍老人,看过,还行,2019-09-28 20:58:13,15,敬畏生命，敬畏责任，敬畏规章。
让我留在你身边,看过,推荐,2019-09-30 17:01:37,28,真实事件加分吧，作为电影还是差了很多
巴伐利亞酒神,看过,还行,2019-10-14 16:03:20,8,吃火锅时，请不要唱歌，谢谢。
five2uknow,看过,还行,2019-09-30 19:01:51,31,瑕疵也不少，但能让人看的不太记得时间流逝，至少说明足够有吸引力了。
三千岁,看过,较差,2019-10-02 23:17:58,21,川航3U8633真实事件只有34分钟，从事故发生到飞机降落。电影进行了非虚构性改编，也就是做了90分钟左右的“戏”，艺术化改编无可厚非。这九十分钟里空乘人员安抚乘客几乎占去一半比重，机场、塔台、军方、指挥中心等分掉剩余三分之一，片头片尾的“加戏”，以及看似凶险恶劣的气候等。不同于好莱坞以人为主的叙事方式，本片以事开始，采用散点视角轻描淡写的对事件主要人物进行粗线条勾勒，导致的结果是所有的人物都欠火候，没有情绪积累到释放的层进过程。关晓彤的附线到底在干嘛？抱骨灰的人有什么下文？机舱内人物只是机械的负责紧张、慌乱，空姐就机械的负责背台词。从篇幅比例来讲，机长刘长健的内心戏几乎为零，驾驶舱内的反应应变以及专业视角的呈现很尴尬。改名《中国空姐》还是比较恰当的。
mOco,看过,还行,2019-10-02 13:06:08,10,把创作目标局限在了还原整个事件，自行拉开了和《萨利机长》的差距。空难段落固然动人心魄，但是反倒让我惊喜的是建置阶段出发前准备的蒙太奇段落（也就只有这么点了）。刻意煽情，勾勒并不成功的乘客群像以及吃瓜群众（关晓彤到底是什么情况），以及冗长无聊的收尾段落。
