用户,是否看过,评分,评论时间,有用数,评论
chanfukl,看过,较差,2019-09-29 14:16:47,23,不及格，塞的人物太多导致主线分散，按照现在的情况至少可以再砍掉20分钟，各种群像刻画以及回忆让原本好好的叙事节奏瞬间崩塌，结尾主旋律太过强行，尬到。
刘十九,看过,还行,2019-09-30 09:39:48,16,被毛阿敏的推广曲唱哭买的票，最后发现果然歌比电影出色。整个事件为拍而拍的痕迹太重了，感觉编剧和导演都还需要时间打磨。而且还出现了ab和关晓彤是怎么回事？？宣传时候为什么不提前告知？名副其实的灾难片了！
九言口上,看过,较差,2019-09-30 22:13:50,23,"每一个奇迹的发生，都不是偶然。
中国机长货真价实，《中国机长》两面三刀。"
张咏轩Wayne®,看过,力荐,2019-09-28 22:12:24,28,头回体验全场尖叫的惊心动魄，把个人对恐飞的心理催升至最大化，焦虑，紧张，失神，好比每次乘飞都要把命交给奇迹的暗自祈祷，刘伟强用强大的导演功底，以好莱坞式的宏大格局娓娓道来，机组人员，地面基站服务，以及乘客群像都给了小篇幅的刻画，然后以轻重缓急有条不紊的叙事逐步支配着观众对真实的恐惧，虽然对事件有所了解，但以全程示人还是触目惊心，见证了万分之一的渺茫几率，还原了中国机长和空服的专业素养，短短的100分钟内情绪不断转折，心情复杂，焦灼惶恐，还有劫后余生的喜悦，和家人重逢战友团聚后的幸福，以及安抵后机长对着凌乱机舱沉默的感同身受，电影热血又带感，真实而克制，完整度和妥帖感恰到好处，为这次航空史上最不可能的任务骄傲且自豪！
古尔齐亚,看过,推荐,2019-09-28 21:50:39,11,拍出了民航机组的许多工作细节，正是这些细节告诉我们，外人眼中光鲜亮丽的机组，并不仅仅是美在其外，而是有着强大专业背景训练的高强度工作，所以我很喜欢片中袁泉在镇住愤怒乘客时的那句话：飞机给你你会开么？
牛逼的大叔,看过,推荐,2019-09-30 19:02:12,33,总体上除了那些航空爱好者有点突兀外，没什么太大的毛病
tulaoji,看过,还行,2019-09-28 20:49:35,24,拖沓无意义的感情戏和煽情坏了个好故事
失控的小跳蛋！,看过,推荐,2019-10-01 03:54:38,17,欧豪太可怜惹，重头戏全程参与，结果脸都没露几个，好不容易露脸了，结果已经变猪头了😂
天马星,看过,较差,2019-09-30 18:18:30,22,和《攀登者》一样的毛病，导演和编剧不务正业拿大量没有感情的水货片段来糊弄观众，浪费题材浪费演员，刘伟强的水准甚至不如一集《空中浩劫》的水准。
Roulling,看过,推荐,2019-09-30 21:24:13,27,1.国庆第二场，20190930点映；2.从电影的故事性来讲，中段还可以更紧张曲折，把后二三十分钟感情戏匀出来观感大概会更强，真实的故事一定更惊心动魄；3.张涵予发挥稳定（除了眉毛画得有点出戏），袁泉优秀，杜江李沁还有许多一闪而过的演员合格，张天爱欧豪关晓彤天使宝贝很尬；4.看到武警消防医护划一赶来，看到成都拉萨空军各方闪回，心中忽然涌出“你的背后有国家”这句话，胸前的党徽更鲜艳了；5.陈光荣厉害，bgm我喜欢！6.虽然还有很大的进步空间，但我们国家也能拍出各路类型片了，今后会更好；7.在《攀登者》的对比之下，决定加一星。
邱小明,看过,较差,2019-09-28 21:18:52,21,看到最后“刘伟强导演作品”几个字，我哭了
巽,看过,2019-10-04 17:46:55, ,13,这么好的题材，拍得这么稀松无味的，可耻的浪费！整个片子充满了应试作文赶作业的气息，还是那种格式关键词字数都规定好的八股文，规定2000字，憋出600，抬头一看，差得老远，又憋到800，1200，1800，最后用尽力气抻到2000交卷。用我们重庆话说，叫屙节节屎。（不过这片子很适合在川渝跟家人乡民一起看，热热闹闹的，观众会给最朴素的情绪反应，并大量发送实时方言弹幕，连小孩子吵闹都不觉得烦了，只觉得临场感炒鸡棒。
字母君,看过,较差,2019-09-28 20:13:39,26,"人物塑造非常糟糕的科普片，一出90%角色都没有作用的群戏，大多时间都是音乐、大嗓门和音效三条轨道在比谁更吵。一众女角色从头到尾妆都不带花，头等舱那位更是冷静得像个恐怖分子。关晓彤、余皑磊、Angelababy、调度台、会议室、各大机场，支线那么多，可谁来解释下它们都干了些啥？
不过从遇险到冲出云层的部分几乎都与真实时间同步，这点还蛮有趣的。而且从小场景细碎剪辑的室内戏空间关系上也可以看出香港主流类型片导演与某些大陆主流类型片导演在调度能力上的差距（说的就是你，郭帆！）。"
武侠小王子,看过,还行,2019-10-06 12:50:26,0,从《武林怪兽》到《中国机长》，刘伟强导演是如何实现豆瓣评分大逆袭的？
扣爷爷,看过,很差,2019-10-01 18:58:48,23,导演把灾难片真正地拍成了灾难。从最开始的群像混剪搭配聒噪不停的配乐就隐约觉得两星预定，没想到看完连两颗星都不想给了。配乐真的瑞思拜，看来导演也知道停下音乐画面就会无比尴尬，飞机还没完全解除危机凯旋的音乐直接起来了！至于人物刻画，对不起，没有表演，看完你甚至怀疑机长是不是主角，而群像成为了真正的机场宣传片空镜头。视觉娱乐？飞机除了晃就是晃，没了！飞机坏了一块前挡风这个事五分钟后导演自己都忘了，飞行员该干嘛干嘛一点没影响，对比同样真事改编的烈火英雄真是一个天一个地。对了，还有杨颖关晓彤，你们是来干嘛的？剧组的盒饭就这么好吃吗？
CeneridiLeslie,看过,2019-09-26 22:19:02, ,17,"我曾在《烈火英雄》的影评里写道：“编剧中的大陆编剧叫于勇敢，真是够勇敢的，一看他还写了《中国机长》，心里一咯噔，得，又毁了一个好题材。
博纳+伟强+勇敢，堪称国难财王炸组合。
   这样下去估计离“徽章电影”也不远了，以后主旋律电影干脆全片警徽挂左上角，国徽挂右上角，播新闻联播得了。” 看完点映，果然是八九不离十"
孟三哥,看过,还行,2019-09-28 21:23:52,21,觉得问题较大的地方一是结尾稍微有些冗长。二是对刘传健的刻画太单一了。总的来说，是合格的商业片，同场的评价也都算不错。
眼袋男孩,看过,较差,2019-09-30 16:56:56,22,100分钟里面只有10分钟精彩。故事是很值得人们感动，但是事实上这件事也拍不了这么久的电影  其实精彩的部分只有穿过积雨云的时候，剩下全部都是在凑数看着挺坐立难安的。演员的表演都有一种大义凛然的感觉，甚至有些台词不知从何而来。毕竟这件事发生的不久，确实没有太多发挥的余地。但是证明了一点，或许别这么急功近利可能效果好一点
草威,看过,很差,2019-10-07 23:09:31,10,既然已经照着正能量宣传片拍了，为什么还要把机组人员拍得这么风尘呢？飞机为啥出事？机长具体做了啥？出了这么大事怎么和乘客交待的？看完了一概不知。演员气质的low和影片内核的low真是交相辉映。妥妥的灾难片。
德卡的羊,看过,还行,2019-10-01 15:36:03,11,60/100，真实事件的魅力太大了，不过本片总体也还算合格的灾难片，顺带还科普了点民航知识，对于共情与煽情的把握和运用非常好。问题主要是几个方面：对事件多角度的展现肯定是必要的，然而截面太多就破坏节奏了（比如完全没用的gxt部分）；然后片名都叫《机长》了，可对于主角的塑造还是太少，基本没什么角色魅力；然后就是结构问题，本可以结合主角拍出家庭-工作-家庭的漂亮结构，收尾偏偏要像狗皮膏药一样一拖再拖，纯属破坏戏剧了。
紹宇くん,看过,还行,2019-12-10 03:24:09,0,拍摄高质量大场面大片即视感，但剧本不咋滴，直接爆米花带过。
🌵🌵,看过,较差,2019-10-03 21:43:57,9,这是国庆档三部中献礼气息最弱的但它展现又是最健康的一种献礼思路，也就是完善有效且能相互配合的行业制度和各司其职的专业人员，剧作的难度在于空险过程的时间很短该如何撑起一部电影的时长，那编剧只能去不加思索地增添（没用的）视角，但这些铺展开（又极其刻板）的人物群像并没有跟主线紧密地对接。还有就是类似于危机的化解纯靠信念（像最后减速的问题，给人感觉就是三人众志成城然后凭借手劲就抵消了巨大的飞机惯性）这种国产类型片通病。
景色分明o_0,看过,较差,2019-09-30 23:26:18,20,结尾真是一言难尽
卫斯理,看过,还行,2019-09-29 00:13:14,20,冲着我一个朋友在里面演了个小角色，多给1星。作为曾经拍过古惑仔和无间道的刘伟强，这个表现自然是不能让人满意的，光观察飞机定位的机构就有4个居多？还有关晓彤那个角色，这些角色的设置除了让这一众本来名气本就不小的演员再继续无底线刷存在感还有何用意？欧豪的油腻和杜江的花心算是里面为数不多正常的人物设置了，只不过在这样一部口号电影中，显得太刻意。
哥本哈树根,看过,推荐,2019-09-28 19:59:44,12,张涵予的演技完全得不到发挥！
自在如风的，,看过,还行,2019-09-27 16:32:28,21,好一般啊！这绝不是一个“著名导演”的电影水平！不仅如此，电影刻意地丰富角色、刻意地铺垫群像、刻意地为了阵容去加那些没必要的故事线和戏份、刻意地再加一个高潮弱化了“真实”部分的感官。主创觉得这是“艺术加工”，其实呢……“真实事件改编”因为这些电影常见的俗套变得更加平庸了！
小瓜呆,看过,推荐,2019-12-05 10:58:56,1,想看袁泉
sudamasiki,看过,很差,2019-09-28 21:13:25,24,"观感真的一降再降，用两个字形容:稀碎。结尾直接把我雷成1星。

这部电影值得买账的只有飞机挡风玻璃破碎后那十分钟的惊险场面！
总体来讲:电影感很差，塞的太满，太乱，情感表现和人物塑造能力还不如我的祖国十分之一。平淡和杂乱感并不是源于导演那些记录性的群众镜头，而是从头到尾导演只是平庸而虚假的呈现那些琐碎的小人物，没有真实感也没有共鸣，演员是ok的，说不上好，但是不拉后腿，导演和编剧才是最大的雷。"
秦小翁,看过,还行,2019-09-28 23:45:34,17,全程节奏感还不错，但始终差点意思。毕竟知道这是真人真事，怀抱着几分敬意
电影榨汁,看过,推荐,2019-09-28 19:46:26,20,真不如叫《7700》，当时机长发出的飞机异常代码，救了这么多人，为机长点赞
色烈芬_,看过,推荐,2019-10-05 16:44:09,6,晕倒的空姐有意识后第一件事是固定好餐车轮子，呼吸困难的乘务长先用广播安慰好乘客再才是吸氧，劫后余生的机长想到面对乘客第一反应是道歉，衷心地请大家相信，你们能遇到的所有机组成员，都一定会像电影里的英雄一样为我们付出着的。
elin,看过,较差,2019-09-30 22:43:06,24,5分吧 没有后面半个小时 可以6.5分 后面煽情没完没了 和尿不尽一样 还尴尬 乘客群像描写太刻意 台词也尴尬 本来很好的题材被导演糟蹋了 换个导演就好了 本片最大的亮点就是袁泉了吧 真的很有气质 演出了乘务员临危不乱的感觉 dj和ab还有女乘客 oh和zta的感情戏写得好差 还毫无意义
挪威耀阳,看过,较差,2019-09-28 21:41:10,24,航空安全教育科普片
圣迭戈-北岛,看过,还行,2019-09-28 23:21:16,19,川航3U8633是稳当飞回来了，电影却坠毁了。点映，6分。刘伟强导演，你可是拍过《无间道》的人啊，都9102年了，这镜头语言怎么一股子路边传媒公司质感……抛开飞行专业技术问题和魔改事实桥段，作为一部普通商业片也是有问题的。该片主创班底可能和《烈火英雄》一样（特别是编剧），或是背靠背拍摄，所以问题相似，从剧本到执行，很像是零散素材的无序堆砌（文本无重心、剪辑失控、节奏失衡），且素材本身（摄影、表演、氛围）质量也不尽人意，缺失了商业片应有的基础质感，甚至片头对于飞行质感的捕捉都比正片更到位。删掉魔改桥段，模仿《萨利机长》加深对于飞行职业特殊性的描写（剧本原有手法很幼稚，角色没有在反差中立起来）是本片的出路。飞行特摄加分，毕竟一比一还原机舱，但是飞行场景的特效部分5毛。张天爱加分。
南悠一,看过,较差,2019-09-30 23:02:54,11,原型事件应该是很牛的事，可惜这部电影没拍出来，刘伟强的导演能力几乎把人物关系都搅乱了。
睡不着就不睡辣,看过,推荐,2019-09-30 23:30:28,16,空中客舱部分很棒，乘务组准备部分挺好的，前后节奏失控减一星，部分支线没必要并且突兀影响观感减一星，袁泉李沁加一星。
方脸杜若n,看过,还行,2019-10-04 00:17:58,0,千万别刻意煽情，讲究实际，注意细节。希望拍出真正的英雄机长。———————— 分割线————————今晚在远大五号厅看的，没有可吐槽的地方，中规中矩吧，致敬刘机长。
Capariel,看过,还行,2019-09-30 16:01:00,26,我觉得大家的表演总体来说都OK，特别是看到袁老师真是不忍心打低分……可剧本也太流水账了……角色扁平脸谱化……果然还是没能超越当年那部《紧急迫降》……也不知道从什么时候开始的，国产电影没有配乐就不会拍了……另外想说一句，关晓彤的角色代表了航空迷特别是民航爱好者群体，这是个挺不错的设置……
方枪枪,看过,还行,2019-12-02 20:21:02,11,还真的挺惊心动魄的....就是关晓彤那条线不知道是干啥的
谎言君,看过,推荐,2019-09-30 22:31:17,20,"三星半
关晓彤线纯属多余
？四川8633
欧豪好惨一男的
拖了点，给祖国庆生挺好的"
Bork,看过,较差,2019-09-30 04:07:14,0,與《薩利機長》聚焦於塑造以一當眾的個人主義英雄、並以此反思航空管理體制不同，《中國機長》的產生正是源自體制對個人的褒獎和宣傳。缺乏能把事件拎起來的抓手，也使得影片有些失焦，許多要點都沒有得到充分展開，成功迫降就是全片的高潮。在對英雄機長素質和事跡的展現之餘，比較明確的一是家庭的溫情，二是樸素的生命觀（提到但沒有涉及漢藏兩族不同的信仰力量），影片稍有些sentimental。剪輯比較緊湊。2019年9月28日19:50於深影學院南路中國巨幕廳，點映。
洋洋洒洒,看过,力荐,2019-09-30 13:54:52,19,"-------""那个机长脸怎么这么黑，太严肃''

-------''那已经是他笑的样子了''"
🌸樂芃☯,看过,推荐,2019-09-29 13:53:08,16,張涵予和袁泉是這部航空題材影片中的主心骨，讓觀眾感受到了千米高空身臨其境的險境，劉長健機長臨危不懼出色地帶領機組將一百多位乘客安全帶回地面，所有乘客獲得了“重生”，影片根據2018年5.14川航3U8633真實事件改編，這也是中國民航史上的奇蹟，中國機長，值得讚譽！片尾毛阿敏唱的《我愛祖國的藍天》好聽。
蒂兰圣雪糕,看过,还行,2019-09-30 03:46:35,18,6分到7分，电影由头至尾按“顺序”把事故讲了一遍，乘客、机组人员、地面人员都有戏份，但是作为事故的灵魂人物“机长”，在事件发生时的内心活动和做每一个决策的原因都没有描写，张涵予变成了工具人，靠着“神操作”就把飞机开回去了，所有演员中只有袁泉让我有代入感，能感受到紧张，其他主演中规中矩，大宝贝和关晓彤好尬，有几个“乘客”表演痕迹太重，看着毫不感动，甚至有点想笑。风暴的特效太魔幻了，感觉下一秒摄魂怪就要出来了。这个电影的问题和演员没关系，主要在导演和编剧。
maria 不在罗马,看过,较差,2019-09-29 23:54:28,34,不擅长的电影类型，果然浪费了一个好故事。袁泉的演技可给五星，张涵予的声音可给五星
已注销,看过,还行,2019-09-30 22:16:10,25,闲笔太太太多了。为什么要把所有出场人物从9个机组人员到119个乘客的故事线都拍一遍，导演是不是看时长不够就找个人物来凑一凑看凑得差不多了就停？
valiantpenguin,看过,推荐,2019-09-30 21:23:56,21,情节紧凑全程无尿点，就是当你回过神的时候却发现电影已经过半的程度~演员熟面孔很多，适合老中青观看，其中穿插的幽默桥段也不错，影片最后落脚点也紧贴祖国(李沁好可爱~~副驾驶有点惨……😆)
醒着,看过,推荐,2019-09-28 20:15:20,17,前面的蒙太奇段落，不仅很好地展现了中国的民生百态，欣欣活力，而且展现了中国面对危机事件，强有力的中国机制，这是一部献礼片应该有的气质。电影有一个遗憾，因为要靠近事件原型，抒情段落很长，情节上高潮段落不够过瘾。让我不喜欢的事关格格，她是来搞笑的吧，非得照顾一个角色吗，不伦不类。结尾声音转场，很大气，青藏高原上的中国飞机，奇观满足，情绪到位，不知道和川航是什么商务合作。
嘟嘟熊之父,看过,较差,2019-10-15 23:10:42,9,作为一部求生片，起码比《攀登者》这样的求死片要Make Sense。于勇敢，两部作品《烈火英雄》和《中国机长》，新时代样板戏编剧第一人，我记住你了。
selfish,看过,较差,2019-09-30 22:10:55,21,可能是希望越大失望越大吧，我期待中的是像空中浩劫那样类型的，结果看到的影片却令人大失所望。有些无关紧要的人物（对我说的就是关晓彤）镜头太多，还有为了冲突而冲突的乘客们，为了不知道什么而调情的机长们，真正飞机失事时处理的情况却一笔带过，对了还有机长女儿cosplay天使的那段也令人无语，好像机长完全是用意念在开飞机，是因为对女儿的爱才冲破的难关一样，当然可能是有这个原因，但更多的难道不是机长的专业技术和责任心吗？最后空难为什么发生的原因也没有，拍这个电影的意义到底是什么？
逻格斯歌,看过,还行,2019-10-13 17:51:35,1,只有剧情没有人物，最好看的还是飞机本身。没啥香港电影特色，灾难片的大场面还好，但宣教太多太装，相比我的祖国就生硬了。不懂得怎么搞主旋律，特别是不懂得怎么表达情感。
二火山,看过,推荐,2019-09-25 23:52:51,18,"特显导演能力的电影，刘伟强去繁从简，从头到尾节奏都把握的很稳，开头流畅自如，时尚优雅从容不迫；中间破窗、穿云、备降，利用地空隔离频繁的镜头切换来增强危机感，尤其舱内没有对白，更压缩了观众喘息的空间；最后备降成功后没有匆匆收尾，而是留出一段戏，让机长从英雄变回凡人，看着空无一人的客舱，想象着全客舱旅客的生命，在精神放松后才表现出劫后余生的惊魂未定，这里张涵予演的很好。

看片的时候身边的朋友一直在问释压低温缺氧的环境下人怎么存活，更何况还能操控飞机，确实是编剧都写不出的剧情，如果不是去年的真实事件，很难令人信服，更体现了英雄机长的伟大。导演将艺术加工降到最低，给观众带来的是最直观的感官刺激，力求真实感。

演员搭配的特别好，袁泉最棒，制服控太满足了！"
邓若虚,看过,还行,2019-10-10 21:36:07,4,除了通过高潮部分的特效带来十分钟左右的冲击，其它部分是不是太啰嗦太刻板太像在赶工拍出来的东西了？
汤姆猫的邻居,看过,力荐,2019-09-30 09:03:44,28,提前一天看到了中国🇨🇳 机长，张涵予饰演传奇机长刘传健，根据2018年5月14日四川航空3U8633航班真实事件改编，其实每次坐飞机都觉得是一件稀松平常的事情，电影🎬 让我们知道了每次起飞，机组和航空地勤等各部门各方协作的过程，所以中国的航班永远是世界上最安全的
马胖胖,看过,力荐,2019-09-30 10:51:37,18,要是有4d肯定爽上天
Erik Lensherr,看过,还行,2020-02-27 15:32:57,0,这拍的什么玩意？？三颗星我都觉得良心不安，货真价实的机祸现场。
山下猫,看过,较差,2019-10-01 12:51:39,6,对原型很多期望的点进行了抹杀，摄影很差，色彩灯光，室内陈设都平。中国乘务长比较合适，袁泉透过挡风玻璃看其他空姐的镜头就能感受到她有条故事线，说她工作家庭平衡地好到不置可否，以及落地后转动戒指，可能因为删掉了故事线反而更有戏。相对而言其他赤裸裸揭露其身份的角色，比如机长和乘客就让人无法下咽。前面职业剧部分还较新奇，释压之后每况愈下，屋漏偏逢连夜雨，不停制造离奇来拉出长度，乘客令人作呕，当然也不可能有事故反思调查，居然连机长的空军背景也一笔带过，为了制造趣味，副机长个个不务正业只顾泡妞。我旁边的女观众是来花钱追求刻奇的，不停摄屏指指点点和鼓掌。
1921,看过,还行,2019-09-29 16:16:48,20,中规中矩 可以说是平平无奇 大片的范头确实都在 但是支线拖沓无必要 叙述太程式化 看着不觉得紧张 也没觉得感动 只想快点放完。。。
维恩B,看过,较差,2019-09-29 21:31:10,20,5。还是觉得视角不够集中，给了乘客以及外界加了太多背景设定与个人插曲，不论是真实如此还是为了增加戏剧性，都显得太过于繁琐和多余。袁泉表现得真好，空乘人员的工作细节有着不错的呈现，无奈整体被视听拖垮了纪实感，到处都充满了遗憾。不过比事件本身还令人崩溃的是一眼望不到头的尾声，以及突然的内心独白，至少可以剪掉半小时……一个正面的例子是绿草的《93航班》。
淋,看过,较差,2019-10-01 00:32:50,8,制作时间仓促不应该浪费好故事！挖掘细节出现的问题太多，前半小时过后观感断崖式下跌。整体叙事效率极低，群像戏非常难看！PS：关晓彤杜江杨颖可以一刀全剪掉，太浪费时间了
novich,看过,较差,2019-10-04 11:23:31,4,川航公司宣传片，人物都是广告宣传片里的扁平模特
