用户,是否看过,评分,评论时间,有用数,评论
凹凸,看过,推荐,2019-07-18 21:38:41,25688,邓超救不起这暑期档，哪吒可以。
⎝丁凯乐⎠,看过,力荐,2019-07-16 13:43:25,30741,"实名反对最赞说烂片的评论，这是人类无法逃脱的真香定律！
看完觉得不值票钱可以来快乐星球砍我！"
凌睿,看过,推荐,2019-07-18 13:53:20,24275,"看到海报和预告片，人们第一反应就是：哪吒太丑了。
觉得丑就对了，因为本片讲的就是打破偏见。
正如很多人一看这是国漫，就不看了；或者去看了，看了觉得还不错也要自动先扣20分。
电影之中，骂哪吒是政治正确，只要你说哪吒是妖怪，就会有人跟着说；
电影之外，骂国产片、国漫也成了政治正确，只要你骂它，就会有人给你点赞。
其实哪吒不是妖怪，他也想降妖除魔洗清骂名；
国漫也不都是烂片，也有人想拍一部佳作证明自己。
比如这部《哪吒》。
山河社稷图一幕真是天马行空，震撼无比，将曾经只存在于想象中的物品具象化，也将中国神话的无穷想象力展现得淋漓尽致。
那些耳熟能详的故事，不再只是故事，而是能看到，能听到，能享受一场视觉盛宴。
今年有《哪吒》，明年有《姜子牙》，封神电影宇宙即将开启。
是时候以电影的形式让中国文化走向世界了。"
嘟嘟熊之父,看过,力荐,2019-07-13 17:17:05,19734,卧槽居然看哭了，这才是货真价实的国漫新希望，终于不再是假大空的中国风堆砌，而开始借神话寓言塑造真正的“小人物”。背负原罪的出身，命中注定的死期，对存在的笃定和身份的动摇，竟指向《刺客聂隐娘》的内核：一个人，没有同类。完整的世界观构建，父子母子师徒兄弟友敌，每一段关系都处理的有血有肉全无敷衍。美术剪辑配乐动作设计，处处都是亮点，就连喜剧部分也绝非装疯卖傻而存在无数细节作为支撑。海边夕阳踢毽和社稷图虚幻仙境两部分堪称绝美段落，飞驰想象力和一流制作实力的结合，值得一刷再刷。严格说是四星电影，但愿意加满五星狂推鼓励！
天马星,看过,力荐,2019-07-14 18:12:22,15549,年度最佳动画，不，年度最佳影片，剧作上的成熟应该让同档期的《狮子王》跪下来叫爸爸，起承转合水到渠成且饱含情感力量，这种成熟度不管是在动画这种形式里还是脱离动画都值得所有国产商业电影学习。整部影片看下来，在形式上非常现代化，包括笑点台词都贴近现代网络化的生活，是谓形散，但是影片把握住了哪吒这个神话人物的内在精神：我命由我不由天，并且自始至终都贯彻下去，是谓神不散，包括反派敖丙及申公豹都人物弧光饱满，在非我族类其心必异的人类世界里，《哪吒之魔童降世》是为所有异类书写的颂歌，这部片子就如同蔡依林在金曲奖上说的：献给那些曾经认为自己没有任何机会与选择的你，请你一定要记得选择你自己，支持你自己。
谢谢你们的鱼,看过,力荐,2019-07-17 21:22:38,10793,牛逼！牛逼！牛逼！4年前翻着白眼看完了《大圣归来》，4年后热泪盈眶地看完这部《哪吒之魔童降世》。没想到2019不仅仅是中国科幻大片元年，本片更是和《白蛇：缘起》一块儿创造了国产动漫作品前所未有的高潮。扎实的故事，生动的角色，饱满的情绪，炸裂的场面，这一切都构成了110分钟云霄飞车式的、畅快淋漓的观影体验，表面上是哪吒的传奇，骨子里面是《绝代双骄》+《悟空传》，毁天灭地的逆天气势更是燃破天际，好一曲震撼人心的“冰与火之歌”！都给老子去看！
亵渎电影,看过,推荐,2019-07-13 23:20:07,11400,技术上还是当下国产动画电影的水准，但在剧作的完成度上，却是第一次这么成熟，这么优秀！以前大圣大鱼或者白蛇这些剧本有先天缺陷的庸常之辈，都被称作是国产动画电影的良心之作，直到这部哪吒，才算是做到了剧本层面上的优秀，兼顾了喜剧元素和主题深度，还为之后的封神宇宙开了一个好头，大家以后可以忘掉大圣了。导演把哪吒的故事做了颠覆性的改编，逆天改命的主题在哪吒身上爆发了耀眼的人物弧光，最后哪吒直接对着电影院里的观众说，今天是我生日宴，你们谁都不准哭，这一刻的泪点实在是太可怕了。第一次给国产动画做自来水，在这个萧条的暑期档，这部肯定会是爆款。
阿珂,看过,推荐,2019-07-19 11:38:43,6538,这个夏天还有比“藕饼”cp更火的吗？
明安,看过,推荐,2019-07-28 22:05:56,3609,“所有龙把鳞片扣下来的时候，我真的感觉敖丙压力太大了。”“我们全村可就指望你一个人去考大学了啊，一定要上清华啊。”“就算把其他报清华的人都杀掉你也一定要考上啊！”
徐若风,看过,推荐,2019-07-18 21:23:14,3775,客观上的确是目前国产三维动画中的最佳。和年初的《白蛇》一道，富足想象力之下的经典魔改，在人物、情节和视听呈现上都冲着一股劲。不夸张地说，这部作品在今年全球范围动画中比，都可以排到最前列。但还是有些遗憾，双生的概念没有做得更加复杂深刻、部分低俗笑料虽有趣但跳线。可能是我期待太高了。
掉线,看过,推荐,2019-07-18 22:55:23,2002,【B】这才叫真正的国漫崛起！美术，制作，人物塑造，立意都比大圣归来更好。最重要的是你真的能感觉到创作者不故步自封的力求突破，也终于在国漫里看到了一直缺少的“想象力”存在（虽然只是在场景，物件设定上这些较为基础的部分，但未必不是个好的开始），缺点是整体风格略显杂糅，笑点像港式无厘头，战斗场面像日漫，有的地方又有仙侠和好莱坞动画的影子，但最后个效果居然不错，而且对于仍处于摸索阶段的国产动画来说这完全能理解。另外，一个动画片的父子情都比隔壁《银河补习班》更真实动人，邓超和俞白眉请出来挨打。
居无间,看过,力荐,2019-07-13 20:52:13,9933,牛逼了！没想到国产动画能把故事内核写得这么成熟，远超《大圣归来》。好几场戏被震撼到，必须五星鼓励了。将“水淹陈塘关”的故事元素打碎了重构，人设和剧情完全依照阴阳哲学来做。太极生两仪，混元珠分为魔丸（火）和灵珠（水）。太乙真人与申公豹，哪吒与敖丙，皆是一体双生。命运的偏离带来了秩序的倒错，于是，善与恶的边界变得越加复杂起来，耐人寻味。每个主要角色都带着宿命感，向死而生，阴阳相合打破命运。哪吒形象很颠覆，华语电影里也是难得一见，最重要的反叛精神立住了。导演想击打全龄观众，而那些嬉笑段落在关键时刻也催生出了悲情，让人泪目。高潮部分的场面戏够燃够磅礴，而且情绪饱满。以后再出国产动画，都将和它比较。
影志,看过,力荐,2019-07-14 21:19:36,7008,“不成，功变成仁”、《神仙的自我修养》、“申公公”、内服外敷效果都一样的解药…前面快笑死；指点江山笔、英气的敖丙、猪鼻子倒带器…中间各种神来之笔；“人心的偏见是座大山，你是谁只有你自己才说了算”、父母面前的生离死别…结尾又被感动得一把老泪。老妈的性格更立体，老爸李靖对哪吒说你的真实身份其实是…时，生怕他说出个“蛋”，这是这部毫不正经却又硬气热血至死的片子能干出来的事。集丧逼和燃于一身，在哪吒面前，没人帅的起来！锁定今年最佳国产动画。
字母君,看过,还行,2019-07-14 01:57:27,25910,讽刺的是，尽管角色口口声声说着“做自己”、“我命由己不由天”、“最害人的是成见”，电影却依然一直在用对肥胖、结巴、娘娘腔等特征产生的成见制造无价值，且一点都不好笑的笑料。
二十二岛主,看过,推荐,2019-07-19 11:03:49,1627,戏说不是胡说，改编不是乱编。把太乙真人设计成和肥猪作伴，哪吒和敖丙还能成为朋友，如果按照六老师的逻辑，这部电影的主创团队是要向本国人民谢罪的。但你不能否认它确实足够好看，而且并没有脱离《封神演义》中哪吒故事的框架，只是在几个重要的情节点上进行了富有现代意义和人情味的改编，很有创新颠覆精神。电影中几乎每一个角色都能够立得住，尤其是围绕哪吒的觉醒、亲情、友情都进行了合理且动人的铺垫，可以说这三条线每一条单独拎出来想做好都不容易，而做好了汇聚起来释放出的力量真的就是又感动又燃。本质还是想探讨人定胜天的问题，成佛成魔全在一念之间，最重要的还是做自己，这可比某些鸡汤说教的要容易接受的多。小包袱很多，但有的实在过于低俗，放屁梗熊gay梗那些让人看着实在不舒服，总体瑕不掩瑜，值得一个好成绩的鼓励。
使君子,看过,力荐,2019-07-19 11:37:10,4963,休说苍天不由人，我命由我不由天。新的故事，改编的很不错啊，就是有点短。友情提醒：观影记得带纸巾
桃桃林林,看过,推荐,2019-07-26 16:29:58,1049,7分，制作确实非常突出，尤其是夕阳下踢毽子和变身两场戏，印象深刻。这也说明，华语动画只要真是踏踏实实下来做苦功夫，还是能出佳作的。剧情相比老版做了很多革新，包括新增的父子情，这个见仁见智吧。主题则是神魔我做主，我命由我不由天的中二少年感，放到现在倒是挺燃的。哪吒变身之后也是大加分，跟敖丙的兄弟情也是相当新时代趣味了。希望每一部用心制作的华语动画，都能有好的成绩吧。不过，个人还是觉得大圣更好些，所以，刚刚还专门给大圣改了分，这样才公平些。都好都好，都加油，都加油!
有心打扰,看过,力荐,2019-07-14 20:33:33,1557,神话故事新编，以一种不令人悲伤的方式来讲述悲伤的哪吒童年。丰富多元充满想象力画面；包含幽默、热血、感人和人生观点的剧情；还有安排得当的叙事节奏，结尾处高潮更是一波接一波，让观众又是激动万分，又是感动落泪，实在令人佩服，这就是一部优秀的动画电影。
法兰西胶片,看过,推荐,2019-07-13 17:30:17,1069,8.5分。逆天之作，大家可以给《大圣归来》改分了。
姨妈的鸭,看过,推荐,2019-07-20 16:53:55,925,一切都很好，但是哪吒，我想我看过更好的。
孤语独行,看过,很差,2019-07-16 22:09:44,3671,哪吒这个形象真的是毁童年，很多人都说这部代表着国漫崛起，请问此种好莱坞式的动漫能代表中国文化嘛？
哪吒男,看过,推荐,2019-07-19 21:40:56,742,谢谢把我拍的这么好！
孔鲤,看过,推荐,2019-07-14 17:10:56,630,点映看完了，不剧透地说，除了哪吒和他娘的人物关系外，这部电影把传统的哪吒故事里人物关系都改变了，哪吒和李靖、哪吒和太乙、哪吒和敖丙等等，因为有这些关系要重新做，所以这些人物的设定才和传统的不一样。整部电影本身严格按照商业片的形式，几个情感转折的节点都掐准了时间，不夸张地说，如果这个系列电影要做下去的话（还有之前的大圣、之后的姜子牙等），《大圣归来》和《魔童降世》在这个系列的地位相当于这个系列的《钢铁侠01》和《美国队长01》，但前提是一定要做下去。
木卫二,看过,推荐,2019-07-23 16:39:17,306,承认期待不高，看得有些意外。我不是哪吒迷，而更接近封神迷——实为情怀的那种玩意，所以看到片方想要铺封神宇宙，无论成败，总归是有人在做这么一步，并且，这一步，作为起点是恰如其分的。不存在“哪吒就应该是代表/刻画什么精神”之类的说法，动画片也不是低幼倾向的文化产品。性格转变过快，密集迎合观众笑点之类的缺陷有不少，但来日可期，可以再打磨。
frozenmoon,看过,推荐,2019-07-26 16:13:23,325,人不过就是半神半魔的造物，这故事按照这个路子衍生。整体非常工整，技术让人赞叹，自《大圣归来》到《哪吒》，这条从中国神话拿改素材的动画之路被证明是最经济实惠的。这里面其实有着另外可以深化的内容，就是几个角色的象征，哪吒像个为民请命的知识分子，但被庸众看作妖怪，他的叛逆不被理解和尊重，龙王是个归顺的反叛者，但被招安并不代表被信任，他的下场故事里讲得很清楚，而敖丙是甩脱出身帽子的唯一机会，而最终，这个年轻人和哪吒那个反叛者合二为一成为一个被大众颔首的理中客。这到底是成熟还是悲哀呢？只不过这个方向肯定不会被明确提点。想想有点悲哀，动画片的形式让这类作品成为了我们电影中最可能表达一些别样内容的容器，但也因为形式，那些表达最终被掩埋在搞笑和特效之中。
方枪枪,看过,推荐,2019-07-13 17:48:47,428,童年时期，最难忘的一个画面就是哪吒自刎！这么多年过去了，又看到了一个看起来丑爆丑爆的哪吒。故事在原作基础上做了颠覆性改编，面子上不必多说，里子中关于父爱的感动，自我认知的成长，世俗偏见的以及反叛意识，都值得称道。还有很多现代化元素的融合也别有趣味！自来水安利，去看就对了…
帕拉,看过,较差,2019-07-17 22:33:08,7644,这种段子堆成的对白恕不是我的审美。
时间之葬,看过,还行,2019-07-14 16:39:20,13223,又一次高举“国产动画良心”的大旗之前，我好奇的是我们的“良心动画”为什么非得加入那些尴尬又低级的网络段子式笑料，难道非得把自己打扮成一半臃肿粗鄙一半热血激昂的割裂模样，才足以迎合主流观众的口味吗？
乌鸦火堂,看过,推荐,2019-07-19 12:29:48,284,这才是暑期电影应该有的样子，不闹海的哪吒，是文本与技术双成熟的华语动画。故事流畅、角色生动，虽然魔改，但整体路线还是以脍炙人口的大闹陈塘关故事为基础，且更符合当下文化价值。观感体验与大圣归来很像，笑料与热血并举。设定方面除了哪吒三件套外，山河社稷图、混元珠等设定都是源自封神的噱头，也有小云云、结界兄弟等可爱的原创角色。只可惜结尾大战意犹未尽，不算过瘾。至于画面嘛，制作水平早就不是华语动画的掣肘了，这部更是有着美观造型和时髦特效的视觉大餐
大島,看过,推荐,2019-07-29 22:08:07,222,一出生就有黑眼圈的孩子肯定不简单
王大根,看过,还行,2019-07-20 19:29:51,8949,"2019年，哪吒都成家庭教育成功典范了，就算你是魔童转世奔着毁天灭地来的，只要家里有钱有权有天命，妈妈爱你爸爸把命都给你，再顶级名师1V1封闭式教育，不愁养不出一个精英来。金吒木吒抱头痛哭：“这个家里没有我们的位置……”
敖丙是真可怜啊，背负了整个家族的不甘心，一人给片鳞好比读大学前村里每家每户给抓把小米，可走到城里，人家一看你头上的角就知道底细了。纵使哪天真能修炼成仙，身后还林林总总一大串亲戚呢，可敖丙能成仙吗？不被社会生吞活剥扒皮抽筋就不错了吧"
Die Katze,看过,很差,2019-07-20 12:04:46,2513,老版可是提倡自由意志的。
蚂蚁没问题,看过,较差,2019-07-19 20:35:50,6918,各种方言、结巴、放屁、烧裤裆的梗，还有什么指纹解锁、游乐场之类的舔当代科技，所有笑点都能在半分钟之前预知，弱智当好笑。最不能接受的是把主题又变成什么“不信命”之类的俗套，那句泛中国地区最中二病没有之一的“我命由我不由天”出来的时候，我饭都要呕出来，本来我们已经很没有反抗父权的人物了，硕果仅存的哪吒也要变成这样，“削骨还父、割肉还母”完全没有，爹妈爱我，父慈子孝，让人忍不住竖中指，行吧，【父母皆祸害】小组关了，李靖也洗白白了，我服了还不行吗？我信命了好吧
荔枝超人,看过,还行,2019-07-17 21:42:12,7882,第一，不觉得好笑；第二，配音出戏；第三，又一部银河补习班。讲完。你们骂吧。
Kouros,看过,还行,2019-07-19 22:24:12,5072,李靖到底是为了什么做 揭穿敖丙身份 这样损人不利己的事？
卢舍那,看过,还行,2019-07-21 08:12:52,3380,就…大家对国产未免也太宽容…
阿德,看过,力荐,2019-07-19 12:24:01,1330,暑期档到目前为止最好看的一部。真正打动我的不是哪吒的人设，而是找回了久违的看港片喜剧的快感！
YiQiao,看过,较差,2019-07-17 21:13:34,4503,这不叫难看这叫什么？剧情低幼主题无趣想法无聊笑点基本都是八百年前的 唯独制作不错 但一枝独秀有什么用 如果这片是国漫之光 那国漫也算病入膏肓了
Cycble,看过,力荐,2019-07-13 17:46:17,995,"1、人心中的成见是一座大山，但我命由我不由天，是魔是仙，我是谁只有我自己说了算。

2、哪吒和熬丙的打斗，是魔丸和灵珠的左右互搏，更是善与恶的现身说法，人性本善本恶并不重要，重要的是你习得的教育是什么，你要成为什么样的人。

3、“今天是我的生日宴，你们谁都不准哭。”哭成狗了好吗。

4、东北天后夏岗丽本色出演的群演太好笑了，哈哈哈哈哈。

5、和“是他是他就是他”的小哪吒完全是两个故事了，不是毁三观，而是打开了封神榜新世界的大门，改编的太好了，这个夏天，绝对要爆爆爆啊。

6、想了好久这部电影的问题是什么，大概是改了哪咤自刎，割肉还母，削骨还父的悲剧内核。"
一棵无聊的树,看过,还行,2019-07-19 11:43:54,2688,全程冷漠脸，我太讨厌熊孩子了，尤其是这么丑破坏力还这么强的。还有给小孩配不屑御姐音让我感到不适。
萨嘎摩多熊猫桑,看过,较差,2019-07-21 21:13:21,2835,国产动画发展了这么多年，似乎是越来越不明白技术它就不是这个行当里最根本的东西，不明白作品里塞再多大而空的感情也无法真正打动人。古往今来反父权反愚孝的动画人物有几个？这么一个难能可贵的形象还给毁了，改得面目全非为什么还要继续叫哪吒？就是叫王小明也完全没问题。至于笑点，永远低俗而不自知，片里翻来覆去地嘲笑结巴、胖子和娘娘腔，有意思吗？做动画的各位是大人了都这样子，还指望我们的动画教出什么样的小孩？
Clio,看过,还行,2019-07-21 22:12:15,1929,陈塘关的百姓跪谢哪吒的时候没有意识到，要是没哪吒和敖丙这俩小兔崽子，它陈塘关也万万不会遭此大劫……
野蒜,看过,还行,2019-07-17 20:52:24,2033,"偏低幼向，剧情含量比大圣归来要多，但观感没有超越大圣，顶多比肩白蛇。有些影评人拿它踩大圣，我？？？亮点在于重写了敖丙和哪吒的关系，正邪一体，反宿命论，龙宫和万鳞甲的设定我很喜欢。但为了故事革新，削肉还母削骨还父的经典场面没了，最后的终极大战也没有燃到新境界。人物台词融入一些现代化的笑点，确实更搞笑，但我出戏很多次，奇幻题材的沉浸感很重要。太乙真人从外形到配音都像pdd，哪吒的傲娇御姐音什么鬼。（炒cp可真好卖）

神话英雄在不同时代被不同创作者赋予不同的涵义，你以为它是骨，其实它是壳。 
朋友说“你不能否认魔童它很当下。” 所以大圣归来不讲大闹天宫，哪吒也不讲闹海自刎。 是时代的反骨逆鳞被拔除了，我们都是龙宫里的老龙。"
LORENZO 洛伦佐,看过,推荐,2019-07-27 00:28:14,243,几个小缺点：娘炮那个梗用得有点太多了后面就烦了，结尾大战有些拖沓，段子堆得有些太密集了导致最后情绪有点破碎。其他都很好，比［大圣］好，可能是这几年最好的国产动画，李靖太可以了吧。
danyboy,看过,推荐,2019-07-28 01:13:54,207,刨去了哪吒自杀还父的情节，就抽去了哪吒故事的灵魂。我只能说，这是另一个故事，我只能说这个新的关于青春期的故事讲的不错，舞美、画工、形象设计都好。但，这是一部拍给80后的电影，为人父母的80后很爱看吧；养过利维坦式宝宝的80后很爱看吧；熟悉周星驰式喜剧的80后很爱看吧；把自己代入到李靖夫妇而非哪吒和敖丙的80后们很爱看吧。你们一定很爱看，因为你们已经不再是曾经那个哪吒，而是守着工资的总兵咯。一言以蔽之，这不是哪吒的故事，但不妨碍是另一个讲的还算不错的故事。片尾曲的歌也不错。值得票价，就是我全程到目前都醉着。
LOOK,看过,较差,2019-07-21 22:01:14,1945,远远不如小时候看的《哪吒闹海》来得撼人心魄。传统中国各类文本，动人的都是关于人伦的张力，哪吒是骨肉还给父母，修得至纯至净莲花身，本作改得不伦不类，不中不西，对抗个人命运很是大而无当。人物造型、笑料、桥段，迪士尼、香港无厘头、电脑游戏借用不少，意思却不大。迎合的心态永远弄不成一流的商业片。2.5
非相君,看过,还行,2019-07-18 22:04:11,1438,"一部神话片，笑点还靠屎尿屁来撑?可气的是我还笑了。经典的哪吒是一个反抗权威和父权的形象，这部把李靖塑造成一个有爱的父亲，于是一部俄狄浦斯式的神话变成一个友善的童话。
哪吒多会变化术，一些笑点是靠变化术制造，乾坤圈变成一个类似金箍的限制性法器，恭喜你们把哪吒变成第二个悟空。"
承阿生,看过,很差,2019-07-19 22:36:03,2286,以为是混世魔王，结果是缺爱小瘪三，坏又坏不起来，人设单薄。配音除了申公豹，没有一个不出戏的。剧情陈旧，梗又不好笑，觉得是一部不入格的跟风（网络这几年的痛点：留守儿童的父母之罪、校园bully致郁、社会judge成性）之作，最后我命由我不由天确定不是九几年穿越过来的idea？？？？观后感应了片尾曲其中一句“在期待后失望”。完全没有新意，敖丙的爹的细节值得赢取一颗星。但，影视书，讲究的是整体，而不是一个华丽的手。
深夜声噎,看过,力荐,2019-07-14 17:33:52,465,火然，意思是要火的样子。比大圣厉害多了。冰与火。不虐(让再长大点再来虐吧，先美好童年先)，从头笑到彩蛋，踢毽子感人。丑萌喜欢。坐等好影院屏幕二刷。3D记得带上眼镜儿~火，火个小哪吒吧
轻点蟹黄鱼有味,看过,还行,2019-07-20 11:49:11,1287,1.笑点太尬，尴尬的方言，尴尬的人物设定，尴尬的屎尿屁。2.故事内核老套，又是所谓的“逆天改命”，在孙悟空那里用得太多了，已经完全没感染力。3.强行煽情的时候更加尴尬，原版中的冤与报复的张力几乎没有了。4.这个哪吒的形象设计几乎是唯一的亮点，加上有些想象和画面特效不错，最多三分吧。
theemo,看过,较差,2019-07-18 15:52:09,1457,还行，十五岁以下的可以看看。
五色全味,看过,还行,2019-07-14 19:21:04,704,很主流的商業動畫，把反抗父權忤逆到驚世駭俗的哪吒形象用父子情、友情、追求自我這些主流主題消解了（反抗父權變成了父子情深實在是⋯），配合煽情、打鬥、奇觀場面、喜劇段子，非常通俗，沒什麼深度（至少喪失了「哪吒」這個角色本應有的深度），但製作和娛樂性都不錯，應該會大賣。
吃货乌贼娘,看过,较差,2019-07-19 15:29:41,1061,丑，魔童就得是丧尸脸吗。
小时候可牛B了,看过,较差,2019-07-19 16:49:25,1009,专属中国的另类超级英雄吧，故事改编太大，我一般无法接受，我的原则是，这么喜欢改编，为什么不自己原创一个剧本，说到底还是剧本不够硬，想蹭别人的ip
南悠一,看过,还行,2019-07-24 19:14:31,749,国产动画两大负面特征，“台词特别会喊口号，一句深刻的也没有；噪音杂乱但视觉中心喜欢偏移。”至于这一部的问题还有，笑点让人出戏，改编尤其乏力，动机不够清晰，情节带水拖泥。中国人一般不相信人的行为和立场之间会有必然关系，当他们设计人物行为时，并不会去考虑人物立场是否一致。当他们看电影时，同样也不会从影像本身判断创作动机。
地平线的旧火车,看过,较差,2019-07-21 14:51:05,820,国产动画区真是最分裂的一个区，很多人一边叫着动漫不是低幼作品一边为片子里的低幼笑话鼓掌……哪咤这个形象看你想怎么塑造，是反抗封建礼教的悲剧英雄，还是奉行封建礼教才能带来好果的教材？导演看来选了后者
