用户,是否看过,评分,评论时间,有用数,评论
滿神的異教徒,看过,很差,2019-07-31 12:09:41,184,周星驰式幽默是将搞笑段子甚至金句穿插在它注定应该属于的地方，而不是那样毫无章法的堆砌和滥用，网络用语和段子的大量使用削弱了原本古代背景的合理性，是一种极其讨巧的心思，打着迎合大众的恶趣味来达到现象级作品的目的，忽视了一个作品应该有的那些基本要求，这是对自己和对观众双方的不负责。
哼哼.floweray,看过,还行,2019-07-30 17:54:32,102,"不行，这次我要站在你们大多数的对立面了。
优点固然明显，例如绘图设计啊，剧本完成度啊。
但是，较点真，粗鄙的笑点和混淆的设定，特别是最后老百姓们那一跪还是没有超脱出君君臣臣，父父子子的纲常。
我觉得我们喜欢孙悟空，哪吒这类神话人物且乐此不疲的改编，很大程度上是弥补了“叛逆”“犯上”“弑父”在现实中无法践行的心理诉求。
但除了寥寥这几个，还有谁呢？"
SydneyCarton,看过,还行,2019-07-21 17:50:07,146,真是过誉啊，技术和预算都比《大圣归来》高了不少，但缺了《大圣》最成功的那一股劲儿。谁也不敢得罪，又把故事做得太复杂，一口气出不来。如果能爆，也只能归功于这个撤片档实在没片看吧。
皮革业,看过,还行,2019-07-27 21:26:13,106,喜剧部分全程滥梗，角色设定也接受无能，制作完成度确实可以，基本抵消。观感其实跟银河差不多，审美相当，只是方向不同。
张天翼,看过,还行,2019-10-14 11:31:48,28,故事架子和人设不就是小鱼儿与花无缺吗？敖丙亮相的镜头，全程代入的是花无缺。这片是国漫史上一个进步，这是无疑的，但就是觉得特别可惜，特别可惜，特别可惜，这个魔丸灵珠转世成两个小孩的故事，主角其实跟“哪吒”一点关系没有，随便叫他小明小刚都行。但他占了这个名头和躯壳，把那个闪耀着万丈悲剧光辉的哪吒的灵魂挤走了。好烦“做你自己”的鸡汤套路。
UrthónaD'Mors,看过,还行,2019-07-29 11:42:15,48,命不由天的概念是好的…但还是有瑕疵太接地气了还有这给孩子看真的好吗？妥妥培养出毁天灭地型熊孩子
邓安庆,看过,推荐,2019-07-21 21:18:32,59,很成熟很好看的作品啊。美术，制作，人物塑造我都很喜欢。
zhang 2nd,看过,力荐,2019-07-14 17:36:55,131,做预告片的人可以开除了。以前看电影的时候，很激动，眼里含泪打转。这一次，我靠，眼泪流到脖子那儿了，没赶上截住。不过这片也有几段很差的，瑕不掩瑜
肖恩恩恩恩肖,看过,2019-07-21 18:02:05, ,48,李靖还蛮🉑️的……
汝就做吾的犬吧,看过,较差,2019-07-31 16:23:12,83,确实这代技术团队比《大圣归来》进步了不少，但是这片除了建模技术和配音演员很敬业就真的没啥了，大段大段堆出戏的流行元素，表达的思想都是喊口号一样直白、反复的摆在台面上强调，角色性格全都是为了迎合那些“看个热闹”的观众在耍帅、卖惨，如果接下来要拍《封神榜》的续作还请换个导演和编剧吧，我不抵触改动，但我打心底里不喜欢为了迎合、为了时尚、为了“热闹”的这种改动，《大圣归来》给中国电影动画开了个好头，我不想此之后的动画又倒退回以前那样“只要看个开心就好”
小四川,看过,较差,2019-07-28 04:27:35,157,皮相做的还不错，观感体验也还行，但是依然没有真正吸引人的内核。动漫最吸引人的东西恰恰缺席了。
眠去,看过,推荐,2019-07-21 18:47:23,33,我命由人不由天，谁不会为之泪奔呢
万万,看过,还行,2019-07-22 21:35:22,165,中二你就好好中二吧，非得加那些低级笑料干吗呢
壹安²,看过,力荐,2019-07-20 22:25:20,74,终于打破了《大圣》《白蛇》拘泥于“为国风而国风”的短板，硬件条件满足的情况下专注于塑造人物性格和“逆天改命”的全民情绪点，是近几年《封神》IP改编最满意的一次，《悟空传》请你过来看看人家是怎么拍的。另外哪吒身上看到了漩涡鸣人的影子，不知饺子导演是否也是《火影》迷呢？
舫原,看过,较差,2019-07-20 16:57:46,221,国漫的通病 就是不能好好讲一个故事
千鸟欢喜天,看过,较差,2019-08-05 09:39:46,85,特别难过，如果是普通的动画片做成这样，肯定给五星的了，可惜是哪吒。哪吒是非常罕见的反抗君权父权的古典题材，现在突然又变成歌颂父权（爸爸瞒着你做了XX实际是为了你好）的东西，彷佛心底的一颗明珠被挖出来打扮得花枝招展再放点屎屁尿去接客一样。我能明白当年悲壮震撼的哪吒脑海不可能再重制上映，即使上映了也会被父母投诉到死，只是。。。单纯很难过而已。
晚不安,看过,还行,2019-08-02 03:22:36,34,又一部好设定、烂剧本的国漫典型，长板效应在暑期档再次戳中了观众痛点——《哪吒》的剧作缺陷和胜利曲线几乎和《大圣归来》如出一辙。讲的是逆天改命和打破成见，中式超级英雄的反叛内核总能和时代情绪呼应。把全副精力都放在视效和燃点上，可幽默感是尴尬且失效的，故事细节和转折也难以推敲，从而让亲情与友情的元素变得非常羸弱。回想这些年的国漫爆款，独树一帜的还数《大护法》。
肖浑,看过,推荐,2019-07-28 21:45:08,40,技术优秀，部分细节精彩，但故事整体并没有打动我，外部堆砌了太多花里胡哨的元素，偏偏主角自身的成长变化不够，亲子和友谊两段重要关系竟然都是靠反反复复踢毽子传达，“哪吒闹海”成“哪吒为毽狂”了。
喵老师2333,看过,还行,2019-07-23 22:43:18,149,让人物智商下线来推动剧情是最低级的剧作方式。这个故事就是靠着犯蠢来推动剧情的，浪费了有趣的创意和设定。就算最后口号喊得再响亮也盖不住空洞的故事。导演说为了避免反派脸谱化做了很多设定，恰恰最大的反派陈塘百姓是最脸谱的，跟银河一个德行，群众就是恶的化身。
Ou,看过,还行,2019-08-03 15:56:18,37,分镜和大概念都挺漂亮的。比较可惜的是，最关键的地方被“两年后”给略过去了。哪吒本应自觉触摸自己的魔丸/灵珠两面性，形成自己人格。现在变成了指哪打哪的无名火-小粉红。魔格由何而来？谁给了哪吒那样一把声音？贴了傀儡符的巫毒娃娃？因为人格建构的缺乏，电影最后成了一场大型祈雨祭祀。现象中小粉红和大冰蓝的合一什么时候才能实现？
Eureka A.O.,看过,还行,2019-07-20 11:29:18,92,精致，也抓人，但观感微妙。迪士尼拍出这个可以给五星，中国人不行，中国人知道哪吒到底是怎么回事，不管怎么感人，哪吒能给爹学背书吗？
严荼,看过,力荐,2019-07-24 00:19:12,55,"身份认同长久以来被父权社会描述成无病呻吟的小事，不成体统的歪道；从前的哪吒们，动仄削骨还父削肉还母，投胎再造是他们逃离家庭歧视和社会指摘重获自由的唯一方法；

如果明天，我们每个人都可能是被主流价值观霸凌的没有三头六臂的哪吒；那么今天，我们还要不要作嘲笑一切“怪物”的庸人，镇压一切“妖孽”的玲珑塔呢？"
大头绿豆,看过,力荐,2019-07-26 14:55:25,54,此评价代表一位刚陪一位沉迷西游记数月的五龄童看完电影的老父亲的感受。孩子笑得开心，为父老泪纵横。
渡边,看过,还行,2019-07-26 23:21:14,101,优点是故事节奏和画面都算流畅吧，但技术上并未看到比《大圣》有什么进步，成熟的商业动画吧，影院里的小孩子都看得很开心。为讨好大众难免有些媚俗，屎尿屁网络用语，卖基中二燃加感恩父母？最遗憾的还是改掉哪吒的死法吧，如果没有剔骨还父割肉还母，那用哪吒这个形象有什么必要吗？请蛮吉回来不就好了？
小刘,看过,2019-07-21 08:59:01, ,32,虽然这部电影的本意不在此，可是李靖和哪吒之间改成了和谐美满的父子关系，这故事原有的基调差不多就等于是毁了——当然，你可以说，就是想走出老版那种阴沉基调讲一个全新的美式的对抗众人刻板偏见的青春成长电影。（但是西皮还是可以磕一磕
张春[阿卡纳],看过,力荐,2019-07-21 17:37:12,31,十星！！！！都去看好吗！！！！！！（喊到破音！！！）
仲曰,看过,推荐,2019-07-19 23:48:48,31,熊孩子恐惧症患者慎入
隔壁山田大王,看过,推荐,2019-07-23 21:02:07,30,技术完美。但我觉得“哪吒”是一个“我不要”“还给你”的人物，而不是吒儿这样和解、回归、圆满的角色……
過期罐頭,看过,还行,2019-07-28 03:04:11,113,网络段子对本片的伤害是巨大的，除此之外，这片到底想说啥呢。
艾晨,看过,推荐,2019-07-21 20:40:47,17,三星，前半段三星，后半段四星。
红豆♥,看过,力荐,2019-08-02 00:45:58,27,敖丙好帅好苏啊……我对这种类型的男二简直无法抵抗……
Heattech小伙,看过,推荐,2019-07-27 23:54:30,31,在重庆的影院 人们随着太乙真人的四川普通话哈哈大笑  这样就很好啦   （当然我还是更喜欢经典版本的哪吒  那才是“我不连累你”和“不认命”的真正模样 在我心里 哪吒和大圣是比哈姆雷特还伟大的悲剧形象
托尼·王大拿,看过,推荐,2019-08-10 17:21:44,17,避重就轻间完成了从“父母皆祸害”到“历史进程靠个人奋斗”的温和改良，将哪吒原有的玉石俱焚般的刚烈变成了更符合广泛受众的取向；广泛地吸取了欧美动画长片的剧作模式和无厘头的幽默节点设置，大量的小聪明聚合体。
每日可爱二百人,看过,推荐,2019-07-28 19:56:57,22,好看，技术过关。但可以挖掘的深度没挖够，哪吒有点浅，同样要承受孤独与命运不公的敖丙也刻画得有点浅。而且太像是日本或者美国（更像美国）电影了，跟《功夫熊猫》或《花木兰》似的，中国元素只是点缀，而所有的国仇家恨悲剧宿命都化为了个人成长。个人成长没什么不好，只是看多了有点无聊。
草威,看过,推荐,2019-07-27 22:22:15,20,故事讲得很出彩，实现得也很好。但有一些对白好像刻意的降低了品质感，我觉得不必要。总之加油。
文森特九六,看过,还行,2019-08-01 21:55:02,28,咱也不敢说，咱也不敢问
摸三,看过,还行,2019-08-11 23:48:38,25,抛却一切成见，心平气和观看本片，非常负责任地说一句，真的难看
巴乌,看过,较差,2019-07-28 15:43:58,77,我猜很多女性一定不喜欢这个形象，老少咸宜也谈不上，这哪吒的口儿也太脏了！哪吒他妈就是一大傻子，他爹就是二傻子，太乙就是三傻子，当传统内核被所谓的“好莱坞式亲情友情”消解了，也就不是中国的哪吒了。声音呈现非常廉价，全片毫无想象力，甚至怀疑自己在看真人电影。ps龙宫的设定不错。
埃莉,看过,2020-02-22 23:00:31, ,0,虽然有期待，但是，看了下评论，竟然是个备受双亲眷爱的哪吒……一种一拳打到棉花的茫然感，《哪吒闹海》过去40年之际推出的这部片，是出于商业目的走捷径颠覆这个古典形象，还是畏惧了神话母本里深藏的那些尖锐的痛？往好处想，大圣归来的也不是那只不减狂骄的猴子，但哪吒的核心部分有着不容简化的矛盾：剔骨剜肉，红莲复生，全还给你，不连累你——这不是一段可以团圆的关系，这不是一个有所周全的故事。哪吒两个字背后有深切刻骨的仇恨，是一个原始天真的自由个体，对加诸其身的不公不义欺骗背弃，予不可挽回的自戮——故事里还有莲藕化身，可是我们都知道，那不是他，再没有他。
千寻亿选,看过,还行,2019-07-28 21:41:52,68,千言万语汇成三个字：看不惯
Cosine 万一,看过,力荐,2019-07-14 17:25:15,63,太棒了👏有智商 有逻辑 有意思 希望票房大爆！改编的颠覆又相当合理，冲突和感情都不平面，感觉很多部分有漫威的影子。
你看起来很好吃,看过,还行,2019-07-21 01:56:08,104,国漫就剧情逻辑是硬伤啊，也不讲科学。
隔壁LEO在唱歌,看过,还行,2019-07-27 16:33:41,30,犯了和陈凯歌版赵氏孤儿一个毛病，把原著里最激烈的人性冲突给剔除了。
熊阿姨,看过,2019-10-19 17:32:32, ,12,看了22分钟受不了笑点关了
Ada🧣Wong💋💍,看过,推荐,2019-09-07 01:49:23,11,还行吧，作为最后一批豆瓣观看了本片的观众，谈谈这部电影优点缺点，本电影最大的优点就是颠覆，颠覆以前所有神话故事和电视剧的人物形象，以前的国产剧讲究好人没理由的好，坏人没理由的坏，这部看完给我最大的感触是敖丙反而是全片最正常的人？一个有血有肉的高富帅，敖丙拿的不是小龙女的剧本吗？缺点也很明显，主角一家很欠揍，哪吒有点像戴着大金链的东北小混混，没脑子、喜欢讲义气、爱面子、别人说啥他信啥，一言不合就干架，自暴自弃的病秧子。而哪吒的父亲本片感觉非常的阴森诡异，表面上正人君子作风，实际一股搅屎棍的作用。太乙真人则成了猪八戒人设，总之猪八戒什么性格无缝对接就完事了，申公豹则成了屌丝逆袭遇到社会不公的悲情人物。我看完一度怀疑这部电影的真正主角是敖丙！另外的缺点是笑点太尴尬，求国产动画不要再追求屎尿屁了。
無 念。,看过,推荐,2019-07-17 22:57:54,38,戏说不是胡说，改编不是乱编。动作打斗行云流水一气呵成，技术层面也几乎无可挑剔，最主要的是这次的故事比之前的几部国产动漫都扎实了不少，没有糊弄观众。对权利的解构和重塑，阴阳善恶双生双克的设定，以及对“宿命论”的彻底颠覆，这跟《悟空传》里的空喊口号又不一样，笑点燃点都抛得恰到好处，对于人物性格和神态的塑造也十分得体且合乎情境。很乐于见到华语电影人/动画人对“封神”这个奇幻大IP下手，恭喜彩条屋终于硬气了一回。三星半，加半星鼓励。
静心阁亦疗伤,看过,较差,2019-07-20 09:02:44,145,这个…怎么说就是可能更符合00后的审美，对老年人不太友好，对弱化的母子线有些遗憾。
叶枕,看过,还行,2019-07-21 10:05:50,43,故事完整流畅，表达OK。最大毛病可能就是一个经典悲剧形象，经得起反复挖掘的深度，被迪斯尼化了，阖家欢乐四个字，注定止步在少儿档与真善美。我觉得甚至可以从赛博朋克人体炼金改造角度的切入哪吒这个命题，更别提都被痛痒乐团拿来做俄狄浦斯反叛标签的经典形象了。适合暑期档父母带孩子一起去看。
Koi,看过,力荐,2019-07-25 09:28:08,47,"我一直觉得中国古代神话能称得上传奇的只有两个人物
一是猴子 一是哪吒
百世蕴灵育出只石猴 大闹天宫腾云驾雾
三年怀胎生了个哪吒 东海屠龙翻江倒海
可以说 除了这两人 没人再能当得起离经放纵四个字的
但称得上悲剧的 约摸也只有这两个
一个五行山下压五百年 揭了封印 戴上金箍无悲无喜 拜佛西天 唤孙悟空
一个削肉还母剔骨还父 塑了莲身 站上火轮无怨无恨 封神南门 号三太子
这尘世最擅长的事 大抵就是抹杀疏狂者的落拓 磨平豪纵者的傲骨 斩灭叛世者的孤妄"
陈皮子安,看过,还行,2019-07-31 01:10:13,24,远远比不上老版，哪吒闹海的个人主义对抗父权社会，反规训的摇滚精神消耗殆尽，取而代之的是集体主义认可和嬉皮笑脸，最可怕的是将哪吒本身充沛的生命激情变为了邪恶，又用家庭和集体相混淆的方式进行洗涤。最后变为了父爱无疆，友谊万岁与女权主义对个人自由和性情挥毫的压抑。可见四十年来价值观的惊人变化。
N记2005,看过,推荐,2019-07-18 20:30:52,23,三星半。“魔童”版哪吒与敖丙的共生关系，与酷儿叙事有着不少共通之处。能引导个体觉醒、认知自我的，很大程度上是同路人。哪吒与敖丙通过观照对方，才得以认清自己，明白“我命由我不由天”，魔丸灵珠的“善恶”属性并不能定义自己。但红蓝配色，以及两人“合二为一”的太极阴阳图，实在是过于强烈的暗示...这么看来，李靖在众人面前揭穿敖丙的真实身份，其实是给敖丙“出柜”咯？...暑假档票房的有力竞争者，值得一看的国产动画电影。（作者：紫薯）
萨库拉,看过,推荐,2019-07-18 21:25:50,33,充满想象力的新编，剧作令人惊喜。看上美厂旧版的那一代孩子，和看新版长大的这一代孩子，都很幸福。因为国产动画不仅崛起，还开始甩国产真人片八百里。对比隔壁的《银河补习班》，希望良币能驱逐劣币。
梦魇马戏团,看过,较差,2019-07-29 23:26:10,48,一，商业片要求轻松和笑点OK，但我们有没有资格要求幽默更加高级？二，原作作为古典文化中难得的对传统和父权的解构反讽之作，如此的现代「再解构」，难道不是把它「退回去」了？
嗔,看过,很差,2019-07-28 08:49:45,79,看到友邻都那么包容 我都怀疑人生了  太恶俗了 还不如大鱼海棠呢   真的恶俗到方方面面
伊谢尔伦的风,看过,力荐,2019-07-28 22:41:26,22,惯例还是国产加一星，同时感觉到我作为国产动画的观众阈值在提高，这片子如果放五年前出我一定贼激动，现在看也就是情绪稳定地说“作品不错，但也有一些美中不足”（扶额）…………（当然也有一些比起3岁儿童友谊我更想看72岁直钩钓鱼的个人审美因素作祟。）
某妮,看过,推荐,2019-07-14 18:05:38,42,自古红蓝出CP！虽然对“我命由我不由天”这种主题还蛮疲劳的~｜电审动字［2019］018号
.L.,看过,较差,2019-07-28 07:48:32,79,吹过头，完全没有以前那一部上美影《哪吒闹海》感人
亲爱的桂花树,看过,推荐,2019-08-27 23:41:25,17,"三星剧情，五星的制作。四星平均。
我非常非常反感最后一幕所有百姓跪在地上的情节，让我想起美恐 cult那一部，制造恐怖，然后制服它，大众归顺与你。
比美恐更甚的是，这一部居然大众还下跪了。服了。"
本来老六,看过,推荐,2019-07-20 19:19:03,24,非常不错，但不如大圣归来。我更喜欢白蛇缘起
seamouse,看过,推荐,2019-07-28 22:46:45,11,制作精良，川普加料，笑场频频。不过，为了重塑以天地君亲师孔孟之道为基准的中华民族价值观，本来最该有戏的削肉还母、剔骨还父故事完全没了。
天蝎小猪,看过,力荐,2019-07-25 10:48:24,37,看哭了呀。。。期待“封神宇宙”（真的有吗？）
喵咪戴戒指,看过,推荐,2019-07-22 23:07:51,24,不太喜欢这部戏里太乙真人的设定，低俗梗比谐音梗还要扣钱。打斗场面很加分，终于不是一个大招打赢boss的局了。只是那盘在一根根柱子上的龙，天庭怎么就这么理直气壮让他们数年如一日地在不见天日的地方镇压坏蛋啊，能不能轮个岗…
fwb,看过,还行,2019-08-01 23:02:45,21,我看哪吒，就是抱着观察代沟的角度去看的。因为票圈零星金句所代表的片子主题，不出我所料，一定会打动网络时代活在众人（庸众）普世价值观“无所不在凝视”之中、想要喘口气做回自己（有没有自己另说）的乖顺年轻人的心灵。片子把这个故事所蕴含的原本直刺中国传统文化中最隆重的父母与孩子关系的惨烈故事，柔化成了带入感极强、（小）中产、乖孩子主流心态的父母关系中，做自己，善战胜恶，父母、师傅为孩子奋不顾身………一部不错的主流商业片，为了支持国产动画片，我不后悔花钱买票进影院。对我来说最有趣的，是观察今天能说服年轻人的场景想象、像素精度，以及中国动画片如何在迪士尼和日漫夹击中慢慢摸索自己审美语言的那个过渡………
删邃,看过,还行,2019-07-31 17:28:21,36,价值观表达处理不好，上限就在那儿了。
