用户,是否看过,评分,评论时间,有用数,评论
初悴,看过,较差,2019-07-19 12:03:28,898,"感觉无论从美术还是配乐都和白蛇缘起与大鱼海棠差远了 
那个太乙真人肥头猪脑还一股子方言味儿
结局还是经典的中国式动漫强行大团圆结局
故事情节不算差 但表现的真的很低龄化
很多人吹 说它是目前国漫的巅峰 我觉得太过了太过了 不配 真的"
寒枝雀静,看过,推荐,2019-07-18 21:56:37,235,C＋/ ①相比被盛赞的剧本，反倒是视觉形象的建构比较出乎我意料：莲-火-毽子（鳞片）-红莲的意象联结贯穿了全片，自细微琐屑至宏大奇观完成了完整回环而又颇具想象力的体系。②剧本其实有点过于依赖“孩童”人设，一方面助益了影片暗黑而又诙谐的混搭基调，另一方面也遮蔽了部分剧作上的仓促甚至让人物的成长显得不够充分（比如，“控制”的习得只是如此简单的事情吗？）。③导演对叙事时间的理解可能有些粗糙，连高潮戏一条线到一半时间停顿切到另一条线这样破坏节奏的小瑕疵都好几处。④至于大量不合时宜的笑料，让它们融入叙事的办法只有一个，就是添加让这些“异类”同样受到压抑的细节，而不是大大落落地丢包袱。
耿直的减肥少年,看过,较差,2019-07-21 11:47:27,804,现在看来，中国会讲故事的导演和编剧一只手都能数的过来，中国电影行业现在就是一具大型的行尸走肉，一只没有灵魂的资产怪兽。
路西法尔,看过,较差,2019-07-27 21:23:13,536,一个典型的伪古典主义故事，正适合真正古典已经死去的时代：所谓正义不过是天庭把持的一套话语，而实际上已经没有人再信仰天庭的至高权威，龙族对天庭政策已腹诽千年，哪吒的悲剧完全源于一个失败的预言和一连串僵化的行政命令，但没有人试图修正体制，所有人都在帮助天庭秩序自动化运行然后试图偷偷挖点墙角。剧中的角色除了一个小朋友，几乎没有任何人能向他人打开边界。这种片受到时代的欢迎，正所谓“斯人有斯疾也”。
曼仔,看过,还行,2019-07-27 00:56:27,453,看完心情有点复杂，只能说是雷点萌点兼具吧，不是我喜欢的那一款，但能看出来质感很好。好的地方当然是制作，确实是国漫标杆，甚至叙事部分也不差，是比较娴熟的类型片叙事。但我最不满意的地方恰恰就是很多人觉得燃的地方，这个片子里的哪吒和传统的“哪吒闹海”最大的区别就是，不再有那种六亲不认的反叛性了，而这恰恰是我觉得哪吒这个角色最吸引我的地方，是对父权最为彻底、最为决绝的反抗，甚至比石头里蹦出来的孙悟空还要六亲不认，是以自己的血肉之躯为代价获得彻底的自由，挣脱一切爱与伦理的锁链。但新版哪吒所谓的“我命由我不由天”完全是另一个故事，是网文式的逆天改命，好好活，不抛弃，不放弃，做有意义的事。。原版哪吒是野生摇滚，新版哪吒是摇滚人参加中国摇滚三十年研讨会。
四万八千岁🌈,看过,较差,2019-07-19 19:39:22,585,配音好出戏，反正看20分钟就不想看了
千秋指白头,看过,很差,2019-07-21 02:44:10,1256,不是做的不好，不是不用心.恰恰相反我一看到宣传的第二天就去观影了，本人对哪吒这个人物的感情区别于其他所有的动漫人物，我从小爱读封神演义，自诩为是看着神的故事长大的人，哪吒最重要象征着对父权挑战忤逆的精神在这部动画里面被阉割的干干净净；太乙真人，永远站在哪吒这边，无原则帮他对抗父母、原则、天庭，做好身后事的仙风道骨之人，被丑化成一个骑着猪、说着四川话的胖子（先说明我不歧视胖子，我自己就是胖子，但这里的太乙分明就是丑角）.如果说cp是哪吒和太乙，我愿意嗑，太乙之于哪吒，那比秦五爷对依萍还要好啊，要星星不给月亮，你只管干，出了事我给你兜；在这个电影里，他仿佛一个丑陋搞笑的班主任罢了……至于敖丙，呵呵，一个被哪吒随手打死的富二代有什么资格和他组cp？总的来说，对于本片，我并不失望，我只是愤怒.
欢乐分裂,看过,推荐,2019-07-19 21:30:13,214,3.5；较多低幼欢脱段子集合的表象并不能掩盖其悲剧的本质，越往后越动人，在改编原著的基础上，文本大刀阔斧地改变走向，奉献了一个在（国产）动画中难得一见具有邪气的魅力角色（取下乾坤圈，变身一刻堪称全片高光，碾压帅气敖丙）。善与恶，水与火，在充满偏见定论的二元世界，这两个承载了命运错弄的少年，最终以“我不信命”的信念发出天问，完满开启「封神」宇宙，十分期待了。申公豹和龙族的命运也非常具有意味深长的寓意，并为丰富主题的完成提供富含信息量的支线提供。
荞麦,看过,还行,2019-07-26 13:43:43,378,挺好看的。除了不是哪吒之外。
谢飞导演,看过,推荐,2019-08-29 21:38:23,71,中国的封神奇幻故事是未来商业娱乐电影的大宝藏，这还只是个小开头！祝贺这位年轻的新编导。
三藏法师,看过,很差,2019-07-25 18:08:08,1067,现在上映一部国产动画就是神作，个个都是神作
西帕克,看过,推荐,2019-07-17 22:02:07,158,哪吒的削骨还父，削肉还母，被简化成父爱让他找到自我。原本故事中的反抗父权，也成了对抗世人的眼光。他的魔性可能像是科学怪人把小女孩扔入水中，只是因为对事物认知的体系不同。甚至屠龙的原罪也被略过，成了又一部“绝代双骄”。这样的叛逆更加通俗也更加安全，也是另一种时代精神吧。
风间隼,看过,较差,2019-07-29 10:02:01,416,应该叫《哪吒之真·巨婴传》，中二没毛病，自恋到油腻的程度，就不好玩了。
摩羯座的猫,看过,很差,2019-07-19 22:35:29,844,没有哪吒的灵性，更像是红孩儿叛逆。我不喜欢段子的台词，我也不喜欢国漫强大的宣传。认真讲故事没做到，这就不是好的电影。包袱太多，实质太少。光线出品，一贯宣传手法。刷好的口碑，补贴首日票房。
杰瑞的胸肌,看过,力荐,2019-07-20 21:22:26,388,"比白蛇缘起更成熟，国漫又进步了！！！又燃又有内核，打戏，画面，人物表情，人物性格的塑造和心理建设，都堪称完美。
“是魔是仙，我自己说了才算。”“我命由我不由天”
“若命运不公，就和它斗到底!”
天生倔强，打破成见，这，就是哪吒！"
后自愈,看过,推荐,2019-07-18 23:12:50,190,中国动画缺的不是技术，是故事，和讲好故事的能力。在故事的完成度之余，还有一定的深度。最难能可贵的是，哪吒是个反传统的英雄，他天生反骨叛逆又肩负重任，他是不被认同的异类，在戏谑的打发愁苦之后，迎来最终的爆发，切切实实的感动。李靖也一直教育儿子哪吒，不要在意他人的眼光，要做自己想做的人，不要轻言放弃，包括在生日宴上对儿子说的一番话，一个不善言辞却一直包容理解儿子的父亲形象就油然而生了。要说教育和父子情，吊打隔壁《银河补习班》。
同志亦凡人中文站,看过,推荐,2019-08-23 18:05:15,76,跟“哪吒闹海”相比格局太小了，得了狂暴症的哪吒也不太讨喜。但创意和细节都值得嘉奖，还有N多熟悉的家乡元素。让封神宇宙来得更猛烈些吧！（这版的李靖我可以…）
把噗,看过,推荐,2019-07-26 21:17:45,84,徐克+周星驰，精准复刻。
HooChao,看过,很差,2019-07-14 15:38:40,619,戾气太重，受不了，3头身变身5头身，接受不了，不建议未成年人看
Paco,看过,还行,2019-07-18 21:41:36,257,3.5。真纯粹。虽然文本完全不是想象中的高级向，但“不认命”这个基本点在情绪释放上真是合理又张扬，放低一秒防线眼眶就红了。技术上丰富度、流畅度双高，也基本跟得上想象力，但质感依旧有欠；剧本前松后紧，在节奏和笑点设置上都有刻意之处，但整体已相当圆熟，多主题驾驭得当，去二元化也成效显著，对神话元素更深入更有机的结合野心已然初俱，完全超越《大圣归来》没任何疑问。作为后起，如果能把投机又扭捏的《银河补习班》狠狠爆掉，那也算这个暑期档唯一能给的安慰了。
芦哲峰,看过,较差,2019-09-03 10:21:04,166,脱离原著看，可以给四星，国漫的进步显而易见。但如果对比原著看，一星都不想给，《封神演义》在古典名著中并不突出，但反抗父权的哪吒却是中国古典文学里最出色的人物形象之一，与反抗君权的孙悟空、反抗科举的杜少卿、贾宝玉一道成为最有反抗精神，最神采奕奕的人物，结果却被刻画成符合社会主义和谐价值观的父慈子孝，让人呕吐。看完这个熊孩子长成孝子版的丑哪吒，还是让我们来回顾一下真正的哪吒吧：一个人在海边嬉戏，打死蛮横无理的夜叉和太子，闯下祸来。怕受连累的父亲，要杀他以绝后患。他割肉还母，剔骨还父，自刎而死。后来又起死回生，取荷藕做骨，荷叶做肉，与父亲刀剑相向，大打出手。——记住，这个牛逼到金光闪闪的人物才叫哪吒。
刘小流,看过,力荐,2019-07-13 19:12:00,325,看到顶着黑眼圈、要吃人肉的哪吒出来，感觉就全对了。 大家都知道颠覆好看，可多数颠覆改编问题在于，颠覆之后又要束手束脚，到最后干脆成了反颠覆。本片中成了魔童的哪吒，到最后同样没办法颠覆到底，但本片优秀在角色的转变遵循着最质朴的感情线——它是哪吒在人群中艰难的自我认知，也是哪吒父子的若即若离，它完全像极了多数父子关系模式中的对抗、理解与守护。 让哪吒只是想不怂地活出个人样，便也不用到最后对人群不会消散的偏见选择性装瞎，更不用去印证百姓值得守护。这气质，真不多见。
恶猫的步调,看过,推荐,2019-07-17 22:42:39,127,用周星驰的元素做中国式的幻想喜剧3DCG动画电影，这样的模板，确实是个可复刻的方向……
谋杀游戏机,看过,推荐,2019-07-13 15:15:45,153,光线点映。冷不防看第一支预告确实有点挑战审美，不过看完就会完全爱上这个古灵精怪的混世小魔王，是当下流行的丧燃款。外表邪魅狂狷烟熏妆，内心是个单纯善良的小孩，好面子装酷很可爱。饺子是学医的，一点点自学成动画导演，了不起。制片人说这片并没有花很多钱，请不起一流特效公司，就找了一堆二流三流小公司磕了好几年。画面比大圣精细，前半段笑点密集，哪吒无敌破坏王状态、四个人追逐打斗长镜头很精彩，密码指纹解锁、坐骑放映机猪、山河社稷图、指点江山笔、三维弹球有很想象力。父爱、母爱、师恩、和基友敖丙亦敌亦友等人物关系也都刻画得比较充分。哪吒要拍成三部曲，明年还有姜子牙，非常期待上古版复联了！
西风独自凉,看过,很差,2019-07-27 08:40:13,162,华夏是孝道文化，但哪吒闹海是我的最爱：骨肉还给你，人格、精神永远独立。任何文化唯有保持对峙的紧张状态，才有可能革新、前进，歌颂父权是什么鬼？这不是我的哪吒，这是向钱看的辣鸡，负分滚粗
应用层协议,看过,很差,2019-07-27 01:25:22,176,我求求你们睁开眼睛划拉一下这片子铺设的都是什么笑料：形体羞辱、生硬的方言梗和口吃梗、屎尿屁和排泄物笑料、络腮胡娘娘腔、网络流行语以及港式无厘头杂糅，我实在分不清它在风格上是更接近春晚小品还是王晶、黄百鸣们的陈年港式大杂烩，或许兼而有之吧。没人说过哪吒的文本就不能做喜剧化处理，但影片实际呈现的又是什么趣味？叙事、表意、情感的传达，没一样不是浅表而庸俗，所有重要的信息、情绪全都要用嘴吼出来，而配音的表演质量又基本维持在国产古偶剧的中下游水准，尤其敖丙，活脱脱的3D版杨洋。这么个玩意如今票房口碑双线飘红，更有所谓“国漫之光”的桂冠加持，大概也只能说明，我们的观众对于一部动画电影最普遍的定位和期待，也就是这副样子。
竹顶针,看过,2019-07-26 22:56:27, ,80,前半段尴尬，后半段行。元始天尊的镜头很少，但觉得他的动作设计是最漂亮的。
文森Vincent,看过,较差,2019-07-27 15:56:29,104,这片子有丝毫细节可言吗？★★
不良生,看过,还行,2019-08-03 10:32:41,84,人们总是夹紧双腿正襟危坐对电影里的异类奉若为偶像为图腾为英雄，却拍拍屁股走出影院后对身边的异类避之不及铲除剿灭泯然众人。
TimberNord,看过,推荐,2019-07-30 23:21:02,42,人物设计父母的那个眼睛，有点让人发毛！反派师傅那个造型好像木兰里面那个太监哦！动作设计好棒好棒！最后高潮部分有一点点的拖沓，不过整体真的很让人惊喜了！我们小县城的电影院里男女老少哭得稀里哗啦的，没办法我们乡下人就是这么sentimental..... 最后，真的，好希望，自己小时候，学会，踢毽子，啊！可惜很遗憾我点开的是跳牛皮筋的科技树，后悔！
咱说,看过,推荐,2019-07-28 22:16:57,46,"可圈可点，可圈可点。
看的时候会默认四十年前的经典《哪吒闹海》的剧情走向，看着看着发现本片完全没有照搬原来的故事，而是完完全全讲了一个新故事，并且不再是个人英雄独角戏，而是成功塑造了四个主要角色，这一点太赞了。而要批评的则是开篇半小时打诨插科的小把戏太多了，可这毕竟是个叙事性的神话正剧，不是《马达加斯加》或者《玩具总动员》，所以分全扣在这里。另外，技术上还有待赶英超美。
顺便看到有人拿《哪吒闹海》对比，认为本片不如旧作的，我必须指出一个基本事实：《哪吒闹海》没有传说中那么好。它是文革结束后美影厂赶工出来的作品，技术上已经有各种不足；更致命的是它跟那个时代的很多电影一样，带着过度的政治隐喻，四海龙王就是四人帮，当无论左还是右的意识形态的灌输盖过了故事本身时，就很难做出好作品了。【佛永润广正佳】"
曾经的可以,看过,较差,2019-07-19 20:50:57,158,一个偏心的老板，一个不靠谱的师傅，一个溺爱过分的母亲，一个忘恩负义的父亲，一个专职于打砸抢凭天生神力欺负别人还抱怨自己没朋友的官二代，一个将父辈几代人全部心血毁于一旦而只顾交朋友的太极爱好者，而以上这些通通是正面人物，老龙王最可悲，申公豹最努力，而两个人的下场却都不是很好。对，这就是这部电影的全部，你可以说他画面好，你可以说他故事解构完成度高，但是你要说他三观正，却难以承认。
文刀大土申,看过,推荐,2019-07-20 20:27:36,76,二刷完毕，确定是我本月甚至今年的惊喜之作。妇孺皆知的“哪吒”神话传说在这里被重新解构，整体的故事完成度很高，这很难能可贵，辅以更具观赏性的喜剧元素，让整部片子的娱乐观赏性提升不少。
涛戈戈,看过,很差,2019-07-29 00:43:06,221,如果我们国产影片的对白台词继续这样低级趣味的尴尬下去；如果我们树立的国产男孩形象再继续走这种小大人、没教养、我最牛逼、目中无人的路线；如果我们继续用今天影视圈的品位和文化底蕴糟践神话和历史人物，那么电影院有一天也会成为工体，成为一个不能带孩子沾染的地方。
纳兰风澈,看过,力荐,2019-07-19 13:54:46,151,很像1970年之后的中国威胁论（魔童）、89年联合国制裁（关到死）、2001入世腾飞（当妖怪给他们瞧瞧） 和 2018年的中美贸易摩擦、华为事件（若命运不公斗到底）！2019最强国漫没有之一！！！
格里高尔,看过,2019-07-28 09:27:17, ,110,"看了预告片，感到厌恶，作为反父权的偶像，居然被编排出""这是爹教会我的道理""这种台词，这还能看吗？"
陌生的天花板,看过,较差,2019-07-20 19:33:42,150,不好看，不要浪费时间。画面制作再精美，也只是表现形式。国内不会再有描述人性的好作品了，政治干预太严重。原本对天地君亲师的反叛，变成了亲情友情包围下对命运的挣扎。
派大星,看过,很差,2019-07-21 19:55:32,145,被骂也要说，不好看。尴尬的故事，刺耳的配音。台词反复说教消除偏见，电影里又处处充满用偏见构成的低俗笑点。哪吒发怒打砸抢烧是因为受到偏见不开心，无辜受害的百姓就是一堆充满偏见的愚民。也是呢，愚民们你们只是失去了家，哪吒可是受到了偏见呢🙃因为敖丙加一星
染井吉野,看过,较差,2019-07-19 14:22:03,302,看预告时，我以为丑是最大的雷点；看完电影，丑是最无关紧要的ooc。这个故事和哪吒毫无关系，那个小混混我也绝对不认。
FORMLESS,看过,很差,2019-07-27 11:41:06,259,看片前：“我倒要看看这么丑的哪吒到底有多好看“，看完：？？？即使他是所谓的国漫希望我也要从我的个人审美来进行客观公正的评价，而不是一味的夸大说这是一个怎么样的进步。我并不认为这是一部优秀的作品，虽然这对于国漫来说可能的确是难得一见的片子，我承认片中的美术、特效以及配乐都还不错，是电影工业化上的进步，故事结构世界体系比较完整，但是于此同时粗俗油腻的对白台词让我无法忍受，哪吒的人物塑造过于刻意做作，穿插的搞笑桥段简直宛若智障疯狂出戏，很多转折和过度过于牵强，凭借着快节奏的转场硬性煽情，色彩饱和艳俗的让我怀疑人生，如果说这种滥情且廉价毫无文学素养的剧本可以代表国漫的希望，那真的挺绝望的。因为这部片子符合当下语境的快餐和刺激，你不需要动脑，这种叙事结构以及一句“我命由你不由天”和鸡汤文有什么区别？？
大聪看电影,看过,力荐,2019-07-28 20:41:10,56,无疑，这是今年暑期唯一的爆款+黑马。 哪吒和敖丙的友谊，努力过，彼此成就过，此情有憾，然无对错，往后各生欢喜。哪吒和父母之间，同行半路，一别两宽，余生漫漫，依然亲情守候。
[已注销],看过,很差,2019-07-24 00:27:23,243,都已经改的这么面目全非了，为什么还要叫哪吒呢，猴子热度蹭完了蹭孩子？
禁闭岛,看过,很差,2019-07-21 18:06:20,202,只说问题。1.为什么哪吒是三子，但整部电影完全没有交待老大老二。2.为什么影片充斥着娘娘腔、结巴、肥胖、放屁等恶趣味？3.为什么人物设定脸谱化，把申公豹做成丑角？4.李靖为什么当面拆穿自己的救命恩人是龙族？5.真心没觉得魔丸比灵珠坏到哪里去。倒是敖丙后半截人设前后矛盾。整部电影人物台词生硬、剧情衔接不流畅，人物表情僵硬、台词浮夸，动画片就可以没有“演技”？总结：完全没办法和大圣归来比。
哈哈哈哈哈,看过,很差,2019-07-21 06:36:40,226,屁屁翔受公关稿蛊惑早早买了票 拉我去感受“国漫崛起”    看完我就他妈回头给大鱼海棠改成五星。这都啥几把花里胡哨的 国漫格局越来越小  我咋觉得他妈外国人都要比导演明白哪吒这个IP的内核      只想讨好观众 难成大器
Peter Cat,看过,推荐,2019-07-30 02:26:42,42,三幕设计和人物刻画比这几年漫威好看多了，完全是可以卖到全世界商业片。既然是就着好莱坞做的，我们就用好莱坞标准来评。
麦耳。,看过,还行,2019-07-26 23:29:04,122,虽然这个故事一直用最大的声音吼着“我命由我不由天”，但我并不觉得这个动画本身有挣脱某种“枷锁”。
琉球,看过,较差,2019-07-21 10:39:52,223,哪吒真的一点都不讨喜，就算如此李靖夫妇还是对他爱的愿意为了他去死，啧啧啧，也不知道想要表达什么。就算后期要成为英雄需要反差也不至于把他设定成这样吧…还有，哪吒不是打死了敖丙还抽了他的龙筋么，这里咋还成cp了...另，哪吒配音真的生理性不适
尼尼尼奥,看过,较差,2019-07-25 01:22:48,210,电影交流会上一派喜气洋洋的氛围。导演说让这部电影成为国漫崛起的代表，而我觉得最多凑个国漫复兴，血统不纯何谓“国漫”？另外只有我一个人觉得电影三观扭曲吗？主角形象另说，台词轻浮，情节丑恶低下：百姓因恐惧哪吒装死跳进真棺材，逝者横尸大街还抢人家符咒？？放屁没完没了还要反派没完没了吸？？娘炮和残疾人也能没完没了搞笑？这部电影我果断不能买单。
不脱,看过,还行,2019-08-04 00:52:37,84,“我命由我不由天，是魔是仙，我自己決定！”那么，申公豹、敖丙和忍辱负重数千年的妖龙们为什么不自己决定？太乙不必为贪杯误事负责，难道不是因为被师父钦点了“仙命”？一个官二代把整个陈塘关搅得天翻地覆，就为了找个自我认同？！哪吒到底自己决定了什么：仅仅是不理睬“白痴们”说什么吗？我不觉得哪吒故事就一定要弑父，事实上封神演义就把西游记里反抗性的剔骨析肉改写为孝道动机，后人当然可以继续改。可这种改动太说明问题了：当父权家庭悲剧被改成了中产育儿传说，当欺男霸女的龙王三太子被改成温顺英俊的悲剧少年，当活在神仙们欺凌下的无辜老百姓被改成了不断误解官二代的“白痴们”，你真的可以无动于衷吗？片子当然好看，简直堪称享受，但真正可怕的不就是这样的叙事正变得好看且享受吗？
小斑,看过,推荐,2019-07-29 18:44:32,44,原版的哪吒是最道系的神话人物——不受半点委屈不着半点羁绊，宁可剃骨削肉也不违本心。其间之血腥极端背伦，同他清纯稚弱的外貌形成极致对照，在封神榜一众妖仙之中也是最cult的。当然，这种无君无父的故事现在不许拍了。然而鬼娃恰奇的脸和“我命由我不由天”的正能量并不能补足莲蓬里的窟窿。说好听是符合流行，说难听就是俗气。跟我记忆里的哪吒落差未免太大。感觉是用他的身世设定讲了个别人的故事。好在故事本身，除去个别屎尿屁掏裤裆的梗低级且不知所谓之外，整体还是流畅的。制作也非常用心。远高出了国产动画的平均线。
万里独行甄志丙,看过,推荐,2019-07-27 11:41:12,103,有些人一谈中国电影就扯立意扯逻辑，谈漫威的时候标准就降到爆米花电影。
Ozymandias,看过,很差,2019-07-22 09:42:15,227,戏说不是胡说，改变不是乱编。求求你别用哪吒好么？人物轮廓别一个个长的像个白皮猪猡好么？
水怪,看过,还行,2019-07-28 09:30:24,122,无因的反叛，对着空气和闪电的怒吼。
[已注销],看过,较差,2019-07-24 13:18:55,225,戏说不是胡说
Grey与時光機,看过,还行,2019-07-21 08:14:10,231,有些梗，真的蛮low的…
子文东,看过,推荐,2019-07-19 20:28:50,78,非常完美了，角色的设定和特效终于完全达到了国际水准，对情节的改编也很合理，无疑值得赞叹，强烈推荐去电影院看。但缺点也很明显，就在于这巧妙的改编本身，因为它最终完全消解了哪吒作为一名逆子英雄的强烈悲剧性，他终于还是被驯服于“伦理”了，所以这又真的是一个“哪吒”的故事吗？不，这只是一个正能量统御天地的故事。
丁一,看过,推荐,2019-07-18 22:45:54,54,少年的你，有个小小的愿望，愿风雨云中，刀背藏身，一秒钟行八百里，刺破六欲天
开府仪同三尸,看过,还行,2019-08-03 22:38:21,60,"1、制作是精良的，电影工业是有长进的，
2、剧本的内核是媚俗的。阉割了“削肉还母，剔骨还父”的反叛精神，替换成“父慈子孝”、”用爱挨雷劈“的”正能量叙事“。这样一来，哪吒已经不是哪吒，而是一位成功接受思想改造的优秀少先队员。
3、对白大多是用段子堆砌起来的，未免单薄。致敬星爷的那部分也略显刻意。
4、看来”空手接白刃“已成为李靖的默认技能。
5、李夫人管哪吒叫”吒儿“，置金吒、木吒于何地？应该管哪吒叫”哪儿“……
P.S. 温馨提示一下：最后一个彩蛋不必等。"
Fishrainy,看过,很差,2019-07-24 12:51:07,199,请记住动画片本质是给孩子看的，这部片走歪了
鬼腳七,看过,还行,2019-07-23 20:19:06,99,制作ok啦，故事这么改也不是不行，反正也不敢照着原本拍。改编的重点是把反抗对象抽象化，不反体制只反命运，最后落到“做自己”，这其实是妥协。虽然能理解，但也是妥协。本质上，没有剔骨割肉和重塑肉身这一破一立的哪吒，是没有意义的。要看身为异类如何自我认同，不如看X战警啊。
