用户,是否看过,评分,评论时间,有用数,评论
阿紫,看过,推荐,2020-02-12 22:40:39,0,多重身份的俄罗斯套娃，换什么发色都好看
一碗云吞,看过,推荐,2019-11-18 06:46:11,0,音乐好听，姑娘好看，主角光环太强，叙事靠three years earlier来回倒实在太烦了，基本算个爽片。寸头小女友多好啊，为什么更喜欢俩渣男。。。
KinG羽,看过,还行,2019-10-20 18:15:37,0,每年类似的伪女权动作片一箩筐，时刻三十年老吕又倒退回去了。作为爽片总归还是有爽点的，你让身高一米八的俄罗斯超模出来打架杀人，随便配点傻叉KGB、CIA剧情都不会难看。又是靓女又是帅哥，还一直玩闪回反转，吕导演这是岁数大了，开始各种偷懒了？
huyouyou,看过,力荐,2019-09-29 07:55:00,1,前20分钟不太好看，但随着情节的闪回和错落交织，才体会到吕克贝松的功力。#20190929
枯藤和老虎,看过,还行,2020-01-19 01:06:22,0,MV段落多了点，还挺欢乐的
yum,看过,还行,2019-12-21 19:00:32,0,吕克贝松就拍个这？美女无脑动作片。Helen Mirren+1星。
red.,看过,还行,2019-07-04 00:54:32,3,很陈旧的故事，动作戏弄弄的90年代。卡司很好。多重解释的剧本结构（对，那些画面技术上讲不是回闪）。很多地方尽然不够专业。不过前后左右的男性观众都看的很high，美国市场因为最低宣传已经溃败了。若中国俄罗斯无法上映，票房能回本就不错了，若如此的话，pathe就完全收下e。
Nin,看过,还行,2020-03-07 07:18:40,1,好 香 艳 （我说Cillian Murphy
AnnieSY,看过,较差,2019-09-21 22:13:28,3,这也太扯了点儿，这细胳膊细腿的能以一挑十个打手？两个特工头子就这样陷入恋爱脑？轻飘飘地她就设计了三个老谋深算的家伙？可惜了卢克和基里安。
甦醒 Nostalgia,看过,较差,2019-09-17 00:25:44,0,吕克贝松对女性特殊的癖好，总是爱拍这种聂隐娘式一个人孤独到天崩地裂的角色，从尼基塔到贝娜，变得更商业但依旧没变的是对主角模样的审美和对绝命杀姬的痴迷。
Cycble,看过,推荐,2019-10-14 23:45:01,1,最后一句“bitch”掷地有声，啊，女人只能靠自己获得自由。不到最后，谁玩弄谁，还真不好说。
龙皇,看过,推荐,2019-10-29 12:52:17,2,美女一大堆，养眼；间谍无真情，悲怆。女主打斗很精彩很连贯，由于开挂，能够左右逢源，克格勃和CIA通吃。想不到女主竟然是吕克·贝松科幻电影《星际特工：千星之城》（Valérian and the City of a Thousand Planets）电影中的缪星公主。
盒饭,看过,力荐,2019-10-05 00:02:09,2,完成度相当不错了，就是笔记本电脑有点儿穿越。
猪头妖怪,看过,较差,2019-09-14 04:12:03,0,好了，是时候把Luc Besson加入黑名单了……
木匠小强,看过,推荐,2019-10-16 11:39:24,1,女人之间如果不是为了争夺男人，而是为了争取自由，那他们多半会变得惺惺相惜。爆头爽片，血浆值回时间。
Marco,看过,还行,2019-09-20 11:36:36,2,【6.5】螳螂捕蝉，金蝉脱壳。工作诚可贵，爱情价更高。男女尽情事，自由唯我意。反转略微有点刻意，但在剧情编排上有先果后因，且不难理解，乃是观众的福音。喜欢吕克·贝松编剧上的干净利落。但是美国拍片有个不适应的地方就是俄罗斯的特工都在说英语，听上去有点别扭。片中的男特工们智商集体offline，果然男人都是用下半身思考的动物吗哈哈哈哈，竟然觉得有点好笑。
Vivian,看过,力荐,2020-02-20 01:38:44,0,因为最近的片荒，你值得五分
мая,看过,还行,2020-01-22 19:00:54,0,6，爽片，满足了大部分普通观众对美女间谍片的观影预期，高冷长腿美女，凌厉的动作戏，周旋于各种男人之间的情节逆转，该有的一样不缺。电影错乱的时空感感觉像是吕克贝松故意的，特别是在女主调戏美苏双方间谍的故事放在一起，有一种法式无厘头的恶意。现在对吕克贝松也没啥期待，能拍成这样算是不错了
小沙皇,看过,力荐,2019-09-21 00:31:45,2,啊啊啊！我觉得好好看啊！超爽，超美！超带劲！若为自由故，两者皆可抛！
琧婯,看过,还行,2019-09-27 23:35:30,0,主要看女主。。。剧情是天马行空到处臆想，只能看个热闹
犯怵中的嫌疑喵,看过,2020-01-11 21:20:54, ,0,算上马扎儿展今天露点三连可还行- -笑点又多，爽到了233（不出个手榴弹打火机周边吗hhh
