用户,是否看过,评分,评论时间,有用数,评论
Forever Parker,看过,力荐,2019-06-22 07:16:17,591,男特工可以是帅哥，女特工也可以是超模
秀山鲤鱼,看过,推荐,2019-09-11 00:41:45,5909,7分，美国人拍间谍片，苏联人都是傻逼；苏联人拍间谍片，美国人都是傻逼；法国人拍间谍片，美国人和苏联人全是傻逼。
Peter Cat,看过,推荐,2019-07-03 06:54:32,1220,不要有期待，忽略那些低级bug，享受超模。
影迷劳拉,看过,推荐,2019-07-25 21:38:51,861,是我向往的感情生活。
瓦斯,看过,力荐,2019-06-28 10:42:39,437,女性大爽片，好看到飞起，妹子版邦德合辑，简直想推荐给所有不反对porn的妹子！
邰思,看过,推荐,2019-08-06 14:42:58,697,同样的KGB背景下，这才是红雀该有的样子——冷漠、美颜、克制，九头身女特工不需要演技爆发，不需要太多情感流露。凯伦米勒和墨菲锤哥还弥补不了演技缺口的话，如何体现女主的弱小无助楚楚可怜又暗地自成一派的刚强呢。该享受美好肉体的时候你在讨论演技，我觉得这在亵渎我的视觉功能。
ANNA,看过,推荐,2019-07-06 13:40:15,398,俄罗斯大长腿版尼基塔，真超模带您领略正版红雀风采（此处无diss大表姐）。男配撸哥和墨菲都是我菜，女爵一如既往优秀所以看得还挺开心。我只有一个问题。90年的手机？笔记本电脑？贴身剪裁西装？？？这是平行世界831的90年？？
魔法炼金术士,看过,推荐,2019-06-23 04:47:15,234,大爽片！吕克贝松可以啊！
晚安、本杰明,看过,力荐,2019-09-11 13:36:03,387,"碟中碟中碟中谍
好看的人真是没头发都好看"
sisimint,看过,力荐,2019-09-14 22:13:13,273,两个男人都靠不住，这部剧说的是忘年交的girl power💪
楚恻,看过,推荐,2019-06-25 09:24:27,171,第一次在豆瓣评没有上映的片子，但是的确是看了，台湾真好。吕客贝松真是厉害，什么片子都能拍那么好看
同志亦凡人中文站,看过,还行,2019-06-20 18:34:04,1040,吕克·贝松估计是看了“红雀”后被大表姐的身材恶到了，才会找个美艳冰霜逆天长腿的名模来把红色间谍的故事再拍一遍。前3/4静静看你扯淡，最后1/4反转才真的好玩。基本上这个故事就是：没有什么能够阻挡，老娘我对自由的向往啊啊啊~~~~~
苍穹的幻想,看过,推荐,2019-09-12 00:28:18,122,渐入佳境的一部电影，毛妹特工睡了KGB后又睡了CIA，深谙国际象棋的她决定不做棋子，为了获得获得自由身变成一根人形搅屎棍，搅的美苏情报部门阵阵腥风血雨；结尾一再反转，让人拍案叫绝！吕克贝松虽然近几年执导能力有所退步，但是在女主角的选择上一如既往的保持了高水平，几场激情戏把法式风情、浪漫和狂野展露的淋漓尽致！
张小北,看过,推荐,2019-09-16 14:51:14,66,我还是怀念那个当年说自己这辈子就拍 10 部电影的吕克贝松。
独行侠杀手阿何,看过,力荐,2019-09-10 23:59:28,35,KGB VS CIA，我们中出了个叛徒。超能杀姬，女版John Wick，名字轴对称的Anna。女主到底拥有何方福气？？？？！！！可以同时与Luke Evans和Cillian Murphy发生性关系？？？！！！！！以及Alexander Petrov！！！！！《速激》母子变上下属，疯狂跳跃的时间点稍微令人不适，不合时代背景的高科技产物如笔记本和U盘又让人瞠目结舌，但反转再反转的戏剧性剧情足以证明Luc Besson的水准从未下降过！！！轮番变装秀的俄罗斯超模Sasha Luss，身段颀长，摇曳生姿，步步生风，高冷美艳又柔婉动人，超模气质满溢毕显，酷似《女孩》里雌性同体的男主小哥，看得人魂魄都被勾去了！！！！！！[9.8看的]
[Deleted],看过,还行,2019-06-21 09:29:40,1045,生命诚可贵，爱情价更高；若为自由故，两者皆可抛…
江未,看过,力荐,2019-07-22 01:21:26,32,我被女主迷倒了
選凝,看过,力荐,2019-06-15 21:25:00,17,沒有一個廢鏡頭！剪接滿分。有腦商業片的極致典範！不能喜歡更多。
木由,看过,力荐,2019-07-25 02:20:33,7,吕克. 贝松的片子一直都很带感啊！莫斯科双面女间谍的题材也很符合我对夏季大爽片的期待。第一次出任务的莫斯科饭店打戏干脆利落，看超模甩着长腿击杀目标很酷。不过混乱的性关系真的有必要吗，尤其不要虐短发女友啊！真是越漂亮的女孩越会骗人。
寒狐传媒,看过,推荐,2019-09-14 07:54:22,85,女间谍：我不要放假的啊？！
巴伐利亞酒神,看过,推荐,2019-09-26 22:51:03,63,世界上最了解女人和LGBT的导演是阿莫多瓦，世界上最了解直男的导演是吕克贝松。
芦哲峰,看过,还行,2019-09-11 09:48:02,627,看性感超模在美苏之间，在男女之间，在生死之间，纵情打枪与打炮。若为自由故，情人皆可抛。
狼矛,看过,推荐,2019-09-17 04:09:12,42,片中女主大段打戏看着特爽，反转就像俄罗斯套娃；反倒片中的男性角色都挺单纯的，果然男性都是用下体思考的生物么(笑)。
狮与羊,看过,较差,2019-06-21 15:30:07,235,每次廉价大反转之后都用冗长闪回毫无新意地重述观众知道的事，这策略实在是蠢到家了！！！
凌睿,看过,还行,2019-09-16 16:04:44,388,"克格勃说，她干满五年就能退休；
中情局说，一年之后她就能去夏威夷生活；
女上司说，保证让她重获自由……
所有的承诺从来都不会兑现，所有的保证都只是为了安抚你的说辞，因为他们知道还没到那个时候你就死了。
他们利用她，所以她以其人之道还治其人之身。
他们把她当成一枚棋子，其实他们也是她的棋子，是她通往真正自由的垫脚石。
千算万算，最后把自己算了进去了。
还是那个道理：
女上司、中情局探员，这些看起来很聪明的人其实很愚蠢，因为所有人知道他们想干什么。
安娜表面上看起来很蠢，其实才是真聪明，因为你不知道她是扮猪吃老虎，不知道她做了什么、想做什么。
真正聪明的人是不会让你感觉到他很聪明的，当你发现的时候已经晚了。"
本初老儿,看过,还行,2019-06-22 10:39:26,177,Flashback太多，略显烦人。
内陆飞鱼,看过,还行,2019-09-11 01:54:37,135,虽然是无脑动作片，没有“黑寡妇”主演的《超体》好看。曾经传出米兔新闻的吕克·贝松真的是一生只爱一种女人，波波头，模特身材，少女相貌……这一部女主92年的俄罗斯超模萨沙·露丝，跟年轻时的安娜·帕里约、米拉·乔沃维奇有些像，不知道跟双鱼、直男导演是什么关系。
派翠克,看过,较差,2019-06-24 11:18:56,207,本来故事在吕克贝松最近的几部电影来看已经算是不错了，尤其后半段还算是有趣。但我这人最受不了各种显而易见的bug的：87年的苏联普通家庭用笔记本电脑连着wifi上网登记注册当兵？？？90年已经开始用体积这么小的手机了？？还USB插口？？U盘？？？这是哪个平行宇宙的科技大爆发？？？
_witch2,看过,很差,2019-06-21 08:13:42,61,我服了，吕克贝松现在堕落的和吴宇森一个德性了，先不说故事又多稀烂拖沓无聊，开场快一个小时好不容易等来第一场动作戏，结果剪辑中庸疲软的一塌糊涂，这素材拿给我剪都能剪的比这好………………难怪连宣传都不宣传，片方自己心里都有逼数
张咏轩Wayne®,看过,较差,2019-09-11 13:51:53,48,两个小时真是煎熬，原本一个小时能说完的故事，导演玩反转和非线性叙事玩的不亦乐乎，不仅磨磨叽叽，还特别招人厌烦，类似《红雀》的红色间谍故事，在女主安娜的身份背景上一直兜圈子搞玩味，是超模也是杀手，牺牲了流畅的讲故事手法，换来支离破碎的形式主义，动作戏少而糙，逻辑bug遍地都是，开了挂的女主，长了眼的子弹，还有那些与时代不符的科技运用，廉价反转，无意义闪回，深怕观众不知道，结构玩法实在蠢，女主周旋两男一女之间，杀人不是重点，被欲望自由抢占了先机，吕克贝松真堕落，像交出一张学生作业，时代在更迭，技法在倒退，难怪自己的电影公司亏损到被收购，该！★★
桃桃林林,看过,还行,2019-08-07 18:05:40,97,吕克贝松实在是……女主一边美一边杀人是唯一看点吧，各种硬反转也是够了。
掉线,看过,还行,2019-09-14 02:12:21,70,【C+】吕克贝松类型片功底还是硬，各种流畅的摇镜和剪辑看的太舒服了。选女演员的眼光也是一如既往的好，虽然Sasha Luss全程面瘫，但身段和气质实在是迷人。就是这个剧本真是计中计中计中计的没有必要，转几个弯是高智商，转好几个弯只觉得扯淡。看到安娜前后嘴吻两国特工的镜头，我爆发出杠铃般的笑声。（PS.全程脑内弹幕，超模这么薄脆的身材，根本打不动人的吧）
黄信滚,看过,还行,2019-06-26 00:32:09,48,片子本身质量两分半撑死，好好一题材拍得太乏味了，看得味同嚼蜡如坐针毡。叙事结构和反转勉强加回一点分数。
人类学科研究员,看过,还行,2019-09-16 02:27:33,48,套娃叙述，吕克贝松老了。以及为何他那么执着于优盘？
SebMia,看过,还行,2019-09-24 23:36:06,53,以安娜的身材和颜值，不来中国当网红可惜了。无需动脑，不用杀人，对着镜头扭一扭，夏威夷别墅秒到手～7/10
谢谢你们的鱼,看过,较差,2019-09-11 18:52:14,24,吕克·贝松还要拍几部电影证明自己是一个傻逼？We already know，ok？是当所有人没有看过《红雀》和《原子杀姬》吗？对前妻米拉过于思念以至于想找了一个替代品？最可怕的还是这种明明俗到骨髓里面还要打肿脸装cool的片子了！
外出偷狗,看过,还行,2019-09-08 23:26:43,37,当然无法理解吕克贝松为什么9012年还在拍名模杀手，但有对比就有伤害，真模秒杀红雀，不亚于Lucy，或者还能给黑寡妇点灵感。尽管Bug奇多（老式笔记本电脑已经有WiFi了）、时间前后跳跃奇多、反反转转奇多，但整体剧情和观感都要好过<基努里维斯带狗III>。
嘟嘟熊之父,看过,较差,2019-09-11 19:14:35,24,吕克贝松改行了，现在是苏芒的接班人。
与碟私奔,看过,推荐,2019-09-10 23:48:52,28,所谓螳螂捕蝉，步步紧逼的节奏，剧情的回闪推翻刚刚以为的故事，在“危险不会提前给你发出警告”的信条下，一切皆有可能，苏联（俄罗斯）美国从来就没有停止过彼此的渗透和反渗透，貌似无辜问题女孩的自我救赎之路其实就是一种“国家利益”的权衡所谓自由只能靠自己去争取和付出。电影干净利索符合导演的风格，可能这种没有什么拖泥带水再加上养眼的美丽模特的背景才是电影好看和过瘾的提升空间吧，这个90后女孩子演绎的自主独立坚强和聪明是好莱坞电影所塑造不出来的，也只有这个俄罗斯的女孩子看着更本色和真实。
小小农,看过,力荐,2019-10-04 21:30:46,3,戏剧来源于生活，电影照进了现实，然后，你最好还能举一反三以此类推，听出讲故事人的弦外之音，接受你不愿相信的那些。山姆大叔有实力守规则，而且很温柔，所以吕克贝松敢调戏，甚至意淫人家徒有其表，这个显然不厚道。至于战斗民族，吕克贝松似乎也挺懂的，他们喜欢膨松剂就成人之美嘛，给面子又不会缺斤短两。KGB背景，美苏，假想的硝烟看起来挺像回事儿的，关键是养眼的安娜，她没消失在《杀死伊芙》里的科莫的影子里。说的还是自由的事儿，将军的棋子也好，倒戈的子弹也罢，女主就是一条想要自由呼吸的鱼，在权力的泥潭里，鱼戏泥潭间，鱼戏泥潭东，鱼戏泥潭西，最后摆脱了这肮脏的游戏。信用为负的极权制度满目疮痍，这个表现得还算生动。另外，女主的身份很有意思，从来都不是普通人，不是普通人家里的孩子。
谢飞导演,看过,推荐,2019-12-18 17:09:51,16,法国导演吕克贝松的商业片，拍的不错。运用时空交错、倒叙、前闪等手法把一个俄国女特工的故事讲得非常引人，普世的争自由主题也鲜明、自然。在广州回北京的海航飞机上观看，是电影未来以网络营销为主的多种流媒体发行方式的很好事例。
Mathilda,看过,推荐,2019-09-10 23:28:15,25,太可惜了 anna和maud的情感就这么被一笔带过了！女主有点点像安雅（腿这么长，摔下来应该会折吧
把噗,看过,较差,2019-09-11 10:10:50,23,不要有期待，注意那些低级bug，忍受超模。
托尼·王大拿,看过,较差,2019-10-09 21:51:17,7,不停的倒叙展示出放肆的不加节制，或许更是创作力大幅下滑的有心无力。动作戏剪的还成，但单镜头稍长就看出了些许笨拙。
frozenmoon,看过,较差,2019-10-09 22:54:04,12,这都是啥啊，到处都是常识错误，还有那些过时的排演式的不可能的打斗。看见笔记本电脑注册当兵的时候我都懵了，到底是哪年？发生了神马？
仿真男孩哪吒,看过,还行,2019-10-04 02:48:24,21,都9012年了，剧本还可以土到怀疑吕克贝松被冷冻了二十年刚醒过来提笔写的。
老袁,看过,推荐,2019-09-12 10:46:13,32,作为吕克贝松这一部不算佳作，但观众没什么好挑剔的。腿长一米八的超模游走于俄美两大帅哥，还有一个同样肚脐底下全是腿的女朋友。这些都不够看，非要盯着逻辑问题不放，实在是买椟还珠。
文森特九六,看过,还行,2019-06-23 20:36:49,11,围绕“疾速”系列崛起的西方华丽硬派动作类型复兴，“拍摄美国电影的法国人”吕克·贝松难免也会参一脚，依旧是建立在无数自作聪明的Bug级小反转之上的短暂快感，无法同雷奇与史塔赫斯基媲美的格斗戏也在剪辑速度和场景选择上得到了最优的平衡缓冲，非常塑料的流行电影，却也是“欧罗巴”近年来观赏性最为舒适的一部了。
zhang 2nd,看过,推荐,2019-09-14 11:24:57,12,男帅女靓，吕克贝松还是那个爱做梦单纯善良的boy
晚不安,看过,较差,2019-09-30 23:13:24,11,三面间谍、双面情人，年度最扯淡特工片。《超体》至少还能让人WTF一下，两小时的《安娜》就真是庸俗不堪了。吕克·贝松已经沦落到拍这种不入流的行活，还把自己整得特别像一个女性主义导演。让模特女杀手思考人生的意义，却把自我挣扎拍得如此塑料、廉价。用起闪回的叙事诡计也是不顾基本法，跟不要钱的大白菜似的。倒是把故事逻辑都接上了，但是不经过精心设计的反转，在观众眼里就是另一种形式的偷懒。这么说来，还是你爱狗的基努大爷给力啊。
Ricky925,看过,还行,2019-09-11 22:23:58,19,吕克贝松对女特务的极致幻想，政治爱情我都不要，我只要自由
乌鸦火堂,看过,推荐,2019-10-04 18:31:41,5,3星电影+1星情怀，吕克贝松电影精华+致敬前妻。几乎是《尼基塔》的翻版，但没有后者的温情悲凉，单纯走商业爽片路线。御姐动作电影，老吕可是创始人，最明白怎么能拍得好看，但有些吃老本，交叉闪回叙事更是毫无卵用的炫技。结尾戴帽子名场面致敬《这个杀手不太冷》，女主角长得很像前妻米拉乔沃维奇，角色用的是前前妻的名字，老吕偏爱这口。虽是老调重弹，但趣味性还是有的，男人都是大猪蹄子
街坊饿霸,看过,较差,2019-09-21 00:11:52,10,如果这是一部AV 我给满分
请叫我腹黑,看过,还行,2019-09-15 22:17:58,15,虽有数不尽的bug，道不完的老梗。但谁叫就爱这种冷面孔大长腿配置，动作戏还是非常爽的。毕竟身材真的甩大表姐好几条gai，老吕diss《红雀》很到位了。
程育海,看过,较差,2019-09-25 00:41:02,3,比起导演能力毫无进步而言，更可怕的是一切“省力至上”原则指引下的全部，导演自己没当回事，观众也对本片没有太多期待，原始满足够了就行，美人揍人，够美足矣，足则足矣，只是忍不住叹息，吕克贝松一如那些赞美过的香港导演，江河日下靠制作把戏度过职业生涯后半段，“可喜可贺”。不是他们老了，是俺们过去太年轻，太容易喜欢上一个人。
Bryan·M,看过,较差,2019-09-14 18:57:43,5,就不能老老实实拍部动作片就算了？非的用个不过关剧本拉个谍战片的架势出来。想看爽片你得先熬过前面不知所谓的前戏，安娜口中“惨”的呈现显然不达标。第一场动作戏打击感和剪辑效果压根没撮合好，爽度大打折扣。最终反转也缺乏颠覆性，比较反套路的应该是双方没能火拼吧。还有架空历史不彻底引发的科技树bug就不细说了。电影唯一可取的只有超模的颜、子弹穿过消音器悦耳的枪声、肉搏战时不时出现在镜头上的血液效果，一部失败的造星电影。2星。
iriselite,看过,还行,2019-09-13 10:40:50,4,故事胜在意想不到的多次反转，可惜过于冗长，老套的闪回叙事很拖沓乏味，减弱了整体的叙事节奏。果然海伦的演技最赞。打斗戏中规中矩，没很出色，和女模的床戏都没。。。
发条橙,看过,还行,2019-09-10 22:10:23,19,电视电影的廉价感，没那部BP机，真没看出来背景年代设置在美苏冷战时期，大小bug数不清，各种反转比我XX还硬。并且，这就是一部“情色片”啊！这样想的话，它是合格的。吕克·贝松很会选女演员。
木可流芳,看过,还行,2019-09-10 16:16:08,10,海伦奶奶的演技在这部里面都downgraded一个层次了哈哈，典型爆米花片。不要有期待，跟着吕导爽就完事了。plz享受超模。
荔枝超人,看过,很差,2019-10-09 17:10:45,12,吕克贝松还是王晶，傻傻分不清楚。
是蟹,看过,较差,2019-06-23 15:48:24,1,吕克贝松也救不了。仿佛又看了一次红雀……短发女友更是神似John Wick3里面的女配…各种出戏。尽管全程内心“我可以”，剧情仍然很一般，无情两星惹。闪回太多太烦了，毫无叙事的诚意。
纯黑色、独白,看过,推荐,2019-09-13 18:29:04,7,太久没有打斗谍战剧了！！！ 克制 冷静 沉着的全片节奏。但完美的讲了一个环套环的故事！金蝉脱壳 借花献佛和走为上计的完美展现。人人都有她的诉求，人人却都只会索取，留一手总是没错的。电影里的bug用科技巧妙化解带过我觉得没毛病，虽然这部并不是真正意义的谍战片，花拳绣腿和超模换装pl'ay总是值得欣赏的，最爱穿貂皮餐厅那部戏，那叫一个不科学反常规的slay。
柯里昂,看过,推荐,2019-09-10 22:56:37,6,三星半。要不是贡献了两场尚且可看的枪战戏，吕克·贝松这剧本编得确实有让人翻白眼的冲动，其实女特工和双面间谍一类的戏码不值一提，但回想一下，即使算上由男性主导的电影，近年的动作片中也的确少有能让人心悦诚服的作品，而虽然和吕克·贝松主笔的这个迂回却笨拙的故事一样，作为一部动作电影本片也并没有在外观风格上拿出足够的亮点，但整体上来看总归还是拍得流畅，几位主演也都很好地在各自位置上完成了任务，女主表现很飒，不输《碟中谍》系列捧红的丽贝卡·弗格森和凡妮莎·柯比。
that幽幻,看过,还行,2019-09-15 21:08:52,8,6.3 不管kgb还是cia都是英国人演的，难怪被女主玩弄于鼓掌间，都多少年了吕克贝松还在拍这种老掉牙的剧情，还设计了这么多理所当然的反转，只能说太有喜剧趣味了。当然，本身就是奔着女主看的，也的确社保。
恶猫的步调,看过,还行,2019-09-11 15:53:36,6,其实除了之前打着预告片吸引人眼球的餐厅大战戏，太大的看点是没有的……幸亏我还是挺喜欢他的配乐（其中几段）。频繁用了闪回反转结构，但是并没有什么加成，搞得最后有点吕克·贝松女权版肖申克救赎的意思！？（所以硬塞的女朋友T角色到底搞什么！？又没床戏）吕克·贝松对演员过往履历的prodction value真是一如既往着迷，比如海伦·米伦，肯定是要让人跟她《赤焰战场》的退休特工联系上的。吐个槽，标题难道不该是：From Paris With Love。
kylegun,看过,推荐,2019-09-11 00:29:12,5,锅碗瓢盆拆吧台的餐厅杀大赞，克格勃总部脱出也不错，但除了这两场动作戏其他实在太一般了
圣代队长,看过,还行,2019-09-22 00:28:54,0,"立意好，长得美，就是打斗太差，比不上寡姐和朱莉的一个脚趾头。lucy、anna,下一部应该拍Vivian?"
哼哼.floweray,看过,还行,2019-09-12 16:04:25,6,"25年了，其实我更想看到吕克贝松继续玛蒂尔达长大后“继承衣钵”的杀手传奇，更更想看到莱昂鬼使神差的出现。
当然，我也只是想想。"
法兰西胶片,看过,还行,2019-10-01 01:36:25,7,6.5分。当年冼杞然拍《黑猫》照抄《尼基塔》然后找吕克·贝松的发行公司卖版权老吕当时就掀桌了。现在老吕又把这张桌子摆了回去，摆得还挺工整，重新上了漆。
Alan,看过,较差,2019-09-15 08:17:47,7,lol 这个编剧真是胡编乱造异想天开 sasha真是好看 不过这小胳膊小腿怎么看打人都不疼
峰峰峰峰,看过,较差,2019-09-23 23:23:46,1,无脑爽片~
握瑾怀瑜,看过,很差,2019-07-06 04:11:41,4,真的无聊，第一部在电影院看到一半就回家的电影。
苏乏,看过,推荐,2019-10-19 23:29:28,2,相当套路的动作类型片，不过好看，ANNA本身就是高度对称的名字，既是双面间谍的人设，又为多次反转做了相当明确的暗示，叙事借助打乱时间线来安排节奏，为原本或可猜到的结构增加了变量，剪辑点是花了功夫的
思路乐,看过,还行,2019-10-02 10:37:51,3,【B－】算是一部低配女版JOHN WICK，而且无论是视觉设计还是动作拍摄都被JOHN WICK甩了一大截（室内霓虹光效与外景拍摄都不如前者，而动作戏的打击感与写实/写意风格更是被完虐）。不过作为一部特工电影，整体剧本和创意的完成度还是尚可的，女主也实在是养眼，但也仅限于此了。
艾晨,看过,还行,2019-09-14 21:48:31,4,美就完事了！
梦梦,看过,还行,2019-09-22 11:41:40,7,名字带娜的尽量别招惹，安娜汉娜还有娜娜……
七海,看过,还行,2019-09-18 10:29:13,7,名牌超模最佳广告片导演获得者，吕克·贝松！
曾良君,看过,推荐,2019-09-25 03:29:45,7,如果是年轻时的米拉·乔沃维奇来演，就没有任何问题了。
诸葛若见,看过,推荐,2019-09-21 21:42:40,4,如此尤物，才配倾城。剧情如俄罗斯套娃，反转反转再反转，法国人暗喻太有意思，分别吻别美俄两国特工。
陆支羽,看过,还行,2019-09-10 23:04:23,3,2.5。
小唧唧,看过,还行,2019-09-10 23:39:37,11,想玩时间线，却弄巧反拙把故事讲得支离破碎...... 安娜的短发女朋友全片最美有木有！？有木有？！
🤍,看过,还行,2019-09-23 02:34:02,3,手机电脑什么的我都能接受，但设定上实在是有太大的逻辑错误。从影片开头得知1990年安娜去巴黎，但最后档案却显示她1960年生，1985年加入KGB？？所以安娜30岁被星探发现去做模特吗？不说不可能找年龄这么大的新人模特，就是演员本人现在也没到30呀？看起来更不到30！！为什么要设定的这么大？？17岁父母双亡后过了一阵浑浑噩噩的生活，还足够小能达到入伍年龄，再被KGB挖掘训练几年最后去巴黎，设定为1968年左右出生才正常吧！！
女神的秋裤,看过,还行,2019-09-12 19:12:49,4,超模很美，演技渣渣，花拳绣腿，毫无力道，反转加一星吧
John Coey,看过,2019-09-16 23:50:24, ,1,"貝松基本炒了自己以前在尼基塔用過的橋段, 餐廳刺殺梗又被拉出江湖,即便找來超模也表示是玩不出太多新意出來."
那个尼克Clémtt,看过,还行,2019-09-15 12:34:41,3,电影还行吧，称不上很好，影片前面真的太平淡了，看的很无聊，中间剧情才是真正的开始吧，刺杀的戏份还可以 ，最精彩的部分就是结尾的反转了，还真是螳螂捕蝉，黄雀在后。
喜喜,看过,还行,2019-09-19 22:29:01,4,全世界地位再低下的妇女也没本片中的女特务低下，被美俄集团耍的团团转，实在是太惨了。
James Bond,看过,还行,2019-09-16 14:44:58,6,让一个超模来演杀手是咋想的？女主真的无力吐槽，打斗镜头全是预告里的，奇怪的剪辑，柔弱的力度…非线性叙事和反转还稍微有点意思，此片不爽就不说了，看完还感觉就是个四不像。
YthguaN,看过,还行,2019-09-12 11:42:39,5,白天揍摄影师晚上杀人 还能跟Luke Evans Cillian Murphy乱搞 这大概是所有超模都想演的片子吧【这个叙事结构对无脑爽片来说挺帅了
