用户,是否看过,评分,评论时间,有用数,评论
il,看过,力荐,2020-02-15 18:43:16,0,不是第一次，也不会是最后一次。借由隐忍和不辨，粉饰的太平生活，高低潮有时最终恒温在太平格；颂扬加剧羞耻，破口大骂显得讽刺。当上帝当，信仰，被赋予死物意味，不会大过餐前利口酒意味，有无无妨。你失去一次机会，你失去很多次机会，希望你的辜负，不会成为你选择做懦夫的借口，我是说某裆假意工人领袖的狗比资本家们。（算了还是不要天真了。
cliosong,看过,推荐,2020-03-01 19:14:08,0,（7.5/10）肯·洛奇为他们那个语境下的工人阶级奔走呼号时有一个好，就是没有“精英式的的虚伪矫饰”，直接把底层的生活现实——也就是那个苦难的现实——曝光在意图躲避进艺术的殿堂里假嗨的观众面前，他给我们的是被从酣睡中扇醒的快感。但是我不喜欢他的电影，也不喜欢近年来欧洲电影届对现实的非常关注，虽然我近来有意想要克服这个偏见。但目前来说这涉及到某些最根本都分歧：这个欠天降火与硫黄的世界是暂时的，而艺术的价值是永恒的。
齐小博子,看过,力荐,2020-02-04 20:02:33,1,我国向来自豪于高效的快递和外卖系统，但这系统中个体被无情压榨摧残之痛还没有电影来表现，肯老爷子给办了。个人觉得比《我是布莱克》和《年轻的阿迈德》都要好。
江湖骗子valkyrie,看过,力荐,2019-12-17 16:49:41,1,"#EUFF 3rd 每年大银幕上丧一次，2017年《海边的曼彻斯特》男人丧，2018年《一天》女人丧，2019《对不起》全家一起丧。
社会主义的996还用“福报”“兄弟”来掩饰一下，资本主义的996压根不遮掩自己滴着血泪的獠牙。
名为“自雇”，却不能开着自己贷款买的货车带家人出门；被混混打得头破血流在医院，接到的却是“你找到顶班司机了吗，不然要罚款”的电话；温柔的护工却面对的是“麻烦你去照看一下吧，很抱歉这个没有加班工资”；曾经也是肆意相爱的青年男女，被生活逼迫到连做爱都只能“我会把你放在明天计划表的第一位”；为了唤回浑身反骨的孩子，损失了工资遭到了罚款却得不到理解。
好在最后在苦痛面前一家人捐弃前嫌站在了一起，可带着伤痛的身躯开着车会去向哪里？银幕没有解答，观众此起彼伏的抽泣声也没有答案。"
2miao,看过,推荐,2019-05-17 07:45:00,3,一家四口在回不到的过去和望不见的将来间挣扎。现在时的生活琐碎而富有压迫感，家庭内外部大大小小的意外接踵而至，大人们在工作中遇到的人为设计的死规矩指向一个僵硬而冷漠的大社会，小家庭里的人们在与之较量的过程中不断消耗着彼此的感情，也确证着对方的珍贵。肯·洛奇电影的神奇之处就在于它们传递出的温度感，就如本片里，一往无前的父亲和被他甩在身后的家人，依旧牢牢地拥有彼此。
蒜 | BOY A✎,看过,推荐,2020-03-10 17:33:32,0,有时候阳光美好的电影看多了，我们会觉得世界原来是那样的，不断给自己信心和勇气，重新面对这个操蛋的世界。这部电影就是让我们看到，世界的另一面，还有那么多苦涩和无奈，无论你多么努力和勤奋，你也站不起来，只是我们更愿意被阳光美好所麻痹，希望生活不要抛弃自己。直面脆弱和不堪太揪心了，但这TMD才是生活啊，生活哪有容易的，只是大家都藏在了心底
二月鸟语,看过,推荐,2019-07-11 11:45:40,0,SIFF19，被生活胁迫的人们，他们的结局就像电影的结局一样，随时在戛然而止，剩下的只是欲哭无泪和背影。
Mockingbird,看过,推荐,2019-12-01 02:01:46,2,欧影展第一场，算是一个蛮不错的开头。作为欧洲著名左翼导演的肯·洛奇，一如既往地将电影的视角投向了资本主义社会的底层人民，而作为来自其中的电影主角们也大都属于“狄更斯”式的“底层好人”形象（父亲为打了孩子还在外徘徊反省；母亲从不说脏话而因动粗而内疚哭泣）——可以看出，肯·洛奇对底层劳动人民投入的不仅是关注的眼光，还有对善的相信与爱意（正如同狄更斯所做的那样）。电影的现实主义手法贯彻的也很彻底，镜头转换几近不动声色，背景音乐也几近于无（留下的只有人物对白与环境效果音），情节设定也简略了前因后果（就像是择取了一段生活图景，也仅此一段而已）。最终电影的结局走向了一个让人看不到希望的闭环，就连用来道歉的纸条都是公司用来给顾客致歉的便签纸，这一反讽实在既露骨又令人感到心酸。肯·洛奇电影是很好的社会图景。
仲夏之门,看过,还行,2019-10-24 06:17:04,1,无功无过的肯洛奇式调研文稿，越往后剧情僵化的毛病越严重。
K45P3R,看过,推荐,2019-10-30 04:25:18,2,（7.3/10）女儿留下的字条。仅仅是收件人错过的一个快递。父亲留下的字条。却是一个家庭错过的时光。是受困于现实的无奈。是压在社会制度下的生活。
probe,看过,推荐,2020-02-28 12:08:16,0,看的难受到都不想评论什么拍法了……肯洛奇总是在警示我们有些事始终没有变，即使“顾客就是上帝”这种看似利人的口号表象下，也掩盖着多少人对人的压榨。若说肯洛奇的电影是给与影片中的人物同阶层的那些观众看的，那就如揭伤疤般痛苦，他更力求的是把这些能引起人性共情本能的内容，呈现给那些晒着阳光不了解阴影下到底怎样的中上阶层看的，是用来挑战中上阶级对世界的虚伪描绘的。对上层看来始终是悲哀的难以撼动，不然肯洛奇也不会坚持到今天依然不断有这样的题材能持续获得共鸣，起码能给予自觉不稳定的中间阶层与底层能更多的了解到临近阶层的苦难，懂得要把宽容与理解更多的给予处于“同一战线”临近阶层，阶层的团结才有抗争的力量。
Alias,看过,还行,2019-05-17 06:33:29,1,故事本身没问题（除了最后部分的过度抓马），肯洛奇最大问题是手法太老化僵硬，把非职业演员居然都能调教得毫无随机性和活力。也难怪被人说是阶级斗争样板戏了
南悠一,看过,推荐,2019-05-17 06:39:41,1,这些年的肯洛奇虽然保留着以前的大体风格，写实主义、针砭社会和对底层人民的平视的怜悯，但多多少少有对他最标志性的两个作品有所背叛，尤其《我是布莱克》将《风吹麦浪》中人设刻板的缺点最大化，也没有了《小孩与鹰》用简单故事反映复杂主题的优点。在这部新作里，因为生计，一家人之间矛盾丛生，又在细微之处流露爱和亲情，实在动人，人设比《我是布莱克》好了很多，更弥补了后者剧本上的生硬，也比后者更适合拿奖。
食指,看过,力荐,2020-02-07 20:36:20,0,看肯·洛奇的电影，你能看到从60年代开始，到目前为止，整个英国社会下层人民生活状态的变迁。
Dear Cosmos,看过,推荐,2019-11-30 23:54:56,2,"#EUFF2019#
第一部肯·洛奇，很受触动，会觉得有些用力过猛，但不是导演用力而是生活，不似《开战》那样富有战斗性令人震撼，而是让人产生深切的悲悯与同情。让人回想起第一次读欧亨利的《麦琪的礼物》、读莫泊桑的《项链》，悲喜交加到让人直呼c'est la vie。每到这个时候总会感叹，自己离真正的“生活”是多么遥远。"
番茄杀手,看过,力荐,2019-08-26 22:17:31,1,艹 看哭了 太难了 真的
江寒园,看过,推荐,2020-03-05 00:02:04,0,艾比拿过电话失态地对管理吼出脏话和哭泣的时候，想起北京驱逐低端人口，地铁上一对情侣，紧紧握住的双手和低垂的哭泣的眼睛。永远向肯·洛奇致以敬意。
莯,看过,力荐,2020-02-22 11:54:40,1,底层真的低贱得心酸。一家人一起心酸
唐那啥,看过,力荐,2019-11-30 23:55:35,2,表演控制的太好了。脆弱的物质和精神平衡经不起任何必然会来的意外，就是低收入人群的现状，当然傲慢的观者只会觉得是不懂克制的情节剧。
Jin Unrated,看过,力荐,2019-06-23 21:09:57,0,隐约觉得儿子是导演的价值观投射。涂鸦和广告，一个宣扬反权威，一个宣扬消费主义。但在目前的社会，创作与反抗消费主义有关的艺术又能做什么。Ken Loach 的电影都像纪录片般真实，妈妈的崩溃和警察的告诫都太让人心碎了。
斯齊佐飛力尼克,看过,推荐,2020-02-09 14:58:35,0,也不是无解的，但凡那个叛逆的大儿子不那么自我，这会是一个虽然辛苦但能拼凑出不少幸福片段的家庭；又或者父母二人都能有一份好一点的工作，即使亲子关系不和谐，至少不会四人都筋疲力尽。但可惜，这就是不幸的不可改写。
巴鲁和希达,看过,推荐,2020-02-22 21:02:03,1,"7.5
意义大于内容，影片所描画的艰辛让我有几次都不能直视，深深的害怕生活给这个苦难的家庭更多意外的不幸。
现实主义题材并不讨喜，然而这才是我们最真实的人生。"
m89,看过,还行,2020-02-21 23:23:32,0,好久没感受过这么浓厚的伦敦郊区音了…金钱社会，消费主义，劳动人民的一曲悲歌。善良、勤劳、有责任心却只能在底层挣扎，越努力工作越陷入无底深渊。
苏莫,看过,还行,2020-03-09 17:43:29,0,故事行进到结尾这里，电影结束了，但人物还要继续往前走，一切都可能发生，疲于奔命倒下了，贫贱夫妻散伙了，儿子辍学去打工，女儿早早嫁了人……然后，这样的故事在新的家庭里轮回，像是《神曲》里的第一层地狱：在向往中生活而没有希望。
Matrimandir,看过,力荐,2019-06-18 13:14:15,1,"先五星，赶完今天的场次再细写一些，肯洛奇真o是关注人性之光的导演。伟大！

＃SIFF 第九场＃"
朱熠,看过,还行,2019-06-24 07:44:33,0,苦啊苦啊苦啊
布拉德痞特儿,看过,推荐,2020-03-09 15:47:34,0,不论是什么制度下，底层人的生活都太不容易了，不需要多么富有，哪怕是简单的家庭和睦幸福都是莫大的奢望。在肯洛奇的镜头下，不需要刻意煽情和制造剧情冲突，因为它就是生活。
咯咯精,看过,推荐,2019-05-17 06:24:48,2,男主角长得好像Damon，衰老弱小又无助得我心如刀绞。Be fine love.
F,看过,推荐,2020-02-28 23:31:04,0,本来打三星的，看完一周了至今仍会回想起来。改四星
大海里的针,看过,推荐,2020-02-09 11:57:50,0,看着太糟心，本来底层社畜就够不容易了，还摊上那么个败家儿子，然而正是因为底层，所以对子女教育不够，恶性循环。
matchbox,看过,还行,2020-02-08 21:38:49,0,唉，底层人民的无奈。
猪头妖怪,看过,推荐,2019-06-20 13:49:35,0,虽然略逊于前作《我是布莱克》，但依然饱含情感，没法不叫人感同身受。父女快递的那场戏堪称全片最大亮色，真美好。
AshBoydSwan,看过,力荐,2020-02-05 19:26:01,0,太惨了...我怀疑伊纳里图是不是给错了把这部当成了达内=。= 感谢老爷子多年来一直将镜头对准社会底层人物，敬佩。
ピラミッド,看过,力荐,2020-03-09 12:43:40,0,贷款 加盟 罚款 看到这些，才发现英国人民原来也和我们一样
任孝恒ShawnRen,看过,推荐,2020-02-11 17:27:28,1,妈妈脾气太好了，极有耐心，爸爸犯了错也很快能道歉，还有个听话的乖女儿，一家人能在一起好好说话掏心窝子，这些都太难得甚至都有些美好得不真实了，两个职业选的很好。这样的现实主义题材我国能拍出100个不重样的，喔，不好意思，不让拍。
彼得潘耶夫斯基,看过,力荐,2019-12-13 19:54:08,2,作为一个被《小孩与鹰》吸引过来的人，惊讶于肯·洛奇的多重面孔，他固有的抒情性和对青少年心理的关注，如何与一个马克思主义者的道义感相得益彰，也许就艺术而言，重要的不在于他在底层劳工议题中所处的立场，也不是他所拍摄的题材，而在于影片的叙事多大程度能够把工人的生活重新有机、总体、全局地组织起来，肯·洛奇从《我是布莱克》到《对不起》一直在进行这样的尝试，看护和送快递都是与异质性的社会空间打交道的职业，在这种繁忙、机械、辗转的劳作中，洛奇展现了工人家庭的生活如何被其“职业”所粉碎、绑架和撕裂，以至于他们的亲情和爱，他们对孩子的无私的投入，也带上了劣质、残次品的味道，洛奇对德西卡和彭泰科沃的新现实主义的当代延续本身就是一件创举，电影的方法性在于，某种看似本质性的道德水准、家庭危机，都是压榨剩余劳动的结果
水片,看过,力荐,2019-12-01 01:17:42,2,最生活的视角 最冷静的方式 最大胆的创作
∮3alloon,看过,力荐,2020-01-07 11:44:07,1,（A4.0/P4.5）绝对不要是「可能是肯洛奇的最后一部影片」*万象百老汇
一笑懸命,看过,推荐,2019-06-29 11:59:31,1,"现实主义描述底层英国快递司机一家的艰难生活。丧的程度堪比海边的曼彻斯特，不同的是里面的主角是来自真正的曼彻斯特。相同的是，对于操蛋的生活，不管人们生活在哪儿，似乎都找不到解决问题的答案。一家人都在愤怒地问“is it always my fault?”，也在发生一次次日常事件后互相道歉""sorry it's my fault""。其实我们都知道，不是谁的错，生活本是如此。只不过导演们似乎一旦铁定了心想要传递一个信息的时候，就会选择性地表现生活中与我们为难的部分。
影片颇有意味的以父亲填表买货车加盟快递公司起，自最后毅然决然开着van离开去养家糊口，前后呼应的有始有终，却抛给我们一个惨痛的现实，生活在底层，哪怕再努力工作可能未来也不会更好。"
Nowaysis,看过,力荐,2020-02-04 21:31:50,1,This is Tory Britain!
闪电杰克,看过,还行,2019-06-20 00:02:45,0,#22th SIFF#第七场：不如前作，依旧很丧。
一朵潛水云,看过,还行,2019-12-01 04:11:09,0,"感覺肯洛奇近年拍片的目標都挺很明確啊，就是為了底層勞工舒一口氣，用電影共同思考一個家庭。繼續用很簡單的故事去講述家庭關係、資本運作模式。還有挺關心新一代年輕人的。完全用同理心去思考「手機」就是新一代青年人的「全部」；還有對""Big Data""的調侃；用暴力教小孩並不可行。最後還留下了反思。但相比起《我是布萊克》，這齣明顯沒有那麼的淒涼與尖銳。"
想吃肉,看过,推荐,2019-08-27 23:40:45,1,各种倒霉的小事堆积起来的痛苦你没办法去责备任何人，看似作天作地的儿子只是太渴望父亲的陪伴，冷酷无情的邻班只是被资本的大山压住，说的俗点就是众生皆苦。前面的细碎小事足够把人压垮了，最后的设计反而显得刻意，不过够我哭好久了。不只是对快递员，对普通的众生都好一点吧，大家都太苦了
热带疾病,看过,推荐,2020-01-05 22:23:55,1,肯洛奇太能理解我们穷苦人民的不易了，观看过程中几度都要跟着这一家人崩溃了。已经拿了两座金棕榈的肯洛奇还在把创作目光对准底层工薪阶层家庭，还是继续了他的大写实风格，生活的艰难就这样平铺直叙地摆在眼前是无论如何也回避不了的。
RioLiv,看过,力荐,2020-02-05 19:32:04,0,真的好惨惹，不管做什么都会被干死，唉！
小年左,看过,力荐,2020-03-06 01:47:05,0,琐碎生活中任何不尽如人意缓慢刁钻地生出霉点，引发一再短路，而迎着「断电」的日子再三铤而走险，每个人都心知肚明，那个心中盘算好的「六个月之后就会好了」，只会越来越偏离轨道。击溃善良的不是什么利刃，而是叫人无处遁走的反复敲击的「勺子」，以及你因此正在爱人之间的裂缝里洒下虎牙，但你明明是想在那变成沟壑之前填平它，越努力，越事与愿违，这股莽夫力太戳了，心好痛。所有的着力都轻且清澈，收到的回击力却钝重。虽然只看过两部他的作品，但粉上了肯洛奇。妈妈和女儿，简直人间天使，天使怎么可以受这样的苦，哎。
废话盒饭,看过,推荐,2019-12-10 22:58:48,1,影片呈现的所有矛盾最终导向资本主义社会的弊端，在当今社会尤其我国真的很容易引发共鸣，本质上来说和小丑燃烧小偷家族讲是一件事情，但是肯洛奇比较温情的一点是他还相信人性与家庭，害行
超cute侠,看过,推荐,2020-02-13 18:53:03,0,肯·洛奇的镜头始终逡巡在底层人民的苦乐之间，残酷之余又带有一丝温柔，影片通过个体悲剧折射了整个大环境的弊病，包括劳工权益，养老问题，儿童教育等等，当一个环节出现问题，家庭幸福如同多米诺骨牌一般轰然倒塌，好在导演为观众提供了善意与希望，儿子的迷途知返稍显生硬，但对父亲来说是个安慰。
东北洪常秀,看过,推荐,2020-03-06 14:12:21,0,"电影讲述了一个英国送快递老哥的窘迫生活，肯洛基对现实世界的底层人民一向充满悲悯与深情，从点滴刻画一家人掰手指头算计生活的辛酸状态到最后男主崩溃的间隙时间都没有，前后情景的叠加形成了巨大的力量，那些苟延残喘在社会上的真实个体瞬间栩栩如生，幸福指数的降低与资本社会对劳动力的不断攥取息息相关，链条越来越紧，处于底层的人的挣扎也会越来越难。可是这些被刻画的个体们又能否抽出空隙来看这部描绘他们生活的电影呢。
	看完这样的电影，对任何鸡汤都充满了腻烦，艰辛才是常态啊。"
AlanX,看过,力荐,2019-12-08 21:38:44,1,#2019EUFF 朴实却感情充沛。什么是家？家是无论你一天回来多累总能得到放松的地方，是无论起了多少争执总会回归平静的地方，是能让家里的每一个人得到关心的地方。生活的残酷，压得这个家庭喘不过气，可即便如此，他们也不放弃，也会从中找到那细微的快乐。对不起，我们错过了你。没关系，为了这个家，我愿意。
Chaall,看过,2020-01-05 23:00:31, ,0,普通家庭的和和睦睦需要严格依照时间表勉强实现，稍有偏差代价巨大。付不起的医药费误工费设备损坏费，努力工作有用吗？今日份恐婚恐育。
白桦林与橡树,看过,还行,2019-05-17 17:03:09,1,北英格兰版偷自行车的人混400击，一个家庭的故事反映了现在英国社会上出现的不少问题，像北部经济滞后，工人阶级被压榨，青年教育，NHS及护工工作高压等。72 Cannes
蜜柑餡的溫文酥,看过,力荐,2020-01-05 17:08:29,0,令人心痛的「越窮越見鬼」
budaphin,看过,力荐,2019-06-18 12:42:42,0,虽然他们的生活我没经历过，年纪也没到，但怎么会有那么强的共鸣感？？？
pixiedust,看过,较差,2020-02-16 08:09:40,1,但英国的物流实在太差了 时间完全不用想 三天两头自己把货MI了 恶意的摔砸。。。。 这么惨我都觉得同情不起来
Shawn,看过,还行,2020-03-08 20:18:16,1,无论在哪里，底层的生活都是困难模式，不是不努力，是有太多的无可奈何。
变形的文科生,看过,推荐,2020-02-26 12:02:59,1,太苦了太苦了太苦了，借用朋友的一句话，这就是“英版骆驼祥子”啊！
老珂,看过,推荐,2020-01-12 17:35:20,0,高潮戛然而止的结局恰到好处，文火慢炖佳境渐入，又一部掩卷长叹的社会众生相佳作。今年欧盟影展又一部惊喜。#欧盟影展深圳站#20200111
蛋堡的波特,看过,还行,2019-05-18 23:35:55,2,不能期待有驚喜，但會給到的依舊都還是給到了，還是很肯·洛奇的底層故事。
苙原May,看过,力荐,2019-12-01 16:36:50,2,肯洛奇把现代物流业货车司机的生活，拍出了意大利新现实主义《偷自行车的人》的窘迫感，从开篇就生怕那辆货车刮了蹭了偷了坏了。在空间上，从主角一家辐射到其他边缘人群，快递员、护工、问题少年、孤寡老人的生存现状。在时间上，拍出了那种每个上班族都懂得的要命的紧迫感，压得人透不过气来。多少人都是这样越努力越贫穷，每一分每一秒的生命都被生生榨干了。
玩玻璃球,看过,力荐,2020-02-18 01:02:48,2,移动互联网时代的后现代冷血吃人不吐骨头的资本主义，肯洛奇一个1930s 居然有如此洞悉。比之前获奖的《我是布莱克》犀利太多现实太多。大数据时代真正的个体悲歌，一切都被精算和剥削。最后不留一点希望，不管天塌地陷，我要去上班。不管洪水滔天，还是要上班。
喫茶阑珊客,看过,推荐,2019-06-24 13:22:28,2,【SIFF第五场】手中的扫描器是瑞奇的上帝，耳边的手机是艾比的世界；货车载着生活的重担，电话听着瘫痪的呐喊；他不能让女儿共乘货车来分忧，她无法把丈夫列入计划做第一；致歉卡填入的是残存的温情，电话里怒吼的是尚存的人性；说什么雇佣自己，还不是被机器奴役，谈什么怒而罢工，永远会有他人顶替；且压抑所有的怒火，隐忍一切的痛苦，转化为一句鞠躬尽瘁，死而后已
来自小城日照,看过,力荐,2020-02-22 18:35:14,1,全片唯一快乐一会的，就是带着女儿送快递那段，最后还被老板批评了。
迷失东京,看过,推荐,2020-01-11 15:32:12,0,被现实压垮的一个普通家庭，为什么都说拍的是底层人民？这种事情能发生在任何一个普通的四口之家身上……每当说出为了更好的生活努力工作这种话时，往往都会在努力工作的路上把生活推入深渊，但现实又逼着人不得不努力。把镜头聚焦于社会高速发展的另一面，记录下那些最应该被记录的生活，这样的肯洛奇，值得我永远爱下去。
儒,看过,还行,2019-09-04 20:44:02,0,因熟悉的空间体系感到亲切
Gawiel,看过,推荐,2019-10-27 09:53:05,0,快递员父亲与家庭护工母亲面对青春期的儿子，剧情并不复杂，快递说是“自己包车当老板”但全无时间自由，家庭护工的工作牵涉的大量情感劳动，而儿子看着这样的生活也对未来毫无斗志。可是现在的电影能把这些展现在观众面前已经不易。
yfxlavender,看过,力荐,2020-02-08 12:15:09,0,被操蛋的生活不断强奸。如《弗洛里达乐园》一样，关注底层人民的生活。
罗宾汉,看过,还行,2020-01-05 21:19:16,0,明显不如上一部金棕榈作品《我是布莱克》。同样是描绘底层小人物的生活故事，这部作品少了很多以往作品里不动声色的感情流露，而替换上似曾相识的戏剧化情节，结果自然是陷入到煽情的漩涡里难以自控。很有可能是老导演对当代的底层生活欠缺深入了解有关，这远非上世纪七八十年代保守党执政下的英国社会。
汀上白沙,看过,力荐,2019-12-13 18:23:12,1,看哭了好几次，如此沉重又如此真实，结尾很赞，资本主义撕下了罩在传统社会关系上温情脉脉的面纱
发条橙,看过,推荐,2020-02-07 17:46:22,2,第一部肯·洛奇，四两拨千斤，真正的现实主义电影。家家有本难念的经，成年人的生活没有容易二字。尽是残酷，不见关怀，甚至没有一丝怜悯，太难了，生活真的太难了，到最后，只得一声叹息！
seamouse,看过,推荐,2020-01-17 21:43:07,1,当韩国的劳苦家庭成为短暂欢愉的寄生虫时，英国同结构家庭却不得不在996的日子里朝死打拼，以为有六个月后的出头之日。肯大爷继续熟练地为对抗资本主义，设立揪心的苦难处境，且与时俱进的跟上互联网物流，可纽卡斯尔社区就没蜂巢快递柜吗？
luerdelphic,看过,2020-02-29 13:18:25, ,0,然后呢？
碧落亦然,看过,推荐,2020-02-22 14:21:29,0,生活的无力在于生活中的每一分每一秒，环环相扣。
alain.proust,看过,推荐,2019-11-30 23:29:26,1,堪称年度最惨电影，但我相信这依然比现实生活还甜一些。@MOMA
惘然,看过,推荐,2019-06-20 11:21:23,0,"底层生活真的太惨了。
关键这种惨还特别现实，你都不能用一句“艺术创作而已”来安慰自己。
且滚雪球一般每况愈下。
有爱也不能拯救，爱只会被惨淡现实折损摧毁。
人也就这样被一点点摧毁。
导演不煽情，不给解决之道，没有光明希望……只能日复一日。"
zzy花岗岩,看过,推荐,2020-02-09 20:53:57,1,依旧很肯洛奇，揪心无奈又带一丝温暖，而这就是生活的样子~
✟卡淡,看过,还行,2020-03-04 01:00:29,0,没有快递柜的资本主义社会。底层人民的悲剧。
