用户,是否看过,评分,评论时间,有用数,评论
渡口无边,看过,推荐,2019-12-15 22:00:51,0,三星半。肯洛奇拍这样的题材似乎已经轻车熟路——边缘人物，恶性循环而无出口的生活。然而，这种对他来讲信手拈来的剧本，会让人时不时感受到每个人物和事件被赋予的强功能性，包括一遍又一遍强调的罚款、不断作的儿子等等。结尾街上遇到歹徒的那场戏，也一定程度上破坏了原有极为生活化的案例典型性。但仅管如此，故事依然戳心。
零点七,看过,力荐,2019-12-22 03:51:49,0,想到之前看到有个video essay说，去抵达某种程度上的character nihilism是非常容易且偷懒的事情，与之相比非常难的是对于整个结构的情绪里“丧”的呈现，在这个意义上它真的非常动人，也很了不起。
HSS,看过,力荐,2019-12-01 00:01:10,1,差点在电影院崩溃。
五色全味,看过,力荐,2020-02-13 02:31:42,0,故事實在是太讓人心碎揪心了。ken loach一如既往關心底層個體，電影信念如此堅定，真是讓人尊重。ps：兒子的演員竟然和kes有些相像
qw0aszx,看过,推荐,2019-06-20 10:25:57,0,肯洛奇还是稳 ★★★☆
锋,看过,力荐,2020-02-22 21:20:45,1,超级震撼的现实主义佳作，保护善良淳朴本性的人原来要付出这么大的代价，无论是天性使然，还是底线约束，甚至无能为力，一个人不去掠取、欺诈、巧取豪夺、争权夺利……就要准备好生活的摧残与嘲笑，好人好报的神话越来越远，是要坚守自己的本份，还是要迷失在物欲横流的世界，成为一条普世的囧态。尽管哪一种失败结果的悲惨程度都相差无几，而且人们在任何体制和意识形态下都无法遁形，太多辛苦的人都能看到自己。那么，你还愿意做一个遵规守矩的好人吗，那时也许连拥有爱与被爱这样人类与生俱来免费的天性，都是一种奢望……
外出偷狗,看过,力荐,2020-01-17 11:02:02,0,Ken Loach不是在重复自己过去的作品，除了继续细致观察描述工作阶级家庭的生活和工作，带观众感受他们的艰辛与困境，更是极为透彻地描述了2010s/互联网时代的现状，工作的“人”的作用和位置被改变和扭曲，再把影响深入到家庭和下一代上。不能要求人人都有共鸣或危机感，但看不到问题所在就太可恶了。
吃糖吗,看过,力荐,2019-11-09 04:18:07,1,"太绝望了。到最后我脑子里就一句话for God sake, please! no!"
兔子杰,看过,推荐,2020-02-22 17:26:34,1,"越努力，越不幸。
这才是能覆盖大多数人的真相，而不仅仅是那高高在上有如何不食肉糜的几句“我不喜欢胖子是因为他们不够自律”“你不够成功是因为你不够努力”。"
好想成为大熊猫,看过,还行,2020-02-11 14:44:18,1,现代世界光滑的表壳下，肯洛奇注意到了无数的支离出的坑洼和断点。也许每一封邮件都可以到达目的地，但是延宕的邮件已经不再是正确的邮件，人变成了数量化的时间的奴隶，为了弥合事故中损耗的时间而无力挣扎。
蓝白江原道,看过,力荐,2019-12-09 00:13:37,1,把我完全击碎。
