用户,是否看过,评分,评论时间,有用数,评论
Rhodesia,看过,推荐,2019-08-27 22:20:05,1,没想到是这么一惨到底的…太多人生活不易了，多与人为善吧。想起奥威尔说只有对工人阶级家居情形的回忆让他觉得时代还不算太糟，不至于活不下去
陆支羽,看过,推荐,2019-06-19 01:00:46,2,4.0。1.有不少鼻酸时刻，戳中我们的软肋。2.尽管依然对肯·洛奇提不起太多兴趣，但不得不承认他对底层日常的拿捏功力。
万古忠义李秀成,看过,推荐,2019-11-30 22:56:45,2,观于欧盟电影展，英国外卖小哥的故事，摆脱了工会传统的包袱，一切都显得那么赤裸，也显示了导演关注最新现实的努力，没有刻意卖弄伦敦风情好评，催命的电话铃声好评，贵在细腻真实，但还是要扣一星给英式傲慢的老屁，还有“对美好生活的向往”跟“回到原来生活”的希望，自暴自弃的儿子反而来得更真实，《伦敦一家人》在21世纪就是这个样子吧，最后，求中国版。
唐小万,看过,推荐,2019-05-25 23:54:58,2,感觉成在剧本也败在剧本，好在有不少四两拨千斤的戏，很快能让你进入情绪和人物，坏在后半的用力导致有点刻意。肯洛奇总能让我看到社会和阶级的塑造下，人性中无可救药的一部分。
EpicurE_17,看过,推荐,2019-06-18 14:08:28,1,贫贱家庭百事哀 你坐着看他们面临的现实问题嗟乎长叹 而当你身在其中 根本没有伤春悲秋的奢侈 房租、账单、家庭鞭笞着你即便被生活揍得鼻青脸肿也得开着货车跌跌撞撞去上班 在 [我是布莱克]里冰冷的卡夫卡式政府官僚在这里只是换个了面孔变成资本家 平民还是一样的无能 无助 无门 无所遁形
俗人说俗话,看过,力荐,2019-06-20 10:21:26,0,We Missed You，We Love You
Jason Bourne,看过,力荐,2019-06-20 10:19:43,1,上影节#4。第一部肯·洛奇。相当好！泪目两次。
蓝风筝1986,看过,推荐,2019-06-22 14:29:05,3,4.0。电影拍的太真诚了，我们站在何种立场也就不重要了，社会就是这样的，很多判断基于我们所处的视角，如果拍一部快递老板的个人传记，或许也是心酸的，电影可以试图还原并解释当下所看到的视角发生的一切，它引领我们去察觉不一样的现实，我觉得中国主流市场很缺肯洛奇这一类电影，为什么很多弘扬真善美的片子最后都成了伪光正，其实根源在于它究竟是真还是伪，我们太过于关注表面的光鲜，我们宁愿去尝试欺骗也不愿意真诚的面对自我，这也是当下的现状，就电影创作来说，真诚大于立场，喜欢《我是布莱克》的观众应该也会喜欢这一部。
冰红深蓝,看过,推荐,2020-02-11 10:11:00,3,肯·洛奇新作，又一次在深入底层人物细碎内心的同时折射出广泛的制度性问题。1.聚焦一个快递员（无保障，计件收费，承揽关系）与护工（无加班费）的悲催生活，一个每日匆忙奔命，另一个随时可能需要去陪护老人。2.一切唯效率指标马首是瞻，快递扫描枪成了所有送货者的奴隶主，在资本时间的体系中无止境地丧失自我。3.除了快递业现状与老龄化&养老陪护问题，工薪家庭的子女教育亦成难题，捣蛋与偷窃的儿子让无力的家庭雪上加霜。4.尽管高潮与片尾稍显戏剧化，却至终未背离于生活，肯·洛奇老而弥坚，稳健表达，我们太需要如此直面现实困境的电影。5.油漆喷瓶同[我是布莱克]。6.掉进流沙的噩梦——愈努力工作，就愈沉入无底深渊。（8.0/10）
桃桃林林,看过,还行,2019-05-17 06:07:19,3,7分。肯洛奇正常发挥，无论是风格还是主题，都是一惯的。讲的又是一个底层家庭如何绝望的活着，有多苦、有多难。一如既往地关注底层，也是肯洛奇式良心了。唯一遗憾就是，剧情在后面的发展略刻意，各种倒霉事都撞上来
wenc,看过,力荐,2019-06-20 10:23:46,1,#siff  共情地看哭了操！
✘.,看过,推荐,2020-01-11 23:56:54,3,"肯洛奇镜头下是没有low/high tea的英国人，这些人最缺时间，眼睁睁看着他们在淤泥中挣扎直到筋疲力尽。穷人从来没有时间喘气，满满的时间表。如何辨别穷人只需看他们是否走路、吃饭都比别人快。
底层家庭有可贵之处，比如家人之间团结坦诚，也比一般人更勤劳吃苦。现实是，可贵但不值钱，屁都不是。
相对《布莱克》用力许多，无助、愤怒然后绝望。当镜头对准医院里的那群人，仿佛看到了肯洛奇宇宙。
我们错过掉无数时间，可不能错过这部电影。★★★★/8.5/#2019欧盟影展#
不同于《寄生虫》善良无害的上层阶级，这部反过来善良无助是穷人的属性。影片打动人的都是些生活点滴的细节，很高级地藏了起来。底层人被资本玩弄，一天忙到晚，来不及喘气也看不到希望。这家人惨爆了，而且还是未完待续的惨。★★★★/8.8/*2"
风撼斜阳,看过,推荐,2019-11-30 23:59:47,3,资本的无情之下，一家人的挣扎太戳心了，剧本虽然俗套却真实得够压抑，表演很到位，丽莎这一哭把我也给煽哭了。送快递这个切入点很有现实性，一边是我们连五分钟都等不了的急不可耐，一边是 14×6 连请假都要罚款的工作，社会就这样越来越快，再也没有回头路。
德卡的羊,看过,较差,2020-02-01 18:51:01,2,55/100，看电影的时候当然还是会为主角一家近乎“倒霉透顶”的遭遇而同情与压抑，行动换来的某些反馈似乎成了如今社会底层的普遍现象。肯洛奇当然还在关怀，但他是不是已经忘记了自己是在拍电影。
宇宙,看过,推荐,2019-06-18 12:53:04,1,#大光明影院# #SIFF2019# 4.0 分。第一部肯·洛奇。还是很喜欢且值得尊敬的，决定去补一些肯·洛奇。那些在数字零工经济下失去运作稳定性的家庭，更喜欢前半段，后半程有点太依赖偶然事件。
郝小勺,看过,推荐,2019-06-19 00:10:18,5,没有激烈的反抗和呐喊，不是卖惨，更不会虚情假意的盲目乐观。肯洛奇最最打动我的地方，永远是他对温柔的、艰辛的、绝望着生存的普通人，对于他们的无限关注和悲悯之情。#SIFF2019#
Sabrina,看过,推荐,2020-02-13 20:51:10,0,底层人的生活到哪里都是艰难。
小粉,看过,推荐,2019-12-01 00:02:10,1,仅仅一百分钟、压抑到让我一散场就飞也似的逃离影厅，在前门东大街上一路狂骑、呼吸雪后清冽的空气、戴上耳机听一首chemical brothers才终于舒畅起来。为什么光活下去就如此艰难？善良、努力、坚强地面对这个世界，仍然日日挣扎在工作与家庭的水深火热之中。快递员一天工作14小时，一周六天，没有上厕所和吃晚饭的时间，一日矿工就是几百镑的罚款，这种自我雇佣的特许经营权是什么鬼？社会主义真是天堂。所以，看完电影最大的感触就是，我、再、也、不、喊、着、要、辞、职、了……
マツハラ,看过,推荐,2019-11-30 23:02:56,1,"#A-#
肯洛奇继续坚持自身立场确实很打动人，有一定力量的作品，有点遗憾的是力量仅仅来自材料本身。（但我会永远支持这样的创作。"
得得儿,看过,推荐,2020-02-05 19:35:32,1,事先备好纸巾，果然从中段开始噗嚓噗嚓掉眼泪。最后爸爸在留言便签上画了个笑脸，哇地一声连鼻涕泡都哭出来了。
OreoOlymLee,看过,较差,2019-06-18 12:47:05,3,所有能张口说话的角色在里面只有两个用途，一个是直接通过口述的方式表意，另一个则是某个节点突然被雷电击中了似的，被格外刻意的苦逼情节设置推着跑了一段之后才开始抱头痛哭强努泪水，看得频频笑场。结尾一场戏家人纷纷从家中冲出拦车，我差点以为男主为了坚持工作要从家人身上碾过去。看的时候数次想为Ken Loach老师点首小甜甜，you better work bitch!
Lycidas,看过,力荐,2019-12-15 21:55:42,1,这两年的肯洛奇太好哭了，非常愤怒，也不会忘记温柔善良。话虽如此我还挺想念《天使的一份》和《寻找埃里克》那样give it all a laugh还能苦中作乐的时候，大概如今世道大不如前也没有这种心境了吧。足球笑话依然很棒啊！
Peter Cat,看过,还行,2019-05-17 07:36:49,5,聚焦于互联网时代自主营业快递员，不得不说肯洛奇仍旧最敏锐抓住了当下资本主义形态中最制度化压迫形式。但陈旧的观念先行的剧作思维依然拖了后腿，尤其是在结尾部分暴露无遗。即使不说是全然刻板的，但试图构造矛盾激化的意图生搬硬拗地拉扯着跟不上人物和剧作，通向真实的反面。
顗礼,看过,还行,2019-06-20 10:16:55,3,无功无过，肯洛奇用一个家庭投射了一些社会性普遍问题，立意和主题表达还算明确， 缺点是刻意与奇怪的结局处理；其实全片大概80%的内容我都是喜欢的，可惜最后20分钟实在是太讨厌了，扣分
SleepWalker,看过,力荐,2019-06-18 12:26:45,6,SIFF.  肯洛奇太狠了，完全不给人活路，又不能去死，只能苟着。真的，只能苟。
董食肉,看过,力荐,2019-05-27 23:41:03,4,前两天在马路上堵车，听到旁边车的司机和乘客的对话。说一个快递小哥本来在山东送快递，听说北京挣钱多，就带着一家人来北京打工，30多岁过劳而死。车一开动我就从那个对话里抽离了，再也没往心里去。今天看到，不胜唏嘘。sorry we missed you. 我们错过了很多故事，但是有人会记得，他们还在拍，就是这个世界最宝贵的财富。
kylegun,看过,力荐,2019-12-09 20:57:22,2,偷换概念所谓自主经营，实则要求更为苛刻更无保障；跟踪计时通讯无数功能，从没考虑过快递工人的如厕问题；儿子痛斥消费主义创造虚假需求，父亲却靠运送虚假需求养家活口；公交车站喘口气向陌生人恸哭，训话警察道出传递不出的苦心，公园椅子上女儿打来的电话；以为藏起了钥匙，一切就能回到从前……太惨，太好，老左肯洛奇did it again
萨库拉,看过,还行,2019-05-17 16:47:21,5,一直都比较克制，最后的意外事件便显得刻意，但功能达到了，以至于老婆在医院发飙时有观众鼓掌（真是可爱的观众啊……）@Cannes
計画通り,看过,力荐,2020-01-12 18:31:40,2,【欧盟电影展-长沙】现已加入肯洛奇豪华卖惨套餐。（肯洛奇：给👴爪巴）纪实一般的叙述，非科班出身的演员，把生活这出三流戏剧演得出神入化。家庭戏太精彩，彼此深爱却相互作践才是亲情真谛。用女儿的小费吃一餐印度菜，已经是命运对他们最大的怜悯。熙熙攘攘汲汲营营，生活不允许任何人擅自焦虑。我太能理解，那种丧失了一切可能性的迷途感，那种想一刀插爆自己太阳穴，让眼泪从血管里喷出来的冲动，它们喷薄而出，你却连失控的咆哮都狼狈得超乎想象。最杀人无形的是，我以为我所见的是人间疾苦、切肤之痛，却发现这不过是生活本身的样子。
后自愈,看过,还行,2019-11-09 20:57:49,4,一如既往的稳，稳到没有什么惊喜，比《我是布莱克》好。人只能作为一个没有感情的工作机器，是随时可替换的螺丝钉，底层人民生活的真相就是一片鲜血淋淋，是面对“你有手有脚干什么不好”这种指责都无力反驳的绝望。现实是，悲惨仍在继续，他们或许也看不到为他们拍的电影。
不正同學,看过,力荐,2019-05-17 07:24:26,5,艺高人胆大 老先生这把年纪了愿意站出来淌这趟浑水真的尊敬 演员效果都很棒 seems basic but feels strong #Cannes2019
艾栗子,看过,力荐,2020-01-13 02:41:26,1,#2020深圳欧盟影展#太惨了。。要对快递小哥好点啊！一些接近纪录片的片段越真实越让人动容。这就是每天发生在我们身边的世界，只是我们看不到而已。除了全世界底层人民都一样的苦苦挣扎之外，最难以忘怀的是银行破产清零使得儿子对教育的意义产生了怀疑，这一点非常可怕。学习、知识、努力还有什么用吗？为了像你一样陷于挣扎吗？儿子的问话让父亲沉默，也让人觉得绝望，如果连努力的意义这一点都不相信了，还能如何带来新的希望呢？这一天对每个社会都或多或少会到来吧。一种无力感。此外很厉害的一点是把大数据时代的恐慌也一起展现了。第一次在大屏幕上看到对于大数据控制的控诉，恍惚有种赛博朋克的科幻感，回头才猛然发现我们早已生活在其中了啊。感谢肯洛奇这样忠实地记录时代，同时也觉得中国导演不能这样拍电影，真遗憾啊，我们丢了多少好故事。
杨欢喜Metiche,看过,力荐,2019-11-30 23:51:24,3,若我们谈论Joker我们在谈些什么？当把哥谭换成纽卡斯尔换成伦敦换成北上广，当把红鼻子小丑换成快递小哥护工大姐或者每个深陷996的你和我，当你被打被抢还被公司要求赔偿，你可不能拔枪杀人再化身什么反派英雄，你只能默默在医院说了脏字狂道歉，然后瞎着一只眼睛照样开工。又想起那道给快递小哥按投诉按钮的辩题，有权按还是有权为善？我们在这个永远没人故意犯错但永远都是错的世界，早就没有自己以为的那些权了，我们拼了命努力工作经营家庭，也只为被时代洪流裹挟得面目全非时，心里能坦然一点。因为迟到错过了一单客户，因为疏于关心错过了子女的成长，可当终有一天自己再也撑不下去而彻底绝望，谁又会因为错过了我们而感到抱歉呢？深夜的百老汇，大家都被电影丧到默不作声，车窗外呼啸而过一辆小摩托，嗯，希望他这一单安全抵达不超时吧。
glim,看过,力荐,2020-02-07 20:44:31,0,是的，有时候我们习惯了这样的说辞，很抱歉，对不起，不好意思，我们没能帮得了他。然后，就变成了一种约定俗成的规矩。但是，并不应该这样，一部近期被下架的动画里说过，如果一个人都救不了，怎么能指望去救其他更多人。每一个人，才构成了集体，希望我们不再说对不起，而是，我来了
我爱罗宾,看过,力荐,2019-06-18 12:57:29,5,业界良心肯·洛奇，永远热忱，永远热泪盈眶。看到曼联球迷这么苦，阿森纳粉丝也潸然泪下
少年面条,看过,还行,2019-05-20 14:32:15,1,肯·洛奇这次很克制，整片看下来看的很舒服。全片的表演特别是小女孩的表演很让人惊喜。戛然而止的剧情也刚刚好。但感觉应该也是陪跑其他金棕榈入围影片的一部。
五加皮,看过,力荐,2019-11-30 22:53:35,3,中国没有肯洛奇
猫猫子,看过,力荐,2019-11-30 23:39:17,3,这是一部曼城土味电影，推荐给@盘尼西林乐队。
唉唉唉德华,看过,力荐,2019-06-18 12:21:10,4,21世纪必看的现实主义题材电影，对不起我们错过了你，本质上表达的是对服务业，乃至底层劳工们的关注。错过了你，错过的是社会对于劳动过程的关心。快递的下单与签收，和布列松的《钱》一样，所有的中间过程被社会所漠视，而在身陷在中间环节之中煎熬的人们，我们错过了你们，我们应该对你们的遭遇与苦难保有必须的关注。
kulilin,看过,推荐,2020-03-04 12:44:44,0,评球那段过瘾
老罗Lazzaro,看过,还行,2020-02-29 00:18:39,0,沟通的缺失与死命的顽固，底层的真实命运，对待生活的态度很压抑，结尾又有些过头。
色烈芬_,看过,推荐,2020-03-10 10:44:13,1,镜头像一把锋利的手术刀 剖开了低层人民的冷暖日常 最让人难受的是 休息日一家欢乐吃饭突然一个电话把妈妈叫走了、孩子闯祸被校长叫去父母但父母工作太忙根本没空等等小事完全就没有夸张 生活啊就是这样。最后一段爸爸伤痕累累要开车出去 儿子说你只剩一只眼睛能看这样出去很危险 爸爸说再过半年就好了，怎么知道的？爸爸怎么知道喔 可还不是为了不让家里人露宿街头拼了命铤而走险去努力？他也没办法啊…幸好啊 他们怎么穷苦怎么吵架的最后还是一家人相亲相爱 所以Ricky啊 你只剩一只眼睛能看了 所以别哭了 好好开车吧 加油。
老羊,看过,还行,2020-03-07 20:20:18,0,其实，你不得不每天都工作，并且要努力
fire,看过,推荐,2020-02-08 17:31:39,0,好好活着努力活着
CMpunk,看过,推荐,2019-12-29 17:52:52,1,"#欧盟影展#
最后一个桥段用力过猛了一些，与前半段所精心营造的克制理性略显突兀，对其批判性建立的流畅性有所阻挠。但瑕不掩瑜，导演对于社会底层群像的刻画惟妙惟肖，穷人是没有资格提前计划的，资本的原罪在看似平淡美满的生活里缓缓浮出水面，在原本正在步入正轨的家庭里凿出一个个坑坑洼洼，越是希望一切复原，窟窿却是越补越大。借大大的话说就是，当今社会的主要矛盾在于人民对于美好生活的向往与落后生产力之间的矛盾，白人老板一度让我恍惚，原来这样的剥削不止是天朝才有，但导演想要表现的不是可以指名道姓的剥削，而是体制与阶级之间无意识的无形剥削。其对于现世数据化时代的人际关系描绘格外生动，以冰冷的具象瓦解了抽象的社会劳资关系。以晚辈为情节点，以长辈为情绪线，故事结构对称而工整，是为高效转化其凝炼思想表达的基石。"
神仙鱼,看过,推荐,2019-12-01 10:19:41,0,令人绝望的无解困境。肯洛奇为什么不能退休？对很多人来说，他的关心和拍摄可能是唯一的希望和慰藉。
了不起的花轮君,看过,推荐,2019-06-20 11:38:06,1,男主真的像低配文森特卡索，英国银行倒闭这么惨烈吗？英国人为什么不用快递柜！
圆首的秘书,看过,推荐,2020-02-03 01:30:39,3,比起前作稍逊，但仍属佳作。实际上这并不是一个简单的资本主义问题，因为雇主也在片子里有充分时间对自己的主张进行申辩，肯·洛奇试图让观众理解每个人的处境，而不是浮皮潦草地展现一种漠不关心或者穷凶极恶。这一部其实会更像《风吹麦浪》，有比单纯的社会问题更加深刻的复杂性：它关乎人的境况，现代社会每个人都被自身所束缚，被周围的环境所异化，家庭趋于崩溃，人与人之间的关系趋于恶化，肯·洛奇所寻找的不是一个解决资本主义问题的办法，而是一个善意的、人性的出口，他所要求的，其实比我们想象的还要少一些，但他确实问了一个重要的问题：究竟是什么，让我们变成了这样？也正因如此，即便是这么老生常谈的话题，我们还是会被这种单纯和直率触动，正如我们还会被东木的古典主义所触动。毕竟人是人，与机器不同。人！
JIN,看过,力荐,2020-02-10 08:30:39,1,依然肯洛奇，和前作我是布莱克一样，关注普通人的挣扎，人生真的太难了……片子看得让人难受，但这就是残酷的真实啊……
樂啊樂,看过,推荐,2020-01-12 14:47:58,1,欧盟电影展最后一场。肯洛奇这次真的惨不忍睹，全球卖惨导演第一名，但是还是挺好看的。中国人看了都会难受的一部肯洛奇电影，因为跟996有关。不知道到底该怎么评价，比《我是布莱克》好，但是还是仅限于叙事，戏剧的张力更大了，虽然设计感还是有些重，不仅有外部矛盾还有家庭危机，还好男主有这样好的妻子，换个脾气不好一点的，男主估计都想自杀了，结尾太刻意了吧，但是听着“我得工作！”还是感觉很难受。
Rocrw,看过,推荐,2019-09-16 05:59:57,2,太真实了，太丧了。时代洪流中的小人物的故事，拼尽全力还是活得如此艰难。压力一点点堆积，终于把这个家庭压垮。最后爸爸流着泪咬着牙坚持工作的样子真是令人感叹，资本家的压榨就好似结尾的处理一样，看不到尽头。可是回想过来，生活就是这样，你又能怎么办。
萌特斯,看过,推荐,2019-07-09 15:41:16,1,太惨了，哭不出来的那种。人生除死无大事，可是这么苦的活着却是图什么呢……
红蓝色的风雨夕,看过,推荐,2019-10-03 04:43:00,1,VIFF19 #27 [Centre] 太贴心了还准备了CC！好像是第一次在大屏幕上看有CC的电影……？那段Fuck you and fuck your device得到了全场鼓掌，上一次电影中间的鼓掌还是寄生虫里面的桃子哈哈。喜欢这样干净利索的结尾。虽然影片是关于无止境的惨，但印象最深刻的还是生活中的那些亮色吧，女儿写的你欠我爸一条干净的内裤，爸爸看儿子的涂鸦，儿子对爸爸难得的关心……哦对了英超球迷之间的斗嘴太有意思了。
哪吒男,看过,推荐,2020-02-07 15:37:38,1,勤恳顽固的工人阶级再次被无情的管理制度逼上绝路，劳动最光荣，带着人性劳动最痛苦。
小月,看过,推荐,2020-02-02 23:11:12,0,7分。1、那些吹嘘西方好的人应该看看这部和《我是布莱克》，我说的吗，原来就是布莱克的导演呀。2、贫穷夫妻百事哀，少生娃多赚钱，越穷娃越没志气吗。3、刚看了《平原上的夏洛克》，终于知道为什么av有素人类，素人很真实啊。4、这片是真的吗？老板会这么冷酷无情？劳动法都没有吗？工伤保险都没有？各种盗抢险都没有吗？
匡匡,看过,推荐,2020-02-12 17:03:37,2,肯洛奇一直是影人中的良心。始终将悲悯的视线，投向社会底层小人物的辛酸无奈。不愧为是枝裕和的偶像。虽然但是，最近的电影感觉都不太好看，应该是我出了毛病。什么时候看电影这件事才能重新变得有滋有味儿。
🌵🌵,看过,推荐,2020-02-09 16:54:41,1,有刻意之处，但肯洛奇从六十年代“战斗”到今天本身就是传奇了，况且他书写的议题始终是具有时代先进性的，影片没有仅仅停留在对资本主义的抨击，以小窥大地截取了社会运作机械化的本质（而非某个资本家之恶），每个人都成为带动这个大机器工作的齿轮或者螺丝，你一旦不能跟上它一刻不停的转动速度，就会自动被废弃掉，因此这样的世界里哪怕一点点人性的温情也显得格外动人。再一次感叹：模仿韩国电影没有出路，我们需要的是肯洛奇。
Paco,看过,推荐,2020-01-17 21:38:10,4,《我是布莱克》是“关怀”，《对不起》是“同在”。一旦角色的主要动作不再承担明显的表达目的性，这种美学选择便显得高尚——可以说是狭义的，也可以说是以“他们”作为主体在考量的：渐近线可以远（《寄生虫》），但不能没人近。我们需要更多这样的肯洛奇。©资料馆。
水水,看过,力荐,2020-03-07 14:27:21,0,唯真不破！这样的电影我们怎么拍不出来？btw立意甩小丑几百条街。
Panda的阴影,看过,推荐,2020-02-22 17:30:06,0,"See, at some point, every family is gonna have a problem. 家家有本难念的经。前部分的一家人的工作和生活，让我再次感受到自己对生活类电影的青睐，瑞奇违规停车差点被开罚担、与支持不同球队的球迷发生口头争执两段笑到我了，与女儿一起奔跑送快递那段也好温馨，然而即使与心地善良的妻子艾比各自拼命努力工作，也免不了遇到各种不顺心的家庭问题。乖巧懂事的女儿可遇不可求（她的哭戏让我湿了眼眶），时常惹麻烦的儿子生活中也挺常见（身边也有熊孩子）。后半程把好些小概率事件集中发生于这个家庭感觉有点过于戏剧化，儿子被学校停学而后偷东西被警察抓、父亲遭遇抢劫被暴打还要被罚款……哎，在遥远中国这边，我周遭的亲不也蛮多人是在类似的艰难中求生存。P.S.：听他们的口音感觉有些熟悉，原来是 Oasis 的曼彻斯特老乡。"
帕拉,看过,力荐,2020-02-01 16:52:12,1,谢谢肯·洛奇，一直在为底层发声。
Methy,看过,推荐,2020-02-13 21:37:17,1,看完《美国工厂》再看这个就很魔幻；人类在幻想机器人彻底取代劳工后的世界，却不大自省到机器作为一个绝对公正绝对无情的存在早已成为了劳作的外骨骼——快递员的打卡器和儿子的手机，是被机器控制与用机器创造的两个极端；坚信街头艺术仍然有穿透资本的力量，儿子说只偷连锁店不偷街边小店，老左派的一点执着和情怀。
seabisuit,看过,推荐,2019-11-30 00:25:20,0,从来不会让人失望的肯洛奇还是惨到不留任何希望。  台北院线。
DreamReaver,看过,推荐,2019-12-13 20:11:36,2,平静地描述一种制度性系统性的压榨，中国确实需要一个肯洛奇
马 夋,看过,还行,2019-06-20 10:20:19,2,对不起，我们可以错过你，但是没法错过钱，这样才能支撑你成长。
蓝格子,看过,力荐,2019-11-30 22:57:03,0,能这么冷静的刻画一个这么惨的故事，大概也只有肯·洛奇了，好久没有这种👀电影的感觉了，卡片出现那一刻，觉得电影名字起的太好了。@保利天安门 11月👋
