用户,是否看过,评分,评论时间,有用数,评论
不姨妈的大白色,看过,推荐,2020-01-17 00:47:08,0,泪光闪闪。几个小演员演的那叫一个！啥叫未来可期啥叫入木三分！既怒又恨啊！因为这对禽兽父母说的对啊！我打我自己孩子就算打死了又关你们什么事情呢！所以啊！让我们尽自己所有的能力成为善良的大人吧！就算不能改变什么至少不要冷漠和麻木吧！
圝33＂,看过,力荐,2020-02-25 00:24:50,0,同样的问题也存在与家暴 小女孩已经属于相当勇敢的去报警去求助男主 如果不是呢？是不是只能面对死亡 真的只有弟弟死了才能得到公正吗？如果没有猩猩视频是不是就不能胜诉了呢？
Tolkien,看过,还行,2020-01-03 22:29:19,0,虐虐虐
Pancy先森,看过,较差,2020-02-19 04:30:33,0,和熔炉不是一个级别的，没法比
KevinZii,看过,推荐,2019-07-25 00:35:23,0,又一部《熔炉》，直击社会问题。
雷斯特雷波,看过,较差,2020-02-04 23:55:59,0,作为电影来说，铺垫不足，急于求成，漏洞百出。
ßëë,看过,推荐,2020-03-08 16:26:49,0,难受，现实生活中我们都是冷漠旁观者。现实中也没有长腿叔叔。
康斐灯,看过,推荐,2019-08-06 15:37:28,1,没个大猩猩还破不了案了？不过真觉得，男人掌控着权力，女人却掌控着男人甚至周围的人，婊起来太可怕了。
束竹,看过,还行,2019-08-12 23:07:16,0,拍的还好，不过本身立意大于片子。希望国内也能拍类似题材。
水色姬,看过,推荐,2019-09-01 11:19:13,0,真的是很震惊了。真实事件改编很受触动。希望这样的事件越来越少。但愿世间太平。
不覺,看过,推荐,2019-09-07 21:19:53,0,當一個女人開始扎頭髮的時候 你得小心了....狠起來不要命的....
JIE,看过,较差,2019-06-28 21:53:40,1,拖沓
烟水,看过,力荐,2019-07-14 22:16:54,0,我好难过。
show,看过,推荐,2020-03-06 03:49:10,0,好羡慕这个小姑娘的头发啊……好多人在说要塑造那个变态后妈的变态原因，有必要吗……有原因就可以作为打人的借口了吗？小胖子男同学去送礼物发现多彬被打之后立刻给叔叔打电话，之后叔叔背着多彬出来的时候小胖子跟在旁边哭的不要不要的，想到素媛里的小胖子，太可爱了。家暴真的，太无助了，第一想到杰鲁米。
阿西,看过,还行,2019-08-18 13:17:39,0,旁观者的冷漠无视到底有罪无罪？法律可能真的无法裁判，过分煽情，但是我就是看不得虐童题材啊，哭死我算了
elaineOoo,看过,还行,2019-10-20 21:29:12,0,电影很理想化，现实却是很残酷的
