用户,是否看过,评分,评论时间,有用数,评论
Z星驰007,看过,力荐,2019-07-06 21:51:44,735,全程气的发抖！！！韩国电影拍现实题材真是太大胆了，惊悚程度直逼《熔炉》啊！！！比起父母对孩子的暴力，邻居、老师、儿童福利院的冷漠和遇事就躲的态度更让人气愤！！！！中国电影，你醒醒吧！！！睁眼看看世界吧！！！邻国的电影在控诉法律的漏洞，帮助法制进步，而我们国家呢？？？？？哀我国电影不幸，怒我国电影不争啊！！！
软性飞草,看过,力荐,2019-05-29 23:31:01,549,一个敢于拍自我检讨法律缺陷的电影总会帮助社会进步。
蜷在贝壳里的猫,看过,力荐,2019-06-27 01:07:04,282,可悲的是，现实往往更悲惨，施虐者五个里面有四个是父母；可笑的是，电影里的英雄，往往只是活在电影里，多的是邻居那样装睡的人，觉得父母教训子女天经地义的人们。到底是长大让人的心变得冷血，还是冷血的人长大了呢。看电影最痛心的大多是“真实改编”。
安仔大kuma,看过,推荐,2019-07-04 02:17:11,528,可是。。。现实生活中哪里来的长腿叔叔和视频小熊呢？
永远的热泪盈眶,看过,力荐,2019-06-28 12:53:50,183,给社会提个醒的片子总是有力量的，在这里我保证，“我可以正义”，遇到虐待儿童的行为，我一定会管。
郑乔尹,看过,推荐,2019-06-27 05:16:59,388,这是我不愿意评价的一部电影。人生绝大部分恨意的来处。
午后红茶,看过,还行,2019-06-29 15:47:19,397,什么叫人文关怀，这就是人文关怀。希望有关部门能放宽对社会题材的把控，让更多的有社会正面效应的影片出现在我们的大银幕上。
又又,看过,还行,2019-07-03 17:56:31,276,短评里那位“虐待孩子和正常打孩子不同，孩子不听话打几下是正常的”？？？exo me what's your problem???
9L-ing,看过,推荐,2019-07-04 06:50:30,286,是不是要被打死了，才会被关注？否则会被认为“人家只不过在教小孩”。甚至被打死了，都会选择相信疑点重重的案件结论，而不是质疑控诉家暴，原因是“这类案件通常很难打”。父母没得选，人生该有多绝望，出生在这样残暴的家庭、冷漠的社会，所以当多彬遇到男主的哪怕是一丝丝好意，都抓住不放，那是人生最后的微光。多彬，不是你的错，是大人们的错，是这个世界错了。
PROMISE921,看过,力荐,2019-07-04 21:55:30,137,打死的是孩子 就16年？？？？？？？
tadanobu.,看过,力荐,2019-06-29 03:19:58,36,大半夜的哭成猪头了，演员们演得特别好，最近国内也是特别多的家暴事件，但是韩国的电影很多就是敢拍根据真实案件，这些电影能引起大家对社会问题的重视，看了演员们的采访特别是东辉，拍完这部以后觉得自己也像电影中的律师一样的人真的很感动，虐童真的要引起关注，多一份关怀，多一份热心，世界会变得更美好。（希望多彬以后能与长浩在一起，长浩真的是一个暖心的男孩子。）
忘川,看过,力荐,2019-07-07 17:53:42,21,"电影从开头就抛出了个问题，受害者在众人面前被活活杀死，无所作为的旁观者到底有没有罪？
在没有好撒玛利亚人法的国家，在法律上因为怕惹上麻烦，恐惧被波及而无所作为的旁观者确实是无罪的，但是在人性上呢？"
liudae,看过,推荐,2019-06-30 10:16:13,192,第一，儿童虐待与正常家长打孩子是两码事，现在的观念容不得打孩子，但是很多时候打几下孩子是正常的，因为孩子太不听话。第二，本片中关键证据是视频，如果没有视频呢？现实中将会有百分之99的案件没有这个视频。第三，为何不调查邻居获得证据证人口供。
亮仔,看过,力荐,2019-07-05 13:50:19,8,看过真的很气愤，家庭暴力的危害无法想象，银幕里只展现出了凤毛菱角，太多的孩子被继父继母虐打，这样的事件真的是让人无法忍受，久久无法平静的感觉。两个小演员太给力了，带入感强，感动人心！柳善塑造力也是真强，之前有过被害人的角色，如今强势转换，让人恨之入骨！李东辉也有了真正男子汉的角色！至少可以让我记一辈子！已经入选我今年韩影十佳之一
法外之徒,看过,推荐,2019-07-08 01:58:29,128,估计韩国的虐待儿童法案又要改写了 (姜智淑女士成功让我对女性扎头发的动作产生了恐惧。。)
kiki204629,看过,推荐,2019-07-02 23:23:54,122,根据真实事件改编，韩国电影这些年来能把社会话题改编的非常好搬上银幕，现实远比电影里更多触目惊心的事情。从2001年到2017年，虐待儿童举报增加了10倍，绝大多数施暴者被判缓刑或者罚款，而施虐者5人中有4人为父母。看《何以为家》让人感叹无人知晓的悲剧，看《坡道上的家》让人反思现代育儿观念，这部电影则让我感叹家庭暴力发酵后周遭人陌生的冷眼旁观，警察、邻居、甚至家人都可以无视。这个社会的底线到底是什么？
fallingraining,看过,力荐,2020-02-03 23:07:11,2,真正需要改变的恰恰是东亚儒家文化圈内家丑不可外扬和自扫门前雪的陋习。
浮生,看过,力荐,2019-06-03 23:42:56,15,韩国真的很善于拍摄这样的题材，但是这种电影往往没法看，看了真的很扎心！而且又是真实案例改编，真的不敢相信有这种畜生爸爸和禽兽继母！为什么不判死刑！
喜杨杨,看过,推荐,2019-06-29 18:16:58,125,"最悲伤的一句是：‘’根据真实事件改编”… 真的发生了?! 邻居 老师 警察，真的有那么多人没有出手相助… 为人父母不需要培训考试，真的是最大的bug… 
片子一般、但意义重大。
如果看见受伤无助的孩子，希望你可以伸出援手！"
木光,看过,推荐,2019-07-09 12:16:45,38,现实改编，儿童遭遇迫害的韩影我已经看出阴影了。于是这部电影一开始我已经把自己带入到阴影中。揪心、头皮发麻、无力感贯穿始终。即使拍的不及《素媛》《熔炉》等掷地有声，依然让我如鲠在喉。我盼望有朝一日，所有人懂得一个为人最基本的道理。你可以不喜欢、讨厌这个世界上任何生命体，但不要去施加伤害。
一句话影评,看过,还行,2019-07-05 23:51:49,111,如果没有熊娃娃呢 片子用这样一个概率极小的直接证据 将坏人严惩 但没有解决一些更重要的问题 像是熔炉和素媛中 受害行为发生的各种原因探讨 正义之士们的艰难抗争 共情程度依旧局限在孩子被虐的阶段 电影只能算呈现叙述事件 而不能在深度上加深
𝚁𝚊𝚔𝚞𝚢𝚘𝚞,看过,推荐,2019-06-28 19:33:43,41,意义大于片子本身
Scarlett,看过,较差,2019-07-03 08:57:26,65,题材值得尊敬，但影片本身也太烂了吧。。。。。。
は,看过,还行,2019-07-01 04:32:35,46,真实事件改编 唉 好痛 我赞成好的结局给人希望 但现实远没有这么幸运 剧情设置还是浅尝辄止 社会舆论发酵和庭审戏能细致点会好一些吧
五色全味,看过,推荐,2019-07-19 04:09:36,20,戲拍得簡單，遠不像《熔爐》那樣drama和煽情，但相比《熔爐》，我更喜歡這部戲。戲中不直接呈現那些能製造效果的殘忍虐打場面，處理上很小心，避免藉此煽情；亦有一份成年人角度非常誠懇的自省態度。我看到創作人的善意，縱然戲劇上未必滿足到很多人，結局也偏理想化，但我認為這是一部有良知有溫度的好戲。
世纪末之诗,看过,还行,2019-07-05 23:47:38,36,6.5分。跟素媛差不多的题材，但是评分差很多。案发之前的铺垫太长了，后面所有的重心都放在了法庭上，对法庭之外大家的努力描写很少，法庭戏也拍得很儿戏。
发条橙,看过,还行,2019-07-15 18:29:46,28,一时竟想冲进银幕手撕这天杀的毒妇，妈的，可气死我了。
学号06,看过,还行,2019-07-06 15:30:03,12,老师教育我们剧本编不下去的时候不可以有投机取巧的行为
梦行30,看过,还行,2019-06-28 12:20:23,9,一般般，金刚还是找到了？我怎么没看到哪找的？小孩子演的很好啊，但是电影有点乱其实。可怕的还是现实越来越多的虐童案件
桃桃林林,看过,还行,2020-01-14 17:24:32,4,这种电影看着太揪心了，韩国电影现在总是做得过于戏剧性。但是看到小朋友被打的场面，还是心疼得不行。
下饭菜,看过,还行,2019-07-20 19:30:08,7,拍的有些矫情
刘在石的妈妈粉,看过,力荐,2019-07-05 00:07:43,7,"年度必看韩影之一！电影是有力量的，电影应该有力量的。敢于拍自我检讨法律缺陷的电影总会帮助社会进步。我很羡慕，很羡慕他们国家能够拍这种对社会有影响力的现实电影。
最惨痛莫过于影片开头那句“根据真实事件改编”。
最近的韩影如《证人》《白小姐》普遍关注残疾、家暴等儿童问题，而到了本作，虽然情节发展都在预料中，但它优秀在于将每一个“俗套”的感染力最大化，它的张力不亚于《熔炉》《素媛》等，真实如重拳一击一击穿透屏幕打在鼻梁，看到最后我一边掉泪一边咬牙切齿。
女孩视角的家暴、旁人视角的家暴、最后视频男孩第一视角的家暴，加上男孩死亡前胸腹的模样，电影毫不回避或吝啬丧尽天良的禽兽行径。
不是生了孩子就叫做父母…他们毁了一个生命，也毁了另一个生命的人生！
娃娃鱼和后妈发挥不错。
小女孩超神演技，看好她发展~~"
glim,看过,较差,2019-06-29 08:55:56,60,其实电影很一般，但是意义很重大。试想罩国有这样的事，最后肯定是今日头条里的人血馒头
猫苦艾。,看过,还行,2019-08-02 13:32:27,9,煽情，也套路，有点疲劳了…
Niiii,看过,较差,2019-07-03 14:45:25,38,题材好，拍得烂。都起诉了还不第一时间隔离小孩，邻居证词也没有采集，玩具熊的设定太戏剧化了，总之剧情有很多说不通的地方。电影光是想通过这种突如其来的证据来解决冲突，而没能真正从社会层面反思现实中面对这种无证据的窘境该如何处理问题。我还是一如既往佩服韩国电影的煽情本领，我一边觉得电影不行一边哭成狗
c.love._,看过,推荐,2019-07-03 12:42:39,14,个人感觉毁在结尾了 哎呀卧槽这么可爱的孩子怎么下得去手 这些人都特么脑子怎么想的 变态就该立即处死别再祸害别人
康报虹,看过,推荐,2019-08-28 11:40:18,17,我们一路奋战，不是为了改变世界，而是让每个人好好的活着。
朴不程,看过,推荐,2020-02-16 22:55:21,3,再次诠释了后妈不是人。对于出现像里面那样的律师我表示悲观。。。煽动性情节可同于《熔炉》《素媛》，但手法、格局和寓意上远不如后两者，后两者更为深入地叩问到制度层面。7.9
小月,看过,还行,2019-07-12 10:17:13,3,其实这样的影视剧并不少见，只是现实并无法杜绝，儿童缺乏表达能力，缺乏自我保护能力，也容易被亲近的人误导等等原因。而社会大众也不过是冷漠的感叹，真是可怜，父母真是人渣。。如此而已。
绿脚趾,看过,推荐,2019-07-17 17:24:43,7,我们应该多多鼓励这类型的创作
扰扰,看过,推荐,2019-07-03 21:02:34,9,母爱缺失下的悲惨故事……
期假有沒戀網,看过,很差,2019-07-06 13:24:51,34,糟蹋这个题材了 一切都太巧 本可以拍的很好 但是这个手法以及内容都是套路感太强 故意煽情 男主演技真的蛮差的....翻盘的是摄像头 那个金刚娃娃找回来女孩就愿意讲话了 而且男主的台词 还有那个后妈的台词都太尴尬了 电影又很拖沓 导演真的不行✋
kylegun,看过,推荐,2019-08-01 00:50:33,3,无脸照片，汉堡之约，星空天花板；又见38位无声证人案，但对旁观者的批判和法理本身的反思还是弱了，基本让一个坏到极致的继母承担了所有的责备，处理得不太好
曼靑,看过,推荐,2019-08-31 22:28:20,5,同样都是「父母皆祸害」的主题，和隔壁日剧《坡道上的家》歌颂母爱的画风不同的是，韩影的画风一如既往的彪悍。从《熔炉》、《素媛》开始，韩国拍了近十年的虐儿施暴性侵题材电影。每一部电影都像冬天湖面上的冰刀 划出一道道尖锐的声音直刺心脏。继母施虐七岁和九岁的姐弟，导致弟弟肠道破裂致死、并且嫁祸给姐姐意外杀人——这个设定已经让我在心里捅了这个继母一百多刀了！如果你想知道在恐惧中成长的小孩儿是怎么样的，我想我会告诉你 剧中的弟弟就是这样的小孩儿。七岁才第一次见到汉堡包，他不敢吃，因为吃汉堡包会有面包屑洒出来。律师叔叔不以为然的笑道 汉堡包就是要边吃边洒的呀。他并不知道，吃饭洒出来 对弟弟意味着的是一顿狠狠的毒打。他至死都没有体会过所谓的妈妈是一种什么感觉。
陆支羽,看过,还行,2019-06-26 18:36:10,2,3.5。
已注册,看过,很差,2019-07-04 23:12:21,5,人物完全立不起来，故事毫无逻辑可言，还有极其拖沓的剧情，视听和表演上完全没有动人的点，气氛全靠音乐强起，流水账一般的叙事。导演处理戏剧转折点的重要情节性物件的方式比艺考学生还要稚嫩。韩国电影越来越多地打着真实事件改编和社会影响力的幌子来收割好评。有些甚至是如这部片子一样臭不可闻，除了小演员以外，真的一星都不值。
鬼腳七,看过,还行,2019-09-22 19:14:08,0,也算某种韩国特色类型片了
我没偷你口红,看过,推荐,2019-07-06 17:36:45,7,综合来说四星吧，法庭最后那段不太好，太刻意了，另外，导演选个这么可爱的女孩来演，还真让人理不清楚是好还是不好
今言,看过,推荐,2019-09-17 20:02:04,2,因题材多加一星
谢谢你们的鱼,看过,推荐,2020-01-13 09:48:19,1,是《素媛》那一类的电影而非《熔炉》，情节写得比较温和与自然，弱化视觉上的冲击，花更多的时间在铺垫和丰富人物之上，不走类型片的形式，不用类型片的拍摄手法，一切只为更冷静地呈现真实事件，煽情方式相比同类型的韩国电影克制了很多。
我呼吸的空气,看过,推荐,2020-02-01 17:40:13,0,"7.5分吧。故事前半程不怎么揪心，平平实实的叙事，不然我早就弃了。柔软化处理让人能看得下去。平常人的那点恻隐之心和正义感有时太珍贵了!.""宅、罩、洗""系列。"
zhang 2nd,看过,还行,2019-10-02 16:40:25,0,平
梵目,看过,力荐,2019-07-11 17:23:02,0,家暴罪恶
洋酒豆豆,看过,还行,2019-06-27 04:37:16,3,这种题材一打开眼泪就往外跑，希望现实意义能多推动更多的对弱势力群体的关怀。但是作为电影本身来说，人物塑造和剧情推进感觉不是很完整。
雲語荷棠樾,看过,推荐,2019-08-12 08:59:40,1,Tsks凤凰天使字幕组
Panda的阴影,看过,推荐,2019-09-05 04:44:29,0,1.想起隔壁喝农药自杀的邻居大婶生前有次和我聊起她小时候她妈的对他们兄弟姐妹劈头盖脸、拳打脚踢的家暴往事，印象很深的一个就是被抓着头发直接从二楼楼梯拖下来，根本不管她们身体疼不疼…当时听她讲话时，我无比惊愕，万万没想到如今看起来有些慈祥的老奶奶曾经会是那样一个人？然而，尽管如此，她依然被她们兄弟姐妹赡养……2.想起在天津遇到的“黄鼠狼事件”，自己的善心跟不上自己的能力，导致不够勇敢的我也成为冷漠的“人类”，然后为此而自责好几天……3.如果那时候我“死”了，那些直接或间接伤害过我的人/朋友会为我的死感到愧疚吗？…我更能确定的是，爱我的父母肯定会非常痛苦……
听霜书生,看过,还行,2019-08-22 11:12:53,0,评论里有个讲背景事实的，更寒心。
飞鸟凉,看过,还行,2020-02-18 00:05:19,1,3.5 社会意义大于剧本及拍摄水准，戏剧性大于人物（男主和父母的塑造，以及结尾有力证据的处理都不太好）。对于善与恶的呈现过于潦草。在韩国这样的男权社会中，（后）妈被塑造成大魔头，而父亲对于后妈的恶行习以为常视若无睹，实在奇葩。以及看的过程太难受，几乎不可能在孩子遭受如此虐待时还能无动于衷。
夏季的天空,看过,力荐,2020-02-21 20:43:18,0,"以真实事件改编的社会题材电影，真实、犀利、芝焚蕙叹、泣下沾襟。
“并不是爸爸妈妈相爱生下的孩子，就不能像别人那样生活了吗？”
“我是妈妈莫名其妙生下的孩子？莫名其妙生下的孩子就要忍受拳打脚踢吗？”
“大人是不能信的。说出来又怎样呢？珉俊不是都死了嘛。只留下你孤零零一个。要是相信了大人，你会死的，你会被假妈妈打死的。可我还是觉得好委屈啊。就算有点委屈，还是能活着好点。”《熔炉》、《素媛》和本片最令人“惊悚”的地方就在于，这些电影都是由真实事件改编 -- 地狱空荡荡，恶魔在人间！
本片的故事原型：
发生在2013年的韩国继母虐童案--“漆谷虐童案”。
只生不养，何以为人？
雪山崩塌的时候，没有一片雪花是无辜的。
幸运的人，一生都被童年治愈。
不幸的人，一生都在治愈童年。"
不贰,看过,还行,2019-10-13 12:07:54,3,很好的题材，但是拍得瞎，太多的情绪化。杀人的人被惩罚，但是法律的疏漏、邻居的冷漠、社会机构的敷衍塞责，这些某种程度上的帮凶，并没有为此承担实质性的责任，连一句追讨都没有。杀人的人固然可恶，但一个纵容凶手的环境同样在作恶。
Morning,看过,还行,2019-09-07 08:31:36,2,写得好正面的角色，但是写不好恶魔的角色，导致进入对抗之后，几乎平铺直叙，柳删和导演一起做出来的扎头发的细节很好，既有冲击力，也是文学意味，庭审戏的几处高潮也设置和处理的颇为简单，总之好的社会题材并没有推向被电影再次展现和创作的极致的准备。
Lunar C.,看过,推荐,2019-07-31 01:06:52,2,看这种电影真的难受，学责任分散效应时候就说的开头案例，雪崩的时候每一片雪花都觉得自己无辜。不过管别人的事确实需要勇气——影片里那些邻居如果都报案的话，又怎么会发生悲剧。一直告诉自己要尽量做个正义的人，110过打女人的邻居，扶过躺马路中间被撞倒无人问津的大爷，给路上酒醉的女孩叫过回家的车……做个好人吧，如果世间人人都献出一点爱，那么受益的人总会轮到自己。保证自己安全的前提下，还是决定继续做个“管闲事的人”。
凝固的奶茶,看过,较差,2019-06-28 23:46:23,13,1.前面很拖沓，而且电影对该题材的挖掘不够深刻，缺乏探讨输出
河狸,看过,还行,2020-01-15 08:41:04,1,题材非常好，但是拍得过于敷衍，连韩国影片的标配‘催泪’都做不到，实在是失败。另外，编剧你是多无能，才会想出用玩具视频当证据的。
𝙎𝙥𝙖𝙧𝙠𝙮 | ✟,看过,2019-09-22 01:27:16, ,1,而现实生活中成年人就是这么不可靠 成人世界才会讨论合理化打孩子
Vi,看过,还行,2020-02-28 17:53:29,0,对罪行的熟视无睹是最可怕的，也许一声呵斥都能救人于水火。韩国电影能涉及并探讨这样的社会议题，促使人们反思并提高社会责任感，这是我们羡慕不来的。
阿尔法,看过,推荐,2019-07-13 14:01:14,2,全程都在虐呀，看的揪心，看的不愤，真的推荐。不是新闻里面几句话就完事了。
多宝,看过,较差,2019-07-10 14:41:08,7,阳痿叙事法，无情绪无转折，又散又拖沓，浪费好题材。
魔法炼金术士,看过,还行,2019-10-10 22:07:58,1,改编得其实特别不好，是事件本身的社会意义在发挥效力。庭审的过程敷衍潦草，基本上只有直接证据和多彬指认两个障碍。最失望的是最后庭审的说教，男主角充当了法官和社会道德裁判的角色直接对着犯人指责纠正，配上底下所有演员的拼命拭泪，太刻意直白了。
童叮叮当当,看过,还行,2019-07-03 18:31:00,3,歹毒，金刚设定玄学
这可如何是好啊,看过,较差,2019-07-21 12:46:35,4,确实可以跟熔炉比，因为都差不多僵硬苍白。对施暴的刻画简单粗暴，人物描写老套空洞，空有现实题材而无现实意识，现实中真的有律师会和两个素不相识的孩子出去玩？继母往死里打，身上连点伤痕都没有？关键时刻视频小熊从天而降这种剧情是上世纪从没走出过乡村的编剧与自己的玩具熊同床共眠时灵机一动想出来的吗？玩具熊还能录像？？还录的继母正脸？？？exo me？？？人物性格转变莫名其妙，尤以男主为甚。演技？男主三分之二都是死鱼眼，“你是人吗”那一句，我瞬间脑补成了偶像狗血爱情片出轨情节，两个小孩演技都好得多。只能说韩国导演很幸运，他们有很多超级加分的题材能拿去随便糟蹋。2.6/5
白兔糖,看过,推荐,2020-01-20 23:22:54,2,力度和深度都有所欠缺，但题材取胜。韩国电影在挖掘题材和直面题材这方面真的做得好。
玥玲,看过,2019-08-13 21:28:52, ,0,看的影评，就当看过了，不评分，
酱酱酱酱,看过,力荐,2019-12-27 09:20:44,0,看得我稀里哗啦 天下有这种妈妈
Vivian,看过,还行,2019-11-01 20:45:42,0,不知道是不是因为看的多了，没觉得感动
山上风下,看过,还行,2019-10-27 10:07:08,0,2.5 浪费题材
小年左,看过,还行,2020-02-27 00:16:37,0,又是真实故事改编、我妈中途就被气哭，后面视频证据出来的时候，母女俩几乎抱头痛哭啊太可怜了…抹一把眼泪言归正传，这部探讨的家庭暴力又和《素媛》和《熔炉》不尽相同，素媛完全是变态作案，熔炉还在打法律的擦边球，衣冠禽兽们假披善衣有预谋有组织地犯罪，但继母或生父母虐童会更复杂，除了犯罪当时，平时或多或少会尽到一定义务（也许没有），这部最后继母诡辩的时候有提过「买菜做饭照顾起居送她们上学」，真假不得知，但一部分被家暴者选择不报案确实也与事后的「呵护有加」式哄劝有关，感情在内也是此类案件更难突破的原因之一。这部过于脸谱化也许更能煽动民情。anyway，希望也能成为可以影响法律的作品。
斯齊佐飛力尼克,看过,推荐,2020-02-23 21:54:55,0,太残忍了，很多情节压根不忍心看。我们需要开始质疑那些孩子杀死孩子新闻背后的真相了。看完这个才真正觉得《小偷家族》的创作角度有多难得了。
Q。,看过,还行,2020-02-19 23:50:57,0,题材很好，但整个电影拍的很流于表面，人物刻画不够饱满，剧情衔接也缺乏连贯性。 ★ ★ ★
弓谷所長,看过,还行,2019-07-20 18:25:42,1,看的真难受，韩国会拍出这样的电影，很多电影都是这样强烈的让观众感觉到咬牙切齿的痛恨，但我感觉一直这样的方式，也是在过度消费观众的价值观，就像狼来了喊多了，最后真狼反而变成假狼的。不能一直看这样的电影，会对人生产生怀疑的，其实美好的家庭更多。
seamouse,看过,还行,2019-07-29 23:49:20,0,议题意义深远，摄制展现一般。韩国还是擅长把新闻第二落点，表现得悲喜交加
yasha001,看过,推荐,2019-07-19 10:08:43,1,8分。剧情方面很抓人，特别是最后与继母法庭对质和小姑娘开口说出真相两段戏。小姑娘和男主的转变升华是自然的，这就不容易。这部片批判了社会上虐童和冷漠的现状，够了，不用要求电影再深入挖掘为什么会有这样的情况，连深度新闻都达不到，影片能让人思考就好。那个金刚玩具能录像前面一直没说，导致后面剧情感觉就是为了能告赢继母才说明清楚，是一个不足。
胡二,看过,还行,2019-08-06 12:00:20,0,孩子太可怜了
Heaven,看过,还行,2019-07-07 11:15:34,4,有金刚的是电影，无金刚的是现实。
Tina,看过,推荐,2019-07-28 10:10:47,0,太凄惨了！孩子一再地问大人“我做错了吗”，但在冰冷社会中，汲汲营营讨生活的人们哪会有耐心去听一个孩子的呐喊？当我们在质问片中邻居、老师、警察、社工的冷漠时，其实将自己代入同样的情境，未必会比这些人表现得更有几分人情味，这也是片头被抛出的案件的意义所在吧。冷漠、事不关己、高高挂起、不要自惹麻烦上身，将“明哲保身”这一套玩得如此熟练的成年人，该怎么心安理得地面对孩子纯洁如黑宝石般的眼睛？
枯川满,看过,较差,2019-07-06 23:21:09,4,讲真，这样的题材在这样的导演或跟风环境中，已经被玩坏了。
