用户,是否看过,评分,评论时间,有用数,评论
谢谢你们的鱼,看过,力荐,2019-12-05 21:25:49,36,毫无疑问的年度最佳，一部为大银幕而生的杰作，最后十分钟更是让人泪流不止。很难想象好莱坞居然愿意为这部如此深邃、深刻甚至颇具哲学意味的文艺片砸下一亿重金，意识流的叙事、缓慢的节奏、仪式感极强的画面都使很难抓住普通观众的内心，但是詹姆斯格雷天才一般的电影美学却让本片时刻调动着我的神经，他用最宏大的太空探索行为讲述着渺小个体最私人的情感，对亲情的追寻，对爱情的惋惜、对自我的质疑。更值得称赞的是，詹姆斯格雷完成了连诺兰都没有完成得事情，那就是用超感官的视听语言和极强的情感穿透力为观众还原了太空旅行的孤寂、孤独、绝望与无助。影片最动人和最让人心碎的就是父亲最后对Roy说的那句话，Let me go，Roy.有多少深情遁入虚空，无处寻觅。仰望星空，你才真正知道自己的渺小。
东遇西,看过,很差,2019-12-05 16:26:27,22,叙事从头到尾就是一场灾难......
晚不安,看过,推荐,2019-12-04 22:31:12,17,新千年最忧郁的太空片，在宇宙间喃喃自语，在月球上安静激战，巨幕厅观看土木海王星美如《星际穿越》。布拉德·皮特那张苍老的脸无比纯真，是海明威“冰山理论”的演法。相比《地心引力》《火星救援》的写实，格雷显然试图抵达《飞向太空》式的孤独。第一镜就致敬《2001太空漫游》最后一镜，但没有任何野心喷薄而出，而是非常克制、深沉地拍最核心的父子关系——不是对抗或反叛，而是追寻与超越。但汤米·李·琼斯突然的柔软会让人有些困惑，而皮特以爱之名自我解脱的收尾也是相当站不住脚。——既然已经抵达太阳系远方，不应该有更宏大的东西在召唤吗？这主旨的露怯一下让本片跟杰作拉开差距。在第三幕到来之前真是一部纯五星电影，离年度十佳只有一步之遥。
蛋堡的波特,看过,较差,2019-08-29 16:59:59,85,早起在《婚姻故事》和這部中選擇了後者，想著科幻片總能提神醒腦，但事實證明這是個epic failure的選擇，那點動作場景全都剪進預告里了，接下來全都是詹姆士·格雷一如既往的催眠大法。
女神的秋裤,看过,还行,2019-12-03 23:12:01,19,片子就像其中一句台词说的：beautiful but empty。另外，片名应该叫《如何不花一分钱去到海王星》。
seabisuit,看过,力荐,2019-12-06 03:00:12,19,第一部詹姆斯·格雷，在《现代启示录》中窥见《黑暗之心》的旅程。大部分人一辈子都在躲躲藏藏，这就是一部教人怎么做自己是否要更自私的电影。发现毕生寻找的外星生物并不存在之时，那种自我迷失也正是对人类而言在无限宇宙中所感受到的最大孤独，被获得的虚无所吞噬。几次旋转着的动作跌入某些领地都不会变化的心率抵不上对父亲的真情告白，但你们却告诉我这是错误的，所以最后能不能回到地球已经不再重要。无后遗孤到底怎样找到归宿，这经历充满了悔意与执着，当明白一次伟大的探索要达到那个目标看见结果注定会离家越来越远，告别的同时对观者是一种警示也是激励。为每年都能在影院看到这样顶级或硬或软的科幻片而欣慰幸福，圆了那不可能企及的太空梦。于冬的博纳能在今年投资皮特的两部真是开了天眼，可喜可贺。合生汇杜比厅，华星IMAX二刷。
徐若风,看过,力荐,2019-12-06 22:40:17,30,今年新片目前TOP3。喃喃自语是一把利刃，配合皮特的声线和泪痕，直接真挚地切开类型的外衣，将太空片化为绝对的“私电影”。我们只有通往另一个世界，才能变得敏感，走入自己的内心。太空片自诞生以来，很大程度是对古希腊神话的当代重写——父与子的伦理冲突、伊卡洛斯/普罗米修斯等是反复出现的母题，变奏成“我”的存在与宇宙的虚无。本片在这一层面上的思索并不特殊，但出色之处在于还混杂了格雷一贯的“唯一的世界与另一个新世界的转变”之题，从而引发比《迷失Z城》中沉溺“旧世界之梦”更大的回响。生发出的是孤勇、沉痛的自责和无药可救的浪漫。
alain.proust,看过,力荐,2019-12-05 01:57:57,28,在经历波动的变奏之后完美收尾，和德尼《太空生活》的结局一样闪耀着人性的光辉，昭彰爱之于人类的必要性，无论是重返旧的家园或是建设、探索遥远的新家园都需要爱：Clifford没有爱，残杀同类与猩猩无异，他丧失了作为人的能力，却也无法寻获宇宙的奥义，天体恒久黯淡而沉默；Roy有爱，幽蓝的海王星也发光，催人泪下，因此他大概不会听见什么来自宇宙深处更为宏大的呼喊声而抛弃人类孤身一人星际探索，如果真有什么声音在呼喊他，那也只能是爱——宇宙无情，哪里有爱哪里就是我们的家园。
翻滚吧！蛋堡,看过,推荐,2019-12-05 00:32:11,16,3.5 并没有预期那样沉闷，开场太空灾难的调度临场感十足，后段许多类型化的段落也不时刺激观感。这终究还是一场属于詹姆斯·格雷，属于“迷失Z城”式的太空探险。对未知文明的探索和自我认知的迷茫在格雷的宏大叙述下充满浪漫色彩和哲学思辨，隽永又悲凉。然而探索内心的终点还是落回到人类最私人的情感羁绊上，皮特的转变基本依靠几个闪回就敷衍过去，这个结局我不可以。
南悠一,看过,较差,2019-08-30 06:38:17,25,故事的设定非常吸引我，一个儿子寻找失踪的父亲，父亲的任务则是外太空寻找智慧生命，不禁让我想起同一届威尼斯主竞赛单元另一影片的名字，“关于无尽”，是宇宙的无尽，也是人作为唯一智慧生命之孤独的无尽。詹姆斯·格雷按太阳系星体结构来架构剧情脉络的纵深，为我们制造了一个太空题材的兔子洞，里面黑暗而诡奇，充满思辨又混沌一片。导演善于宏大叙事，往往先行设计宏观文明空间，像个囚笼，然后把人物像宠物一样关进去，演员在人性雕琢上发挥的空间并不大，以致这部作品显得乏味，结尾也缺少力量。
巴伐利亞酒神,看过,推荐,2019-12-05 20:44:01,14,科幻皮囊，文艺灵魂。与其说对星际的探索，不如说对孤独的思考。当你终其一生，发现整个宇宙只有人类一种文明时，你如何面对内心的幻灭？星空下父与子的呓语，不啻于一场太空中的嗑药，迷幻到不真实。另外必须说一句，近未来这个题材着实太棒，月球基地和火星旅行，真的是人类目前为止所能幻想的最近目标了。
萨库拉,看过,推荐,2019-12-08 23:58:32,15,一部“反”太空探索的太空探索片。为了证明我们在宇宙中不孤独，陷入了更大的孤独。在地球上孤独，在宇宙中更孤独。看到“我们只有彼此”，真是哭到抽搐。这么简单的道理，人类都不懂。
Henrique Asano,看过,推荐,2019-09-27 10:24:29,75,一个反传统大片常规的第三幕，但其实是和全片的情感传递一以贯之的，以及几场可圈可点的太空戏，动人的视觉奇观
Joker,看过,还行,2019-12-06 01:32:59,17,四个情绪爆点均与死亡有关，而死亡的背后似乎传递了某些特殊信息：1.月球背面的死亡是人类怀疑同类，文明的副作用与人性本身的原罪。2.动物实验引发的死亡是人类怀疑异类。人类与生俱来的傲慢会带来灭亡。3.驾驶舱内的死亡是感性杀死理性。对标不断出现的心理评估：情绪波动会阻碍人类的发展。4.父亲的死亡则意味着英雄主义的幻灭。也等同于承认了探索的意义是虚无的。循此苦旅，以达天际。电影在星际寻亲的故事外壳之下，嵌套了许多对人和时空之间的思考，漫长的旅程中，人物与时间空间彼此相对立，越是遥远，越是孤独，心理上的“失重”越发明显。直到面对最后的终极答案：我们所探寻的一切都是毫无意义的，就算最强大最坚韧的英雄面对这个答案也会崩溃。摄影非常唯美，孤独的气质也拿捏的很好。但是将落点聚焦在继承者的身上，有点虎头蛇尾。
要丸,看过,推荐,2019-12-06 19:34:13,15,太致郁了，完全和《星际穿越》是两个极端。虚无主义的感觉，主角和父亲其实在某种意义上是一模一样的人，都是没有感情的理性机器，偏执且孤独。但不同的是一个决定毅然赴死，一个决定融入社会。而正是这种反差的玩味狠狠地嘲讽了人类感情的无意义。导演真的太狠了，如果说诺兰在歌颂人类情感与爱大于宇宙一切的话，这个导演就是在无视人类情感，强调人类在宇宙面前的渺小和虚无。我们作为宇宙中孤独的生物真的是在无意义的存在吗？我不这么认为，我们不需要寻找其他生物，其他星球没有光明没有黑暗，没有爱也没有恨，但在地球我们有彼此，这就够了。
迦南Canaan,看过,推荐,2019-12-06 01:28:49,12,3.5入4。优秀但远非杰作。将本可宏观展示的题材做了微观的情绪处理是非常需要勇气的尝试。IMAX体验极佳，我相信只有在电影院中后半段才能发挥最大的威力，在一片沉静中突然的旁白激起了我一身的鸡皮疙瘩。电影对孤独的展示具象且充满力量，但后期对孤独的注解却不够精致，你可以看做是人性的光辉，但其本质其实与“我站在宇宙中心呼唤我自己的爱”无疑，相对电影对孤独巨细的刻画，这个落点实在是显得潦草。
柯里昂,看过,推荐,2019-12-04 22:40:47,15,虽说今年不少电影都用了大量旁白（独白）叙事，但这部其实完全可以不用，格雷对自己的影像叙事能力太没自信了。
圆首的秘书,看过,力荐,2019-12-10 16:20:37,22,这是一部真正能给人巨大幸福感的电影，无论是白天还是晚上，当你看完电影走出电影院，看到街上车水马龙抑或灯火璀璨，会感觉整个世界都在围绕着你。环顾四周，想想父母双全，想想世上还有这么静谧深沉的影像，感觉到爱，一切都很美好。
室内滂沱,看过,推荐,2019-12-06 07:26:38,16,最喜欢布拉德·皮特侧脸的镜头，他的睫毛像蝴蝶扇动翅膀。假如影院的影厅就像一座封闭的太空舱，你必须在黑暗中和这部电影“关”在一起两个钟头，才能感受到影片传递出的这种细丝一般的渺远与孤绝。詹姆斯·格雷的特别之处是，他当然是有才之人，但他的作品从不需让你惜他的才。这当然也是一部十分闷骚的电影，但相比邓肯·琼斯、斯派克·琼斯、查理考夫曼、维纶纽瓦，影片从未将一切异化，而是就算故事都已经讲到了海王星，所见所触仍然是熟悉和温暖的。对片中所说的“这个壮美的宇宙背后是巨大的空洞，如果没有爱和恨、光明与黑暗，一切都是幻影”深深佩服，汤米李琼斯向后退、缩回手，是今年看过最感动的一幕。从主角到火星后就开始变得如诗如画，已经不必符合情理，那些跳剪的拼贴组合很厉害。遗憾是配乐还是有点像诺兰电影，以及后劲偏小。接近五星
帕拉,看过,推荐,2019-10-02 12:57:09,15,后来我知道了，这是人类孤独的探索。深入太空就是深入我们的内心，没有同类没有陪伴，没有什么治得好我的孤独。
药师,看过,力荐,2019-09-25 10:30:40,28,已经很久，很久，很久没有在太空片里看到这么私人的闪烁了。这个时代能拍好片的人本质上都是传教士，超验体验是极致到微观的天赋。
天马星,看过,推荐,2019-12-07 15:46:54,9,格雷用一部「迷失太空」就完成了对宇宙与内心的双重探索：对宇宙的探索最终走向虚无，对内心的探索最终走向孤独。如果一切探索的终点都是虚无与孤独，那探索还有没有意义？格雷将深入内心与飞向太空互相映照，做到了真正仰望星空的同时又凝视内心，真正地触碰到「星际探索」这个词的内在含义。二刷IMAX，再一次迷失在皮特的蓝色瞳孔中。
bloom,看过,力荐,2019-12-04 21:29:45,17,太空伯格曼。
qw0aszx,看过,推荐,2019-12-09 23:10:45,5,除去掉估计被强行加上的生硬旁白，还有现在这个结尾，其他所有画面都让我想要漂浮于其中
余小岛,看过,推荐,2019-09-28 23:45:20,12,意识流式太空电影。前面大段梦呓般的独白，后面大段如水般的沉默，美轮美奂如坠云雾的太空摄影。与其说是太空探索，不如说是自我心灵的探索。飞跃数十亿英里，寻找父亲搜寻智慧生物，最后找到的是更美好的自我。。
btr,看过,力荐,2019-12-09 23:14:05,17,#影城一厅 如维吉尔在《埃涅阿斯记》里说，就这样他朝着星辰而去。星际旅行是探索也是逃离，但逃离无用，其他星球变成地球和战场，太阳系级别的孤独才是终极人类状况。一部很有史诗感的电影。冰冷机构／语言背后潮涌的情感、头盔上映射出攀爬绳索的手（内心的旅程）和海王星旁父子如脐带相连令人感动。
ripple,看过,力荐,2019-12-04 15:09:59,13,思维/思绪化的影像，以及影像建立身体/肉体性的技巧，纯视听的——思想的影像
九個9,看过,还行,2019-10-01 04:01:57,10,银河版爸爸去哪儿
AshBoydSwan,看过,力荐,2019-10-07 02:27:18,16,高级…是格雷巨巨的《黑暗的心》。电影语言一直跟着角色的内心发展在走，剧作扎实，节奏稳健，扑克和窝爹的表演是看到目前的年度最佳。摄影也太好了。人类永恒的孤独（未知的内部世界）和无垠的星空（未知的外部世界）都是令人恐惧却又充满诗意的，格雷给了它们应得的残忍的美。他的厚重和温柔融入了电影的每一帧，大师之作。
乌鸦火堂,看过,较差,2020-01-02 18:04:41,14,作为科幻迷，对本片的失望溢于言表，是那种打算有着哲学思想深度，还巴望着娱乐效果的样子，结果哪头儿都没兼顾。浩瀚宇宙、漫漫征途空有镜头感，但过多的旁白和快慢不一的节奏冲淡了应有的沉溺感，你要说是商业资本绑架导演意图，但也不是绝对，因为这个故事也没必要拍成这样的类型，不就是《黑洞表面》的模式嘛，拍成商业大片也没问题，但非要搞成这种，结果不伦不类
赱馬觀♣,看过,还行,2019-12-06 15:50:33,8,太空类型本位上展开过多联想实在没有必要，这就是一部现代启示录四十周年的献礼影片：男主启程寻找神秘失踪的传奇人物；船长自作主张改变航道去检查未知风险源；关键时刻一位女性的身世诉说坚定了男主继续探险的决心；神秘人物最终现身却已报赴死之心……再查查导演格雷的简介，“10岁时，看过弗朗西斯·福特·科波拉的《现代启示录》之后，改变了自己的志向，决定投身电影。”
又又,看过,还行,2019-09-28 16:33:31,11,大概也就睡了十几次吧，brad pitt的喃喃自语真的很催眠啊。第一次裸听英文，大概听懂了70%吧然而真的欣赏不来此片… 2019.9.28@曼谷电影院
RioLiv,看过,力荐,2019-10-07 03:04:07,18,第一次在电影里使用独白的格雷，让Roy的这段太空之旅更加接近越南丛林里的Willard，Willard找到了恐惧，Roy却找到了比孤独漂泊在宇宙中试图征服恐惧更重要的东西，格雷对自己的角色一贯的温柔和怜悯。电影前半段像是Roy不超80bpm的心跳，极度客观冷静；叙事深入带起节奏渐进，火星上父亲回应那一刻开始，镜头语言，音乐，表演瞬间提升，并将这种引人入胜的高潮一直保持到结束。看得眼睛都要戳到屏幕了！TLJ演得太好了，为什么会有这么好的老头！谢谢福斯让格雷保留自己的结尾，最后40秒去掉就是格雷自己的结尾。
Lacie,看过,较差,2019-09-22 09:50:22,21,爸爸再爱我一次之outer space篇。是地球已经满足不了自我救赎这种题材了所以要搬去外太空吗！除了海王星好美以外，毫无看头。哦，还有那个蠢出天际的captain，见过坑队友的，没见过顺便把自己坑死的👏impressive
哪吒男,看过,力荐,2019-12-18 21:33:22,10,宇宙的尽头也没有答案，如果你要的只是答案。
删邃,看过,力荐,2019-12-08 17:05:25,11,重刷，被父亲的最后一句“像我们这样的人不多了”完全戳到，感谢格雷用资本的钱拍了自己的东西，升五星。// 抛开那些形式上的东西，格雷最大的优点就是无论什么题材，他的故事内核始终是最经典的，是莎士比亚的，这也是为什么《星际探索》在经历了肉眼可见的资本摧残以后仍旧保留着古典的迷人的姿态。但千万不要像我这样抱着太空伯格曼的期待去看，你给伯格曼几个亿他也不会拍科幻片，他会告诉你可以但没必要。
我们的失败.,看过,力荐,2019-12-07 12:31:40,11,9.0-
下落不明,看过,还行,2019-09-21 09:49:22,10,看到了地心引力+银翼杀手2049+降临+太空漫游 后排老美说还有星际穿越+现代启示录的 这么多珠玉在前的作品 又是一部让人怀疑太空片仅此而已了吗的片 全程莫名其妙 蜻蜓点水 太空基地成了纽约地铁站 天呐 人类还是不要去太空制造垃圾了吧 经费在燃烧 赶紧拍完得了！ 天呐 3.2
朝阳区陆依萍,看过,力荐,2019-12-07 21:32:08,10,真的没想到，我爱死了，非常动人！拍太空题材想要呈现那种视觉，孤独感和什么哲思是很常见的，但这部电影有少见的那种性感诗意的，gentleman的，优雅古典的，脆弱敏感的，complicated emotion…，大概从皮特一个人飞往海王星，我就一直在流泪，我自己都不知道为什么，当然父子情深还是稍微流俗了些，但整体非常棒！#想和皮特在外太空性爱#
飘飘然,看过,较差,2019-10-01 12:58:57,18,还真以为是黑暗之心和现代启示录 结尾lame的要吐血了 这个导演老是以一副“我有很深刻的东西要告诉你”的嘴脸来欺骗观众 其实只是热衷于Abandonment issue.
8888恭喜8888,看过,力荐,2019-09-19 14:24:07,21,【82分】极其浪漫的真正太空公路片，从地球到月球，从火星经过木星土星，再到终点的海王星。每个地方展现出来了不同的色调，环境给人记忆深刻(尤其是火星）。一场探索人类精神的旅程。全片集中于Brad Pitt的角色一人，用非常漂亮的镜头剪辑展现太空中的无助，以及曾经的亲情爱情。全片用了非常多的旁白，部分有效部分还是有点没必要，比如第三幕，极其多的面部特写足够展现出这些旁边的内容。配角不完全无用，让观众看到在太空中不同的时间，不同的威胁展现出不同的人性，却没有人类好的一部分。全片给人很多2001，飞向太空的感觉（多个方面，比如一些闪回Liv Tyler角色的片段打光以及feel，多个地方的建筑布景等等）。如果你之前不喜欢格雷，那这部更不适合你。另外那个月球飙车挺新鲜的，但是不如火星登火箭那段震撼吧。
K45P3R,看过,力荐,2019-09-19 07:44:48,18,（8.9/10）詹姆斯·格雷的《星际探索》其实是对自我的探索。对人性的探索。这是一部浪漫又悲伤的公路电影。人类将所有特质都带入外太空。唯独没有好的那一部分。Roy在寻找父亲的旅途中反思自己的人生。并从这阶段人生中解脱出来。转向下一阶段。| 格雷的剧本还是一如既往的精巧。充满着各种互文和象征。Roy与飞船实验室里的狒狒一样有着被遗弃后的愤怒。遗传了父亲的自毁倾向正如那艘执行自杀式任务的火箭。太空舱与空间站的对接失败就像父子之间的陌生与隔阂。虽然故事仅仅聚焦一件家事。却有着涉及全人类的力量。
咯咯精,看过,力荐,2019-08-28 06:21:52,8,https://music.apple.com/de/playlist/ad-astra-by-james-gray/pl.u-jV89ampTlp11BJ 二刷完成 同为TKS粉 overjoyed//embargo过了赶紧奔赴战场。寻找失落文明的expedition我没买账，但是一旦剑指宇宙作为星际殖民主义者就完全领会了。所有日常和诗意完美嵌套tks式叙事长诗，弦乐和电音里精准的读脸术，不存在speech，surge-波-震荡回旋。“驶向宇宙回到内心”genre的最高之作。认可70s科幻硬：失重环境闪电遭遇战、智杀实验猴、1分50秒完成劫机屠机、星球环境决定思维长相和palette、克拉克信徒……可能是今年水城至爱。
汽车大师,看过,力荐,2019-12-07 13:59:59,10,用最宽广的画卷描绘最亲密细微的情感。由白天到黑夜，混沌到隐秘，行过死荫的幽谷，角色弧画成了圆
逢澶Ty,看过,还行,2019-09-21 15:15:49,9,打从心底说不出到底不喜欢这片什么地方。Brad Pitt真心好，孤独感可以打满分，但整体总有种说不出所以然的感觉。是否定要上升到哲学高度感叹人生大彻大悟呢？在一众科幻太空题材中，可以算是中上水平，期待值放低可能还有不少惊喜。
阿哲系,看过,力荐,2019-09-21 01:40:32,13,"#cineworld, 人的情感探索起来比宇宙还神秘；哪一天地球不适宜呆，别想着去其他星球糟蹋了，无法抓住地球这一头彩机会的人类基因可能不值得延续；有这两点强烈立场，多数太空科幻都有所保留地去接受，但这次诗意中带着爆发的旅程很让人满足啊。
比起《地心引力》更多是让人想起《太空生活》，比诺什歇斯底里地创造生命，琼斯别无他法地抛弃生命的对比也挺有意思。
想到一个朋友，她父亲欠了一些债后消失了十年，前年她主动找到了父亲，父亲身体健康，但总是说与神对话，她给他买了房子，尽力陪伴，会不时跟我分享菜田里的丰收，我很敬佩她，换做我，我想很难做到，但不解的是她感受到的愧疚，她觉得父亲的状态她是负有责任的，说那时的他也是按自己所知的最佳方式努力过的。下次见她我可能要想起皮特了。近年的我总是对父母感恩同时愧疚。"
Gloomy Elliott,看过,较差,2019-10-03 20:53:47,18,"一场真正的拙劣模仿

如果说所有的科幻电影都是对2001的拙劣模仿，那星际任务就是拙劣中的拙劣。
一个莎翁气质的宿命故事放在太空的语境下本应该有些新意，但却杂糅了太多经典元素导致很多内容有头无尾，显得故弄玄虚。

部分基地场景带着银翼杀手的美学韵味，而飞船内又是写实的空间站风格，整体气质割裂。故事的启发性十分微量，节奏却又始终在文艺片的频道，缓慢且松散。我多年来始终喜欢BradPit的长相气质，但这次的表现依然平平，并不到位。

想来想去，除了pit的长相，真的毫无优点。。。一部爆米花电影再平庸，也总归能靠大场面值回一点票价；但这样一部不伦不类的，自说自话着一些诗意话语的太空艺术片，我真的找不到任何浪费时间和票钱的理由。☹️很失望"
西楼尘,看过,推荐,2019-12-23 13:02:06,13,父亲探寻壮阔的宇宙风貌，希图获得生命的征兆，但那里没有恨没有爱，宛如虚无。我生活在充满恨充满爱的星球，情绪稳定，却无比孤独。舒缓室播放着虚假的美景，饲管里汲取着无味的食物。我们是出生在火星的孩子，还是滞留在宇宙的猩猩，是生命的探险家还是星际的流浪者？是宇宙的奇迹，还是上帝的弃儿？
内陆飞鱼,看过,还行,2019-12-30 09:26:53,6,视听语言还是不错的，本质上不是烂的问题，是表达的重心不明确；要商业没有多少紧张刺激的商业看点，大众肯定失望；要人文反思，也没有多少值得反思的空间，资深影迷也不买账。
哼哼.floweray,看过,还行,2019-12-06 20:00:47,10,马修，皮特，克鲁尼，一个个的都上天了，小李子你加把劲儿啊，太空F4需要你
儒雅随和缺德梅,看过,推荐,2019-12-06 16:35:48,9,8.3 许多宇航员从太空返回地球后都曾表达过类似的事情，他们原本是去探寻宇宙，结果却发现了自己。救父之旅，也是弑父之旅，触摸人之手消除父亲降下的阴影，破茧而出般地感受阳光。只是为了让人完成这段旅程无所不用其极，无知如我对物理层面的事也是满脑子问号，于是只能这样安慰自己，这是一场心灵的奥德赛，终究还是美轮美奂难舍。
面包面条面饼,看过,力荐,2019-09-29 14:28:56,8,未来启示录
秋刀鱼木,看过,力荐,2019-12-06 15:30:20,10,从情节和技术而言没有任何一点能让我理解；但psycho confession是极致的触动，无论“他看见了不可见的”，抑或对抵达知识尽头再陷入循环的恐惧与痴迷，完全是亚里士多德式的狂热。极其不满的是，漫游宇宙之后居然觉得因为孤独所以要爱身边的人，这绝不是什么温柔，而是对无意义的俯首帖耳，懦夫行径。但连不满都是真正有爽到的不满。
