用户,是否看过,评分,评论时间,有用数,评论
法式曌影,看过,力荐,2019-12-07 20:24:11,8,"【A】失语。没什么好说的。10s最佳太空电影。
21世纪的太空奥赛德，孤独与爱的朝圣之旅。逆流而上，向死而生。
阿莫多瓦：“只会哭算不上好演员，懂得克制眼泪才是好演员”。说的就是布拉德'皮特。"
阿暖,看过,力荐,2019-12-08 17:19:28,4,"I’ve talked when I should have listened. I’ve been harsh when I should have been tender. I always believed I preferred to be alone, but I confess it’s wearing on me. I’ve let so many people down."
皮革业,看过,推荐,2019-12-06 20:21:43,7,爸爸的《迷失Z城》，儿子的《现代启示录》。感觉结尾可以更丧逼一些。
spondee,看过,还行,2019-09-21 21:56:39,5,3.5。布萊德彼特之獨角戲猶如《地心引力》中的珊卓布拉克，偏愛那些內心murmur的直白、無奈口吻(「何必繼續? 何必嘗試繼續?」...... )。以太空人的職業傷害來營造厭世(看破人世)氛圍。救援，指的是自我心理治療，從父子關係著手，意識到父親沒救了(非人狀態)，才停止放棄治療。重點在心理刻劃，只是太空科幻影迷不見得買單 ; 題材氾濫即將觀影疲勞。 http://www.funscreen.com.tw/fan.asp?F_No=1283&fbclid=IwAR30F0yBDieIzHdxVeRQKK5N_FB3t3-19BPVH6z7kEZRCKSLiw9nrzcjj38
豆瓣唯一机器人,看过,力荐,2019-12-06 16:54:11,4,满五星！年度十大！2010s十佳！最爱太空电影第一名！格雷真是太懂探险家和父子关系了！不断去认识世界，不断自我怀疑，不断和自己对话，不断寻找意义，格雷的电影简直是一本探险者手札。
brennteiskalt,看过,力荐,2019-12-13 08:30:35,7,穿过整个太阳系去找爸爸，如此简单粗暴而富有隐喻的剧情线应该让人第一时间就明白，这部科幻片才不是说科学呢，而是在用现象学的说法讨论人的心理问题。游荡到海王星的父亲有着神性，好像创造了世界之后就自我放逐不管不顾的造物主。机器般精确的男主角必须要穿越星际去解决掉他，才能恢复自己为人的情感。最后的布拉德皮特做着心理评估，阳光照在脸上。呵！詹姆斯格雷真是个乐观浪漫派的人性主义者啊！
宇文宙,看过,较差,2019-12-05 22:22:35,9,如果你以为本片是星际穿越或者火星救援那样的科幻大片，想必会跟我一样大失所望。本片无论是气质还是叙事节奏都更像一部文艺片，皮特絮絮叨叨的大段内心独白让影片氛围内敛而压抑，全靠皮特的实力演技撑起整部戏。但最后皮特手持铁皮惯性横穿海王星光环以及依仗一颗迷你核弹的爆炸冲击波作为动力送火箭回地球依然让人笑到泪奔。
不良生,看过,还行,2020-01-04 16:50:23,1,给他一个太空，他能找回一个爸爸；给你一张床，你也能找到十个爸爸。
超搞笑级的？？,看过,推荐,2019-12-05 19:57:21,10,很明白为什么电影评价会两极分化，喜欢的人说，在一个硬核的科幻故事里讲个人情感很难，但电影做到了，不喜欢的人说，电影里的情感撑不起电影的体量。其实都有道理，制作和表演（男主独角戏）十分出色，剧本也出人意料的工整，但最后应当给人情感予以重击的第三幕，却没有撑起前两幕给我们带来的情感期待，终究有些可惜。
我累特,看过,还行,2019-12-06 20:50:10,7,每一个毛孔都真切感受到了布拉德皮特对星际穿越中那个马修麦康纳的羡慕嫉妒恨.......
Gog-Gy,看过,力荐,2019-12-06 02:05:43,10,这个浮躁的时代难以看到这种太空科幻了，愈多人对科幻的定义只剩下漫威或星战（看看评论区，多么浮躁可笑），一部摄影、运镜、配乐、服化道都可称作一流的太空片，却致力于诠释孤独，而不是深入描绘太空战争，自然不会受人关注。本片对茫茫深空的终极思考回归到个体的孤独，以小见大映射全人类的孤独，而皮特很好地把主角孤独自闭的内在演绎出来，结尾的转变与开场判若两人。惊悚元素恰到其处，浩瀚苍穹的壮美与个人、集体的孤独相融，一场体验颇佳的沉浸式观影。
Chris  一切由无聊开始,看过,力荐,2019-12-11 00:07:28,5,感觉挺长一阵了，我加标签没有加“科幻”两个字，这部加了。我感觉从内核上来说很科幻，影像上也很艺术，思考的东西也很有意思，眼袋都会演戏的布拉德皮特又超牛。看完非常过瘾。这不是常见的所谓科幻大片，非常有意思。据说导演的原意还被修改过，不知道原来是什么样子。这种科幻电影是有品味的。为极其少见的文字大制作科幻电影打5星。
anticensorship,看过,推荐,2019-09-29 03:09:59,7,海王星太美了....光环也完美还原。电影内核是在劝退探索者...
SleepWalker,看过,力荐,2019-12-04 21:59:57,11,如果感觉孤独，如果理解孤独，它一定更对胃口。没有《星际穿越》中大开大合的父女深情，没有《地心引力》中对地球依恋敬畏的高亢颂歌，却好似融合了两者的文本核心，提炼出一种更复杂更难释怀的情感能量，因此，后劲澎湃。渺小的自身在浩瀚的宇宙中迷失，追寻父亲的脚步以践行自己的诺言，在星际中探索的究竟是什么，是缺失的爱？是未知的远方？还是缥缈的未来？皮特从头到尾的呢喃一次次叩击着内心，我知道，我相信，时间会证明这部影片的伟大。
街坊饿霸,看过,推荐,2019-12-05 22:49:29,6,人在宇宙中是一个不断瓦解的过程，朋友、爱人、国家，离地球越远，这些就越狗屁不是。到了最后，连人本身可能都不再是人。我比较喜欢电影中这种得到与瓦解并存、绝望与希望共生、男人与男孩同在的美，哪怕是追到冥王星，哪怕人的意义只剩下一点气若游丝的亲情，它也依然是值得的。
基瑞尔,看过,推荐,2019-12-05 21:34:13,9,不曾想到今年几次在电影院落泪有两次都和太空题材有关系，一部是《太空生活》，一部是这个，它们总有种很特别的美好（和久违等待的可贵）。人类在浩瀚太空中，不再是尘埃，而关于新生与传承；而尽管未来危险密布，地球不再安全，但一次探索，数次“战斗”，终归是对自我的认识与重新和解。Brad有几幕特别好，不放重心在演戏实在是太可惜了。PS 尽管就出现了几秒钟，Natasha Lyonne那副嗑high了的模样还是让我笑死了，顿时渲染了后未来的绝望。。
有心打扰,看过,力荐,2019-12-06 13:27:41,6,无比忧伤的科幻片，关于追寻、关于亲情、关于太空。观感就是(《星际穿越》+《生命之树》)/2+《地心引力》=《星际探索》。
Paco,看过,推荐,2019-12-15 22:53:57,8,4.5。虚幻的光斑被胶片记录得无比真切——这是它贯彻于文本、视听乃至戏外的“对立统一”之缩影，也是它可被完全感知而无法拆解致知的所有。一部以彻底的折返肯定“中庸”、勇敢面对电影本可回避的困境、诚实回应时空区间给出的无解、以《飞向太空》的姿态和《火星任务》的语气尝试再次触碰《太空漫游》所触碰的作品。同时也因为这份“过剩”的勇敢和诚实，甚至难以在当下找到真正属于它的参照坐标。前有《银翼杀手》1982版，后有《星际探索》2019版，五星值得被保留。→20.2.15和爸妈在家二刷。更多映照自己的感触了。我妈：“我知道你爸是他，你是他爸。”
羚羊的灵魂,看过,力荐,2019-12-03 16:03:08,4,你有你的蓝色星球 我有我的蓝色星球  你害怕孤独 但孤独是我的使命  所以  放我走吧
某妮,看过,较差,2019-12-05 20:56:20,10,我以为自己在看2019漫游太空，但其实我在看爸爸去哪儿、异星觉醒、上海堡垒、美国队长、布拉德皮特写真……｜电审特进字2019年第65号
最长的电影,看过,推荐,2019-12-04 19:24:45,10,每年都有几部反类型片，去年的《希斯特斯兄弟》都能上7.8，今年这种“反类型”的科幻片在豆瓣连7.5分都到不了？这部严格意义上都不能称为反类型，之前能受得了《地心引力》的洗礼，这次就原形毕露了？一个个的看不懂也来打影评？
派翠克,看过,还行,2019-09-23 09:58:13,7,这片很让人观感断裂，在月球上是动作片，去火星路上是惊悚片，去海王星路上是文艺片。但无论如何，让如此宏大的铺垫服务一个如此无聊的结果，我不知道是不是编剧能力水平太有限，所以草草结束影片，美其名为反高潮。P.S.我可以肯定片中的设定理科生看了一定想砍人。
旧书君,看过,还行,2019-12-05 23:15:32,3,地月火民航、月球海盗、扒火箭飞船、自杀式深空探索...…这些事件在远未来的展示已经屡见不鲜，但放在还未至大航海太空时代的这个近未来时间节点上展现，这个搭配还是挺奇特的。但是这个故事也是单薄到……皮特连表演欲望都没有。有一个点还算喜欢：无处不在的心理评估+火星地下安抚室。每每看得我很焦虑。表示写故事的人设置了一个类似发条橙一样的敌托邦在隐处，还是有野心的。这样来看这电影似乎也没那么薄了。
kylegun,看过,力荐,2019-12-09 20:55:39,4,太空天梯垂直极限，月球Mad Max失重漂移，space monkey夺命救援，火箭搏杀一抽三，神盾穿越行星环……分明就是邪典片套路，却给套了个严肃科幻的外壳；近未来宇宙殖民设施和愚蠢人类社会关系等设定还可以，孤寂绝望的气氛营造也不错；但什么海王星反物质脉冲啊，人肉火星广播啊，生爬火箭宇宙乱飞啊，科学概念方面的槽点实在过多；导演James Gray从首作的纽约《小奥德萨》街区到如今的太阳系边缘都逃脱不掉daddy issue，所谓一辈子拍一部电影大概就这个意思？
frozenmoon,看过,还行,2019-12-23 15:04:30,6,很喜欢这种科幻壳子探讨情感的东西，远比纯硬科幻有趣得多。外星人存在吗？不存在吧。人类的存在就是极致的孤寂和荒凉吧。
刍狗,看过,推荐,2019-12-05 21:17:52,12,这片必须一个人去看，要再赶上个没嘛人的场次就更完美了
神仙鱼,看过,推荐,2019-12-05 22:39:41,4,实为“心”际探索。第一刻想到的自是大佛那句永远无法探索的内心宇宙。你可以耗尽一生在其中，但陷入便是无尽孤独，至死也无法明白。老麦克布莱德找了一辈子没有找到另一个愿和他一起进入这个宇宙的人，无望而去；小麦克布莱德学着父亲的宇宙观在自己的宇宙中摸索了大半辈子，最终才知宇宙和宇宙尽管相似却大为不同。孰对孰错呢？真的可以简单打上冒险和保守的标签吗？我不知道，我也还在探索。宏大中的细微处藏着最动人的情绪，像一束电波点解万千分之一的疑窦，格雷一定无数次进入过自己的宇宙。喜欢他在那些即将冲入类型化的片段中的回神时刻，特别迷人。配乐特别棒，沉醉在他的节奏调调中。//第一部格雷
风间隼,看过,还行,2019-12-08 00:53:32,5,典雅而工整的电影，节奏和视听都相当老派，气氛渲染到位。可惜太空场面实在太难摆脱绿幕动画那股浓浓的塑料味了。
饕餮暴血,看过,力荐,2019-12-07 09:00:25,4,寄蜉蝣于天地，渺沧海之一粟。以往优秀的太空科幻都是讲抗争，而星际探索则用两小时的孤独和喃喃，用一个寻父之旅达成了人类面对宇宙的终极归宿。所以结尾不同于《地心引力》的振奋，更接近于《银翼杀手2049》的悲怆。还得感谢资本与技术，让格雷之类的作者导演可以更好的营造出自己心中的氛围，从月之暗面到红色沙漠到幽蓝星环，构筑了极致的孤独，而皮特的独白则成为了连接电影和观众的最后一根线，彻底沉沦
SELVEN,看过,推荐,2019-12-06 16:00:02,4,75/100 这是一个恢复“人性”的故事，视听都是顶级的审美品味，看之前知道是天空版“黑暗之心”，但实际上也是一个深空的迷失Z城，但可惜的是我期待那种像迷失Z城般的高端结局终究还是没有发生，非但没有发生，我认为它的结束过于任性，无论是在镜头语言还是文本语言上，怎么说呢，毕竟还是要对影院买单的类型片观众负责的吧。
Anubis,看过,力荐,2019-10-13 13:10:11,9,"what if your absent father consumed by his passion is literally billions of miles away? How fucking romantic is that? 史诗又个人，The Tree of Life in space不假。视听奇观、声音设计美妙（上次看这么好听的片子是Mother!）、布拉德皮特long overdue的表演大师课。 以to the stars的名义，说了""We're all we've got""、""live and love""。爱与和平这么过时的信息在今天怎么表述，本片给出了绝妙回答，以至于我这么cynical的人都泪目了"
Panda的阴影,看过,推荐,2019-12-05 22:26:50,5,2013年的《地心引力》，2014年的《星际穿越》，2015年的《火星救援》，2016年的《太空旅客》，2017年的《异星觉醒》，2018年的《登月第一人》，2019年的《星际探索》。这些年每年美国都有“太空”题材的电影，可惜后几部都没有像前三部让我那么喜爱了。—— 虽然叙事节奏缓慢，但故事情节倒没有早前因“太空文艺片”预期的那么沉闷……如果太阳系的行星（还有月亮）人类都能居住、要我选择一颗居住的话，我想我还是会优先选择住在地球上。★★★☆
功夫熊猫大碗熊,看过,很差,2019-10-17 11:21:09,12,目瞪口呆，作为一个文科狗也觉得导演不是在拍电影而是在试图重写人类物理学天文学工程学教科书，理工人士狂嘲文科生的好材料。什么情感都不重要，因为观看此片你就能见识如下场面：火箭降落火星不是用着陆舱而是整个倒转屁股朝下往表面戳（还要毫无缝隙刚好戳到下一次发射的发射台上），火箭发动机都预热点火了一个只穿宇航服的人还能从发动机旁边外部可以打开的舱门钻进火箭里，整个火箭飞船靠一个几十升的氧气瓶支持七十几天行程、被打爆了就全体窒息挂了，能飞到冥王星的太空站外部挂件面板还用个汽车货柜都不如的外部插拴固定、一手就能掰下来，还能当挡板挡开光环带的各种碎陨石（与此同时宇航服推进器疯狂开挂一路冲冲冲），冥王星核爆一发直接把飞船推到不知道什么轨道上直接回地球，以及有没有人介绍下到底用核弹炸反物质引擎会出现什么事？
SebMia,看过,力荐,2019-12-09 19:44:56,11,执着于“寻找”的人是孤独的。父亲终其一生行进在寻找新生命的旅程上；儿子则执迷于寻找父亲留在身后的脚印；他们都将自己锁定在一条没有分支的道路上，将其他一切幸福的可能隔离于身体之外，或许，这是独属于伟人的孤独。但，比一意孤行更能实现自我价值的方式也许是放眼看世界。即便是伟人，在追寻理想的路上，请试着打开心扉，接纳爱。有人说这样的科幻片太无聊了，但我要对坚持这类创作的导演说，在你孤独的创作道路上，有卑微的我，还有强大的“我们”。（ps：短时间内不敢再看皮特了，否则真要弯了🙈）9/10
Hysteriafoi,看过,很差,2019-12-10 13:24:29,5,好好拍太空制杖片不好吗整什么狗屁不通的情感立意啊
思路乐,看过,推荐,2019-12-06 20:28:08,4,【A－】一种很奇妙的关系是，无论是银幕外的我们，还是银幕内的他们，所共同面对的，都是我们所无法理解的事物。我们惊叹、焦躁、悲诀、愤怒，在奇观面前迷失自我，在宇宙中央自我迷失。父与子，堕落与拯救，孤寂与迷失，他们都是同一个人，在相同环境下的不同选择。格雷依旧是当下好莱坞最独特的导演之一，古典、优雅，且从一而终。在影像世界的追寻中，他所唯一确认的答案就是追寻本身，无奈的答案，深刻的答案，一切答案的答案。
怀璧不予,看过,还行,2019-12-05 21:40:33,4,皮特的文艺个人秀，目标模糊的被动主人公，以内在冲突为故事驱动，再加上走马灯一样的NPC角色提供大量解释性台词，以及主角贯穿全篇的内心独白，构成了一部令人犯困的小情节电影。片中包含的现实元素，如违抗军令、过失杀人和官方灭口等情节，统统以文艺片的超逻辑方式来处理，不能深究。电影特效很不错，证据是观影时恐高的男友经常手心冰凉出冷汗。
UrthónaD'Mors,看过,推荐,2019-12-06 14:54:25,1,宇宙的瑰丽宏大与人类的无助和旷世孤独。ps:这么多年这么多部电影拍下来皮特终于有了细腻的演技，尤其是孤独到快要崩溃的他就连那眼轮匝肌条的抽搐都带着化不去的哀伤。
介意,看过,推荐,2019-10-04 11:39:04,3,"La photogénie de Brad Pitt comme un star, c’est à dire la photogénie dans son sens vulgaire, n’éclipse guère la photogénie de ses paupières sillonnées, ou plutôt d’une larme se défendant, telle une astre suspendue dans l’univers."
Riri,看过,力荐,2019-12-04 23:24:03,7,作为一部科幻大片，有大气唯美的摄影美术，有悬疑甚至惊悚桥段，还有眼睛里装着整个蓝地球的皮特，但导演用这些所有元素，讲了一个儿子努力走出父亲阴影，从孤独中重新拥抱这个世界的故事。好似一个顶级的交响乐团，演奏了一曲小夜曲。非常私人，非常喜欢，在这个很容易到达月球的时代，我们终于可以探索别人内心的宇宙。
pucker,看过,2019-10-04 11:45:13, ,3,最大的败笔是男主太不立体了，本就是要走心理悬疑，以庞大太空为背景使人对未知产生恐惧，乃至精神失常，但男主的心理这么简单真的很失败。这就是既要艺术又要商业的博弈失败品。政治背景靠几个片段也反应不太出什么。画面做得很好，太空的荒凉、无尽、渺茫表现得很好，蓝光紫光绿光红光，交错覆盖在星球上，星球上的冷光再打在人物脸上。真的拍出了一个星球存在在冷冰冰的太空里，没有空间时间的感觉。音乐也很好。浪费了这些画面了。Brad Pitt还蛮不错的，难得不耍帅，他最后看起来年轻了一点原来不是我的错觉。
明安,看过,还行,2019-09-24 16:22:56,11,人情味太浓了，都进太空了还寻什么亲，跟恒星一起在宇宙中航行就够了。
Favillae,看过,还行,2019-12-06 20:05:46,4,真正与片名ad astra相配的是罗伊的父亲，一生都在航向群星未知深处的征途中，隔断与地球的一切联系也毫不care这种世俗的联系，矢志不渝，纵然折戟沉沙，也从未想掉头转向回到来处，一个没有家园的永恒的孤独行者，也必然死于途中，这符合从古至今那些狂热的探险先驱，总想走得更远，再远，没有他们人类不可能跨海飞天。不承认罗伊对父亲的论断，因为意识到虚无而无视眼前的美丽云云。罗伊很明显是父亲精神的囚虏，从未在地球上体味到归宿感，他是格格不入的，与周遭是割裂的，他的跨越太阳系之旅与其说寻父，不如说寻己，但最终在海王星他却突然找到了归宿——地球，平庸到令人郁闷的结尾。要是结尾安排罗伊接替父亲走下去，向太阳系外出发，进入无垠的深空，我就打五星。
✘.,看过,推荐,2019-10-05 23:34:21,8,"一直认为格雷是科波拉接班人，期待会是太空版的《现代》。经历补拍重剪难免担忧，不是每个导演都能像维伦纽瓦，能够把作者性与商业性共存。
格雷的作品一向具有上世纪好莱坞电影的古典味道，他的叙事、镜头与打光沉稳而且实在。《星》依旧是那样的电影语言，这是格雷自己的作者商业电影。无论什么题材到了他手里，都离不开对血缘、个人情感归属的思索。
每一部作者电影有着它不同的质感和样子；很多作者导演们拍的始终是一部电影，然后观众选择去欣赏。
人类不管到了哪里，那里就会成为地球的模样，这种延续是件恶心的事。坠入深渊然后向往孤独，借向外探索之名，实则逃避，逃向内心深处，这不就是豆瓣用户么，大家都是缺觉的人。★★★★/8.1
一场与内心的较量，那里是最孤独的封闭空间。每年能醉在影院的影片不多，这是一部。★★★★/8.7"
xiaoxiongdi,看过,推荐,2019-10-11 17:53:03,6,内核很俗套，但这样的视听，很难不掉眼泪吧
比多,看过,推荐,2019-12-09 15:33:16,3,虽然满篇絮叨的独白，摄影也参考很多。但摄影、独白都和主题结合的不错。我尤其喜欢男主的厌倦感，即便最后回家了。这是用科幻外壳讲西方的老主题：弑父和归乡。皮特就是俄狄浦斯和奥德修斯的结合体，皮特的眼睛好透亮，颜色也好，比猫的眼睛还美。
盲忙,看过,推荐,2019-12-06 13:37:47,2,心理预期是完完全全的太空文艺片，没想到有多个场景相当残酷，比起漫威那些所谓的太空作战更加真实而震撼。皮特对着话筒和父亲的那番告白，绝对是今年最好的表演之一。如果是我，大概会让影片结束在返回舱里皮特的脸，以及外边的人伸出但没有被握住的手那一刻，但这样就变成了“就算征服了宇宙，但人还是一样的孤独“，这和格雷想要传递的“与其去远方化解孤独，不如握紧身边的人”相去甚远，可能相比于带着希望的格雷，我是一个彻头彻尾的悲观主义者吧。
荔枝超人,看过,推荐,2019-09-27 16:47:19,3,一部重点讲太空人心理状态和微妙情感的太空片水准之作，比Arrival还要Max Richter。甚至可以说本来就是给Max实验音乐拍的一部超长MV。
寒狐传媒,看过,推荐,2019-10-08 07:55:12,3,3.5星。当一束光扫过皮特的脸庞。 精灵公主加0.5星。《真·爸爸去哪儿》
viennavirus,看过,还行,2019-12-06 12:54:43,2,寻找父亲，杀死他，努力摆脱成为他的命运；凡人来到所能及最遥远的宇宙，却依然是愚不可及的凡人，所以还是要回到地球——真是这个太空电影大年最沮丧的结尾。那些一惊一乍的动作场面，可能是为了避免观众陷入深度睡眠所做出的尝试。
Virgil,看过,推荐,2019-09-30 03:44:24,8,"20191206 广州北京路飞扬 三刷 | 20191026 @ Premiere Elements 二刷。Still so good. 补了一刷错过的细节。今年最喜欢的新片之一，国内定档会考虑三刷。这种完全不需从科学角度考虑是否严谨，重点全在探究人类心灵的太空片最棒了——讨论严谨与否会毁掉所有情调，因为我毫不欣赏科学 | 一刷 @ Формула Кино Галерея / Formula Kino / Ligovskiy Avenue, 30, St. Petersburg."
Helicopter,看过,2019-09-21 15:27:39, ,5,睡过...😅😴
kakakarl,看过,还行,2019-12-04 16:24:36,5,可能是隔着头盔的声音设计的原因，一直有种闷闷的感觉，加上节奏缓慢和剧情渲染出的太空孤独感，显得格外沉闷。偏执的父亲在想啥呢？你连太阳系都没离开，找啥地外生命？导演在想啥？怎么能把科幻片拍得这么无趣…
朴不程,看过,推荐,2019-12-07 14:56:25,2,面对无垠浩瀚的太空，一段外太空寻亲之旅，终归面对的是整个人类极大的局限，人类之渺小与浩瀚宇宙之间永恒的虚无感。按格局，大有银翼杀手的2001太空漫游的质感，视听语言极佳。故事性太弱，叙事镜头深沉而冗长，点到为止，甚至令人有闷睡感。一条寻亲线而已，这片子更像是科幻小段，情感上是不受迷影所爱的，说到底还是孤独。我个人很喜欢里面的太空布景，有种静谧的美。7.7
海樹,看过,力荐,2019-12-07 02:48:11,4,故事核心不值一提，稍微改改放到大航海时代立刻就能拍…商业点不就是加勒比海盗了文艺点也可以是高更儿子找爸爸…反正就是个男人死也不想回家引发的故事（这个时候应该给老爸看三体），立不住的地方虽多，但架不住影片实在太美，看imax简直拯救了我对电影的失望，何况三层楼高的皮特脸不知道得让多少人分泌催产素（词出死亡搁浅）。而且全程紧张刺激扣人心弦豪无尿点，我是不能理解这片子哪里闷了（什么你说因为皮特独白多所以这是个文艺片？），重点是配乐好得不行，太飞太鸡血了，音乐和音效我给12/10分。说起来该片摄影师合作的导演都音乐品味斐然，羡慕
zzy花岗岩,看过,力荐,2019-12-05 21:08:44,10,皮特献出目前今年我最喜欢的表演之一~
王写写,看过,推荐,2019-12-05 15:43:36,4,4.5。看完这个，几乎就忘了今年其他科幻片了，总感觉跟神枪手之死很像。不过还是离伟大差了一步。
小水,看过,还行,2019-12-09 23:38:33,2,星际探索讲的是，人心的距离比从地球到海王星的距离更遥远。
Derridager,看过,较差,2019-12-06 17:50:13,5,无法理解这部mongrel film的存在。
