用户,是否看过,评分,评论时间,有用数,评论
下克上,看过,推荐,2019-05-26 02:01:12,197,十分大胆的美术风格。可惜摊上一个俗套到无以复加的剧本，挺好奇为什么请得起这么好的作画这么好的配乐却搞不出一个合格的剧本呢。离完美只差一步。
夏南,看过,推荐,2019-07-02 22:16:00,72,绝了 竟然是这样的动画电影？脑洞太大了 审美真的很好 空间设计绝了
同志亦凡人中文站,看过,推荐,2019-11-30 12:33:30,51,粉红爽片，又热血又燃还有点二，配音全是扛把子。机甲战士的冰与火之歌，俩男主在决战中接吻…人干事？
Joywhen,看过,力荐,2019-08-16 19:51:49,241,真男人就是钻穿地心也要救心爱的男人！
WeirdFishes,看过,力荐,2019-05-27 00:09:11,168,在“高考誓师一百天”下面当堂炸成一朵烟花，然后世界随之毁灭……是我儿时浪漫的梦想之一（
橘 きよあき,看过,力荐,2019-05-25 21:39:35,117,炸裂。奢华的金田流作画狂欢、各处被大量运用的雅致凌厉的正三角几何体、奇想天外的跳脱电波系调色、轻松抹去2D与3D界限的无线条平涂、澤野弘之近乎原始神明崇拜的凄厉配乐，均使这部片的时髦值和冲击力达到了Trigger史上的新高度。剧情虽则与KLK之类一样，荤腥夸张到孩子气的程度，但也偶尔有平静节制、堪称隽永的时刻，我满足了……
钉宫党的胜利,看过,还行,2019-05-26 20:15:27,71,看前面和后半部分的时候我看得快睡着了。整体故事展开飞快，就像把一整季的故事都塞进一部动画电影里了一样。讲实话剧本没有任何新意，套路的故事套路的人设。主人公的热血笨蛋人设，不知道是文艺复兴还是为什么，但怎么看都有些过时了。演出依然酷炫爽快，不过分镜切地太快，加之我坐在前排，眼睛没有跟上。而且总体来讲，对今石洋之的片子看得太多，实在审美疲劳，导致打斗的时候昏昏欲睡。亮点是最后男主男二的深深一吻，这对cp糖我表示我吃，也算是为数不多我喜欢的亮点。总体来讲风格依然独特，但放在今石洋之的片子里没有什么亮点。对没怎么接触过今石洋之的人来说不错，对老观众就差口气了。
说了我是黑无常,看过,推荐,2019-06-06 06:19:25,39,大型兴奋剂现场，偶有安静的文戏我才发现自己在耳鸣。没结束就想二刷，但我真的买不起第二张票了，有大拿安排一下SFC上影一号厅吗？PS. 悠长的人工呼吸坦荡得我没话说，从虚耗中睁开眼的リオ根本火之睡美人，按头卸下巴吃CP，全场一片死寂，可以。19.6.5 @东京TOHO Cinemas上野店
xxxOASIS,看过,力荐,2019-05-23 21:25:04,80,脚本继承天元突破和KLK的衣钵、尤其是角色原案几乎照搬天元突破。trigger这几年来的画面实验加上流行的motion graphic设计风格等等取百家之长酝酿出新时代动画表现手法。虽然机体设计并没有突破前两部的框架（本身今石可能也不在意做萝卜），但是这个炒冷饭和自我抄袭真厉害👍缺点是电影篇幅太短，剧本的反转表现力差了很多。ps：1.见面会的佐倉小姐为什么可以这！么！好！看！2.リオン为什么这！么！可！爱！（香草）2.雅人叔声音定番出戏。3.本质基番，Garo给Lion人工呼吸放了一分钟。
桃桃林林,看过,推荐,2020-02-09 16:50:20,16,画风太强
morning,看过,推荐,2019-05-26 19:39:45,21,松山健一和早乙女太一和雅人叔都配得太好了吧……！
德卡的羊,看过,推荐,2020-02-06 20:30:45,10,82/100，我的天，这是啥爽翻的东西啊？几何大色块满天飞，二维+三维结合的作画炫到爆炸，醒目的风格让人过目难忘。内容老套了一点，110分钟对这种题材和故事有些太长了（反之也可以说故事太简单）。但不管怎样，TRIGGER和今石洋之让人疯狂！
Rhodesia,看过,还行,2019-08-18 19:04:13,33,不适的点太多了，说实在的我宁可去看蜘蛛侠…听出了雅人叔的破锣嗓子我就没入过戏了，虽然个人最大亮点是江户盗贼团组合作为皮下重出江湖哈
徐若风,看过,推荐,2020-02-27 16:40:19,5,没想到最后是“真·燃烧小宇宙大电影”，官方逼死同人。二维/三维×CG/手绘之间的异质拼贴，荧光色系的大幅碰撞，以及高速率的分镜与配乐，整体完成得非常融洽，在视听层面上绝对是去年做得最好的日本动画片，甚至可以说远远超过第二位的《天气之子》《海兽之子》一大截。但故事太遗憾，几乎成为呈现视听的辅助品，为了燃而燃，也没有其他东西，虽然表面上是写了个起承转合，但其实又一直处在一个层面上打转，冗杂的元素都很老套，这也是为什么越到后面越觉得“燃得很平”。
godannar,看过,推荐,2020-02-10 23:00:48,5,实事求是，PROMARE的问题只有一个，但也致命：他明显是由一个更加十分明显大大大的原案压缩而成的。为了保全最后的决战，观众可能不得不忍受作者在电影前三分之二「左手喂你吃一颗葡萄，右手丢出去一串葡萄」的奢侈行径。不过，在某种精神状态下，即使是那被舍弃的部分最终也可以汇合成为一个伟大的绵延体验，现在我想记录的只是这个。
一,看过,推荐,2019-05-26 19:38:29,4,🐔劳紫拯救一切！！！
昏睡红茶,看过,很差,2019-06-24 11:53:48,25,"这片主角才更像恐怖分子,反派才更像正义的一方"
冷凍トイレ,看过,还行,2019-05-29 22:16:28,17,"3.5剧情没意思，中间睡着了。"
灯塔守夜人,看过,力荐,2019-09-24 07:13:15,65,"动画两大帝国的美帝近几年无限将3D动画和特效像真实与现实推进，而日本代表队则又一次把动画与现实的距离拉开，将其打造成梦幻与理想的代名词。

这部动画的艺术表达太震撼了，在整体画风上做的减法通过光效effect和配色补足了视觉冲击。这种2d和3d的效果真的是我的奋斗目标了。科幻和日本传统文化的融合也很令人惊叹。但不得不说泽野弘之的配乐的确带感，但他个人风格太强好出戏啊。另一个出戏的点就是男主的中二癌了，每次他说出羞耻台词都会感叹，不愧是日本动画啊"
蓝调,看过,力荐,2019-05-26 01:11:39,64,棒，人设欺骗我感情画女硬说男٩(˃̶͈̀௰˂̶͈́)و
团小纸,看过,推荐,2020-02-23 22:33:57,0,扳机社和今石洋之奉上的好作品，不合理的透视、几何图形、夸张的配色造就了一部风格独特的作品，不变还是机甲的浪漫，但估计是成本受限，剧情还是弱，但动静相间，静的部分深度还是可以的。
不爱画画的人,看过,力荐,2019-05-26 22:00:23,49,5刷了，感慨看这片只有0遍和无数遍，居然播了5个月还没下线，我还想看！！！！太喜欢这个美术了，角色设计很棒，战斗也爽得一塌糊涂（重点是那么高的饱和度画面和那么频繁的打斗却没有让我感到疲劳……），剧情也是从头燃到尾，扳机社惯有的高潮后又高潮；泽野弘之的配乐也不错。故事算是讲得不错，就是堺雅人的配音中气不足又不符合年龄！绝叫都破音了惹。以为被基情海报骗进来要被喂BG了最后还是搞基，扳机社诚不负我。リオ可爱！！！！！
TwT,看过,力荐,2019-05-26 14:23:47,47,票房十五亿了普罗米亚天下第一。十二刷完了。我还能看五十遍。上次被技术甩脸还是看蜘蛛侠平行宇宙的时候，没有泪点，虽然有残酷表现不过总体还是能开开心心看完，全程震撼，太爽了。音乐和画面太酷炫了，之前对泽野审美疲劳不过这次泽野发挥超好。superfly的两首主题曲好神。也因为声优犹豫过不过声优很合适。剧情可以考据的细节也很多。剧本比隔壁天气之子强太多，我个人很爱中岛写的台词。lio可爱疯了。galolio天生一对。他们俩是命运啊？引进搞快点，全人类都应该看看promare
HC,看过,力荐,2019-05-26 21:28:06,43,堺雅人告诉你一个优秀的演员来搞配音也是风生水起，无所不能。Trigger粉必看。
那朵椰菜花,看过,较差,2019-08-19 14:28:08,7,畫風特別但說不上喜歡，激昂的音樂太吵，亂叫名雖然荒謬但還是中二了點。
悲欢离合变速箱,看过,还行,2019-09-26 21:38:54,13,抱着应该就是满分的期待去看，看完心情有些复杂。从画面和分镜的角度来看，的确是满分问之无愧！这是一部不去影院看会后悔的电影，特别喜欢中间有一段静音黑幕。但剧本的硬伤真的无法忽视，雅人叔的配音也构成了绝大败笔。我是那种即使是爆米花片也喜欢探讨人生深度的人，所以真的因人而异。
塔塔君Minkun,看过,还行,2020-02-06 00:37:33,7,懂了，即使今石洋之、中岛一基甚至泽野弘之再三板斧也好，扳机这群人做出的作品最大的优势是永远能为最传统otaku的部分套以崭新潮流的衣钵展现给世人，所以扳机片再老套也不缺新观众，此乃褒贬双重意味的新瓶装旧酒。倒是视觉效果，看着看着感觉真的有种在看纯正金田片的感觉（指闪瞎眼程度）。
哼哼.floweray,看过,推荐,2020-02-12 20:13:36,2,是男人就开扎古
Wallys,看过,还行,2019-08-22 18:51:53,5,幾何色塊的堅實，一種爽快對二元論的推翻，線條是為著事物和概念已經十分rigid的狀態而存在的，一切規則定義已述明而不可更動的世界裡，人們的作為還有什麼潛能能改變世界、動搖彼此呢？電影創造了的電車難題，跟它的世界一樣分明，乍看數字構成了人類，如線條為著形狀服務，但當你不斷放大裡頭事物，成了一種碎形，這時問題已經有了答案，指向那個一致的對。當事情的對錯涇渭分明時，世界卻為自己的消極更行辯護，陷入更大的漠然，你，一個人，仍能夠堅持嗎？放大這些看似分明的「水火不容」，每個人為固著的overvalued ideas各擁其主到真的無法溝通嗎？當無法愛人的惡是如此明顯，不是正逼迫人們該選擇站在對的位置上？冷調的火，熱血的救火者，在愛與同理的神經元單位上一致，火刷上了溫柔色彩，救人的手心燃起了義憤，大膽地轉換成同義詞。
大草,看过,力荐,2019-05-29 23:41:01,19,我师父堺雅人宇宙第一
事務局長,看过,力荐,2019-05-28 17:33:07,10,リオ好美
Suito,看过,较差,2020-02-10 19:26:36,6,别说剧情了，这片就算是作画都没什么好吹的，而且整体的效果为了追求时髦毫无视觉冲击可言，从头到尾的紫色基调5分钟就审美疲劳了，简洁并不意味着毫无层次可言。恭喜今石洋之，你拍了一部trash
托纳里诺阿欧,看过,力荐,2019-05-27 15:33:39,3,虽然觉得剧情实在有点赶，黑幕暴露得有点快，但是这消防片犹如炎炎夏天，艳阳高照底下畅饮雪碧，然后大口嚼着冰块的爽快。美术风格简直满分，在萝卜片的动作场面中还能让人有空感慨机械线条的漂亮！！松山健一和早乙女太一基本及格，虽然音量上还是短板，堺雅人要鼓个掌，在自身声线的局限下还能掌控这个角色！リオ真是太好用了~
一曲吟逍,看过,力荐,2019-05-27 22:42:32,8,剧情并不复杂，但是很紧凑。打斗制作很独特，实现了很多的“只有动画能做到的视觉效果”，这一点非常了不起。。男主（加洛）和男二（利奥。没错，黑衣黄绿色头发的利奥是男二号，看起来女生身材、女生长相、女生发型，但是是男的）竟然有吻戏。（2019年5月27日观影于上野）
野乃花,看过,还行,2019-09-22 23:07:05,10,"這是我在別的地方看到的影評：「普羅米亞就像是在一部有24集的動畫中挑出1、12、24集來看。」
故事框架、起承轉合都有了，但是在節奏的掌握、情緒的渲染的方面都不到位，整部電影在劇情部分就是一個字：「趕」。
不過美術和配樂都很棒，配色鮮豔卻不刺眼，而澤野大神的音樂是無庸置疑的好聽。"
水脉,看过,推荐,2020-02-22 10:11:49,0,画风很拽呀，机甲打斗和肉搏都挺好看的，但是不太喜欢嗑药一样的满屏炫彩几何图形，人物的性格塑造也有一点类型化。想象力超棒，尤其喜欢那个司令的高空全玻璃办公室，估计是无数观众都幻想过的住所。故事设定很贴合现实了，现在地球处处灾害和瘟疫横行，有限的资源和无限的贪欲让人类再一次走到了战争的边缘。近几年大部分展望地球未来的科幻作品都在探索移民外星的方式，这样在十年前看起来是异想天开的想法，有可能成为人类唯一的出路，难以置信
小油飞,看过,还行,2019-09-20 12:28:12,4,属于剧情是啥能吃吗那种，不要带脑子去看，后半彻底放飞还是很带感的。每次冒出新的过于随意的中二设定都是全场爆笑。急救那一下更是全场尖叫鼓掌，没想到美国肥宅也很懂嘛！
ohanaaa,看过,推荐,2019-05-25 20:32:55,2,3D相机的运用令人瞠目结舌，可以说是艺术了！所有人散场第一句都是「カメラやばくない？」标准的今石洋之式分镜，剧情老套又怎么样呢，爽就得了【。单看画面想给10颗星，但明星当声优真的不是一般出戏，真女主怎么看怎么是内山昂辉脸啊（
望远镜,看过,力荐,2019-11-02 07:52:42,4,非常简单粗暴富有今石洋之个人特色的燃片爽片，色彩设计炫目，运用几何色块来表现火焰特效这点也很时髦。2D作画和3DCG的融合非常好，天马行空的打斗分镜配上泽野巨神的配乐简直high爆，处处有好莱坞大片的既视感，摆Pose和大声喊出招式名字的时候依旧是老一代日漫那个味儿。剧情发展倒还挺好猜的，双男主CP好磕，阴谋曝光之后的剧情一度联想到流浪地球，只是最后的解决方式有些意想不到，怎么突然就SF了呢
太阳的倒影,看过,还行,2020-02-14 12:21:17,2,今石风格的一次总结与升级，更加频繁和复杂的镜头旋转，广角，跳剪，字体；LOWPOLY结合色彩更玩得出花。按理说视觉风格化程度本来是比蜘蛛侠平行宇宙要高的，但脚本并没有升华视觉表现，反而图填了不少蠢和疲劳感，令视觉表现全然达不到平行宇宙的那种感染力。音乐也是，单看视觉设计，会觉得普罗米亚更酷，但结合音乐，剪辑，无疑是平行宇宙拥有更酷的感受，普罗米亚这种战斗高潮突然来个慢半拍的主题曲把节奏往下一拉真是让人瞬间痿掉...种种不相契合的地方导致，看整部动画的感受，还不如看片段；因为在片段里看不到那些不和谐的元素，从整体上说反而观感更好。
亘亘LOOK,看过,力荐,2019-10-12 14:17:54,3,燃啊阿啊阿啊阿啊全程热血。话说为什么男主们半裸，没有get到。
澳大利亚喂袋鼠,看过,力荐,2019-12-05 06:13:02,5,嗷嗷我看了个啥？！本来是正常的日本sf轻小说然后是脆皮鸭然后是反歧视然后是神展开星际穿越？反派是堺雅人配的wsl。当然最值得称赞的是一吻定情和数字时代色彩展示，赛璐璐和张艺谋式色彩美学彻底被打入历史。我吹爆！London Stratford Westfield VUE商业上映中观看，英国腐女太多惹！
小爱,看过,力荐,2020-02-06 19:35:15,3,8.5分。脚本傻得可爱，说是从哪个少年漫编辑办公桌顺手摸来的我都信。整体色彩又莹又亮够迷幻，救火兼打架的画面和分镜炸裂得一塌糊涂，用碎片分层次制作火焰甚至阳光的效果太喜欢！今石洋之正经玩起未来感十足的影像果然牛逼，太到位了。跪求国内引进，三刷起步。
[Deleted],看过,较差,2019-09-18 13:00:44,5,为什么反派会是Allmight英雄的形象？通篇战斗集锦拯救地球的目的是为了反之塑造火族英雄的形象吗？并没有建立的英雄，让冰火蓝粉色仅仅是强烈的视觉奇观
路西法尔,看过,还行,2020-02-06 14:28:57,3,这不就是天元……
Fernan,看过,力荐,2019-12-03 21:01:42,5,“burnish的火焰，是自由的火焰。”作画分镜震撼你妈 不多说了BD买起
K,看过,力荐,2019-10-27 19:40:49,1,爽！就是靠气势硬干！唯一的缺点就是帧数似乎不够。
Kappa,看过,力荐,2019-05-31 12:10:52,5,炸裂！！！！视觉毒药送您上天。
张华弥,看过,较差,2020-03-01 01:31:55,1,最后十分钟值两星。视觉创意很好，其它元素审美疲劳。
GIVIND,看过,力荐,2020-02-17 11:16:35,3,画风燃爆了！！！时尚度中二魂满级，动作酣畅淋漓，剧作提取了当下流行科幻概念的精华(虽然<三体>老生常谈但次元跃迁部分第一时间想到的还是<三体>)，总之超高完成度了！(居然还暗戳戳满足了一下广大腐女的幻想) // PS. (总有错觉是Splatoon巨型机械化，任天堂或成最大赢家？！)
Rembrandt,看过,还行,2020-02-09 20:51:36,3,同质化角色太多了，主角卡米那，女主阳子，辅助蛇崩乃音，又又又又上钻头的那一刻不免有消费情感之嫌(该叫还是叫了的)……建模全景展示的环绕镜头也过于多了，大量平涂、运动切分和流体三角等视觉创意都掩盖不了镜语的乏味。至于剧作，把故事讲完整了就行今石监督的咱不挑。
-GreenCui-,看过,还行,2020-02-06 20:07:39,7,真是无聊到一眼就能望到头的故事，剧作漏洞太多了，核心创意还有盗用《炎炎》的丑闻。机甲战斗 色块风格 字体运用 男主人设，视觉上与其说是“今石洋之特色”不如说是他最出色几部作品的元素大杂烩，只有少数几个分镜能让人勉强打起精神。泽野弘之的配乐也是越听越无聊，日本薛之谦是你吗？吃安利小tips：永远不要相信你首页平面装饰美术从业者的电影品味。
✘.,看过,还行,2020-02-11 22:40:20,3,色彩超炫，3D加手绘，有《平行宇宙》的惊喜。致命伤是画面完全扁平化就没有了视觉中心，一到打斗部分就花得不行，风格化玩脱了都忘了自己在做电影。★★★☆/7
染|SEN,看过,较差,2019-10-14 15:24:44,4,画面绚丽的英雄打坏人片
やす,看过,力荐,2019-09-25 10:33:48,3,堺雅人承包我从头到尾的笑点（道理我都懂为什么他要换10条声线
虫旁解虫,看过,还行,2019-09-20 13:24:07,3,音乐铺太满，无脑燃太久也很累。美学满分，色彩搭配几何图案构图眼花缭乱非常过瘾。吻戏猝不及防，全场欢呼鼓掌。
有寂,看过,还行,2020-02-17 20:07:33,1,双斩少女和吊袜带天使的无限重复，难道希德尼娅的骑士是最后的史诗萝卜吗
ChingYew,看过,力荐,2019-09-25 09:30:41,2,这种美术风格也太赞了吧，剧情也很完整，太适合青少年了！
晴蘭,看过,推荐,2019-06-04 23:18:56,6,独特的美术风格和带感的表现形式，加上泽野大神的音乐，可以称得上是动画界的艺术品了。雅人叔的声音辨识度好高，意外地和他配音的角色很搭。真CP其实是男主男二，一个吻拯救了地球。
西卡里奥,看过,还行,2020-02-16 17:40:18,1,正角反写的开场十分别致，有着x战警的类似文本。高强度的视觉线条色彩对撞，作画风格（取消背景虚化，让前后景一样清楚；镜头环顾的三维动画）使空间时而扁平化时而立体化，当线条流动与镜头设计的运动组合出现时，会让作品处在一种“不断燃烧炸裂”的过程中，而这也刚好与其中的热血中二有了共通。
kylegun,看过,力荐,2020-02-21 16:04:37,0,财阀军管近未来城变种人清洗利用，异次元火焰生命共振能量穿越技术，农地沙土化挖地取水行星改造机甲大战古早味救火机甲，就是结局什么水火之魂巨大化燃尽太阳系啥的太套路凑合了点，其他都蛮精彩有趣，画面元素纷杂得快把人闪瞎掉
红楼白衣,看过,还行,2020-02-11 11:52:53,2,“只会拍天元突破的今石洋之”。trigger和今石再这么止步不前下去，我都想期待一下“树挪死人挪活”的鬼话了。
血源2出了吗？,看过,力荐,2020-02-15 00:06:13,1,1）一如既往的扳机燃！！！各种意义上的爆燃！！！2）扳机这次的作画风格完全是传统TV动画里的一次革新，有点儿low poly复兴的意思。3）与这次疫情颇有映照的，是本作里人类如何和突变的“自然（的自燃者）”相处、所谓异变者（Lio）和民间力量（Galo）如何对抗当局（当然这也是诸多番剧的最爱的主题）。
fire,看过,较差,2020-02-29 13:03:34,0,故事概念就很中二，全片都是浓浓的中二少年气息。拍得还行
思路乐,看过,力荐,2020-03-09 22:26:08,2,【A－】嗨疯了，真特么嗨疯了，这玩意实在是太对我胃口了。二维与三维的技术作画实在是震撼，无边界、无极限。碰撞拼贴的色块，只存在于动画载体的炫酷运镜，都汇聚成艺术表达的冲击波，将文本上那些令人反感的中二燃烧殆尽。但另一方面，这种扎根于本土中二文化下的东西却又能反哺那些绚丽的作画艺术，将其与现实的距离进一步拉大，在艺术表达上建构出真正纯粹的梦幻空间，只属于日本动画的影像奇观。
黑衣,看过,力荐,2019-05-30 10:46:04,2,新感线剧团和准团员猛刷大屏，新感线式口上，歌舞伎见得，身为一个舞台剧粉，歌舞伎粉，配音演员粉，动画粉，一部片子满足次元交汇哈哈哈
jj73浅之,看过,还行,2020-02-25 22:37:49,0,中二热血机甲少年漫的剧情把老阿姨轰炸得好累哦哈哈哈哈。画风特别，棱角分明的几何体、街头涂鸦式撞色配色、像半成品一般的极简背景增强了未来感，动作场面眼花缭乱的分镜也几乎在炫技了，不愧是跟过庵野秀明和渡边信一郎的人。堺雅人咆哮的声音也太好认了
半拉西瓜,看过,还行,2020-03-07 13:51:19,0,五分制不好细化，整体推荐一波，毕竟除了画面之外还有泽野弘之的原声，但我还是要喊出来，普罗米亚跟天元突破比起来，差一百个卡米那大哥
灰色幽默,看过,较差,2020-02-09 13:48:26,2,中二版的……冰与火之歌？
ANDERSEN,看过,力荐,2019-05-26 15:40:30,7,虽老套，但还是好看，cp我吃了
有心打扰,看过,力荐,2020-02-14 20:05:09,1,啊！啊！啊！卧槽！卧槽卧槽！！全程抖腿！！这画面这剧情这配乐，太燃了！！我的中二魂要燃炸了！！最后...最后...竟然...我竟然被甜到了？！！这怎么回事？！！
多不利登,看过,较差,2020-02-13 11:15:00,0,2020021 二星还行。为什么总有一种既视感。太重复自我了？
美人長命,看过,较差,2020-02-06 07:29:38,1,好失望。看睡着两次，生物钟杀手！建议正在调整作息的人别在清醒时间看。
某J。624,看过,推荐,2020-02-16 02:19:23,0,除了剧本没什么可挑剔的，画风和音乐真的酷炫，松山研一vs早乙女太一vs雅人叔配音一本满足，虽然故事没新意，但上次见到如此绝美的W式爱情还是风都的侦探和他同体的卡面来打。最大的两个彩蛋：日系文化梗，以及当年「江户盗贼团·双雄」终于一吻定情了。
SquareOfSlow,看过,力荐,2020-02-15 00:35:53,0,帅炸燃爆爽上天，时髦度过高，无fuck说，trigger牛批！
弥赛亚代言人,看过,力荐,2020-02-07 23:08:02,2,一个关于OMEGA级变种人大战高达然后双方合体对战超级高达的故事。片子的作画和节奏炸裂到无以言表，属于那种“在观影过程里完全没有时间和精力去思考后期凌乱的剧情和不够饱满的世界观设定只能跟着电影叙事中二之魂爆燃两小时”的炸，在临近复工的时节能等到这么一部爽片，整个人都精神了一点儿呢！
iriselite,看过,推荐,2020-02-11 00:37:22,0,制作精良，画风独特，有别于一般的日本动画。一开始便是节奏紧凑，机甲打斗场面激烈，故事及画风借鉴了《蜘蛛侠·平行宇宙》。越看越燃，很过瘾。
Lycidas,看过,还行,2020-02-10 04:44:28,0,3.5 堺桑说话声音好好认啊，特别画外音的时候就是一个古美门非常出戏。演出真强，纷繁色彩和几何图形构筑起极平面又极立体的神奇感受，每分钟都在脑子里炸烟花，想大银幕看爽个够。画风人设故事和受歧视族群反压迫的主题都谜之上世纪九十年代，真·文艺复兴，泽野的配乐也太吃老本了吧……
comple,看过,力荐,2019-12-09 09:52:07,3,牛逼，看傻了，十年前在电影院看天元突破大概就是这种感觉吧
Tod,看过,力荐,2019-10-22 02:56:34,5,扳机社是神，今石洋之是神！大哥开鹤望兰！！我的burning soul是突破天际的！天元突破的影子随处可见！最后看到摩纱雪的名字，galo和lio的姿势太飞跃巅峰了！！作画超神，艺术风格超神！真实看哭！同场老外不断尖叫呐喊！真的太好看了
