用户,是否看过,评分,评论时间,有用数,评论
路人廿五,看过,推荐,2020-02-20 00:01:15,0,标准的今石洋之片，剧情一团糟，全凭冲击力撑起全篇，但是谁叫trigger粉普遍就好傻燃这一口呢？全片一眼能看到天元突破，双斩，franxx，ssss gridman的种种既视感，虽然3D的两场打斗比较惊艳，但是分镜的交待还是比较考验观众的空间想象力。作画精细程度在历代作品中算中等，感觉和黑岩一个水平。后期有一段冲击力也略显匮乏。泽野弘之的输出一如既往的宏大与悠长。反派的配音明显能量不足，结果ed一看竟然是雅人叔，只能说是术业有专攻了。
有过的L和KA,看过,推荐,2020-02-10 22:17:38,1,毁灭一次地球，释放燃烧之魂。艾娜作为女主实惨，一片绿。基本就是无脑的剧情，看的很放松。
子夜,看过,还行,2020-02-22 22:24:40,0,捂着被桃红柳绿荧光紫闪瞎了的眼睛来打字，强烈谴责画师们自己画得兴致勃勃然而丝毫不考虑观众能不能看明白的动作分镜，还有那中二的人设、贫瘠的剧本外加95%的时间里都漂浮在剧情之外的不知所云的配乐，嗯，这就是普罗米亚。
Doublebitch,看过,力荐,2020-03-09 10:37:41,0,今石洋之永远是你大爷
yy,看过,2019-10-09 13:33:13, ,0,虽然情节不是我的菜 但是色彩太美了。。
请保持高冷,看过,推荐,2020-02-24 16:13:19,0,这个画风我喜欢
许大海,看过,推荐,2020-02-13 19:56:13,1,太今石洋之了，我永远都吃这一套
show,看过,还行,2020-02-11 00:21:15,0,低像素虎兔感。人工呼吸抢救好评。人设很虎兔，故事很漫威，画风不太喜欢，不过这个肯定会有很多本子吧嘻嘻。
梦之安魂曲,看过,还行,2020-03-01 13:38:32,0,虽然很燃，很热血。但本身就不喜欢机甲一类的我再加上这种画风以及突出的色彩显得花里胡哨的，反而让我更加不喜欢。以致于中间有一段看到打瞌睡了。歌曲倒还不错。
口木君,看过,力荐,2020-02-08 12:32:41,0,加洛和艾娜钻头既视感好强。时尚又自由，淋漓尽致的热情。亲吻传火的画面太美了，黑白的世界和跃动的火焰。
麻非,看过,推荐,2020-02-10 16:14:07,0,是爱情（2019-08-03想看）
咸菜帮老大,看过,还行,2019-10-06 02:23:32,1,给我燃睡着了。还有，两个人人工呼吸需要这样放一年吗？
乔京,看过,还行,2020-02-25 23:28:29,0,今石的华丽视觉，泽野的恢宏配乐，扳机社的优良制作，相比之下剧情倒是拖了后腿。リオ的人设和声优太可以了，美人啊美人
簏眯矽汼,看过,力荐,2020-02-15 01:26:05,0,狂气肆意张扬，简直就是一场视觉的冲击，剧情和表现力还是天元突破那套，不过看得真的很过瘾！！！
静静的投资,看过,还行,2020-02-07 00:24:51,1,教科书级别分镜，但是砸在剧本上，再加上天元突破型的分镜运用过多，导致成了教科书而不是电影动画。没看过天元的观众会觉得，卧槽这么牛逼，但看过的观众只对剧情创新有兴趣，剧情没兴趣的情况下，只能比较这处分镜很天元，那处分镜很斩服…
爱影,看过,还行,2020-02-29 10:23:31,0,冰火一家人
𝚁𝚊𝚔𝚞𝚢𝚘𝚞,看过,力荐,2020-02-20 23:56:53,0,啊啊啊啊啊啊啊啊啊啊啊啊太爽了！点燃了我的中二之魂！这个画风这个制作真的是赞爆！配乐也燃的一批！情节也深得我心！太！好！看！了！
吃盆折耳根,看过,力荐,2020-02-10 05:42:35,0,中二满满，绚丽的电子毒品。越来越喜欢今石洋之了。
Kinyuan,看过,还行,2020-02-07 00:24:59,1,失望，今石洋之的风格也遭不住充满陈词滥调的剧本，看了一半不想看了。没有爽到想要像《蜘蛛侠：平行宇宙》一样原谅故事。剧情两星，作画四星。
乍暖,看过,推荐,2020-02-10 08:36:33,2,7/10。有《吊带袜天使》那味了，这才是蜘蛛侠平行宇宙的正确打开方式。卖腐的尺度刚刚好，就是后半段莫名其妙的救世主模式太中二了。不满意反派的设置和配音。
海星,看过,力荐,2019-05-24 21:29:06,2,年度最佳爽片。机甲、合体、人造都市、宇宙船、钻头、地球危机。
quriola,看过,力荐,2019-12-19 03:19:50,0,画风音乐好赞！剧情非常燃又中二，看得好欢乐！leo人设不错
