用户,是否看过,评分,评论时间,有用数,评论
陸灯3396815,看过,较差,2019-10-30 11:18:58,1,太差，说实话，有一星是给两个女王的，一个女王漂亮却无脑，只会愤怒，一不留神，乌鸡变凤凰了。另一个女王，又美又有勇有谋，却因为敌众我寡，可惜败北。难道女人就只能美美的无脑的，才对吗？让这无脑的剧情气坏了。
栗色雪,看过,还行,2019-10-30 01:01:54,0,朱莉颜值还能再打一百年。
Jin Unrated,看过,较差,2020-01-06 03:21:11,0,cheekbones competition 又一部把人类比作蝗虫的电影 😆
龙皇,看过,还行,2020-01-31 16:52:28,0,论门当户对的重要性，女人狠起来更可怕。范宁眉毛太强硬，嘴角往下，不好看。黑暗仙子怕铁，可以理解成鸟类怕人类的子弹；王后对摩尔王国的侵略，可以理解成城市对原野的扩张。
m89,看过,还行,2019-11-27 13:59:38,0,沉睡魔咒之黑凤凰。强行大团圆结局，帝国主义的恶臭。
草原上的马,看过,很差,2019-10-18 19:32:19,3,浪费了我差不多一个小时的时间，想骂人
旧书君,看过,还行,2019-10-29 10:18:31,0,第二部引入暗夜族土著我还挺意外，海上窠臼的奇观也赏心悦目，但是目的性就是为了强行大战嘛。战后一秒钟迅速和好，迅速结婚，迅速呼唤和平呼唤爱。我真的服迪爸爸（不）。朱莉还是你朱莉，S-L-A-Y。以及王子换人颜值跌爆，还是大少美。
dum没头脑,看过,很差,2019-10-25 16:01:07,0,这个剧情狗血的像屎...
爱之深,看过,还行,2019-11-02 01:16:53,1,洗白了反派人物，对于最狠毒的人的结局处理还是比较温和的。公主有点太过圣母了，不知道如果电影以小孩为主体受众，灌输这种圣母精神是不是一件好事。
等着风的四叶草,看过,较差,2019-10-31 14:53:02,2,公主是有史以来最没大脑➕白痴的公主。完全不带脑子，全程看的憋气分分钟气到死，好几次打算弃影离开了，可念着连续上了八天班和在路上的一个小时忍住没走……懦弱王子还有野心家肮脏心得王子亲妈这里竟是些什么人啊，没一个人智商在线，批评迪士尼这部太差。以前崇尚的童话里才有的人间真善美，勇敢都哪去了。还是回来造梦吧，这样的黑化接受不了。
克拉許crash,看过,还行,2019-10-22 23:50:25,0,公主！你懂个屁咧，懂的话，就不会怀疑我！Sorry都不见你说一句！哪个白目编剧编的，还要我帮你挡一箭。只有人类的世界才有这么蠢的公主，白羊你了。（迪斯尼果然惯性宠坏公主教坏孩子不负责，我觉得不适合小孩子看啦，你以为人死后真的能复生咩？）
甦醒 Nostalgia,看过,很差,2020-01-05 14:31:56,0,这种华丽且傻逼的电影给大人看幼稚，给小孩看限制想象力，迪士尼在真人魔幻的道路上越走越找不准定位
芥末蘸酱,看过,很差,2019-10-20 13:41:40,1,迪士尼邀请大家去城堡做客，却把象征着童真和善良的精灵们杀死在城堡里，自黑起来也是够猛的。再就是最后一秒串戏到黑凤凰，你串啥不好啊非要串黑凤凰，你不扑谁扑。
jakefang,看过,还行,2019-10-20 23:50:24,1,迪士尼最怂公主减一星。迪士尼最蠢王子减一星。
斯宾诺莎的镜片,看过,较差,2020-01-01 18:27:19,1,失败的续作。从主题到节奏。
早見 英,看过,还行,2019-10-19 19:25:31,1,"草丛中的精灵，空中岛屿，魔法巫术。迪士尼擅长的造梦，造美。
婚礼鸿门宴，杀意长乐宫。童话故事，真讽刺，其实也一个比一个黑。给小孩子看，确实不太适合，但他们也有能洞悉阴谋的必要。其实相安无事的最好方法还是筑起高墙。而不挺身斗争，权利也无法得到保障。
这一切你都似曾相识，对吗。
可这是童话，人类是坏的。
不要相信他们。"
CyberKnight电子骑士,看过,较差,2020-01-11 13:55:35,1,画面确实好看，迪粑粑有钱嘛。鸟人的部分都有点尬，分分钟穿越到阿凡达。朱莉女王和菲弗王后气场都很强，其他人智商都不在线。整个故事太乏味太PC，刚刚血肉相搏忽然就改婚礼现场了，大家还相逢一笑泯恩仇……我可去它的吧！
妍春,看过,很差,2019-10-22 22:17:04,2,恭喜圣母片喜提新成员！欧美的全面圣母化似已不可避免，“(生于忧患)死于安乐”不吾欺也。这部片子同时也是编剧干预严重的一则例子。MichellePfeiffer凭借非凡演绎功力将一个无逻辑角色强行拉上轨道（牛逼），公主角色的圣母属性则贯穿始终（现实人设就这样么？），切瓦特的加入不过是逆向放大了公主的“理念优越性”，杀精灵要弹琴要磨蹭要艺术化印证了弹幕理论“反派死于话多”，树树挡枪简直如编剧窜入屏幕疾呼“快保护圣母！”，叛逃精灵在心里转变零描写的情况下反水洗白……如此如此，不一而足。如果朱莉没有自带气场，恐怕也不过是编剧的一个工具。
琧婯,看过,很差,2020-01-02 00:33:22,0,真的不知所谓的电影。。。
Niqa,看过,还行,2020-02-24 11:55:48,0,主线基本上就是前期鸡飞狗跳后期大团圆的家庭伦理剧了。故事设定真的想一出是一出哎。Maleficent 的几个造型不错
超人叔叔,看过,还行,2019-10-20 20:30:05,0,哇 米歇尔·菲佛vs安吉丽娜·朱莉！核心是比谁更傻 迪士尼真的爱独占满屏画幅 IMAX23
沙加之伦,看过,推荐,2020-01-05 15:37:44,0,范宁妹妹真是太可爱了~国王和王子跟俩傻子一样全程懵逼╮(╯_╰)╭
Dita,看过,还行,2019-10-18 18:20:21,2,朱莉美艳不可方物，依然是那么傲娇fairy godmother！菲佛这次演反派也是气场强大。怪不得公主混不上单人集，真的是猪队友！看我朱莉后妈的眼神满满都是爱😭
无糖燕麦,看过,还行,2019-10-21 14:51:06,0,【3星】你不需要遮起你的犄角，也别让谁夺走你的翅膀。
糖仙贝,看过,较差,2020-02-06 02:46:09,0,一个动画片能无聊成这个样子也是奇绝 我谢谢我自己吧 早年间立下的规矩 不花钱进电影院看动画片 看来是对的。
Zcc911,看过,较差,2020-01-05 02:09:56,0,Maleficent.Mistress.of.Evil.2019.1080p.BluRay.x264-SPARKS
黑猫,看过,较差,2020-01-06 22:48:13,0,去你妈的圣母脑残片！
子佩_字书影,看过,还行,2020-01-01 22:28:51,1,当树藤与花装点了整个城堡，我只想到的是秋冬天枯树落叶真的很丑。
壹毛镜,看过,还行,2019-10-22 12:03:03,0,朱莉的颧骨我爱
般若死火,看过,较差,2019-11-26 16:18:52,0,公主你能不能再智障一点？
Neroat,看过,还行,2020-02-05 19:08:03,3,挺无聊的，勉强及格。改编的童话也依然是童话，不带脑子看就行了，美丽的公主和帅气的王子幸福的在一起了......这不挺好吗。
Knight,看过,推荐,2019-10-19 13:58:04,1,可能对于我这个年龄的人来说剧情很俗套，但说不定young generation喜欢呢？制作是真的华美，视觉享受
米开浪基•洛,看过,还行,2019-10-18 21:43:53,2,这影院画面太昏暗，特别累。冲着朱莉去的。美国电影黑人和白人的混搭演出还是有些奇怪的感觉。
Molly,看过,推荐,2019-10-19 15:56:55,1,剧情确实是过家家啦，但是服化道场景太好看了，我喜欢
麦田里的终结者,看过,较差,2019-10-20 10:52:10,1,Guess I'm still not a huge fan of Angelina Jolie
杨谧,看过,较差,2020-02-14 20:20:29,0,这他妈啥？
小年左,看过,还行,2019-11-10 18:39:38,1,第一集是你要这王子有何用？第二集是连公主也没用了，哦也不能说完全没用，至少还涅槃了后妈。真童话，简单易懂没大脑。但翅膀太美了，朱莉太美了，多给一星吧。
一实,看过,还行,2019-10-23 06:33:55,0,安吉丽拉朱莉凤凰涅槃，美翻了！
vanvan,看过,还行,2019-10-26 19:40:22,0,少儿魔幻
WIKI魏,看过,较差,2019-10-23 23:54:43,0,朱莉也救不了我的瞌睡，因为朱莉倔强的多给一颗星。真是“沉睡的魔咒”，这个咒太强大了！！！提醒大家带好脖枕、小毯子，被旁边的呼噜吵醒了也别动粗，都不容易。
