用户,是否看过,评分,评论时间,有用数,评论
二货云,看过,还行,2019-10-18 12:28:32,16,"为了今天看首映，特地昨晚补了1,个人感觉比第一部好看，这个好看=颜>剧情，(*´◐∀◐`*)朱莉伤后美得不可方物，场面总算比第一部大了一丁点儿，远祖起源海岛，森林王国，王子的人类王国，当然三界都是蠢才，除了自私邪恶的毒皇后，暗夜族看似强大却秒被灰飞烟灭，精灵好像毫无用处，纯牺牲品？更别说最蠢的艾丽范宁，你妈都说了不是她还跑去心疼未来公婆，一心只想着结婚结婚结婚，眼巴巴等着毒皇后被暗夜族撕裂生吞，结果迪士尼为了合家欢，只肯惩罚变山羊，杀了那么多精灵就这么算了？OMG"
锐利修蕊,看过,还行,2019-10-20 23:52:48,5,三星半。虽然结尾依然还是迪斯尼万年不换的美好和平，夹杂排挤男演员，照顾低移民，顺便用技术调戏了下黑凤凰，但我没想到这部电影里面还暗藏了一个现世寓言。即使完成的非常浮皮潦草，但让公主的婚姻付之东流，反女权争霸，又看到两位异国女王高级互撕，还是充满观影欣喜。迪士尼厌猫实锤，但我最讨厌里面那个弹钢琴的T！简直生理性厌恶！另外和我妈一直在讨论朱莉女王的狼型龅牙、异军凸起的锁骨，以及她对“爱情到最后都是稀烂”的感悟真是好啊！（？？？）电影里面有句台词“这不是童话故事”看似是自嘲，结尾的松一口气又让人觉得：不要小瞧了童话故事，童话是成年人的乌托邦，正因为现实纷争杂乱。丢了童话，那该多没趣儿啊！
张咏轩Wayne®,看过,较差,2019-10-18 16:47:20,8,本集是前作的延伸，本意想给反童话故事一个更为完美的结局，顺便将灵魂角色玛琳菲森的背景进行了拓展，画面一贯是迪士尼的梦幻场景，形态各异的生灵，色彩斑斓的画面，然而故事弱智，角色傻白甜，老套的阴谋论，深挖的种族矛盾，强扭的合家欢，都是迪士尼必不可少的标配套餐，公主和王子的结合是happy ending也是矛盾的引线，无所作为又不可或缺，好在电影节奏明快，画面赏心，安吉丽娜朱莉盛世美颜外加八米气场，加强了许多看点，两方对决一言难尽，虽然技术和场面毋庸置疑，但技法和战斗力如同过家家，让整部电影看起来像一场负气的闹剧，然后鲜花落幕，美好永存，浮皮潦草的贯彻迪士尼的宗旨，怎么看怎么蠢。★★
鱼是鱼的鱼,看过,较差,2019-10-19 20:31:10,4,Elle太美惹，连傻逼累赘起来都这么美。
胖丁桃,看过,较差,2019-10-20 01:30:18,2,种族融合不好拍啊，迪士尼童话片根本不适合讨论如此复杂的话题，不明白为什么要选这么个角度切入这个故事，把战争归咎于散播恐惧上面，把现有的贪婪和曾经的迫害轻描淡写，最后打完了也没有任何解决办法，那请问大团圆结局是怎么来的？更不用提史上最废柴公主和王子，迪士尼拍了这么多真人公主电影，万万没想到最不讨喜的竟然是睡美人。值回票价的只有茱莉和菲佛，茱莉对力量与强大的展示的确无与伦比。
cult,看过,还行,2019-10-16 09:47:42,9,"杜比影院 | 《沉睡魔咒2》

《沉睡魔咒》是迪士尼真人通话改编系列中的一个异类，它是系列首作，虽然属于公主系列，但主角又并非“睡美人”爱洛公主，而是“反派角色”玛琳菲森，故事也围绕后者展开，不仅如此，她还被成功“洗白”，而且《沉睡》也是真人公主系列中唯一一部拍到了续集的作品，迪士尼对玛琳菲森是真爱了。
这种爱在第二部中得到了延续，不仅深度追溯了玛琳菲森的身世和所属种族，还让她拯救了三界。
在第二部中，种族冲突升级，直接发展成了魔幻战争大片，各种空战场面，还有一幕想起了饕餮围城。米歇尔·菲佛饰演的食肉系残暴种族灭绝主义者最终化身成为食草动物。第三幕的大战非常精彩，用来征服直男观众，当你怀疑这是否还是公主系列的时候，片尾又用一场浪漫婚礼来挥洒少女心，征服女性观众。"
Mr. Infamous,看过,还行,2019-10-23 15:37:58,4,朱莉堪称绝美，IMAX放大了那种唇红齿白的艳，森林再惊奇，都是作陪。这种大女主，只有菲佛能来一斗，而智商与真情都被放逐的小女孩，不外背景，甚至险成反派。颠覆性不及一部，但战争场面够大气，就是这系列，基本上从来不管那些挂掉的角色。话说，片头范宁拿起皇冠的一瞬，圆环里竟然透出基德曼的脸。曾经的次子团团长弃龙迎凤，沙滩鼠麻雀变凤凰，女黄蜂变公山羊，睡美人更是倒转性别与年龄。
科林,看过,还行,2019-10-23 21:36:30,3,"红粉挥洒命飞纷，
美裙变色致敬梗。
真爱泪珠落满地，
凤凰涅槃黑媚生。"
朴不程,看过,还行,2020-01-01 13:35:55,1,暗黑婚礼，这次是回魔境老家组队抵抗人类好战分子，婆婆大战丈母娘，一言不合这婚咱别结了，逼婚的妈妈们看看。6.9
末药煎肉塔,看过,还行,2019-10-18 18:12:18,13,现在还能看到Jolie展示肤白貌美大长腿就是最大的满足了！剧情傻，男性角色更傻（而且历史上的战争都是男性挑起的这片里集体装热爱和平小天使是干啥）。最高光的情节应该是国王昏古七了，侍从建议王后用真爱之吻唤醒时王后那个亲不下去的嫌弃表情，哈哈哈哈 #中年夫妻
Amberose,看过,还行,2019-10-29 17:21:08,3,看完气坏，浪费了这么好的题材，这么好的特效，公主宛如弱智，王子简直鸡肋，这明明是一个种族屠杀的故事啊！
壹安²,看过,还行,2019-10-20 20:03:30,1,又名《玛琳菲森：源起之战》或者《驯凤高手真人版》。格局开很大，第一部还是城堡和森林那点事，第二部开始讨论种族残杀、政治阴谋、国家联盟…但依然用童话故事来包装，只是最后永爱化解仇恨转折太太太快了，拍音乐剧吗？不过说到底看这部电影的人，才不关心剧情，只看我们朱莉还是依旧那么女王那么slay，就满足了。
冰镇西瓜橘子水,看过,推荐,2019-10-18 13:57:35,25,朱莉真是美艳无双 菲佛也是风韵不减当年 两个人火花四溅 争锋相对太有劲了！ 什么 你说公主？ 不好意思她和王子都是道具人谢谢
自由的幻影,看过,还行,2019-10-19 16:24:17,7,大银幕欣赏菲佛的美颜
SleepWalker,看过,还行,2019-10-18 19:46:52,6,跟第一部比没退步就已经是进步了，原创的情节很稀烂，但是特效还真不错，确实砸钱了，影院观感上佳，以及，颧骨魔咒2。
陆支羽,看过,还行,2019-10-18 23:49:40,2,3.5。
诸葛若见,看过,还行,2019-10-24 21:23:39,1,婆婆大战教妈，睡美人结婚要杀半家。续集剧情也太傻。
雅典娜,看过,还行,2019-10-24 22:50:10,2,我知道肯定好看不了但我太想念IMAX厅了，好几个月没进去了啊！就，看看五颜六色乱七八糟的画面也行了～ 不过中间跨度太大有点没想到，本来的英国古装童话风忽然间变成了驯龙高手场景下的阿凡达… 【以及Daario是不是会继续当女王面首（？）【以及黑凤凰跑错片场了吧
方枪枪,看过,还行,2019-12-31 14:55:47,1,安吉丽娜·朱莉Slay全场，遇见这样一个傻白甜女儿，真的是令人物语
爆米花教主,看过,还行,2020-01-06 17:33:10,1,沉睡魔咒之拜见岳母大人
HaGaU,看过,推荐,2019-10-19 20:06:43,6,这是什么神仙打光神仙服装！纯有纯的美！凶有凶的美！这么美还要剧情干什么(￣∀￣)话说莫名想到驯龙记啊～
掉线,看过,推荐,2019-10-23 19:53:13,3,【C】预期太低所以觉得挺好看的，故事不用说了弱智的很，种族歧视主题也没啥意思。但导演水平居然挺不错，几段交叉剪辑很带感，居然搞出了点史诗味。另外玛琳菲森变成乌鸡时，我脑中情不自禁响起数码宝贝超进化BGM。
扭腰客,看过,很差,2019-10-19 10:49:05,4,除了视觉奇观一无是处……
傲游2017,看过,还行,2019-10-18 18:32:59,9,"沉睡魔咒2:婆家抢媳妇之战，迪士尼真人部门日常无剧情有画面和嗑美颜，当然还有片尾曲。看了双子杀手在看这个，感觉技术是真心越来越成熟，但是越来越没剧情，在影院日常放松的绝对佳品。p.s 菲佛气质完全秒杀朱莉,公主简直就是傻白甜没别的了。"
有寂,看过,较差,2019-10-22 21:53:51,4,强烈建议电影分级：十六岁以上禁止观看。和隔壁李安对比一下，迪士尼就是纯粹占着资源不办事的典型啊，已经快变成造粪机了，职业将观众变弱智。这种故事动画片拍拍好了，做成真人版不就是来讨骂的？以及豆瓣标签第一个女性是什么意思，片子里三个主要女性：终极圣母癌、魔物娘、山羊。请对号入座。还有个董存瑞和把弹钢琴弹成吸冰毒的。
深夜声噎,看过,很差,2019-10-20 22:51:07,2,在HK睇小丑映前睇到这续集的诚实预告片就知道不行，垃圾boring至死迪士尼，还无良3D，减一星，以后只要不是高帧率的3D都太没必要了，再来减两星。
许鑫NixUx🌈,看过,力荐,2019-10-18 17:37:37,4,1.片中各种俯冲镜头看得我这恐高症患者有点怕怕的；2.人物的各种脸部特写过于真实，朱丽依旧是最美的；3.“正智”正确贯穿始终，里面的东方面孔（指环王精灵族错觉）和多色人种依旧是美国电影的大方向，一片大同社会的和谐以及冥想思想、朱丽片尾的水墨裙子还是看到了迪士尼对中国市场的用心；4.坏皇后暗示希拉里？5.朱丽片尾好几次落泪让我真的被感动了呀，忍不住想哭，尤其是凤凰涅槃那段；6.朱丽整体造型美爆了！7.迪士尼电影里面的男主真的都成了“配饰”了……8.还是觉得教母和公主才是真爱，那个隔海相望彼此的镜头，还有各种两人对视的面部描写。
武侠小王子,看过,还行,2019-10-26 14:35:17,0,哥特女王绝非浪得虚名。
恶猫的步调,看过,还行,2019-11-11 21:18:20,2,玛琳菲森被救回cave那段，where does it lead，To your cave，step forward into your cave，you're going deeper into your cave，and you're going to find your power animal，“slide”，好的，玛琳菲森变成了凤凰，然后滑了一地。跟搏击俱乐部成功混剪。
UrthónaD'Mors,看过,还行,2019-10-18 16:34:12,3,朱莉和范宁负责美就够了，以及自己养大的熊孩子吃里扒外了怎么办？当然是选择原谅她啊…（所以散发着绿绿的光）人生赢家是王子的爹啊，睡一觉啥都有！真的，最后的最后我怎么这么可怜这个酱油王子和死去的精灵们呢？精灵们死去也就算了怎么还当天结婚，这和坟头蹦迪有什么差别？？？？还有这群暗夜族和公主一样都是铁憨憨啊，真的太傻了知道要死还疯狂向前冲，服气
feeling,看过,还行,2019-10-18 22:01:26,5,影19294：莫名其妙的就知道大军将至。不深究。公主傻白甜，气死老母。精灵们可爱，不过朱莉气场一直在线，与族长飞行一刻是真美。黑色凤凰涅槃，一袭黑色在缤纷世界真正的女王。
桃子,看过,推荐,2020-01-28 02:51:28,1,斑豆和小蘑菇实在是让人尖叫的萌！！！范宁和朱莉的对手戏都很好看，米歇尔菲佛也很够看。发现好演员就是不管在怎样荒谬的环境里，都可以自己制造适合的气场。主场戏让人不得不想到cliche的权游血色婚礼。但是，管风琴被设计成武器的创意还挺棒。朱莉的角色遇到了她的族群，好像灵感来源自蝙蝠？“原来我们都是在天空下自由翱翔的，现在只能躲在洞里” 结合当前的情况 ，居然看出眼泪。为什么非要不停地push其他物种啊？不管是什么生物，你抢走它的栖息地、威胁到了它的生存。就一定会发生战争啊！peace together不好吗？古人掌握的知识（不管以哪种方式呈现），现代人反而不懂了。文明发展得太高速，过于自大了吧？这是地球上第几个文明还不知道呢！
LORENZO 洛伦佐,看过,较差,2020-01-19 05:07:24,3,艾丽范宁的角色想让人掐死
纳兰风澈,看过,很差,2019-10-19 00:49:29,8,虽然他们一无所有，但他们获得了民主、自由！
A Bold One,看过,较差,2020-01-12 17:32:39,1,大倒退。第一部取得的进步第二部给你倒退几十年。花这么多钱用这么个卡司讲了个fuck all。虽然不是主角，但公主人设也太差了，艾丽范宁接续集图个什么啊。迪士尼还是厉害啊，作成这样豆瓣还能6.2。
kylegun,看过,还行,2019-10-24 23:10:46,0,Will you give me away? Never. 人妖冲突白热化之亲家母战争，跟第一部一样平庸，也就母女情和川普婆婆米雪菲花可以看看，养的那只坏猫是致敬她演过的猫女吗？
Chaall,看过,较差,2019-10-23 22:55:52,2,我不停地催眠自己：人真美啊，裙子真美啊，发饰真美啊……这他妈都什么大傻逼啊……
岬,看过,还行,2019-10-24 13:04:52,0,想起我以前曾做过一个梦，梦里我头上顶着一对黑色犄角在人群中，兴奋又骄傲地一边向前小跑一边口中默念“Maleficent”。
许泽,看过,较差,2020-01-13 00:11:20,1,这让人无力吐槽的剧本……幼稚又无聊，好多bug，莫名其妙的节奏……是要逼我因为选角而站王后和玛琳菲森的cp吗……果然还是逃不开续集扑街的定律，全片最爱被关在瓶子里的两个精灵。
Morning,看过,较差,2019-10-21 10:59:56,3,安吉丽娜朱莉受伤后醒来那一组写真大片我都快忍不住笑，这也是小时代风格呀。剧本在开发续集上也是很费心，不仅圆回诅咒的圈套，还利用女巫反派的大成功，直接将她创作成大女主，意图太明显。原本童话故事里公主与王子的形象被成人认同已经很辛苦，现在还要在这种夹缝中生存，直接炮制了后半场毫无情感逻辑的戏可言。刚战争完就举行的婚礼，才是抹杀一切精灵存在的酷刑。
rune1121,看过,较差,2019-10-19 11:45:54,3,迪斯尼就是好莱坞的麦当劳，绝对不好吃，但是老少都能吃，没营养但是热量足够撑，加上点换汤不换药的噱头还能哄骗很多人，所以很多人吃完会自我安慰，我反正吃饱了值回票了。结果是业绩，办餐饮谁干得过麦当劳？而我给一个汉堡包套餐评分，是不是有点傻？
宅咬瑶,看过,较差,2019-10-18 15:04:54,5,魔改1还有点新鲜感，2就真的很2了
mysticark,看过,还行,2019-10-20 15:48:40,0,换导演编剧就让本片成了迪士尼版的“猎神：冬日之战”外加第二个瓦坎达。如果对前作无感并忽略掉大多无脑的地方，本片其实还过得去。公主王子这回又路人了。
mOco,看过,较差,2020-01-10 10:12:17,0,比之上一辈更更更加沦为俗套。花样展现Julie有多美。
🦄Erica,看过,还行,2020-01-28 14:12:22,2,作精公主
♣ 9,看过,还行,2020-01-11 00:59:55,1,我就知道白莲又是让至亲陪葬 自己一点B事没有。话说涅槃了再射一箭啊 6秒内击碎她要CD240秒呢
Favillae,看过,还行,2019-10-19 15:02:26,3,公主恋爱脑傻白甜胳膊肘往外拐坑妈人设无敌，连朱莉颜+气场都救不回来，消遣一下可以，人类为什么没有进化成节能减排天人合一自由自在的有翼族呢，唉，也是，天人合一与自然和谐共存的种族始终要被富于掠夺性与破坏性的工业文明消亡的。
T.V.Zoe ி,看过,还行,2019-10-18 15:04:29,0,服化道很美 终于不是灰姑娘那种廉价的公主裙了  开篇的Fairyland就是从小幻想中的样子  迪士尼还是有点亮奇梦   故事就不要纠结了（我觉得我中国机长PTSD了 飞行戏总觉得椅子在动😂
一口大井子,看过,较差,2019-10-20 19:26:15,4,人类精灵过家家，智商不够特效凑，爱与和平大过天，朱莉收拾完反派后迫不及待把爱洛嫁了，估计是再也不想被这个蠢丫头拖累了。
巽,看过,还行,2020-03-04 20:02:14,0,一部魔戒，一部阿凡达，滋养了整个好莱坞多少年… 跟第一部比起来编剧毫无追求了，现成素材库里的各种前段设定东摘摘西凑凑拼贴乱炖就完事，偷懒行货。（然而，我还是无法拒绝翱翔和巨大的翅膀，妈的
说什么图灵,看过,推荐,2019-10-19 20:12:37,3,没想到居然充满了阴谋背叛和战争，在1里就期待的内容没想到在2里都实现了。但引入鸟组全体破坏了maleficent的神秘感，而且后面满天乱飞也有很影响观感。最后的大战视觉效果很好，但结局走向太草率，很多细节处理的不好。
猫咪建筑师,看过,较差,2019-10-23 17:01:58,1,王子公主简直傻白无限外加负存在感，aurora充分说明恰恰是人类崽子最养不亲，渣渣亲爹遗传十分强大。纯看大嘴和菲弗
hermaphrodite,看过,还行,2019-10-26 22:09:25,1,这对王子公主一定要在一起！我要见证他们生出人类最愚蠢的婴儿！！！！
百竹,看过,力荐,2019-10-18 02:45:39,8,安吉丽娜朱莉真的是一大利器，差一点被掰直，太让人起征服欲了。五星好评无脑是无脑了点，认真打大概给三星半吧，看的过程中一度让人感觉在重温国产家庭伦理剧：傻白甜女主不知所措的在恶婆婆和娘家老母亲的高段位撕逼日常里和稀泥。。。
小片片说大片,看过,还行,2019-10-19 14:25:50,4,人类男女主太不讨人喜欢了，最后的强行大团圆结局也很突兀。
𝙎𝙥𝙖𝙧𝙠𝙮 | ✟,看过,较差,2019-10-20 06:55:13,3,：（ 已经看不了傻白甜非得用爱发电的片儿了
放你娘的屁,看过,较差,2019-10-30 20:26:30,1,"1. 养人类崽太累了，必须时刻做好literally死去活来的准备；2. Michelle Pfeiffer的henchwoman真多才多艺啊，文能弹管风琴、武能打铁、打仗，出谋划策以外还要做传令官，真真Renaissance woman, 不过也说明王后肯定很抠门，N个人的工作一人包办；3. Philip换了人大约没人发现，bland white boys果然是interchangeable的；4. 人类的确是像这个智障剧本里一样愚蠢又讨厌，所以可以打两星。"
张苑希,看过,较差,2020-01-05 16:20:20,0,“唯有将恐惧植入臣民的心中，再利用那股恐惧来对付敌人”。王后一流野心政治家石锤。原想上集剧情就已经很放飞了，没想到续集剧本写的更糙，毫无逻辑一通乱炖。除了二位女王颜值身段值得一看，所有男性角色皆为陪衬，公主恋爱脑全程智商不在线，仗着有教母的爱肆无忌惮，简直可以当选最坑迪士尼真人公主。
苹果碳酸水,看过,推荐,2019-10-20 21:20:44,0,后妈越来越美了！王子真的好看！不带脑子看就很开心
小月,看过,推荐,2020-01-19 12:37:10,0,种族问题，世界和平问题。场景很美很童话。安吉丽娜长发披肩的样子还是那么美，倾倒众生。百无一用是公主和王子。竟然凤凰涅槃了，震惊。
[已注销],看过,还行,2019-10-30 21:40:06,0,王子有点长残了 真爱之吻 二五仔的眼泪 魔法老黑
大星,看过,还行,2019-10-18 17:16:19,4,瞎幾八改編但是茱莉美絕！！！！闇精靈姐姐們美絕！！！！王子身材美絕！！！！ 好 收
外出偷狗,看过,还行,2019-10-23 23:05:58,1,延续新童话的创作方向扩大了世界观，说教意味不算浓厚但是形成了新的俗套。双妈争霸没有想象中来劲和精彩。还是习惯性感叹迪士尼真是太奢侈了，可以有条件搞这样的服装造型道具，搞这样的场景特效，然后拍这么无聊的故事。
城南草木生,看过,还行,2019-10-18 21:15:56,1,美。
滴答、滴嗒,看过,力荐,2019-10-16 11:53:58,1,"没有万恶不赦的恶魔，只有蛇蝎的心肠。恶魔亦是天使
《天使的告白》每次分别她从不回头看我，在他眼里，我是强权者，所有这一切可能都是屈服于我的淫威，但她不知道，我不止是可以被她捅一刀；有一个远古的神，一直在指引我们，当我感受到他的时候，我才知道，世间如此美丽，我却在破坏它。直到，不敢面对你，今天我要许下唯一的诺言：我愿意成为她的守护天使，爱她所爱，思他所思，为她承担伤痛度过苦难，无论贫寒或富贵、无论卑贱或高贵、无论身处乱世还是神所不顾；我愿为她拔剑而战、为她收起翅膀，不离不弃直至永远"
Echo,看过,2019-10-23 12:38:49, ,0,呃… 没有认出范宁
摩诃曼珠沙华,看过,还行,2019-10-24 22:18:30,0,婆婆那句话说得对：现在没童话了
杀手皇太后,看过,较差,2020-01-28 02:25:12,0,也就女王x渡鸦可。其他时间也不知道在干什么，鸟人族那段尬得要命，迪士尼第N次强行续系列。
虫/银拜女神,看过,还行,2019-10-19 02:48:52,2,画面特效服装都好美哦，结局的藤蔓与鲜花下全是尸体吧（。
傻乐的猫,看过,较差,2019-10-31 00:04:23,0,王子是沙滩鼠。这么快就拍大制作可是立刻穿这么多是闹哪样？衣服才脱几天就忙着穿回去你还想做影帝啊？你根本没有演技，醒醒！
独行侠杀手阿何,看过,力荐,2019-10-24 23:54:59,0,杜比全景声厅的音响效果震撼炸翻！3D效果炫目瑰丽至极！暗黑仙子变身凤凰涅槃！朱莉和菲佛两大女王对抗！！！开战场面精彩连连！排场浩大！和平，才是两个王国和种族之间的最好出路。Maleficent依旧是最美艳最具庞大气场最震慑心魄的女性角色！！！！！！！♡Miyavi居然几乎没有台词！！！((٩(//̀Д/́/)۶))Elle Fanning的演技似乎进步了？小帅哥Harris Dikinson的发型差评！！！Ed Skrein的霸气暗夜族和Jenn Murray的红发少女简直是两大亮点！特么的谁不想要Maleficent这样又毒舌又邪魅又嘴硬心软又母爱满溢的仙子教母啊((٩(//̀Д/́/)۶))！！！！！[四星半]
Panda的阴影,看过,还行,2020-01-02 21:21:42,0,《沉睡魔咒2：岳母 VS 教母》。虽然是童话故事，但剧情编排也太乱来了：上一部的结尾玛琳菲森看到爱洛公主与菲利普王子重聚时还露出慈母般的微笑，这一部反而从一开始便“反对”这门亲事……人类与精灵仙子奇幻生物们之间的仇恨误解也是想生就有、想化就解。在一场战争爆发过后，就用一场婚礼美满收场，大家就其乐融融和平相处了……真是想怎样就怎样。P.S.：在决定观看《沉睡魔咒2》的今天仿佛被施了“沉睡魔咒”，老是犯困，(((φ(◎ロ◎;)φ))) 。
海山·野火,看过,还行,2020-01-02 14:24:55,0,空洞乏味，情感错乱。堪称反面教材。
维恩B,看过,较差,2019-10-19 19:25:43,3,迪士尼童话这几年都是华丽而保守无趣。前史都是硬加的设定，玛琳菲森的突然遭遇的“困境”与她年龄和经历不相符，随后很快也就消失了，似乎一切从来都不是问题。屠杀灭族之后是一片欢声笑语，这你敢想？朱莉醒来之后的回眸是全片唯一具有美感的画面。
私~川流,看过,还行,2020-01-05 17:10:32,0,如此傻白甜的故事很适合在飞机上看。
鲸鱼君,看过,还行,2019-10-20 14:16:02,0,《沉睡魔咒2》3D：这一部算是专为黑女王洗白用的，连她自己都才知道她变成这样不是偶然，而是因为有一个特定的物种！黑女王看见没有花的亡灵花、公主看见纺锤车就能猜到王后是罪魁祸首，这对母女真是推理大师。最后黑女王化成了灰，混合了眼泪就能涅槃，只要能happy ending，管你信不信这个邪。★★☆
一默,看过,还行,2019-10-19 01:16:39,2,告诉我们一个道理：和平来自于拥有绝对力量的统治者？
Lunar C.,看过,推荐,2019-10-27 14:34:23,0,电影院看的，比舆论中产生的预期好很多，电影这东西还是得自己看。这一集很宏大，超脱了大多数童话世界隐喻的阶级层面，而转向寓意更加开阔和本源的人类共生，乃至多种族共生、与自然共生。安吉丽娜气场撑得起来她演的角色——古老黑凤凰唯一留存的血脉，这种身世演不好就是黑，但看下来很满足，总体感觉不错。
豆瓣儿酱,看过,还行,2019-10-18 12:04:24,10,这次的剧情真的不喜欢。看的时候气死了，公主也太圣母白莲花了叭，对方王后杀了那么多精灵她居然在关键时刻劝教母放下仇恨？？？什么玩意？？前边强行设定教母是凤凰后裔就是为了后边复活准备的，特别生硬。我不喜欢第二部
旧风,看过,还行,2020-01-29 12:17:05,0,朱莉个人秀啊，各种服装各种好看……
戴老板,看过,很差,2019-10-19 23:21:03,2,这可真是简单得不行的童话故事啊。
L&M&爱你长久,看过,还行,2019-11-01 17:33:41,0,"我真的只是过来看看飞花 +支持一下中年女演员. 很惋惜王后事业未竟, 有野心的女人很有吸引力. 以及要是王后胜出囚禁魔女, 王子和公主被流放, 该有多带感啊."
