用户,是否看过,评分,评论时间,有用数,评论
zavier,看过,还行,2019-10-18 02:42:35,4584,这个公主是所有童话故事中最该死的～
David,看过,还行,2019-10-18 02:02:05,1606,凤凰？…………传奇？……
飞侠式拼搏,看过,还行,2019-10-18 00:01:26,1511,"爱洛公主：我妈竟然不准我结婚。
王后英格瑞斯：我要把爱洛当自己女儿。
玛琳菲森酸了：去他妈的！爱洛只能是我的！！！
于是《沉睡魔咒2：丈母娘大战婆婆》震撼上映。
真爱之吻不是王子，而是被洗白的女巫。这是第一部最大亮点。
而这部续集是真的不行，王子依旧打酱油，俩蠢货居然能圆满，国王更是直接躺赢。
既然重点是放在几位女王身上，为什么不能刻画下男性，而不是让其他人都像傻子似的。这样岂不是更能衬托出她们的强大？
他妈打她妈，因为变黑凤凰他妈的最后双方居然就不打了。
结局的和平处理以及照常举行婚礼果然很迪士尼。大家应该习以为常，反正迪士尼真人部也就那样了，以后还多着呢。
最后，再次恭喜爱洛成为迪士尼第一傻白甜公主，第一坑货玩意。"
甲鱼不是鱼,看过,还行,2019-10-18 02:10:21,1385,因为弹钢琴那个女的给了三颗星，她弹钢琴的时候我以为毒瘾犯了😀
蓝抑郁剂 Lily,看过,还行,2019-10-18 16:08:06,1274,青梅比不过天降，真爱教母比不过傻白王子。自己种的白菜被猪拱了，白菜还帮猪全家伤害教母。教母前一秒哀怨:我没有女儿了，后一秒不计前嫌卖命救瞎眼萝莉。从没原谅过渣男的教母彻底输给了小萝莉，满满的爱全给你，刀子也全接下，爱到赔了王国还送你嫁人，一首let it go 送给卑微教母。———— 迪士尼用一部颠覆传统，又用第二部回归傻白乐。
桃子酱,看过,很差,2019-10-18 01:59:44,1551,两个啥也没干的人谈个恋爱就坐拥江山了？？？她妈和他妈打啥呢？
一口吃掉小蛋糕,看过,推荐,2019-10-18 02:28:45,1629,全程都是朱丽太美了！！！受伤苏醒后那段简直惊为天人！！！光是朱丽的锁骨都够值回票价了，何况还有大长腿。但是结尾略崩坏，虽然羊很讨喜，但是坏人变好的太突然了吧
我爱罗宾,看过,还行,2019-10-17 00:46:49,747,傻子终成眷属，国王艹到山羊，完美
一粒响指,看过,推荐,2019-10-18 09:32:58,1361,白衣亚裔精灵像从横店抓来的 有点出戏
甄甏甏,看过,还行,2019-10-17 15:34:42,534,看完电影我直接不想看第一部了……画面确实非常美，朱莉要胸有胸要腿有腿肤如凝脂格外尤物，但这个故事太傻了，12岁以下小孩子觉得好看就好吧，反正就是个童话故事。艾丽·范宁红毯照都还好，怎么电影里面看上去这么村啊……
龙骨,看过,还行,2019-10-18 17:28:40,340,"看得我有点生气，这本来是我最近最期待的电影。
现在担心《冰雪奇缘2》也出问题。
公主的操作实在是太蠢了，在玛琳菲森打boss的时候跑出来和玛琳菲森聊天……害的玛琳菲森被杀，要不是知道会复活我就骂街了。
结尾也怪怪的，你这边刚打完仗死那么多人，忽然欢庆结婚可还行。
转场一下搞个“几日后”，不就显得没那么突兀了。
剧情拍烂了，至少这部玛琳菲森戏份给多点吧，大家都是来看玛琳菲森的啊。
我后排一妹子，玛琳菲森受伤了，头发放下那段。来个镜头就惊呼“她好漂亮！”“我天，她好漂亮！”
所以就不能多给玛琳菲森点戏份么，这片明明叫《玛琳菲森》啊！！
说句题外话，小范宁确实越长越好看了。
再说句题外话，玛琳菲森笑起来那么可爱，这部居然几乎不让她笑。上一部她很大一魅力就是面对逆境，还有愤怒时会很有反派感觉地大笑。"
amor27,看过,推荐,2019-10-16 16:47:58,673,《沉睡魔咒1》最大的贡献就是这两年万圣节男孩女孩们都不再为扮什么发愁了。而到了2，我最大的感受是，比起20岁美则美矣却无灵魂的Elle Fanning，四十五十的朱莉跟米歇尔同台飙戏的气场十足明显才更有魅力更有看头啊。
狮与羊,看过,推荐,2019-10-17 12:53:43,196,近年少有的将IMAX纵深感表现得淋漓尽致的片子，人像拍的很美，连Jolie黑魔后的身材比例设计都像是为IMAX而打造的。剧情俗套，但也没到讨厌的程度。
凌睿,看过,较差,2019-10-18 23:50:44,1516,"迪士尼真的是一个很神奇的公司，动画电影是拍给大人看的，真人电影却是拍给小孩看的，甚至小孩都不一定看。
如果说《疯狂动物城》《冰雪奇缘》《狮子王》改变了人们对动画电影的看法，那么《沉睡魔咒2》《时间的皱褶》《胡桃夹子和四个王国》就是刷新了人们对真人电影的认知。
王后从头到尾一副反派的样子，就差没把“反派”二字写在脸上了。
那么明显的栽赃嫁祸，爱洛竟然也会上当，宁愿相信一个陌生人，也不相信朝夕相处的教母。
王后多次挑衅玛琳·菲森，一看就不怀好意，这还需要调查才知道吗？
都那么明显了，还拍出了“烧脑片”的感觉，还给爱洛安排一个来到地下室发现真相的剧情，简直是侮辱观众智商。
死了那么多人类和精灵，最后所有人还握手言和、普天同庆，好像什么都没发生一样……
能把动画电影拍得那么有深度，却把真人电影拍得如此低幼。"
王大根,看过,还行,2019-10-18 15:33:54,234,当代王子的存在价值：带着一张漂亮的脸和一副纤细高挑的身材，拿着宝石美美地站在那里，听听公主的烦恼，说几句“做你自己就好”——差不多也是我们对当代王子的全部期待了哈。给堂堂女王搞寻找族人的线是没啥意思，又不是小女孩了，哪还需要这种浅层的身份认同啊。Ed Skrein 演的鸟人也不出挑，还不如咱仙剑三重楼呢……
kakakarl,看过,还行,2019-10-18 16:34:11,248,反派王后：是我散布的谣言，玛琳菲森是巫婆……原来您就是格林兄弟啊～
梁州,看过,较差,2019-10-18 01:48:06,1379,看一半被剧本气疯了，迪士尼的编剧团队能不能换一个？人类的善良永远被解读为愚蠢，看个开头就知道结尾的故事讲上一百遍也不会令人感动，只会令人气愤。大半夜在电影院气死人了，你还不如直接改名叫鸟人大战人类。还有那个脑残的女王，你凭啥是只可爱的小羊，你也配？！总结：本片最大赢家就是那个傻不愣登的王子，睡一觉起来啥都有了，怕不是手握剧本的男人哈？
YthguaN,看过,推荐,2019-10-16 12:18:56,148,朱莉和范宁之间真是爱意深厚火花四溅啊 王子第一部里吻不醒真爱 第二部里跟自己亲妈不如人家跟后妈感情好 是不是太惨了点儿
funny,看过,推荐,2019-10-18 13:49:10,134,爱洛掉了三颗眼泪使女王凤凰涅槃，我为女王掉了300颗眼泪，我才是真爱。3D 效果棒呆！期待续集。话说朱莉的锁骨尖说明她太瘦了
水浒三国金刚,看过,还行,2019-10-18 15:25:23,226,电影院好多观众中了魔咒呼呼沉睡
西帕克,看过,较差,2019-10-16 16:20:13,1009,真是沉睡魔咒。
Keep calm.,看过,力荐,2019-10-18 02:23:26,744,朱莉实美，受伤的时候美得不可方物，变成灰也美。艾洛时好时坏，肉肉脸真的挑角度。菲佛的颜，跪了，谁能想象这是61岁的奶奶。特效无敌，惊艳，迪爸爸永远是迪爸爸。故事上，再暗黑也是童话，梦幻婚礼大团圆结局，除了我可可爱爱的蓝果仙子变成了花花，大反派再坏也只是变山羊。另外精灵们真的太可爱太善良了，自我牺牲的时刻几次泪目。 最后，王子好帅啊，期待大长腿英国帅小伙迪金森的王男！！！少女心支撑我打五星，我爱仙女教母！！
roy,看过,很差,2019-10-18 01:59:54,487,权游8季编剧的徒孙写的本子？？
桃桃林林,看过,较差,2019-10-18 11:54:21,464,5分。所以这部的睡美人是昏迷中醒来的安吉丽娜朱莉么？她睁眼、回眸那一幕好美啊！然而，影片大概只有那一场戏还挺享受的。迪士尼这几年的真人童话电影总是华丽却无趣，都是些为了票房胡凑的项目，视觉特效、大牌明星、保守的合家欢。比如这回，剧情也太俗套和无趣了一些，满是老掉牙的情节设定，最后还来了一轮种族大融合。以及，艾丽范宁很美，但她那个角色到底是怎么写出来的？？？全程莫名其妙，各种犯蠢和添乱，也是够了。
木卫四,看过,较差,2019-10-18 14:32:56,464,上午两国打架屠杀下午联姻办婚礼？？？？这个剧情当我是傻子一样。
我明天早起呢,看过,推荐,2019-10-18 09:20:53,51,爱洛面前是仙女教母，亲家面前黑化女巫，我吻醒的女儿轮得到你们欺负？
琅然,看过,还行,2019-10-18 13:01:19,121,安吉丽娜朱莉好美 能把我扳弯的美
Rui,看过,较差,2019-10-18 11:13:08,328,我就问一句，迪士尼是不是请权游的那两个编剧来写的沉睡魔咒2的剧本？？？？？？？（心疼我的38块票钱呜呜）
Saudade,看过,较差,2019-10-18 15:35:19,330,电影应该叫《我不要我妈了》。女主爱洛应该死一万次，又笨又蠢还圣母。最后死了那么多人，你说今天开心，咱结个婚吧？？冲喜吗？
暖,看过,较差,2019-10-18 14:04:15,145,迪士尼从继母皆祸害走向了父母皆祸害时代。
X教授的傻儿子,看过,还行,2019-10-16 18:36:13,123,"睡美人就负责好好睡觉吧，不要醒过来坑妈~
btw，朱莉美哭我，让我原谅了整部电影的槽点，给值得一看的"
吃货F,看过,很差,2019-10-18 11:18:09,111,这片，我带着这片一定很烂的心情去看的，结果看了发现，居然烂出了新花样。有这片祭献，冰雪奇缘2一定大卖。唯一的看点是三位女神的颜值，也只能看她们的颜值和她们穿的漂亮衣服。看片过程不要带脑，不要想第一部的设定，不然处处都是硬伤，想看百合的也收收心，别吃的满口玻璃渣。全员演技统统不及格，人设崩坏严重，奥罗拉公主是花瓶弱智无能还白眼狼。魔女就个无口的盾勇男主，从头虐到尾爽不到三秒就被女儿拖累自爆，养这闺女图个啥。女反派就是行走凹造型机，除了她真爱不是老公这点有意思外，玛丽苏文里的典型女二和恶婆婆，为坏而坏。这片最可怕的还是断裂感，很多情节感觉都不是发生在一个空间和时间线里的，刚还要杀个你死我活的人们下一秒双双洗白然后手拉手唱友谊万岁…这剧本是一个人写的么，我知道这是童话，但是不代表可以这么不要脸的硬
Y,看过,很差,2019-10-18 21:56:10,67,此片全程可@迷惑行为大赏，甚至连后妈的美貌也很迷惑，为什么她可以美成这个亚子，how？？？why？？？我好迷惑，我真的好迷惑
突然粉碎,看过,还行,2019-10-18 01:29:32,79,从此再无睡美人，只有致命女人，范宁妹子可可爱爱，朱莉和菲佛才是仙女，迪爸爸把童话拍成了寓言，不得不服
Gnossiennes,看过,还行,2019-10-18 20:04:42,80,全片高光时刻只有凤凰涅槃和蓝果仙子在管风琴里的绽放，剧情真的就只是狗血吧，回归暗夜族就只是被救、再被救然后对人类改观追求和平共处这点作用吧，国王真是傻乎乎，你老婆根本就是暗恋她哥啊你看不出来吗？玛琳菲森挡箭化迪士尼灰的时候边上的人一直在爆粗骂爱洛，我特么能说啥，你是对的。
GA,看过,较差,2019-10-18 15:24:05,109,迪士尼你放弃证明自己不肤浅好不好
淋,看过,较差,2019-10-19 17:44:48,124,蠢是公主的原罪
在玩手机的人,看过,力荐,2019-10-19 07:58:52,54,终极赢家是国王，睡一觉醒来什么都解决了
哪吒小丸子,看过,较差,2019-10-18 17:05:59,110,精妙绝伦，邻座高中生都看哭了！郭敬明在家循环观看爵迹并留下眼泪“我们差了什么，不就那点破技术么！”
胡不归,看过,还行,2019-10-16 19:11:52,54,我反复告诉自己这不是《阿凡达》，但这部电影还真就讲了这么一个俗套故事：以贪婪的皇后为代表的人类企图占领潘多拉…哦不，是精灵族的森林，发动了战争，对方部落奋起反抗，双方各有死伤，沉睡的凤凰在危急关头拯救世界。于是世界和平，王子亲吻了公主。片中皇后对着镜头说：“这又不是童话故事”，哦不，这还真就是个俗套的童话故事。期待中的暗黑感没有出现，特效也还行吧。希望把导演换成蒂姆伯顿～
Repulsion,看过,较差,2019-10-18 09:55:38,72,睡国王之烂梗大合集，一根针头反复使用很不卫生，管风琴里的仙子和变成树变成蒲公英的精灵没人管了。把皇后变成山羊可以和叼着耳机流泪竞选年度最搞笑镜头。好些镜头只是为了剪进预告片里好看才拍的吧？总之废戏很多。这样的剧本也能拍，开始担心花木兰……
小老弟说什么呢,看过,力荐,2019-10-18 17:15:49,53,"其实比第一部剧情格局要宏大，但是立意差的不止一星半点

玛琳菲森很美，王后很美，奥罗拉也很美，但公主王子很傻又恋爱脑。奥罗拉可谓迪士尼公主中的坑队友高手，无非仗着“玛琳菲森爱我”各种实力坑，傻白甜王子连自己亲妈都不了解白送我都不要，两人啥都没干就坐拥江山还美其名曰维护了爱与和平，王后倒是认真做反派，她妈打他妈倒是看点，可她妈和她妈又没真正干架，第一部中的剧情反转和true  love都是亮点，而且也有玛琳菲森的自我救赎，本来指望奥罗拉在第二部中会有成长，可没成想还是傻白甜，结尾还让公主女巫卖卖腐之后再回归最套俗最无聊的结局

四星给玛琳菲森一星给认真搞事的王后，迪士尼想开倒车也不是这么开的"
yuna的男票,看过,较差,2019-10-18 23:03:50,83,公主被变成黑凤凰的朱莉舍命救下醒来后第一件事竟然是挣脱着去拥抱王子了？你妈为了你都快被弄死了好吗？那么多精灵都死了然后你大喊着今天要举办婚礼？编剧到底什么脑子？？？
K,看过,较差,2019-10-17 02:53:38,49,大写的花仙子。一点新意都没有，光舔颜还是可以的。坏人就是傻坏，好人就是蠢蠢的。世界可以通过魔法就和平了？迪士尼停留在这不行啊.....
艺仔不明白,看过,较差,2019-10-20 17:20:22,30,"“Aurora, you can come out” “well...can you come in?” → lesbians,  never fall for a straight girl."
幸运+++,看过,较差,2019-10-20 09:18:46,36,真的要被剧本气死，公主又bitch又蠢，完全不能理解，王后从一开始就把我是坏人写在脸上，鸟人啥也没带感觉也没啥战斗力就去打仗了……也就安吉丽娜朱莉够惊艳，小乌鸦还是很可爱，总感觉王子长的有点像小11。（200102，我又开始四倍速过字幕了，再看还是气的要死。真的是越发不喜欢艾丽范宁。）
SELVEN,看过,推荐,2019-10-18 22:39:19,40,72/100 ”一个最好的统治者就是给国民灌输恐惧，然后用恐惧来对付敌人。”
康报虹,看过,较差,2019-10-18 15:39:32,38,编导们在情节设置上所作出的一个个老套、生硬、令人不快的决定，几乎耗光了观众的热情和对整个故事的期待，童话式、乌托邦式的结尾也多有媚俗之嫌，好在服化设计和美学风格依然保持了较高水准。无论是以墨黑和祖母绿为主色调、搭配骨骼和金属材料的教母服饰，还是泼洒印象派色彩、加入森林元素的公主裙，都成为了两位角色不可或缺的一部分。我敢说，如果没有如此精致自然的裙子和超凡空灵的妆容，银幕上闪耀、迷人、夺人眼球的艾丽·范宁便会少几分光彩。
好大一个饼,看过,很差,2019-10-18 14:50:00,43,本片又名《愚蠢女儿怎样帮助敌人残害自己母亲》，烂！！！烂片！！！巨烂！！！
胸口碎大石,看过,还行,2019-10-19 11:13:16,43,7，什么丈母娘的反对，明明是婆婆在作妖！另外，还没结婚的姑娘小伙子们，如果你对象的父母无缘无故的不尊重你的父母，那他们也不会尊重你，望周知。
法兰西胶片,看过,较差,2019-10-19 22:41:32,24,竟然是那种最无聊的人妖种族大战，每个族群智商都很堪忧，最后就连女权的讨论都没有了。归根结底，这部戏最大的意义就是让我想起安吉丽娜·朱莉其实是个黑人混血！
川斩霜行,看过,较差,2019-10-18 20:48:06,38,一星给盘着头发的朱莉，一星给披着头发的朱莉
JoeyLu陆柏宇,看过,较差,2019-10-18 21:52:20,13,这故事跟迪士尼那些只在家庭娱乐发行的衍生片一样，还强行玩上了星战梗。
sisimint,看过,推荐,2019-10-18 19:21:40,40,黑白女王在线battle，没公主什么事儿
时间之葬,看过,较差,2019-10-18 14:14:36,14,这是真·黑凤凰飞化肥化灰了，除了迪士尼这些年一贯的陈旧老套之外，这个系列真正灾难的是那一套丑陋的服化道审美，如果要用一个词来概括，大概就是集于朱莉头顶的塑料假发质感
乌鸦火堂,看过,较差,2019-10-22 12:58:58,11,片如其名
干乚,看过,较差,2019-10-18 21:24:25,20,"两星半/朱莉
朱莉太好看，受伤后那段长发披肩太摄人心魄了。但是整个故事真的又臭又长又低龄，人物的扁平化和脸谱化比第一部还要严重。迪士尼在第一部隐喻一手女权后，第二部又开始了黑人种族。政治影响艺术创作真的很让人作呕，算了。"
瓦力,看过,还行,2019-10-18 19:47:57,19,鸽派沉睡鹰派崛起背景下米歇尔菲佛扮演“瑟曦”，有小矮人“科本”辅助，策划血婚、教堂大屠杀、领导“君临”大战...朱莉相当于龙妈的龙，想被打中就打中，想打不中就开挂力MAX，还有从漫威宇宙借来一群格鲁特，继续保护同伴的使命。虽然有“成为伟大统治者就是要不断给他的臣民灌输恐惧，然后用恐惧对付他的敌人”这样的金句，但童话最后还是童话。
墨墨,看过,较差,2019-10-20 17:34:36,6,突如其来的弱智……
大聪看电影,看过,还行,2019-10-17 13:11:50,23,影片整体故事抛开前童话核心束缚，给足了观众新鲜感，宏大的黑魔世界正在慢慢构建。《沉睡魔咒2》依然充满丰富的想象力，再加上迪家的强大特效，让影片成为一部充满丰富感情又能让人欢声笑语的电影，当然毕竟还是迪士尼合家欢调调，次要人物显得幼稚结局走向稍显低龄。话说那毫无存在感的傻白甜王子送我也不要…
Ptwentyeight,看过,较差,2019-10-18 15:50:27,14,强行种族大团结，搞什么？不是不可以，只是处理太随便了吧！第一部定下的反童话基调，不仅没做到，就拍成童话也没这么弱智啊！Aurora你就不该醒！迪士尼恰烂钱！我恨美国这样忽视艺术创作规律的政治正确！🤷
毛病小精灵,看过,较差,2020-01-12 16:15:28,1,王子：我感觉自己很多余
托尼·王大拿,看过,较差,2019-11-01 16:58:34,5,得承认有些场面在IMAX上看的是真爽，但除此之外吧，简直就是个傻白甜奇妙物语...
好处在笨,看过,还行,2019-10-18 13:20:08,27,前半段还不错，安吉丽娜受伤后的那几幕真的好美啊。但是到了最后半小时有点崩坏，不仅打斗有点没头没脑，而且制作秘密武器的老精灵竟然莫名其妙策反了。还有为了应和和平的主题，最后硬凑的和解的几幕也很鸡肋。而且我严重怀疑暗夜族那么多无聊戏份是为了多塞几个可有可无的演员，暗夜族的进攻就是蠢到看不下去，都知道有那种铁的武器了还不做任何准备直接冲，你不被灭谁被灭？所有精灵和暗夜族战斗力都是渣渣，而且朱莉也是有勇无谋被一箭灭了，最后全靠爱打赢了战争，很迪士尼……
老滚,看过,较差,2019-10-19 17:37:31,14,5.5 朱莉的人格魅力撑起了整部电影，范宁的角色从被拯救演变成了毁气氛，简直是失败至极，迪士尼的电影现在已经成了打扮的五颜六色的腐烂尸体，外表让你感觉充满生机，其实已经充满了腐烂的恶臭
张小白,看过,很差,2019-10-18 14:29:49,34,为了圆剧情设定，强行扭转人设甚至让每个人都变成傻子。一星给朱莉的颜
白昼回响,看过,很差,2019-10-18 14:42:59,38,一星给朱莉，一星给她从巢里醒来的镜头，一星给那个白翅膀白衣服的亚洲人小哥，因为艾丽范宁出演所以倒扣三星，但是最低只能打一星
Ying_0111,看过,很差,2019-10-21 01:24:30,7,让人看了特别生气。我真想问问编剧们怎么想的，能上一秒双方还打仗下一秒被害方和加害方就乐呵呵的一起参加婚礼……一天之内这戏剧性变化让人不适啊。要是有人砸了编剧家对他说“老哥别生气，我听信别人说你是坏蛋，闹了误会。为了补偿一下我请你参加派对啊！”编剧能什么心情？而且撑起整部电影剧情的反派米歇尔阿姨最后被整的很落魄还变成了羊，空喊口号的蠢王子和蠢公主坐收渔翁之利。说好的童话故事呢？太欺负人了……
爱你小能手,看过,力荐,2019-10-18 02:45:28,20,特效很棒，剧情弱哎，朱莉气场8米！
柏🎥,看过,还行,2019-10-18 03:03:05,27,她妈和他妈打他妈的什么呢，你俩搁这俩跟谁俩呢。特效和画面爽到爆，剧本蠢到爆，但谁让他是个“童话故事”呢，也算是基本合格了。看的时候感觉像是看了个换了外壳的《怪物史瑞克2》，一样也是因为结婚这个关卡出了隔阂和问题，然后去解决最后战争之后结婚，那是不是大胆预测一下《沉睡魔咒3》会有《怪3》的剧情走向，开始远征了……
NBCs,看过,较差,2019-10-18 14:04:33,14,"这是一部 “可以但没必要”拍出来的电影
副标题不应该是 “恶魔夫人”应该叫“凤凰传奇”才对
省钱喝奶茶吧 姐妹们"
发条橙,看过,较差,2019-10-20 16:32:59,6,我猜大多数女生看完之后都不禁想问玛琳·菲森的口红色号是多少？！以及，这么多年过去了，迪士尼真人童话/翻拍类电影永远都在原地踏步的拍“同一部”。
Oceans Deep,看过,还行,2019-10-18 18:02:43,24,"沉睡魔咒2不好看
主要是剧情老套。
迪士尼又在讲世界和平爱最大了，我fo。
小女孩恋爱脑被阴险王后算计的事情。
我单方面宣布这部电影入选“这都能he，匪夷所思”系列。
男主傻白甜，
女主恋爱脑，
不过小精灵很可爱。
玛琳菲森有个绝美回眸，
整体色彩构图不错。
个人愚见:
即使要宣扬“包容一切，放下仇恨重新开始”的观念，也不应该把在之前抗中路上流血牺牲的人一笔带过。他们痛苦挣扎换来的沉重的和平，那种“即使现在万般好，但是有的人就是再也回不来了”这样的感觉，不应该一笔带过，否则怎么能体现所谓和平的宝贵。
办盛大婚礼，然后无事发生快乐生活，
这是很常见也很单薄的一个结尾。

这很童话迪士尼，

也确实没有新东西。

不过有一说一，还是比小飞象、爱丽丝梦游奇境记和胡桃夹子好的。"
德卡的羊,看过,很差,2019-10-19 16:29:32,5,30/100，除了零星的几个设计还能说是有点意思，其他都是不出意外的按部就班在好莱坞散发着化粪池恶臭的流水线工厂产出的无聊作品，极度反智，感情滥到令人发指。如果问我为什么还要去忍受这种煎熬，那只能是因为艾丽范宁参演了本片。
寂地,看过,推荐,2019-10-19 09:24:01,22,这个故事又一次告诉我们，想要和平，就要拥有一击制胜的强大武器。
同志亦凡人中文站,看过,还行,2020-01-11 11:18:26,9,他妈打她妈，他和她吃瓜，迪士尼还是拍不好黑童话。朱莉的颧骨可以戳死我了~~~~~~~
Pearciac,看过,较差,2019-10-24 04:28:06,4,菲利普王子大差评，长得平庸就算了，演技简直一塌糊涂；硬要给Maleficent身世加戏败光这个角色本来的神秘感；各种老掉牙元素大杂烩导致最后效果四不像；编剧一定很讨厌Aurora这角色吧，居然写成那样；硬往鸟人里塞各个种族的演员也实在让人出戏；全片Maleficent一个角色专享磨皮，磨得比所有角色都光滑，感觉她既不是人类这边的，也不是那些脸上脏不拉几花花绿绿的鸟人那边的，是别的电影世界里穿越过来的。
Sean长安,看过,较差,2019-10-19 16:34:39,0,"5.5分
   迪士尼真人童话怪圈之沉睡魔咒
   安吉丽娜朱莉和影片特效我给2⭐
   剧情和屎一样，无法入眼
  人物设定，除了黑魔女还可以外其他的人物和shi有什么区别？尤其是爱洛这个角色，简直在侮辱人智商！"
