用户,是否看过,评分,评论时间,有用数,评论
Bork,看过,较差,2019-08-20 04:53:16,3,我不太理解這部電影。不知道為什麼要設置如此“奇觀化”的人物，如此異度空間的場景，以及如此反直觀的人物關係。台詞時而直白似水，時而詰屈聱牙，觀影過程讓我坐立不安。2019年8月19日19:00於中影南方海甸島西溪里6號廳，2019年暑假在海口影院觀看的唯一電影。
空地,看过,推荐,2019-07-27 11:53:26,16,"#13thFIRST#33
女性主义+理想主义的死亡。在当下审查条件下，竟然还能有一部如此直接从女性角度的人物状态到台词描述人对于死亡的恐惧和对性爱的渴望的作品，实属不易。“云”的概念自始至终在摄影上都高度落实，而江上的远景航拍的意境和美感上竟然高于《春江水暖》（仅仅从非长镜头摄影角度）。祝福这部电影也能“凭借力，上青云”。"
[未注销],看过,推荐,2019-08-16 18:36:20,3,"宣传“女性题材”，风险在于空喊口号的反噬，所幸本片不是。详略得当的多线、张弛有度的表达（涉及钱和性，让我想起近期的《寄生虫》和《全裸导演》），不是逼问生活（包括他人及自己），而是不求答案，更贴近润物无声。剧情走向没落入和解的窠臼，最后像是自然地面对。
摄影构图是我很喜欢的部分；点睛之笔——浮棺作为意象贯穿始终，可能是河流中的柳絮吧。"
碎碎,看过,推荐,2019-08-10 15:45:36,7,看了简介做好了沉重压抑的准备，却发现和想象中不一样，有生活琐事，有欲望，有抉择，有幽默，有和解。和每个人的生活一样，有挣扎也有解脱。很推荐大家去看
内有恶犬,看过,推荐,2019-08-17 15:17:57,4,姚晨和整部电影一样，还能更坚硬还能更脆弱还能更好。
十六。,看过,较差,2020-02-06 23:01:40,1,柳絮依靠的可是巧劲上的青云啊，可这电影使的力拙极了。这年头还要依靠做爱来强化自我可以说是十足地陷入当代封建思想，甚至于说当代女性性文明的倒退都不为过了。文艺片不文艺，商业片不商业，青黄不接，令人迷惑。相机对于记者和对于女性完全不是一种东西，从落寞的女主轻易地举起相机拍下了一见钟情的男人这个镜头开始，这个电影就彻头彻尾地肤浅了。一星给直到中风才停止打手枪的李老，一星给所谓因果颠倒的疾病学批判。
他。,看过,力荐,2019-10-02 17:11:10,4,人品抛开不说，姚晨演技从来没得挑，一个人撑起来整部戏。很多父母真的做不好父母，有一部分是努力了还是做不对，电影里姚晨的父母是根本没想好没努力去做一对好父母，当然他们也没错，为了自己生活的愉快不算自私，也是一种活明白。父母不和，俩边都觉得孩子跟自己不亲一直在替对方说话这个细节特别好。杨新鸣是个好演员，每次演什么都有不同感觉。
Steve McQ,看过,较差,2019-08-16 15:45:46,4,Just all over the place
发条橙,看过,还行,2019-08-18 17:48:16,3,表达还行，不过作为处女作的生硬不可避免。最膈应的是明明想打破对女性的偏见，寻找出口，却又左右互搏式的在对一众人物的塑造上充斥着想当然的刻板印象，无论是片中男性还是女性。并且根据影院观众的反应来看，这更像是一部喜剧片？！
谢谢你们的鱼,看过,较差,2019-10-10 11:59:20,4,整体上还是做作呀，故事看上去很有现实感，但是不论是拍摄手法还是传达的精神内核都是无比飘渺和悬浮的，一个个人物也都不说人话，很怀疑编剧是不是一直想做一个诗人。First出来的文艺片都快有自己刻板的风格桎梏了，真没劲！
郝小勺,看过,较差,2019-08-17 20:53:11,6,又傻又装逼
桃子假象,看过,推荐,2019-08-11 19:48:36,8,三星半，‘’送我上青云‘’这个片名真的是一语多关，看似荒诞反讽也很现实，姚晨演起这类型角色得心应手，喜欢‘爱欲之门’那段。
王秀云,看过,推荐,2019-10-10 13:59:36,1,应该能进我今年的国语片前三。很大的惊喜。之前宣传的绝症和做爱都不是重点，讲得很深，欲望、尊严、亲子关系、价值观的碰撞。视听感受上让我联想到《忧郁症》，风格化，能最终呈现到这样的效果，对导演有些刮目相看。
老天使,看过,推荐,2019-10-12 13:26:28,2,出生在一个和睦友爱的家庭大概不会理解这种矛盾。我希望不懂
二道贩子,看过,2019-08-16 18:28:52, ,2,和预告不太一样
黄信滚,看过,还行,2019-12-06 13:26:45,2,台词太中二了以至于把好的部分都冲淡了，浪费了姚晨这次的表演和大陆电影里难得刚而不作的女主。
朴不程,看过,推荐,2019-10-04 06:14:59,1,逝去的理想在从前永远就逝去了，遑论当下即将离别的现实。山上青黄不接的朦胧烟雨，那恍如隔世的梦幻，这一切在现实和理想中进一步迷惘妥协，最终还是离不开对死的恐惧。真假无常，除却生死无外取舍而已。不单单是女性电影，也不单单是关于性压抑，更多的是一种无力感和价值观选择。导演的立意很深，但似乎结构失衡而且太碎片化，但处女作如此很是让我惊艳。7.6
Andrew,看过,还行,2019-08-17 17:09:11,3,可能想讨论的有点多，反而显得无处着力。值得鼓励不值得吹捧。
海蛎小姐,看过,较差,2019-08-18 01:29:53,8,那些年流于表面的，爱探讨人生的青年导演们
查克,看过,推荐,2019-08-20 10:03:42,5,难得在大荧幕上看到批判男权和封建伦理的电影，尽管后半部分有点失控，但是对原生家庭和社会崩溃的批判算得上有力度有深度，个别黑色幽默的桥段很讨巧，对性自由的主张在国内院线中也算得上惊艳了。
小馄饨,看过,力荐,2019-08-16 20:42:28,4,爱欲是人的生门死门，难得的灰色主题，难得的幽默表达，也许有生硬的地方，我很喜欢
Berlinka,看过,推荐,2019-08-19 00:03:02,7,坦白讲盛男这个人物我没有任何共鸣，姿态太过了。反倒是那些看似不适的配角，妈妈，李老头，刘光明，阿毛，随着剧情的推进逐渐展现出丰富的层次感和人性的复杂性，我会更能理解妈妈对年轻漂亮的愚蠢而脆弱的失落，阿毛尊严感的幻灭，刘光明内心那份对尊严的疯狂，还有李老头，死之前最重要的是对人间美的留恋，道德和内涵不再重要。相较之下，盛男对世界激烈的对抗有太多细节显得盲目而傲慢，李老头说，爱欲乃生死之门，一语勘破那些虚妄的灵魂假说。盛男的悲哀在于，过高看重精神的价值，对自己的身体太恶劣，对自己的欲望太恶劣，即使是奋不顾身的那种求生般的性爱，也是对身体的惩罚。人如果不能好好爱自己的肉体，其实即使看重的精神也是空中楼阁，那并不是理想，那只是梦。和解不是目的。
JoeyLu陆柏宇,看过,推荐,2019-08-18 18:10:13,0,洒脱！
胖官赵,看过,推荐,2019-10-24 14:05:48,2,人物状态很有代入感，包括爱钱的四毛、憋屈的女婿、辟谷老人，甚至矫情的妈妈！人物关系确实很简单粗暴，细节也不行，但本身就是一个云里雾里的故事，一度令人想到“如梦如幻月，若即若离花”，什么评论和解析也和“你这样真的很掉书袋”完美对应。我觉得有些点是女性尤其是有过性经历的女性才能get到的，不然姚晨在床戏为什么一副司马脸，完全写实！处女作这样真的很不错。
秩秩斯干,看过,力荐,2019-08-11 01:03:06,17,看的过程中又哭又笑，有一种挖到宝的感觉。淤积在心中的肿胀多少得到消解。几乎没有一句废掉的词，导演在前面埋下的一些点在后面得到呼应的时候，让人会心一笑隔着屏幕和导演心照不宣。还是女人最懂女人，导演加编剧的腾导真是太NB了。好想推荐给所有人。
Blanc,看过,还行,2019-08-18 23:02:02,3,"【不足】：
1、矛盾激化的张力不够；
2、李老和梁/光明与盛男的身份安排太刻意；
【尚可】：
1、长途车并排座位间的缝隙，盛男半遮面一只眼睛偷偷看着熟睡的母亲，百味杂陈；
2、山岚氤氲，有种《锡尔斯玛利亚》云蛇之幻的错觉，无时空之界，无尘世之碍；
【密匙】：
1、棺木从考验人性的真伪到生死的敬畏到爱欲的彻悟之象征意义的更迭；
2、我爱你。
✨还可以雕琢的更上乘。"
Plauto,看过,推荐,2019-08-25 05:17:52,2,有魔幻主义，也有现实批判。人物性格鲜明，压抑为主。
sTill-Life,看过,还行,2019-08-19 17:24:43,3,故事选材和框架都挺好，只是出来的成片让人感到尴尬。导演处女作容易范的毛病几乎都有，女性困境表现得很做作，人物关系也很刻意，空间的处理更是让人疑惑。感觉导演想通过一些幽默让片子轻盈，再通过一些讽刺让主题沉重，但结果却是轻不起来也重不下去，挺遗憾的。/ 08.18 @锡林浩特
张咏轩Wayne®,看过,还行,2019-08-16 15:59:37,4,不差也不好，还是那一套生死遗言和人生困境的事儿，只不过在华语电影的语境中显得更平淡更力不从心，前段现实，中段魔幻，后段诗化，女性导演诗与远方的情结，有风有云是美景，有哭有笑讲格局，主题讨论隔靴搔痒，节奏却被带的七零八落，可深度还是浅薄，女性是探讨的对象，男性完全落俗的成为症结附庸，依托生与死的哲学范畴来强加女性困境的力度，又穿插世俗因素和直白释义来推动剧情，伤疤是揭开了，但怎么都感动不了人，从开头到结尾，生活仍在继续，见想见的人，经历想追逐的事，过后却似乎什么都没变过，一场声嘶力竭的哭泣，几句遥想远方的呐喊，就轻飘飘的跟世界和解了，电影像女性诗人的抒情散文，有广泛的写照，有心境的转变，也有柔软的瞬间珍藏，能被现实抽打，也能被魔幻治愈，总之开心就好！★★★
Sherlock,看过,推荐,2019-08-21 22:40:22,2,最可贵的是诚实，这点已经在中国影院缺席太久了。摄影师这个角色没写好，由此看青年女导演最需要克服的是乙女向文青病，其余人物都很立体，演员发挥奇佳且平衡。那些显而易见的缺点，也被诚实的小幽默所化解，而幽默是需要观察力的，也是稀缺的。以及，我从没在国产片中看过这么棒的床戏，一个是设计，一个是女性视角，这位导演好好沉下心来一定能做出更完善的作品。
慕容白,看过,推荐,2019-10-01 14:27:41,2,好电影，看得人难过，可惜刀刻斧凿的痕迹太明显
桃子,看过,推荐,2019-10-21 15:19:30,0,很勇敢的片子，难得的现代和女性主义。能让自己尊重自己，和让别人尊重自己，也许永远是个悖论吧。缺点大概是台词，尤其是盛男和老人的对话部分，感觉有点儿奇怪，幽默劲儿没上来，有违和感。
Jane_L,看过,推荐,2019-08-12 15:26:26,8,好看，比寄生上流有趣多了
June,看过,推荐,2019-08-10 16:39:41,7,非常惊喜的影片，镜头语言浪漫诗意，展现了满满的女性力量，不足就是剪辑混乱。本以为是沉重的文艺片，但里面的黑色幽默让影片全程没有沉闷的气氛，围绕一个得了卵巢癌的大龄女青年探索了关于死亡，性爱和金钱，依靠男人的母亲和独立好强的女儿形成强烈的戏剧冲突，每个角色都挣扎在理想和现实之间，每个角色似乎都在寻求平衡和尊重。故事并没有多深刻的结局，但盛男所有的情绪，矛盾，和对原生家庭的不解似乎随着一场性爱得到了释放，这个社会似乎没有给女性固定的标准，却又无形的竖了太多高墙。
盲忙,看过,还行,2019-08-22 19:06:01,2,“我爱你”“再说一次吧” 蛮有新意的剧本，但成片感觉还是差了一口气。其实不只是将中国女性的性压抑，而是“失败了的中国人”都压抑，“成功了的中国人”又都是张狂而专横，一副要把过去的压抑全在别人身上加倍发泄的嘴脸，一种近乎于变态的胜利，说到底都是被看不见摸不着的“面子”害的，但就像袁弘说的：面子能装几个抽屉啊？
知更,看过,还行,2019-08-23 12:23:40,3,这片是真的不行 没深度还做作 学啥学一半 讲啥讲不通 本来直白过渡就可以的地方非得整得神神叨叨装模作样 需要隐晦琢磨的呢又赤裸裸给你点透生怕大家没明白 原是冲着营销里的亮点去的 妹想到全片还真就只有这几处零星亮点 平庸至极真是没劲 导演还需要再历练历练啊 / btw袁弘这副扮相一出来可太像我男朋友了哈哈哈直接让我出戏
Starry芷,看过,力荐,2019-08-10 23:34:22,12,"8.10滕丛丛导演 北京当代moma映后场
我很喜欢。里面很多无奈的片段都非常真实，伴着插科打诨的笑点也并不觉得太苦涩，emm凭这一点觉得它的商业性还是有一些的，希望能有个好票房～
C'est La Vie ，但最后大姚那个「哈 哈 哈」表达的还是值得吧，值得坚持、也值得改变。"
轰洪哄烘,看过,还行,2019-08-17 07:33:55,2,看得出有想法有企图，但是又不甘心想抖包袱，文艺类型两头不靠显得有些低级趣味，摄影毫无个性，人物大方向都ok但都太浅，往好处想也许是新导演没有话语权所致，和《黑处有什么》的问题很像
babynana,看过,还行,2019-08-27 19:24:47,1,真正的濒死和虚构的濒死隔着无数个绝望的瞬间。我爸也说每天要大笑，可我都不想让他给我陪床，死也不想吃他狂热迷信的保健品。一开始只是渴望爱的感觉，不停的找。到最后，所有的努力都是为了说服自己忍受不被爱的生活，所有的挣扎都是为了让自己感觉还活着。
逗逼男神,看过,还行,2019-08-26 19:15:02,2,"其实无关于女性崛起，讲的依旧是人之将死就放纵而活，讲的依旧是最大的绝症叫穷。有钱即使是傻13
也能得到尊重，没钱即使了悟灵魂哲理依旧是表演背圆周率的小丑。影片在风景、摄影、构图都比较出色，故事还是平庸了些，女人们都在迷失，男人们都是傻13。"
特立独行的猪,看过,还行,2019-07-27 12:08:49,13,我可以Get到的是女性视角下的真实度与厚度。其他很多东西，内心都在困惑，“必要性在哪里”，“一定要这么拍嘛”。
观赏者,看过,2019-08-22 22:08:15, ,2,从实慢慢变虚，渐渐有所上升。导演调度确实稚嫩，但剧本能看出有很多生活历练在里面，且不限于女性。
云雀,看过,力荐,2019-06-19 21:18:33,14,"我不知如何形容 此刻我的语言都是匮乏的   也许是年龄还小吗直到映后大姚讲述了她内心中盛男该有的那个样子 我才反应过来 我在心里 是认可这个角色的 在这个被现实充斥的时代 这样的角色很显然是微小而又闪着光的 就像大姚说的那样 她像是一个女版的孙悟空 艰难前行 而又奋力的继续打怪 
电影看完之后 我对旁边的小伙伴说 那个最后结尾的人物 是在嘲讽这个时代吗 好像整个影片 除了盛男 他是唯一一个还一直守护着自己内心净土 一直保持初心的那个人 
大姚说对于结局 大家聚在一起聊了很久 最后才给大家呈现出这样一个结局 我想这是美好而又真挚的  
大姚给我的感觉 每一次都会有新的不同的突破与感受 每一次都是全新的姚晨 她有自己的颜色 爱你并期待下一次的你"
张大水,看过,力荐,2019-08-29 16:49:40,7,豆瓣好友制片的片子，五星好评。虽然拍的是川黔小城，但整个给人的感觉是在拍北京，特别是人与人之间的关系太北京了。（所以姚晨那段高潮戏是不是国内大荧幕的第一次）
子弹飞越大吉岭,看过,推荐,2019-08-12 09:36:54,13,非常喜欢袁弘的那个角色，典型的被权力和资本压的抬不起头的小知识分子，如果这个角色的解决能处理得更悲情一点会更好
熊阿姨,看过,较差,2019-10-20 23:37:47,4,所有对话、角色、开篇的冲突设置都像是90年代走出来的，唯一值得看的是袁弘这个角色，设定有些真正的幽默感。
冰镇西瓜橘子水,看过,推荐,2019-08-18 18:45:49,4,袁弘这个角色太妙了 编剧真的是人才 背圆周率这个梗绝了
伊卡洛斯,看过,推荐,2019-08-18 23:08:37,4,文化、生活和隐喻结合的很自然，看似碎片化的叙事也真实地再现了一些人的思维意识流。“我能理解并相信片中的每一个人物，不管我是否认同他们”（维斯安徒生）。
楊零度,看过,推荐,2019-08-22 13:15:52,2,一口在江上游走的棺材贯穿故事的推进，也象征着死亡的降临，它承载着社会、人性、理想、金钱、爱欲这些生命意象，朝着每一个人缓缓行进，等待人用一生的时间与空间去感知它、了解它、面对它，这是科学与哲学都不曾赐予我们的，关于人的力量。
法棍老人,看过,推荐,2019-08-13 20:38:54,10,【点映场】从女性视角出发，勾勒出一个患癌白领的自我救赎之旅，家境优渥却无处筹措医药费，只能寄希望于那一纸荒诞的自传合同。观影过程笑料不断，多处情节让人忍俊不禁，尤其做爱那段，全场捧腹，一定程度上消解了略显沉重的主题。色调压抑，画面雾气氤氲充满诗意，题材很现实，聚焦当下独立女性的困境，透过对死亡的审视，来直面崩塌的人生，最终与自己达成和解。PS：大姚姐很有气场
老袁,看过,2019-10-10 08:48:24, ,4,我只是想和大家打个招呼
水浒三国金刚,看过,还行,2019-10-24 10:05:44,0,好片微文艺，送你上七分
岬,看过,力荐,2019-08-27 19:08:10,2,无风皆絮 大雅大俗 飞虹梦中过 我已上青云
东北洪常秀,看过,较差,2019-08-17 17:03:52,4,有理想的男人你嫌穷，不穷的男人你嫌俗，不俗的男人你嫌胆小，胆不小的男人你又怪他活没你手指头好。这世上男的都死绝了就好了，好期待导演在摆脱男性的情况下做一部独立女性电影，看看到时候该做低谁来抬大女主。
比多,看过,推荐,2019-11-15 19:59:12,1,挺好的电影。就是太拧巴了。编剧和演员拧巴，编剧脑子里想的不是演员演出的那个劲儿。一众好演员没被结构好。编剧作为导演又无法控制，太拧巴了。这本子要是保罗·索伦蒂诺导应该另有味道。或者这位导演保留，让一个懂结构的编剧重新结构一下，效果会倍增。
要丸,看过,推荐,2019-08-16 18:32:12,9,"中国版的《寄生虫》，不是一部女性电影，只是以女性为第一视角切入，顺道讲了平时国内不敢碰的女性解放这一话题。片子如题，讲的是“好风凭借力，送我上青云”有钱你才过的舒服，过的有尊严。不管是毛毳还是刘光明，都是想依附着富人的风向上平步青云。
不论是美术台本还是镜头都是国产中的翘楚，但构建的成分太强烈了，人物标签偏平，但故事纷乱迷离。感觉一切都想一场梦一样，很不真实，有时候想讲得太多也不是好事。"
"""eMily""┆rehab",看过,还行,2019-09-01 19:25:00,1,剧情还是不错的，就是让姚晨给演垮了😔全程觉得是苏明玉来客串了🙄️三星全给杨新鸣👏袁弘演的也不错
Xaviera,看过,推荐,2019-08-18 04:42:01,2,不完美卻足夠大膽，是這個時代，這個市場需要的作品，且希望能看到更多這樣的作品出現
