用户,是否看过,评分,评论时间,有用数,评论
哪吒男,看过,还行,2019-08-16 21:55:45,247,哈，哈，哈，油腻有时，清净有时，被辱时时，这是写给世界上最后一个聪明人的打脸诗。骄傲没什么了不起，低头，足够轻盈，就能飞起。
汪金卫,看过,很差,2019-06-18 14:03:28,583,【上海电影节展映】又一部女性主角、母女吵架撕逼主题的国产片，很烂很雷，五雷轰顶。角色设定简单粗暴而奇葩。不屈权贵的记者女主身患癌症一心求欢做爱，力扛女性独立大旗而不得方法。五大渣男配角（掉书袋弱男、见钱眼开男、枯木逢春男、恶臭大款男、为父不尊男）竞相献丑，加上一个嗲声嗲气惹人厌恶的跟屁虫母亲凑成欠抽六人组。台词矫情扭捏得让人一边起鸡皮疙瘩一边笑出声。时而卖弄文艺上青云，时而脏话连篇接地气。观感坐立难安。锅在编导剧情设定，连少部分亮点金句也被淹没。姚晨演得越努力，越显得尴尬。看完大笑三声，如释重负。P.S圆周率不是这么背的
大奇特(Grinch),看过,推荐,2019-07-27 12:35:50,65,三星半，剧本首先是写人物，对女性内心的欲望有较为全面的展示，拥有女性视角和关怀，也得益于女导演执导。以生死之门打开情欲之门，角色由浅入深丰满，越往后越入佳境。同时，以戏谑和黑色幽默来化解影片自带的感伤，这个度挺难掌握的。很喜欢那个演妈妈的演员吴玉芳的表演。
57,看过,推荐,2019-06-23 23:09:34,52,生活在今天这个温吞社会中的人应该能从这部电影中找到共鸣，不论男女。它讲述的不是一个女权主义的故事，而是更普遍的一种困难，简单说是那种怎么只要做点正确的事就哪哪都不对的哭笑不得，更深刻的版本是，人对自我实现的期望和肉体存在本身的欲望局限，永远地在我们身上拉扯。
木卫二,看过,还行,2019-08-18 17:27:46,139,"时下+86们叫嚣的“我们有钱了""，被这部经济下行、人生寒冬电影，敲得粉碎。但片子最大问题，好像是风格杂糅不统一，不少台词干涩生硬。以开头疯子一脚、结尾哈-哈-哈三声，本片应该是带黑色荒诞意味的轻喜剧，如频频起跳的脏话粗口。可在切入家庭内部关系时，电影又变成批判色彩。贵州外景的云水缭绕，又自带艺术片腔。横空飘来的斯文眼镜π，更是想要尊严，就让你看看尊严被踩的样子。还有粉红西装男，单凭“别跟我啪，啪了之后，你的余生会永远回味这棒棒哒性爱”之类的台词，真乃新油田之子。当然，其他男性角色也没有好到哪去。"
影志,看过,推荐,2019-08-23 00:56:56,22,“只有走的远，才能看清世界” 我想和你做爱、多少钱才肯做、背圆周率到后一百位…不少笑点让这部电影更心酸。然而这么直白的女性表达，在华语环境应鼓励多于挑剔。结尾的“哈！哈！哈！”才是人生真谛。笑一笑，十年少啊，哈哈哈…
暖,看过,推荐,2019-06-18 22:39:25,83,在一种浩劫的状态中展现女性在人生面临坍塌之时那种逻辑溃散的状态，喜剧而轻佻的语调正是这种溃散的本质，处处散落的意像在最后皆有收尾，正如好风凭借力般轻盈，也有种若重的沉甸甸。笑点非常之多，大约人生也是如此傻逼。
杨立青ylq,看过,力荐,2019-06-19 00:26:26,190,像不像每个人一团混乱的生活，盛男像极了每个人的缩影，只不过她比大多数人更加的不幸，经历了特殊混乱的家庭，一份不是想象中的工作，甚至还疾病缠身，有几幕看起来挺荒诞和讽刺，但是盛男却做到了大多数人不敢做的勇敢，试扪心自问看到了所谓扒手又有多少人敢站出来，甚至冒着被报复的可能。电影的命题很宏大，无论是亲情，爱与性，死亡和轮回。每一个命题都无比宏大，只是看起来轻快是否又真正的就是轻盈的呢？电影里并没有给我们答案，而每个人心里都也有一个回答，这个回答也不是答案。因为人生不是一个问题，所以更没有答案。结尾那一句我爱你，还是让人有所触动。每个人的不同即是特立独行，所以每个人都是疯子。
王大根,看过,较差,2019-08-16 19:50:14,357,太做作了，真的太做作了，里面每一个情节、每一个人物、每一句台词都感觉是只可能发生在文艺青年真空世界里的，离真实世界三十万公里，怪不得叫“青云”。很多台词放在美国文艺片里没什么问题，但是用中文口语说“你还没有体会过真正的性爱”，是不是就感觉哪儿哪儿都不对？姚晨真精明啊，连着三部女性题材，纵然难看，也会让人觉得“但是能在国产片里看到这种主题还是很难得对不对”，但是就算再难得，难看还是难看啊……
法兰西胶片,看过,还行,2019-06-17 19:36:30,98,7分。我觉得这部戏最棒的地方就是创造了很多罕见的人物，除了梁冠华那个角色不够对称之外，其他角色都非常有趣，挖苦即关照。但缺点也很明显，人物经常被梗带跑，对梗的依赖，会造成人物的仓促，另外结局要是拍得再形而上学一点会更好，这明明就是一个无解的结局，它不应该还留在这世上，一定要飞起来的，不然上不了青云。
凌睿,看过,较差,2019-08-16 12:12:26,293,"和“女性电影”没有任何关系，就是一部职场片而已。
“职业操守”完全是伪命题，盛男拒绝写自传也和职业操守无关。
她不是一开始就拒绝了，是大纲都写好了，要签合同了，李平一句“甲方都是衣食父母”让她不高兴了。
哪有工作不受气的？哪有当乙方不被甲方侮辱的？
李平在甲方中都算非常好的了，又不要你一直改，又没有过分的要求，她听了一两句难听的话就宁愿损失30万也要纠正对方，简直就是典型的职场反面教材。
电影对金钱和名利的探讨太肤浅了，先把毛毳塑造成财迷，然后得出结论：不要做财迷，还是刘光明那样的不与世俗同流合污的人更好。
先把李平塑造成暴发富，然后得出结论：不要追求名利，还是李平父亲更朴实无华。
你不喜欢毛毳，就一定要去喜欢刘光明吗？你不喜欢李平，就一定要以李平父亲为榜样吗？就没有第三个选项吗？"
酸奶熊妹,看过,较差,2019-06-14 10:50:57,131,前后矛盾，不知道想表达什么
HarperDie,看过,很差,2019-08-11 16:37:17,122,半星。如果用粗制滥造来形容影片的质素，我都会觉得很对不起姚晨。但就公映版来讲，真的令人诧异。一个很有发挥空间、关注女性个体状态的题材，被处理得很空洞。叙事的完整、通俗化的口白并没有缔结出优质的果实，相反，很多桥段如同隔靴搔痒，感受不到角色本身的灵魂。即便是姚晨的表演、曹郁帮了很多忙的影像，也呈现出段落上的良莠不齐，七八个星天外的自如感消散不见。
是乌乌呀,看过,很差,2019-08-12 00:14:43,106,真的是太烂了，一星都多。要不是冲着映后姚晨到现场交流我根本忍不了了。故事讲不明白，台词说不明白，连电视剧都不如，想不明白大姚为啥演这片难道就是因为是“电影”吗？求她别自毁前程呀，导演太差了。交流时说的话很明白就是个爱装犊子的文青（贬义词），主持人也是没招，只能往意境上靠。观众也是傻逼，以为自己看不懂就是牛逼就是艺术嘛，可别逗了。电影史上那么多厉害的艺术片，电影该有的基本要素都很完善，基础做好了再拔高。在对谈中，大姚自己都不看好票房。真的是太烂了，不仅浪费我时间还在侮辱我的智商。
不良生,看过,还行,2019-08-22 18:18:03,137,说不清楚哪里好，也说不清楚哪里坏。黏稠的，雾蒙蒙的，游离的，汗涔涔的，湿漉漉的，破碎的，拧巴的。像是人生。姚晨说“不知道怎么活才是正确的”，大多数人都不知道答案。其实人生就是一个巨大的瘤子，长在身体里面，我们以为喝水就能清心寡欲，可到头来还是想吃肉。于是只好躺了下来，将一团糟的线团般的生活捻出一根绳来，在自我安慰的幻梦中哈哈大笑三声，扶摇直上青云。活着嘛，就是与瘤共存，带瘤生存罢了。
maggietutu,看过,推荐,2019-06-18 23:14:41,68,siff影城 导演处女作，影像上确实稍显稚嫩，不过好在剧本非常抓人，每个人物都饱满而讨喜，这部亚新奖的水平比金爵奖高了太多。国产剧情片少有的锋芒，处处充满着黑色幽默和女性力量，用诙谐自然的方式消解生活本质的困顿和无望。姚晨的人物气质太吸引人了，尤其喜欢她和刘光明在船上的一段对话。
低端的一日三岁,看过,还行,2019-08-13 12:55:49,82,太做作太假了吧？袁弘演技让人出戏。
徐若风,看过,还行,2019-08-16 11:40:42,57,昨天看了制片人的推荐日志，还蛮期待的，没想到emmmmm，不具体写缺点了，只能说是上影亚新入围的正常水平。当然，也有不少好的地方——放在今年华语片的环境里，这样全然女性视角的人物书写，以及姚晨的演技，也算值得鼓励吧。
马 夋,看过,很差,2019-06-17 18:21:17,83,上青云意味“女上位”。电影里那段，先是女上位，然后欲求不满，男性不行，要靠自己自慰获得高潮。但是可怕到要命
Кинo,看过,很差,2019-07-27 12:40:47,61,影片节奏太差，找不到表达的核心。在场的业内大佬纷纷表达自己的赞赏观点，不知道是为了迎合什么。影片的节奏太乱了，商业气息的浓重冲淡了影片原有的抗争之力，发言时姚晨抢着发言，完全忽略了核心创作者导演的感受。不过《送我上青云》这个名字是本届影展中与电影内容最为匹配的一部片子。讲述的为性、为爱、为自由奋斗的女性，却在其他的故事线分散太多精力，不过姚晨在片中对光明的爱慕之情我是能体会到的，每个人都喜欢有才华的人。两个人是需要互相吸引的。
olivia,看过,很差,2019-08-09 23:33:06,47,年度戾气最重女主角，我真是服了这些使劲儿假装讲述女性困境的片子了。
一只神奇海绵,看过,力荐,2019-08-14 00:32:38,87,不止是一部女性电影，更是一个关于尊严与体面的故事。难得的是以如此轻盈的方式讲了一个又丧又燃气的故事。众生相。
寒枝雀静,看过,较差,2019-08-16 11:24:47,63,1.5 / 把各种社会关怀用最浅白的方式几无情境建树地怼到你面前，最后的效果就和一篇心灵鸡汤推送差不太多。很久没有看过这种全是轻飘的概念毫无落实的电影了。没有姚晨谁看得下去啊？——但尽管如此，依然是本周最值得看的一部，至少有在相对边缘的视角讲一些不一样的东西。虽然这种站在主题立意角度的片面夸奖，真的很勉强。
费马的马,看过,力荐,2019-06-17 22:31:10,106,看了上影节首场展映。电影比我想象中要好，是这次影展的惊喜之作，整体完成度很高，画面极美，配乐动听、且到位，姚晨和母亲、李老的表演都十分可圈可点。我本以为是十分文艺气息的电影，没想到观影时大家笑声频繁，很诙谐幽默，在诗意的表达的同时，影片对时间、死亡、爱欲的探寻就不会显得那么苦大仇深。是很合我胃口的片子，国内这个类型的片子非常少，很开心现在有这样一部电影出现，加一星以资鼓励，映后见面会姚晨说起了幕后制作，摄影、美术、配乐、调色等等都是业内大佬，制作很过硬。上映绝对值得一看。
二火山,看过,还行,2019-08-13 00:28:33,57,设定上来讲可以说是富家版的苏明玉，父母依旧不靠谱，姚晨电影电视剧无差别的演出让你看不出任何痕迹。整体是文艺的，不过故事性还挺强，前半段转场切得生硬，后半段渐入佳境。时日无多处世的淡然与本能欲望的释放，也是在形形色色各类人的困境中找答案，有几场戏很喜欢。切回演员本身，姚晨最起码证明了即便是40岁的女演员，依旧可以演床戏，如果她能演符合自己年龄女人的困境，说不定能突破现有的表演瓶颈，就更好了。无论从男人还是女人嘴里说出来，“我想和你做爱”都要比“我想和你打炮”更能让对方感到一丝尊重。
老特拉福德大鸟,看过,很差,2019-08-18 23:53:34,46,能不喜欢袁弘吗，身背徕卡手拿哈苏，遇见路边老太太就发钱。这对佳能小妹简直是降维打击。
嘟嘟熊之父,看过,较差,2019-08-18 15:49:16,64,不是姚晨诠释角色，而是角色服务于姚晨，臣服于姚晨，一个藐视权威傲岸不羁的独立女性形象全靠春晚小品式扁平化同行的衬托才得以不露出马脚。不论突如其来的癌症，抑或淡薄的亲子关系，都不过是掩人耳目的诡计，以一种最粗暴的标签化方式呈现最去标签化的女性困境，是本片最本质的问题。
___肯德基先生,看过,还行,2019-06-17 18:28:01,53,台词写得太差了，剪辑也让故事很破碎，难以抓住情感走向。三俗段子太影响观感了……
葡萄猪不爱睡觉,看过,较差,2019-08-14 12:01:56,66,一部平庸之作，贴上某些标签之后可以营销口碑了
月歌,看过,较差,2019-08-13 00:06:41,32,"［英皇首映礼］两星半，不知道说啥好，讽刺效果是有的，但女性自我和家庭主题都没太讲清，视听一般，台词是硬伤。真的不想再看电影学生作业一样的文艺片了…"
掉线,看过,推荐,2019-08-17 02:01:45,29,【C+】有点有趣有点尴尬。故事是轻盈的，背景，情节，配角们，都有种浪漫的虚幻感，仿佛走进一场梦。但大量描写，台词又十分明显在揶揄现实，很多时候调子也太沉重。最后电影是飘没飘起来，沉又沉不下去，上青云上一半卡住了。想法ok，通过不同阶层，年龄却同样迷茫和痛苦的众生像，让身患绝症的主角对生死的得到领悟，也对自己的人生释怀。但双方联系几乎都建立在一些符号化的交流里，看得到幽默却看不到真正有效的碰撞，最后的爆发因无处使力自然也就泄气。导演还是犯了大部分新人都会犯的毛病，沉迷于自己的“妙笔”当中，最后真正要表达的却力不从心。幸好那股丧而暖的气质还是拍出来了，再充着诚意和姚晨的表演，加半星到四星。
Heartj,看过,推荐,2019-06-17 17:24:24,63,我觉得这就是我的未来。190617上海
CharlesChou,看过,较差,2019-08-18 18:56:15,20,从袁弘出现开始想逃走，坚持看完后真的身心上了青云【姚晨很努力是真的
内陆飞鱼,看过,推荐,2019-10-11 22:38:47,9,没想到《送我上青云》是这样一个故事，一个大女主的生死故事，失败女记者的颓丧、孤傲、寂寞、倔强，以及濒死的身体欲望，很精彩，配角们也有意思，不是纯写实，带点黑色意味，挺有趣，没想到姚晨还可以演这样的文艺女汉子的角色，压抑中的笑点拿捏很好，其他演员也张弛有度，释放自如，片子节奏感也不错，娓娓而来不闷，稍微一点遗憾是有些时候台词太满，像急着抖包袱，有时候又太松，像絮絮叨叨电视剧。总之作为导演长片处女作，拍成这样很不错了，是今年白雪的《过春天》之后，最惊喜的处女作。
Arrow Shaw,看过,很差,2019-08-09 23:10:49,30,虽然在荧屏上看到中年女演员扛旗很高兴，但是感觉扛错方向了...姚晨去拍一个女演员生活大概会好一点，求放过女记者吧
弥耳猫朵,看过,力荐,2019-08-18 01:55:50,74,影片本身我不会给五星，但是看见被戳了肺管子的玻璃心某群体故意打低分，那没办法我就是要给五星，我们缺乏女性视角的作品，而现状就是一个男人说了正确的话就代表全体男性伟光正，指出群体中的害虫就说搞性别对立，有些作品只是用了女性做主角，但换成男性立场同样成立，可在某些人眼里以女性为主角就是女权主义，如今的影视作品中大多都是物化女性，仿佛女性除了谈恋爱一点用处都没有，如果这样一部陈述了事实的片子就让某些人感觉到被冒犯，那么请问看了这么多年无法塑造正常女性尊重女性的作品的我们，是不是要气死了？
马吟吟,看过,较差,2019-08-16 18:50:30,27,pretty bad
Mr. Infamous,看过,推荐,2019-08-11 16:20:22,27,看盛男和四毛仍在争论记者一个月拿几千块图个什么，还在钱与脸间摇摆，感觉自己这条路历来连悲瘦都算不上，何来壮？但饶是所谓成功人士恶臭地呈现嘴脸，没成功的也没能过得高洁，遑论被尊重。就像姚晨映后所说，盛男一直强调想做正确的事情，但正确的定义哪有定数。就连她，被告知有卵巢癌时，第一反应就是“没有乱搞男女关系，几年没有性生活”，人大抵总逃不过被驯化的可能。电影好的地方在于，她不用背负做一个完人的要求。众生相被展现时，也没有过于脸谱地构建关系。哪怕有些台词并不口语，有些行为过于天真，但整体上，姚晨、吴玉芳、杨新鸣等人的表演，以及一些相对有趣、大胆的段落，可以弥补。映后听姚晨跟滕丛丛讲话，寻到很多有意思的角度，包括女性视角、觉醒、争议、床戏解放、票房等等。新导演有这样顺畅且有味的作品，值得鼓励。三星半。
Aboo,看过,推荐,2019-08-11 11:15:35,26,这电影想讲生死欲，全都是送命的大题呀，创作者或端庄或蔫儿坏的表达竟交出了一份有惊喜的答卷。真，是优点之一，人物、台词和戏，落地了，姚晨在这种“真”里演得就自如；有市面上不多见的切入点，但不矫情不迎合不消费也不贩卖，是当下华语电影里较稀缺的可约上好友闺蜜一起看看然后还愿意认真多聊几句的作品，能感觉到导演滕丛丛有想法且自信，未来可期；兼有温暖善意的力量，我看完就有想给身边独立优秀的女性们一个爱的抱抱。虽还没和导演核实，但感觉像洪尚秀、锡兰这些当代电影大师的养分已经开始滋养到现在的年轻创作者。当然处女作，瑕疵也都有，再轻盈点就好了。
凹凸,看过,力荐,2019-08-17 18:47:30,43,不觉得只是题材讨巧，也不觉得台词做作矫情，倒是借一个喜剧的壳洞察到了人生的无力感与挫败感。妙笔颇多，规避开了同类题材最常见的套路，什么与现实和解，什么找寻自我，活下去就不错了，哪能悟出那么多答案啊？最动容的一幕也不过是将镜头对准了妈妈，最大的反转也不过是一记打在自己脸上的嘲讽。有短评说“干扰主题的东西太多，挥出去的拳没打到要害上”，可这不正是片中所说的轻盈吗？
LORENZO 洛伦佐,看过,2019-08-12 01:48:33, ,46,风景挺美的。
無 念。,看过,还行,2019-07-18 16:24:51,25,意外地富有灵气和喜感，看似散漫实则充盈着一种漫游轻巧的飞驰感，颇具“送我上青云”的浪漫意味。这次的人物困境虽然仍主要围绕单身独立的都市女性，但其实也对周围的人进行了不少着色，县城乡镇和都市气质在一种看似二元对立的状态下有着十分微妙的嘲弄融合，人物关系也很值得玩味，是一种自反中透露出自爱的爽快和耿直劲。上映后可能市场反应会比较一般，但我还是蛮喜欢这片的，那种感觉很难以名状但是又真切地戳到了你某些地方，华语片中出现这样的生活小品，尤其还是出自新人导演之手还是挺难得的一件事。它确切地告诉你，对于不同的人来说，生活的痛苦和烦恼有一百种模样，选择释然不一定能解决问题，但至少看起来很酷，哈！哈！哈！（很容易理解姚晨出演这个角色的心境，但还是稍微觉得她在这个项目里作为监制和主演所把控的比重过于高了）
蒜 | BOY A✎,看过,还行,2019-08-20 16:09:42,20,难得有部电影可以如此直白的表达性，反复提到的性生活，性欲望的渴求，老年人的性，甚至女性的绝经和自慰，这是一次非常的突破和进步。同时影片提供了一种女性观看男性的视角，女性思考世界的方式。它直面女性的欲望、自我、尊严，同时也用女性的眼光，关注男性的欲望、自我和尊严。所以这不单单是一部女性主义的电影，实际上，这部影片所表达的是有关理想主义、尊严与孤独
btr,看过,2019-08-21 00:42:24, ,20,梁美枝呀你不要哭了～
帕拉,看过,还行,2019-08-18 14:11:20,10,像是章明《冥王星时刻》与杨明明《柔情史》的结合。
黑道快餐店,看过,很差,2019-08-13 19:28:24,30,太矫情太做作了 强忍着坚持了一个半小时…… 里面角色都不太正常
晚不安,看过,较差,2019-08-18 01:41:05,18,电影不是设定，设定终究无法让人感同身受，电影是一个生命与另一个生命鲜活的相遇和碰撞，在虚构的前提下，它必须摆脱捏造感从而贴近观众的心灵，这与是否现实的风格无关。《青云》看似有很强的女性意识，然而支撑这个骨架的血肉难以成立。如果在建构文本上有刻意为之的地方，那么导演思维和具体执行还欠缺得太多。一个可以足够深刻的议题最终被简单化，于是我也着实被浮皮潦草的情节冒犯到了。诚然，在这样的环境下谈性、谈欲望很难得，但是怎么谈难道不是一件更重要的事情吗？至于强调的幽默和自嘲，都生硬至极。
西帕克,看过,还行,2019-08-17 11:41:25,16,其实是一部公路片，像是文艺一点的《等风来》。有一点小丧，也关注到了一些女性困境。但编排还是太散了，停留在写段子的阶段。
调反唱唱,看过,推荐,2019-08-12 10:17:17,20,3.5生死是什么，大笑三声。
一二三,看过,推荐,2019-06-19 00:16:40,36,很久没看到这么自在的国产片了，幽默和刺痛的处理都很巧妙，在九十分钟内几乎把每个人物都塑造得生动可爱。管它什么科学哲学灵魂信仰，“爱欲是生死之门，我从哪儿来还回哪儿去。”
我爱罗宾,看过,推荐,2019-06-19 09:44:10,28,渐入佳境，开始以为是解构都市女性的精神世界，结果特别惊喜没有说教和苦大仇深，完完全全有趣灵魂式的喜剧风格。姚晨的题词最打动我，几个配角也很出彩。由奢入俭难的李九霄神似小栗旬，哈哈哈哈
提图,看过,推荐,2019-07-26 10:34:24,27,电影本身毛病存在，但在大陆荧幕上看到对男权文化的讽刺和嘲弄，女性情欲的表达，尤其是那个自慰的镜头，都要给四星
,看过,较差,2019-08-16 17:23:11,24,"【2019年8月16日-北京百丽宫影城国贸店】
整个是一喜剧片！简直是“送观众上西天”。矫情、做作，一塌糊涂，好不容易找到一个关乎女性的电影，奈何碰到一个末流的编剧和导演。
核心议题从始至终都没有表达清晰，拍云里雾里，编剧的脑回路也在云里雾里。瞎玩视觉元素，最基本的叙事都没搞明白，就想走作者电影的套路。
整部影片也就是“我想和你做爱”这一句台词值得一听，谁想到下一句台词直接笑喷。
没错，这是女性题材电影，但没有让你消费女性题材！"
自心,看过,很差,2019-08-14 00:48:43,39,感觉什么都没说明白
郭连凯,看过,较差,2019-08-18 23:44:53,25,比上海堡垒难看
pallas,看过,力荐,2019-06-18 17:20:37,53,气质非常独特的片子，轻盈、幽默、流畅。看似波澜不惊的铺陈之下是尖锐锋利的女性表达。
黑狗成,看过,较差,2019-08-16 11:46:54,23,刘青云老实人疑惑脸.jpg
寇寇谋,看过,很差,2019-08-20 00:27:36,11,脸谱的人物，生硬的关系，牵强的视觉意象，最无语的是，微信公众号的愤世嫉俗竟还想做出一番哲学表达。几乎一无是处
居无间,看过,还行,2019-10-01 23:28:30,11,2.5。文青矫情病没得救。基本上所有人物都流于符号，难以进入，角色塑造太刻板印象。就像软饭男，能忍着背圆周率那么久，突然就因为一个人崩溃继而跳楼，真的难以置信。寻求尊重，是影片的一个主题，但，处理成领受灵堂拜礼和坚持体位在上，前者荒诞后者无趣。女主嫌恶老李，他一两句话就点化了她，成了她的寄托。仔细想了下它的问题，还是调性不统一。一会上下求索形而上，一会黑色幽默，一会揶揄讽刺。编导都力有不逮。
Beatrice,看过,力荐,2019-08-11 15:29:51,26,特别好看！故事完成的太喜欢了，有几幕让我想到洪尚秀，那种对话和画面太舒服了，对于一些人生的探讨也是点到为止没有过多解读，很舒服，文子的音乐也很好。之前看短评说袁弘的角色可有可无，才不是呢，他那个角色太重要了！主创演员都表现的太好了，特别喜欢。ps 这根本不是女性电影啊。有机会再刷
