用户,是否看过,评分,评论时间,有用数,评论
怀璧不予,看过,还行,2019-10-18 21:55:20,10,卵巢癌手术前的寻性之旅。遗憾的是，由于加了这个前提和时限，电影中想要传达的东西很多，偏偏就是没有传达出“女性的性需求”。这不是性需求，而是被爱的需求、被需要的需求以及被尊重的需求，盛男近乎饥不择食的状态，找掉书袋酸叽叽的文艺男被拒，找油腻圆滑满脑子发财的男同事也被拒，最后还是个疯子跟她说了两句“我爱你”，才让她笑得出来，她看不起傻白甜老妈“找男人才能找到自我”的蠢样，装坚强装独立，其实她自己何尝不是这样，真是太可悲了。
Zack,看过,很差,2019-08-19 02:18:08,16,这片子画面的调色就给人一种很直观的难！看！ 低俗老套故事梗还要添点儿文艺意象的佐料 最后什么都没讲出来
舌在足矣,看过,较差,2019-08-05 07:49:44,25,三流电视剧剧情，所有要表达的东西都几乎是硬塞进去的，整个影片飘在半空中的不真实感倒是和标题挺搭的
有心打扰,看过,推荐,2019-08-16 17:38:08,16,哈哈哈，台词还挺好笑，你问我哪里好笑，说真的，走出影厅之后基本就全忘了。影片的调性不统一，不然可以更好，整体还是喜欢的。最后，姚晨结尾处的自慰段落，在我看来可以算是华语院线电影的神来之笔了。
kylegun,看过,力荐,2019-08-25 23:46:39,6,右手中风是黄昏恋的动力；祼和裸的区别；即便熟背圆周率也无法理解时间或灵魂的丈量方式；鞋柜和丧礼适合享受磕头；由简入奢易，由奢入简难；掉下江里失踪的棺材……又一部国产新喜剧，前半部尬戏较多，后半部渐入佳境；说它只黑直男还是片面了点，分明黑的是社会嘛，简称黑社会；还从一位豁达父亲的角度解构了父权的虚无，挺好
思郁,看过,推荐,2019-08-17 14:55:54,16,如果不看结尾，真的是很好的国产片了，可惜到最后积攒了一片的矛盾、困惑和反讽，导演也不知道怎么收尾了，从半夜偷西服那段开始，已经有点绷不住了，结尾简直莫名其妙就完了，就跟姚晨最后没办法，只能打了三个哈，哈，哈
獨孤島主,看过,较差,2019-08-19 08:54:13,16,比较严重的主题先行，与编导能力难以匹配。
韩松落,看过,推荐,2019-08-21 17:56:41,12,小时候看女娲神话，女娲破开混沌，造出天地，轻的上浮成为天，浊的下沉成为地。人就在浊的地上生存，却想着青的天，想着无欲无求成为云，无挂无碍成为虹。生和死这样的大事，会成为穿越清浊，由浊及清的契机吗，会换得病愈后的心清目明吗。《送我上青云》说，并不能。反而，当死亡临近，换个眼光看青天浊地的时候，越发觉出不耐。
OreoOlymLee,看过,较差,2019-07-27 12:29:32,32,一部视角闭塞的电影。男性角色只有在特定场域下才能得到刻画，情绪和人物关系的起伏变化都经过了精密的商业考量。
外出偷狗,看过,还行,2019-08-18 23:43:51,5,难以置信，这么粗糙又充满漏洞，却是银幕上难得一见的现实/女性题材。
phoebe,看过,推荐,2019-08-18 19:53:31,10,"情不自禁地想念起顾长卫来。
立春里王彩玲还好吗?
孔雀里的姐姐还好吗?"
室内滂沱,看过,较差,2019-10-02 05:46:47,13,电影的问题其实是现阶段内地所有年轻导演都多少会遇到的问题：除了主角明星以外的全部角色，都一看就是学表演的人，身上还带着演员那股风采，而没有真正进入各自的角色，人物特征只靠妆和衣着来区分；故事和对白一看就是被人写出来的，一点不自然；仍保留着非常浓的学生气，想诊断时代写活人物，可是缺乏对人生真正的体察，对社会的理解十分之乖；无法将影片体恤人物时展现的柔软气质和影片节奏合理结合到一起，流于温吞；缺乏真正的个性表达，说不出一句别人说不出来的话。在片头就预感不妙，出品公司的logo连篇累牍，加起来足有十家，主人太多当然影响作品。“老戏骨”让影片看起来像电视剧画风，完全没有从学院和制片厂话语系统里走出来，话题看似很犀利，但内在是个比任何人都乖的乖学生，电影行业不太容得下晚熟的人，请继续加油。
锐利修蕊,看过,还行,2019-08-16 21:12:04,15,规规矩矩的写法，干干净净的拍法，但也仅停留在全盘托出的表达。虽然是近几年难得的女性关怀，可依然逃不脱以病为因，辅佐生死观，从而和解为果的老生常谈。偶有惊喜是母女间的对话，梁妈妈简直是混合了我和我妈的做作毛病，让我边看边乐得不行。其实我还是挺喜欢这个借用《红楼梦》作梗的电影，但是说出“好风凭借力，送我上青云”的薛宝钗，在我的认知范围里，的确借风使力不被人喜欢。不过恭喜姚晨，终于有了一部电影方面的代表作！
深夜声噎,看过,较差,2019-08-17 19:27:07,16,怪恶心的，除了谈性爱欲望的其他所有部分基本上都是，也不是没有好的地方，但凡有点好感的地方下一秒马上又被恶心冲掉了，佩服导演的安排，有钱人的生活就是这么有病且矫情的嘛，就当我仇富了吧，不想在学区房奋斗72小时了，快送我上青天。好想看昨日奇迹洗洗眼睛和耳朵。谈女性欲望身体我喜欢的，但导演为啥不专注点还要不断批判一堆无聊恶心的玩意儿现象，现实很丑陋大家都知道了，没必要找那么多烘托，好好拍好女主本身不好么，再深点用力点而不只是骂骂丧话。对了，就想告诉一下，请别人给写的叫传记不叫自传，如果是代笔就是跑业务。
宋雯婷,看过,较差,2019-09-01 23:37:45,13,姚晨很努力，我也一直夸姚晨，但是这一部，不好。演得不够好，因为人物的成长太硬，盛男精神生活里最深层的困境和痛苦没有被诠释出来，她仅仅是因为没有性生活而痛苦么？因为没钱而痛苦么？因为缺爱而痛苦么？不是的，这个角色的痛苦肯定得在于自身，她最后必须从内解决问题才行。现在问题全在外部、全在表面，只是看起来厉害罢了，实际上都是唬人的。人的内部成长，一定是在于寻找，这才是更好的落点，寻找，却找不到，想要勇敢，却跟自己之间存在斗争，最后放弃寻找、放弃努力，在此刻获得快乐，这个人物才会高级，现在太多硬凹，盛男这个角色完成得远没有母亲流畅动人，太硬了。而且最后一个男人压在一个女人身上，要跟这个女人上床，并跟这个女人说，我成功是想要被尊重…… 最后这女性还跟他上床并“得救”了，不是我说，咱能不这么侮辱女性吗？
远子,看过,还行,2019-11-08 19:38:08,8,拍得太僵硬了，像是先想好了主题，然后往里面塞戏……“姚晨”给卡片上的“裸男”打电话的时候，我心想这片子终于要好看起来了，哪知道她是给人家纠正错别字。您不是记者吗，怎么还犯起编辑的毛病了……
涣雨,看过,推荐,2019-08-16 16:08:44,11,刘青云:？？？？？？？？
Koli,看过,较差,2019-06-17 17:55:48,26,哈 哈 哈（男主-1🌟）
开膛手贝塔,看过,还行,2019-10-06 22:17:38,7,女性视角映出的世界，跟当下社会并无太大不同。想要跳脱窠臼，却依旧无法逃出。于是大笑三声，在面无表情中，装做快乐，好让自己解困。有佳句，无佳章，有心，无力。姚晨以为剧本是好风，剧本以为姚晨是好风，结果都错过了青云。
康报虹,看过,还行,2019-10-03 18:23:10,15,很难去定义的一部片子，甚至说不好它到底“好看”还是“不好看”，《送我上青云》就像一个矛盾的集合体，看似是一部简单、轻盈、格局不大的女性主义电影，却探讨了诸多复杂的问题（面对死亡的恐惧、原生家庭的扭曲、不可言说的欲望等等）；塑造了一个个怪异、病态、精神失常的角色，却让人感觉如此真实、如此鲜活；充斥着生硬、尴尬、刻意制造的桥段和令人费解的台词，却总能一针见血地戳中要害。它既是荒诞的黑色寓言，又是写实的生活真相。
迦南Canaan,看过,还行,2019-08-11 15:59:52,6,出人意料，整体给人一种很轻盈的感觉，虽然涉及到了一些在平常华语院线电影中很难见到的且略沉重的元素，例如对于死亡的讨论；女性视角的故事；甚至女性自慰的情节...都是很大胆的尝试。如果把盛男这个角色横向作为当下年轻都市女性（or男性）的一个缩影、现状的一种捕捉来看更有趣，整部电影的涣散和迷茫感其实具有普世意义，这种无意义的方向就是生活本质。唯一的遗憾就是整体过于文艺了，且并非晦涩具有美感的那种，而是一眼看穿比较无聊的那种。以及这部电影和我当下的心境其实还挺契合的，一定程度上也有了银幕外和我的互文，好感max。3.5星入3，姚晨可以继续往这个路子走下去，会更好。
seamouse,看过,还行,2019-08-16 15:58:48,6,女人片，不大看的来，还好主角不是会让我想抛坑躲的怨妇形象，不过也彻底没法进入叙事，在角色关系发展中产生丝毫共情。黔南的取景和拍摄确实神秘而有死亡气味，然而过多的象征进一步消磨了故事情感。
我是白,看过,很差,2019-08-18 22:59:32,15,太可怕了
曼仔,看过,还行,2019-08-23 00:38:08,9,电影本身两星，为社会意义多加一星。身边朋友对这片儿的评价非常两极，一部分人认为是惊喜之作，另一些人则觉得其中女性主义之矫情幼稚简直让人尴尬。我个人观点更近后者。这片儿当然有非常有价值的地方，比如大陆电影里的女性难得正面、正式地在大银幕上表达自己的性诉求，甚至里面有一段女主masturbate的镜头，但这个我觉得社会价值大于艺术价值，就影片本身来说，角色的单薄与符号化、行为的夸张与不合理，实在难以称得上是好的观影体验，而且导演想讲的东西非常多，男女、亲子、生死、爱欲，但是都夹杂在一起，并没有厘清。同为今年的“女性电影”，我更爱过春天，甚至柔情史的一些细节都更让我心有戚戚。整部电影实在是太标语化了，每个角色、每句台词，都是导演在对观众喊话，太直白了。
一颗毒蘑菇,看过,推荐,2019-08-11 12:37:20,25,如果宣发把电影定位成“女性电影”我觉得不够准确，其实是透过盛男的遭遇讲她自身和社会关系里老人、男人各路人等的“求不得”，其他人在困境中索取、求生反过来也会加深她的困境。所以所谓“上青云”是想获得内心所需要的事物，四平想要获得成功，梁美枝想要获得赞美，刘光明想要获得尊重，盛男想要获得爱与理解。导演最后也给出了什么东西是可追的，什么东西会成为无法抓住的浮云的答案。虽然盛男的经历很惨，但导演并没有拍的很苦大仇深，对男性女性的调侃、对自我的嘲讽，反而有很多轻松的笑点，处女作加一星鼓励。
顗礼,看过,力荐,2019-08-17 19:29:32,10,大概是今年到目前为止看过的节奏最舒服的华语院线电影，导演很聪明也很有想法，而且难得的没有让“小聪明”和“小点子”凌架于导演的作者属性与全片的整体节奏之上，反而是用有趣又接地气的方式探讨了所谓“生命哲学”的大母题，相当有灵气和才气了；唯一可惜的是结尾部分俗了点，有点破坏整片的气质；然后，请那些“经验丰富的专业电影人”们看看，同样是拍亲子关系，同样是通过把男人写成臭傻逼的方式来讲女权，这个片子不知道高明到哪里去了。
面包面条面饼,看过,还行,2019-08-04 12:24:35,10,3.2/5 棺材作舟 死亡是主角
躲猫猫社社长,看过,2019-08-18 18:19:59, ,5,"Good characters, a questionable plot, but a shit end. “人生他妈傻逼着呢”补字幕。其实是很适合用新浪潮手法来展现的片子，试想一下，故事里的傻屌们说着傻屌的话，姚晨冲屏幕翻几个生无可恋的白眼，绝对上一个层次加分，这种自我意识self-awareness可能比宣泄情绪更有效，可惜。"
小A,看过,推荐,2019-08-17 23:53:20,10,非常独特。似乎是另一种视角的Paul Verhoeven《她》，借由意外突发事件，推动女主角重新思考自己的人生态度和价值观，借助特殊经历的女主角的眼睛，观察社会上各种人的人生，反类型化的叙事和象征意义赋予影片独特的气质。很大胆的处女作。
沛沛,看过,推荐,2019-08-12 20:14:27,22,我喜欢这部《送我上青云》。生死当前，女性（也可以说人类）的原始欲望和人文尊严得到了考验、展现。一纯粹，就给劲。其实没什么故事，但全是流动的心意。盛男，想接世俗地气而终不得。刘光明的忍辱负重学，四毛的成功学，老爷子的落日哲学，吴玉芳的中年粉红学，都真真儿的。本质上不矫情。即使看着像矫情，也都是人类奔走的自然曲线。
Enjolras,看过,推荐,2019-08-17 18:22:37,8,其实在我看来，这并不是一部女性电影，而是以一个女性角色为中心，展现了现代人的生存现状以及对于尊严的不同态度。对于盛男来说，尊严是追求理想、高风亮节，但最终不得不像厄运低头；对于刘光明来说，尊严是在穷人面前的施舍，是在高谈阔论时的飞扬，转身还是低头在土豪家中装孙子；对毛毳来说，尊严就是要赚大钱，但一边赚钱就得一边放下尊严。关于女性的情欲表达和自身反思都是影片中值得讨论的内容，而对于男性一定程度上的批判也有痕迹，但这些都不构成这部作品的全部，也并不是这部电影唯一值得探讨的地方。不过可惜的是，电影的导演终究还是经验尚浅，故事叙述得还是略显松散了一点，在提出一连串的问题之后，结尾还是使用了含糊抹去的和解，升华一下可能会更好。
beremot,看过,力荐,2019-08-12 22:11:51,17,虽然我是个男人 虽然我没有面对过生命的终点 虽然我没有过几年没有盛男的困境 但是我懂得什么是绝望 什么是渴望 什么是希望 我懂得人与人之间的隔阂与理解 伤害与尊重 懂得人生中现实与理想的残酷 更懂得星空与大地的温暖 在不只是一部送给女人的诗歌 更是一次当代人的呐喊
bloom,看过,推荐,2019-06-22 10:10:53,17,中国弗兰琪。
殇潮|Enigma,看过,推荐,2019-10-02 20:37:52,6,太喜欢假知识分子的描写了。
五色全味,看过,还行,2019-08-21 18:38:31,0,處理和劇作其實都挺粗糙；但在當代中國電影範疇中，少見的寫出了一個有自覺和反抗性的女性角色，現實批判性上也不乏尖銳。值得鼓勵。
云淡风不清,看过,力荐,2019-08-10 15:57:51,23,这几乎是我看过的第一部真正意义的国产女性电影，盛男也是我特别喜欢的一个女性角色，她自我独立、敢爱敢恨，原生家庭的过去限制了她却也成就了她，她有愤怒却也能宽恕。面对死亡，她有真实的恐惧和彷徨，也有很多的不甘心不服气，虽然直到面对死亡才释放了她对欲望真实的好奇和渴求，可让人遗憾却又无比真实的是，哪怕是这一点点欲望、欢愉都是靠她自己自我满足的。就如同从一开始，就是她独自一人面对这个真相颠倒、疯子放火的世界，一个人去医院被告知患癌、一个人去采访写稿凑钱治病，一个人最后带着对自己灵魂绽放的笑容被推进手术室。邂逅的的才子，亲密的家人，熟悉的同事，他们都在她的身边，却又没有一个人愿意真正参与她的生活。电影里的每个角色都在寻求被爱、被尊重的可能，都希望找到免于死亡、免于被遗忘的可能，都是孤身一人，无分男女。
鲸鱼君,看过,推荐,2019-08-16 10:12:16,12,《送我上青云》：它将女性的困境集中到一对母女身上，30岁主张个性，永不妥协；50岁寻求依靠和安全感，两者却殊途同归，难逃孤独窠臼。它大胆表达女性对性的渴求和支配身体的权力，实际是用弱势的立场特立独行着。影片氤氲着迷雾的颓靡美学，扣题又规整，颇有寓意。提名：最佳新导演(滕丛丛)。★★★☆
yuan,看过,还行,2019-08-20 22:33:33,6,嘲弄了一下中国男的不行，要么精神上被阉割，要么阳痿，要么活差。
冰山的阴影,看过,还行,2019-10-04 13:47:46,3,要是李老自传的虚构文本与他们的现实生活能够发生互动就更好了。
好好地,看过,推荐,2019-08-16 18:41:04,10,后劲太大。前半段看似荒谬和尴尬的段落，后面都有了承接。只是这承接撕开或荒诞或搞笑的表面，一针扎进患处，戳破脓包，鲜血淋漓。原来人活一世，最幸运莫过于天生傻逼。
Morning,看过,较差,2019-08-26 08:33:38,4,这个电影就是你刨除了它的所谓大的意义后会变得一点意义都没有，是一个无聊的冰冷环境，不过是偶像悬浮人设的另一个变种，只这个人设和这个情节设置得叫你“害怕”，引诱你去走向现实层面也许和电影毫不相干的不好的一面。人设做得极致，而事情和精神讲得模棱两可，在拍法上又修饰极强，总之是一部我觉得很不触摸你的心的电影，最后和DK又总结出来，这个电影也是恐怖片女主人设：没有朋友。
夏奈,看过,力荐,2019-08-20 00:38:09,7,名不见经传的导演和一个在我心目中曾被定位为“喜剧演员”的女明星奉献了今年最棒的一部国产文艺片。
Heattech小伙,看过,推荐,2019-09-01 15:53:35,6,摘去女性的标签 只看作一个人和周围一些人的生存困境  我是喜欢这片子的 梁美枝 李老头 四毛 刘光明 每个人在爱和尊严的漩涡里打转 是有神的  而盛男 从名字开始 就倾向于一个人设 一个符号 这决定了她承受不了过于沉重的“传达欲”  即便姚晨演得再好 也免不了单薄而失神了
陆支羽,看过,推荐,2019-07-28 11:19:57,4,4.0。
小夕在流浪,看过,力荐,2019-09-01 21:38:33,4,五十元的2D却比想象还要好，默默流了泪也笑出了声。看到很多评论说太标签化太扁平没有一个正常人，无法苟同。成年人的世界正常早已是没有的事情，只有快乐的与不快乐。这一年过的很辛苦，也曾在苏州河边哭着说不甘心，在杭州的城市中心大声喊要成为一个有钱人，无数次和人吐槽含明量超过黄晓明的经理我是怎么难以忍受。真的，渴望成功才是绝症。被人说了很多次太沉浸在自己的情绪中，也被人点破如果你想留在这座城市就要接受含明量高的上司就是一种常态，可是再怎么咬牙啊，我还是感觉那么难。每一个不那么幸运又没有快乐能力的人都是悲剧式的人物，是盛男也是我。
飞行官,看过,推荐,2019-08-19 18:47:29,6,《送我上青云》好看的，我可以再看一遍。算是文艺片吧，但里面有很多黑色幽默，其实可以再稍微商业一点。有个问题是导演要表达的太多，其中有些表达完整了，有些没有。不过瑕不掩瑜，我蛮喜欢的，希望这类电影会越来越多。
NatureLB,看过,推荐,2019-08-16 12:20:58,6,豆瓣到底什么时候开发7分功能啊
Black Tulip,看过,推荐,2019-08-20 12:50:00,3,挺有意思的故事，设定也很巧妙，一个完美的闭环。我们不需要什么参透天机的大道理，有时候一点有意思而又小启发的放松就可以了。
Derridager,看过,还行,2019-08-31 22:20:22,4,怀疑此故事取材于高行健名作《灵山》：相似的寻找框架和若隐若现的长江水系。但这部电影的主角在途中遭遇的陌生人，都不够轻巧、偶发，像一部展示日常怨恨和不满的文艺女生日记。离《灵山》有不少距离。另外，如果将“我想要”简单地与宝钗的“送我上青云”联系起来，恐怕就犯了那个入赘女婿的错：随意嫁接。也不知道这部电影到底想讲什么？世俗与理想的冲突？还是女性意识？
SleepWalker,看过,还行,2019-08-10 20:49:26,10,在内地院线电影里，尺度算很大了，一些双关台词真是挑战审查底线。导演很有表达欲，中年女性焦虑、母女关系、性别歧视、职场生存危机、对死亡的解读......不可谓不丰富，可就掌控力来看，实在太嫩了，给人一种欲言又止的不畅之感。姚晨的表现也没有去年《找到你》那般精彩，我相信这无比接近生活中的她自己。
瑞波恩,看过,力荐,2019-08-23 22:41:00,6,五星鼓励吧，在这个特别的剧荒时期，而且黑色幽默也对我胃口。欣慰地看到姚晨的表演愈加成熟，显然她已经不再是那个“傻大姐”郭芙蓉了，从去年上映的《找到你》到年初的《都很好》直到如今的这部“上青云”，姚晨走出了一条属于自己的现实主义影视路线。当然她塑造的角色也大都是都市里貌似刚强实则脆弱不堪的女强人。这部“上青云”绝对不只是在讲一个身患绝症的女记者的心路历程，主创的野心是要打造一部类似黑泽明《生之欲》的厚重感电影，人在面对生死时应该有什么样的处世态度。虽然有些地方表演还是浮夸了（比如盛男的妈妈发嗲，背诵圆周率的文艺男），还有国片难以摆脱的说教意味，但总体完成度还是不错的，姚晨担纲本片监制，也可以看出她走向幕后的一种心情。
火龙果只吃籽籽,看过,还行,2019-08-21 02:51:58,9,看得正入戏 导师连发十二条语音质问我为何不在学校 我太难了
同志亦凡人中文站,看过,还行,2019-12-17 02:04:43,1,隔靴搔痒的女性焦虑。姚晨演的剩女在丧和痞之间来回切换，连做爱都到底意难平。既然是新人导演的毕业作品就不苛求了...（印象最深的是河上漂流的棺材）
灰色堡垒,看过,2019-10-30 21:30:28, ,1,想法还不错，执行得不好。
老珂,看过,还行,2019-08-21 14:20:44,3,这个片子在正式公映后的一两天，官宣设计了几款把当前获得的“成绩”罗列上去的宣传海报在网络散布，特兴奋。其中包括“豆瓣得分7.4”，这个着实把我惊吓到掉下巴。一种“山中无老虎，猴子当大王”的井底之蛙既视感跃然眼帘。难道区区7.4分就值得如此大张旗鼓作为一种成绩来炫耀，这是对中国制造的一种莫大讽刺，好吗？
突然粉碎,看过,还行,2019-06-18 01:11:55,5,年度脑洞最大的华语剧情片，身处金钱社会，每个角色的动机都不单纯，男权的牺牲品和反智的牺牲品一相逢，就觉得他俩会惺惺相惜，可是睡了男闺蜜就代表女性性解放了吗？？还不是自己动手解决问题
子恒,看过,还行,2019-08-17 13:52:22,4,文艺片也好，有探讨也好，首先是一部电影，得好看。国内文艺片受众不够，大部分是因为确实不好看
Mona Lishark,看过,2019-10-10 00:00:29, ,1,豆瓣儿关闭的第三天，fuck，fuck，fuck。
LoudCrazyHeart,看过,还行,2019-08-20 00:40:05,1,我们到底应该顺应生存的底层需求而背离初衷原则还是大不了饿死一股劲儿拧到底地忠于自我和操守？大龄女记者和男性文艺中年两个人物的设定非常关键。他们代表了当下一类人，他是向往着灵魂却没办法身体力行的尴尬和自我麻醉，他也是经历了各种坚持却被现实要求顺应潮流而反抗的执拗。对女性的刻画我觉得是比较差的，就原生家庭的影响着一块就很具体，例如女主和母亲在老头面前哭诉一切那场戏，很差力道。好在剧本上袁弘那条线的伏笔够狗血够打脸自己的目光，尊严或许并不是多大的事，但你不能没有。
鲸落,看过,推荐,2019-08-17 11:32:12,13,这片儿太有意思了，终于有人正视我国女性的情欲问题。片中，男的道貌岸然地在那里聊灵魂是什么，姚晨演的角色突然来一句：我想和你做。画面一切，男的落荒而逃。还有结尾处，男同事四毛说：凭什么你想上我就不叫强奸，我想上你就是强奸？哈哈哈哈，振聋发聩。我鼓励男性受到性侵害后多去公安局报案，这样才能更好地促进男女平等。
Scripting,看过,还行,2019-10-02 18:32:11,1,没有公路的“公路喜剧”，讲的是年轻人的困境——当你认清生活无奈的真相时，依然热爱生活。就像日剧《非自然死亡》三澄美琴：有时间绝望，还不如去吃好吃的然后睡个美美的觉呢。重要的是看开、看淡。赢或输不重要，重要的是出戏啊！
仿真男孩哪吒,看过,还行,2019-10-03 03:17:19,5,看完发觉自己是个变态，竟然想和梁美枝谈恋爱：)
