用户,是否看过,评分,评论时间,有用数,评论
N记丧青,看过,推荐,2019-11-18 16:53:11,12,父亲母亲相互搀扶着登到山顶，一年四季普照的阳光，见证着父亲的自白与母亲的泪水，也审判着历史里的每一个人。如果说具体的角色是在特定地影射着台港陆，那到底要流谁的血、付出怎样的代价，才能与过去和解、与伤痛和解，继续向前，影片已经给出了一个足够黑暗的答案。当港产华语还在迷茫，台产华语已经下定决心了，我们又准备好迎接未来的风雨飘摇了吗？林生祥的配乐很好听，台北航拍镜头也很棒，为不能在影院里看到的朋友感到遗憾。2019.11.09 HKAFF MOViE MOViE（作者：水泥）
爱教练的吴蜀黍,看过,力荐,2020-01-29 00:45:51,6,我小的时候成绩很好，很听话，从不打架从不惹事，热心帮助别人，无论好学生坏学生，大家都爱跟我交朋友，无论男老师女老师大家都很喜欢我，所有人都对我寄予厚望，但他们只看到了我“完美”的表面，很少有人知道我偷偷抽烟、偷偷看黄片，和班上几乎所有男生做爱——我想，可能是这些阴暗的角落让我更加“正常”，没有像阿豪那样突然崩溃。我有一个堂兄，他大我两岁但是是我的同班同学，他打架、XD、花天酒地，他被送进去又出来，他跟阿和一样搞大女生的肚子，女生也一样对他死心塌地跟他结婚生子，他们一起开一家干货店努力生活，但他没有一位父亲帮他撞死“圈中死党”，所以他34岁的时候死于XD过量。看电影的整个过程都压抑到死，我一直以为阳光普照的地方最温暖，后来想想，可能我们每个人都需要在阴暗的地方去乘乘凉。
HurryShit,看过,还行,2019-10-14 20:18:04,11,或許是鍾對模糊性拿捏最好的一次，要說陽光普照的是家人溫暖或灼人恐怖都有理。三次上帝鏡頭的處理（前兩次出現於母親幫助小玉，後一次是阿和脫險，從奔跑橫拍到垂直俯視；上帝鏡頭本身的感受潛力開發，保護、監視、同時也是不安，扣回電影大量出現高處，且阿豪是跳樓）、兩次陰影蔽日（一次是阿豪自殺；一次表面上是阿和陷險，但以共時性來看，毋寧是父親殺舉）所指向的行動類比性。血緣性（小玉、曉真，因女朋友而被籠罩），反觀菜頭、黑輪⋯整個家庭到最後其實沒什麼改變：依然不說，如媽媽叫阿和把「掌握時間把握方向」冊子藏起，不要給爸爸知道；最後一場騎腳踏車的戲，為何腳踏車要用偷的？（家人之外者，依然是被排除的）鍾孟宏似乎也不願給出明確態度，就是看這一家在時間流轉（或許就是使用〈花心〉緣故）下繼續生活。死亡如何被捲入敘事。
超cute侠,看过,推荐,2020-01-27 22:51:07,10,钟孟宏这次真的很生猛，用一个家庭的悲剧去折射千万家庭的内部问题，24小时的阳光普照可能就变成了烈日灼人，躲在缸底的司马光又何尝不是渴望有阴影可躲的哥哥自己，而一直处在黑暗里的弟弟不过希望在天气好的时候能和妈妈骑单车透透气，正是由于父母与孩子沟通之间存在隔阂才导致了a son成为现实的悲剧。前半段拍得特别好，儿子出狱后节奏有点儿慢，结尾父亲陈述真相体现父爱的手法也不是很高明，当然瑕不掩瑜，演员们个个选得好演得也好。
二月飞雪,看过,还行,2019-12-06 09:05:38,19,大儿子因为长期在家庭中扮演太阳的角色，其实心里不堪重负，已经有自杀倾向，小儿子则选择了破罐破摔。
胤祥,看过,还行,2019-10-08 23:52:19,11,#24th Busan IFF# 亚洲电影之窗。感觉不是太行，虽然“父爱如山”讲得不错也蛮动人的，但是整体上故事讲得比较凌乱，金马估计是要凉……男主陈以文可能还能一拼（但是[叔叔]那俩其实都很好……），女主虽然好但是李心洁更好啊。摄影估计也要凉。这就有点尴尬了。
Sonata,看过,推荐,2019-11-06 00:24:16,15,大兒子自殺前的衝突能多一點強一點就更好了，動畫令人有點出戲，阿河和媽媽演得都很好。結尾騎腳踏車能更長一點我可能就哭了。爸爸幫媽媽那段若能不用講得方式回顧過去畫面，能在當下敘事會更驚心動魄。好劇本，好演員。畫面規格能更高就完美了。
Hiroshi,看过,还行,2019-10-28 22:00:23,15,正如影片155分钟时长所提示的，电影的容量和野心很大，少年犯罪、收容制度、自杀问题…它试图照进台湾社会的多个阴暗角落，但最终，影片的核心还是关于家庭，特别是关于父何为父、子何为子这一典型的东亚式命题，这也是反复出现的台词“只有一个孩子”所寓意的。影片的故事很圆满，有伏笔，有对照，但它的缺点也同样明显，即因为执着于讲好故事，它不懂得节制和留白，而当结局揭晓，实际上它早已不再重要，或者说它的谜底早就被我们知道。
苦月亮,看过,力荐,2020-01-26 18:14:42,7,好电影的标准是能拍出生命之艰难的，艰难但人在不能再逃避的时刻就是绝地反击了，很喜欢阿和在高速上奔跑的戏，和《南国，再见南国》结尾有异曲同工之妙，甚至看到父亲在学生拿到驾照的时候说的那些话，恍惚间有点《一一》的感觉，钟孟宏导演朝着大师前进吧！！！两个半小时的电影没觉得长，很清淡，好像远处飘来的香木，樱花簌簌落在行人的衣服上。又好像脚印在雪地吱吱的声响。
花地,看过,很差,2020-02-01 03:21:39,13,以庞大的意象为题眼却只满足于构建文本内部小世界的奇情情节，横向纵向都毫无辐射面。不是舒缓就能制造“文艺感”，事实上“阳光”的调用只是功利主义的剧作含糊，更大的问题是叙事能力太差，感悟体和情节剧的语调节奏不清，导致结构的松散而非松弛，欲求达到的家庭和解则着力点和力度都孱弱不堪。我们看到一个特殊的家庭，却从未看到关于他们的生活细节，看到得只有对家庭受难共同体的想象。
欢乐分裂,看过,推荐,2020-01-24 22:55:42,6,3.5；一个面临分崩离析的家庭，在万物同享的阳光普照之下，终于从黑暗走向光明；虽说偏向于日系，但戏剧化更甚，叙事线头较庞杂容易冗余枝蔓，且易于电视剧化。最感人的无疑是点题的哥哥，一个将爱的光芒撒向周围每一个人的孤寂者，他的内心即是深潜于阴暗的“司马光”，在梦中告诉父亲、去监狱探望弟弟，他都只说一句“我就是来看看你”，太催泪了，如果有那么一个人能读懂他的心思呢，能解开这个浅浅微笑后面的心事呢。通篇看是「父与子」，从「一个儿子」到「一个儿子」，世事走过这么一大遭，人生啊谁能想得到！每个人都在风雨路上跋涉，最终说服自己，告别自己。菜头也是一个非常有亮点的角色，其实后半程的剧作有点失控，幸好虽有点奇情但幸好圆回来了。
翻滚吧！蛋堡,看过,还行,2020-02-03 01:44:05,9,除了许光汉那条线，剧情一直在冗长的情节剧里打转，略微干瘪
魏晓波,看过,推荐,2020-02-12 01:43:48,5,可怜的菜头
浅水艇司机,看过,2020-01-25 01:48:26, ,11,我穷，我没有一个地方可以痛哭。
Polaris.J,看过,较差,2020-01-26 02:22:06,11,"4/10  越想越不行，有些小细节蛮好的，4分都给细节。金马奖就算了吧！
设定太狗血…哥哥莫名其妙，怀孕女友的处理莫名其妙，整体 莫 名 其 妙。一点也不生活…
叙事不可，镜头又太直接了，明明可以内敛一点， 台词搞那么刻意想玩文艺，最后还要靠父亲来一段抒情拔高 没意思。是枝裕和影子太强了 但人家是枝裕和不需要这么刻意"
シリウス,看过,还行,2020-01-26 18:01:30,3,热带雨输给本片真是让我缓缓打出一堆问号。湾湾的家庭剧总是写出很笨拙的台词，不知道是不是那边家庭文化的折射（非贬义）。而这种完全可以删去30min以上的笨拙与繁琐并不等于叙事的完整。如果是美国冲奖片绝对会全员报配，陈以文靠typecast赢下影帝也有些莫名其妙。最好的部分是在这么高度戏剧化的叙事中凝聚着东方气韵的运镜，这也是这样的情节剧没有TV质感的原因。
康堤,看过,推荐,2020-01-30 12:42:00,4,听到了最好一版的司马光故事。
红豆♥,看过,推荐,2020-02-08 21:18:27,7,我可是个驾校教练，我可忍不了别人这么给我难堪。
有心打扰,看过,推荐,2020-01-26 16:27:11,7,每个人物都写得太好，哪怕只是出场几场戏的配角，以至于每个人物的言行、遭遇和结局都深刻牵引、拨动着观众的心绪。通过人物的塑造，以此构建出冰冷、阴暗的水缸空间般氛围，最后又通过人物的转变，打破了水缸，让阳光照射进来，有阳光，有阴影，有残酷，也有温情，这就是生活，这就是人生。
陶者无缰,看过,推荐,2020-02-26 06:42:05,3,花的心，藏在蕊中，空把花期都錯過。你的心，忘了季節，從不輕易讓人懂。為何不，牽我的手，共聽日月唱首歌。黑夜又白晝，黑夜又白晝，人生為歡有幾何。
谢谢你们的鱼,看过,推荐,2020-01-27 14:54:19,4,果然是钟孟宏的不凡手笔，一个残酷、温情以及黑色交织在一起的家庭电影，一场另类的亲情和解，一次对于现实的无能为力。不被承认的弟弟，被期望压垮的哥哥，口是心非的父亲和为爱硬撑的母亲，这个家庭如此畸形，却又如此的贴近着我们每一个人，最终的最终，在经历了那些巨大的失去之后，我们才会去珍惜那些渺小到不行的幸福，终会等到，阳光普照。
rovaniemi,看过,推荐,2020-01-25 11:31:52,9,每个人的生命中都需要阳光，也需要阴影。真的很喜欢哥哥和女朋友去动物园，弟弟载妈妈骑自行车的两段。
烟波人长安,看过,推荐,2020-02-13 19:23:14,7,浪子改过自新理直气壮，其实是为了逃避曾经的错误；小混混不想在车里抽烟连累朋友，反而成了身死的契机。人性和命运永远是互相缠绕的两条巨蛇，替别人着想的，未必有好报，自私自利的，也未必受惩罚，也许从来没有什么善恶，只是人的每一个行为都有它天然的代价罢了。
阿德,看过,推荐,2020-02-03 21:41:57,5,完成度真好
方枪枪,看过,推荐,2020-01-27 20:12:25,3,有共鸣，有感动，这或许就算是一个好的电影。就像，电影中重复出现的半明半暗的云，何尝又不是人生的写照。
cliosong,看过,还行,2020-02-05 12:23:28,4,（6.0/10）我并不怎么喜欢两种电影：故事走向难于预测、用小概率事件阐释普遍真理。
Omar,看过,很差,2020-01-26 20:41:44,10,这个剧作太差了，没头没尾的跳楼直接劝退
蒲末释,看过,推荐,2020-02-07 18:30:22,3,小叔坐牢的那些年，爸爸意志消沉，有一年夏天打完麻将回来，凌晨一两点，走到家门前的一口池塘，穿着一件单薄的短袖，坐在洗衣石上，一点一点往池塘中央走，水积到腰了。那个时候的他应该是想往暗处走吧。
刘一达,看过,力荐,2020-01-31 17:21:26,3,看到一半的时候稍微有点泄气，猜到了结尾。感谢袁哲生。配乐太好了。
YiQiao,看过,还行,2020-01-24 21:29:47,4,三星半//光影相生 三个少年的设立层次分明//音乐和画面粘合催化情绪 摄影漂亮偶尔会以为在炫技 故事一边撒着狗血一边煮着鸡汤//陈建豪发现自己困在缸里 喑哑着发不出求救的声音 但导演在时间上的塑造欠缺让他失去了本来该有的冲击力//其他人物也是 每个人都讲到但都只讲到一点//层层叠叠的无能为力的令人难堪的困境//带了血色的和解 回味都是苦的//时不时会有感觉 这是一部至少混合两代台湾电影内容和情感的作品//今天的太阳好吗
超人叔叔,看过,推荐,2020-01-25 14:19:14,2,最公平的是太阳 所以有了阳光普照；送别的《花心》听哭 爱的代价有多大
寒枝雀静,看过,较差,2020-02-12 17:21:58,2,2.5 / 一小时沉稳的生活碎片连缀后疯狂崩塌，最终真的就只比《地久天长》好那么1点点。好在钟孟宏对情节剧的表演与抒情方式的那么一丢丢自我反诘，这种反诘带来了颇为微妙的局部语气变化。但除此之外，这就是一部表演、配乐、摄影看上去都很“好”，但就是逐步放弃了电影各元素扭结尝试的半成品，甚至可以说是一片狼藉。让人产生导演能力无限趋近于0的怀疑。
苏乏,看过,推荐,2020-02-09 21:12:46,3,一场“意外”将外在和内涵颠倒，如同司马光杂碎了缸，也便交换了缸内外的光明与黑暗，阿豪的变故重启了人物关系，让弟弟得以不在自己的阴影中——并摇身一变成为父亲，同时换自己永远匿身世外，不再被比较还能随时去“关照”家人；让父亲真的如自己所愿只拥有一个仔，可惜是弟弟而非哥哥，仍不得不放下可惜拾起珍惜。影片试图用错的行为带来的影响去矫正错的时间中不可能正确的方向，意图最终得到相对“善”的结局。从哥哥开始，到父亲结束，甚至在小女的养母和菜头身上，编剧的意图同样适用。所谓阳光普照缸中人，是要用击碎什么来换的
皮革业,看过,还行,2020-02-12 12:17:48,4,出狱前的部分非常棒，后面急转而下，山顶戏彻底败笔，另外陈以文的表演也太过台湾舞台腔……
Pekingcat,看过,力荐,2020-02-20 22:29:48,4,台湾电影真厉害，导演是大佛普拉斯的摄影和制片，这部电影是他自编自导自摄。为什么台湾人这么会处理家庭题材，真的绝了。
猫奴十二年,看过,较差,2020-01-29 12:13:28,4,编剧缺少理科思维，没有串联起整个片子的主题，更没有找到统一的风格和情绪，想打造成忧郁系文艺片，反转却接二连三，不乏视觉刺激的镜头，而且好多情节点缺乏逻辑、段落不明所以，最大的问题是这一家人没有谁是出彩的
のり子,看过,较差,2019-11-27 03:44:59,7,鍾的攝影就是美，他也知道自己的攝影很美，所以就拼了老命炫一下，這種行為模式大抵跟在交友軟體上秀出自己肌肉或屌有多美的人差不多；欸...這樣不是不好啦，只要剪接拉得回來就好～但偏偏就是一場戲能夠簡潔兩三顆鏡頭講完的卻硬塞到各個角度都要放好放滿一個不留，最後導致節奏散漫拖沓。就不提那些灑狗血的八點檔橋段、尷尬的台詞（導演需負責）與強迫讓人發笑的又不好笑的黑色幽默了...多一星給生祥配樂吧。
過期罐頭,看过,很差,2020-01-29 21:47:13,2,有些段落尚可。这片看得如坐针毡，恨不得2倍速。
撕撕撕,看过,推荐,2020-01-25 23:38:39,5,3000.有点有佳句无佳章的意思；被菜头的设定抓住了，可惜少那么一两场（比如站在他本人视角的）戏；即使不如预期，你也很难在 当下/说国语的范畴里 看到更好的现实主义电影了
半掩门儿的~,看过,推荐,2020-01-30 21:48:26,5,以为手握把盘就能控制方向，以为沉默相对便能守住时光，以为身披铠甲方可铁石心肠，以为沦为傀儡便能赎回阳光。谁知阳光普照的背后是阴影，亲情和解的背后是血腥。 生命拥有裂隙，阳光才能照进。多么令人心碎的电影啊！
超大型巨人,看过,推荐,2019-11-02 03:39:20,5,私以為會是鍾孟宏繼《第四張畫》後另一回家庭類型嘗試，結果相較前者而言本作則是各方面皆是飽滿狀態（亦差點以為是鍾孟宏的集大成之作），家庭分崩離析或是光明陰暗的設定對比給這個看似調性走偏一點必然成為人生劇展的故事增添一股新氣象，群像戲之掌握拿捏還算的上可堪（反倒是在人物單一表現空間下就出色許多），而大兒子作為本作核心點題人退場的速度比想像中還要來得迅速，劇作雖然飽滿但在鍾孟宏頭幾部作品常見的結構問題依然還是未有太大的改變，黑色幽默的部分倒是認為是服務敘事調性掌控最好的一次，在表面如此緩和氣氛下收尾實質卻是一層陰影籠罩則與《第四張畫》收尾時的憂愁狀態又一次湧現。
非虚构,看过,推荐,2020-03-04 16:02:42,3,"00:06:36，非现实空间玩的好。00:24:24，6.8.48,很棒的对峙设计。00:29:18，车设计的好，打了隔断对二人关系又有了含义。00:36:50，音乐起。00:41:43，还补了个大景！00:48:37，兄弟俩第一次会面的分寸把握得很好。00:54:20，我槽！01:07:40，既然用了绿幕了，是不是应该变点啥。01:11:38，当然不放心啊，但至少我陪着你一起不放心啊。01:18:28，歌。01:31:11，爸，要不要喝个东西。（导演不骄不躁，心极静。）01:55:38，这就是没有手掌的感觉。02:07:17，菜头这个人物立住了！02:07:31，空镜头竟然可以这么拍！02:21:00，最后的一击，把所有的疑问全部解决。"
烧炭小五郎,看过,推荐,2020-02-18 20:09:11,1,巫建和也太像钮承泽了
Heattech小伙,看过,推荐,2020-02-10 23:29:38,4,影像中被悄悄略去的阿豪的那一跳是真正的生活流水的冲击 自然且强大  （相比之下 那些被仔细叙述的人和事反而显得略为刻意了
发条饺子,看过,力荐,2020-02-07 20:13:54,1,剥去阳光与阴暗的敏感和隐喻，不算上略带狗血的剧情和炸裂演技，打动我的还是朴实细腻的情感和家庭关系的肌理，第一次如此深切的感受到了配乐和摄影之于文艺片的份量。
某妮,看过,推荐,2020-01-31 17:38:59,2,虽然支离破碎此一生，终究缝缝补补又一年。
WakingBruce,看过,推荐,2019-11-19 14:54:30,4,【77】一部很常规的家庭温情片，局部上还是有一些耐人寻味的情节设置，角色的情绪状态也基本到位，不过整体编排还是太过松散，三年前后的段落之间甚至也存在着很大的割裂感。虽然情绪丰沛，但几个主要角色的形象刻画还是稍显单薄了一些，传递情感与思想状态的手法也略显直白(除了司马缸那段)。只是现在还能看到台湾导演可以拍出如此沉稳细腻的生活质感，确实还是挺让人惊喜的。
异鄉者 🎞,看过,推荐,2020-01-24 19:42:55,3,“这个世界最公平的是太阳”，好几处的蒙太奇恍惚中竟然觉得这就是《少年的你》的姊妹片。他们都是生活在角落里的那些人，也都是那些在阳光普照下环顾四周设法找一处阴影躲起来的人。
山下林,看过,推荐,2019-10-31 16:00:34,3,#TIFF2019.导演很懂煽情，知道在正确的时间点用怎样的镜头放什么样的音乐说什么样的台词，但煽情反而显得有些鸡汤和山寨。整部电影的中心太散，也没有传统意义上的主角，更像是对一家四口的每个人进行深究与探讨，而这个四个角色的刻画却都不够深，像是很多电影会犯的大野心的错误。观影过程不是特别享受，但回味不错。
未卜,看过,力荐,2020-02-05 00:36:14,4,"很多年了，说起台湾最好的电影，大多数人可能都会说是《一一》，现在大家可以说，《阳光普照》，也很不错。
导演一定是要有很多人生的阅历，才能拍出这样的电影，全家人都是闷葫芦，有什么话都憋着不说。所以当最后阿文讲出那些事，我都不觉得吃惊，好像他那么做，理所应当。有些剪辑初看起来很奇怪，但是仔细品来却又是留白的妙处。当镜头扫向阿文家的天井，“卧槽”脱口而出，一些片段也是不由的笑了出来，直到哥哥来到父亲旁边，说，就是来看看你啊，直接就哭了，因为这种感觉这种场景，我也有过。"
雨苔思音,看过,推荐,2020-02-15 01:25:21,2,全片看下来，感受到的更多是一种情感的冲击而不是剧情的流动，更像是扔给我们一本经书然后让我们慢慢参悟的感觉，当然在这种朦胧的基调之下，结尾父亲的坦白就显得过于直接跌份了一点，给几个暗示后留白或许会有更好的效果。
τραγῳδία,看过,还行,2020-01-25 15:19:30,3,白鸟和落叶呼应
让保罗切小田,看过,推荐,2020-01-27 15:06:37,3,片尾特别感谢了袁哲生，大儿子身上有他的影子，捉迷藏的故事取材于《寂寞的游戏》。所谓阳光普照只是无所遁逃的困境。
mdr skywalker,看过,力荐,2020-02-27 09:01:11,2,阳光是公平的，它无私地照射在每个人身上，但是总有些地方会留下阴影，阴影谁会去在乎呢？就像躲在水缸里的司马光一样，阿豪与阿和就是两个极端，一个阳光下，一个阴影中，也导致了各自悲剧的发生，对于菜头的角色，导演也有意识地模糊处理，他敢为阿和出头，甚至于抽烟时都选择了下车，他自己也是饱尝生活艰辛，但却成了阿和与阿文心中的石头，惨遭阿文杀害，却让阿和自由地在桥头奔跑，重获新生。一幕幕的悲剧令人嗟叹，也会引起很多人的反思，诚然说它不完美，它有些刻意，也有不少煽情之处，但是这个是去年金马被禁后，交出的最完美的答卷，剧本整体过硬，配乐出彩，演技发挥也都非常不错，尤其喜欢陈以文饰演的父亲。（9/10）
谋杀游戏机,看过,力荐,2020-02-03 23:05:19,1,没有绝对的优等生，也没有真正的坏人，菜头和黑轮都蛮可怜的。阳光普照，人生有阳就有阴。摄影中的光影细节蛮有趣的，林生祥的原声好治愈。（跟着节目拉了一遍片，又发现很多有意思的镜头语言细节，决定改五星了）
张劳动,看过,推荐,2020-02-03 14:53:08,2,"片名的阳光和片子中的阴郁的气质形成一种反差。因为不普照，大儿子被灼伤乃至自杀，小儿子永远躲在光的背面。男主角爸爸演得是真好。原来曾和杨德昌一起共事过。对于父亲的刻画很到位。
我以为 最后翻出爸爸给的笔记本，阿文会把日记写在上面，结果没有。可能这反而是更突显阿豪的孤独，他不会轻易表露自己，全部的压力都放在心里没有释放。你能理解，像极了所有华人父亲，把自己的希望寄托在下一代身上。每年送一本 “把握时间，掌握方向”。
片中的两场雨戏印象深刻，雨代表冲刷代表新的生活吧。前面的雨，从正常生活变为牢狱生活。
后面的雨，从被威胁的生活变回正常的生活。"
落地麦子,看过,力荐,2020-01-28 22:46:54,4,看到哭的电影。海报很像是枝裕和的《步履不停》《如父如子》，那种隐忍克制的家庭情感刻画，是东亚电影特有的美学语言，细腻生动，静水流深。真希望父母给孩子的爱，是那缕斑驳的阳光，温暖而不灼伤。给阳光普照的孩子带去阴凉，给身处阴影的孩子带去阳光。还有，那个母亲与龙应台太神似了。
seamouse,看过,推荐,2020-02-03 18:44:47,2,狱友合唱《花心》 几乎有了悲情城市知识分子合唱《松花江上》之力量。用司马光没砸缸塑型了阿豪，却没能给阿和找到个有阴影的喻体，但这也算不上影片缺点，因为现实的阴影这么大，也就没必要在内心中给自己塑造个躲藏的缸。
坦克手贝吉塔,看过,推荐,2020-02-12 10:57:44,4,配乐原因，总想起交工，县道184，“从那儿望出去”。脚踏车也是风神125。
kylegun,看过,力荐,2020-02-01 14:00:16,1,粪车追数送坟山，错过公交司马缸，一起烦恼亲家婆，托梦买烟见儿子，文明礼貌大耳窿，坐上曾经他不愿下来的后座，正如某柠檬茶广告所言：边度都有阳光~应该是钟孟宏系新台湾黑片中最主流亲民的一部，可以
水浒三国金刚,看过,还行,2020-02-20 18:05:47,1,阳光普照的日子
西决,看过,推荐,2020-02-10 00:00:27,1,愿返校之时阳光普照，请平凡而自由地生活吧。
西帕克,看过,推荐,2020-01-30 15:57:52,3,有些像《步履不停》，都是活在完美哥哥阴影下的故事。阳光普照，说的却是如何躲在阴影下生活。不过钟孟宏把一切都拍出来了，力量也弱了一些。
陆支羽,看过,推荐,2020-01-29 20:12:06,1,4.0。司马光的故事来自袁哲生。
橙子小番茄,看过,推荐,2020-01-25 00:42:09,5,"司马光砸缸故事新编。

开始把我惊到了，到后面反而就没什么意思了。

许光汉那段自白让我决定加一星，新年还希望大家都能找到自己的暗处，可以在暗处稍微休息一下。

压抑喘不上气，为一切事。"
固力果guriko,看过,力荐,2020-02-06 00:03:01,4,被阳光照耀太久的人，会忘记阴影里的冰凉绝望。裂缝中射进来的光，不是希望而是生活的真相。片尾看到鸣谢袁哲生，加一星。
文森特九六,看过,还行,2020-01-24 19:37:07,5,全靠嘴巴说，总归是差点意思。
