用户,是否看过,评分,评论时间,有用数,评论
老珂,看过,推荐,2020-01-29 17:05:45,2,大火开篇，然后经过90%篇幅的小火慢炖，最后大火收汁，回甘悠长。一家四口都有各自渴望的那一处太阳下的阴影来获得片刻宁静，以及自我救赎。
HSS,看过,2020-01-25 15:08:19, ,3,当煽情被滥用，便走向媚俗。
蓝色箱舟,看过,推荐,2020-02-07 13:59:16,2,借女生之口讲述哥哥死前的一点轨迹，这是很拙劣的叙事方式，点题也显得十分生硬。但还是很喜欢哥哥的这条线，可能是因为喜欢袁哲生吧，那个司马光砸缸的故事。“我想，人天生就喜欢躲藏，渴望消失，这是一点都不奇怪的事情；何况，在我们来到这个世界之前，我们不是都躲得好好的，好到连我们自己都想不起来曾经藏身何处？”
null,看过,推荐,2020-03-06 22:21:45,2,很多电影人喜欢拍烂仔的故事，原因我不确定。但我知道为什么很多观众喜欢看烂仔的故事，因为简单，安全。简单，是因为烂仔的生活里基本上没有任何美好的东西，稍微有一点，就值得抓住，哪怕付出更多恶，也要守住这一点点善，这样的故事，非常简单粗暴。安全，就像暴雨天坐在窗前听音乐看书，听什么看什么不重要，重要的是你在窗内，雨在窗外。烂仔烂到观众不管有什么样的优越感都变得理所当然，于是这种优越感就不会被观众意识到，也就除去了因为意识到自我优越感而带来的自我审视和不安。这样的片子，总会有市场。我不喜欢看烂仔的故事，我喜欢这部电影，是因为父子母女所有人，都为了其他的家人而默默忍受了许多，他们原本以为自己无法忍受的痛苦。这是爱。这是生活。
粟冰箱,看过,力荐,2020-02-16 22:39:30,2,太阳底下无新事，事事悲楚，事事可哀。每个人都必须有阴影可躲，才能有一个私密的角落舔舐伤口：物极必反，太过光明有时就是绝对的黑暗。这种淡淡的伤痛好像是枝裕和啊。许光汉讲的司马光那个故事好像在袁哲生的小说里读到过。
小熊QQ,看过,还行,2020-02-06 19:32:14,1,镜头漂亮，但表现力非常一般，只是不急不缓讲了个不错的普通都市家庭故事。近几年台湾盛产这种电视电影。
glim,看过,推荐,2020-01-26 15:49:14,1,我也喜欢阳光，我也害怕没有阴影躲藏，我也知道一辈子没有做错一件事是多么大的压力，我也希望菜头只是出于气愤，而不是想拉着阿和一起沉在那个有断手的锅里。这辈子真的很短啊，有时候你也没有时间，去想明白这些那些
瓜。相信这个世界很变态。,看过,推荐,2020-01-28 16:40:07,1,线索太多，人物关系处理得太潦草，废戏太多，煽情戏又很多余，整体来说，瑕疵很多的一部电影。但是原声，摄影都很不错，整个故事的氛围营造很好，会让观众陷进去。
鬼腳七,看过,推荐,2020-02-13 23:44:51,0,太陽は見上げる人を選ばない。演员发挥的尺寸特别好，除了小姑娘的部分戏。但是吧这结尾一大截也有点卸力，摁了两个小时还是没摁住。
Song³,看过,推荐,2020-02-06 18:03:09,4,中国式传统家庭的缩影：沉默寡言、耿直暴躁、执拗要强的父亲；一味宠溺孩子、没有太多话语权的母亲，承载过多期望的长子以及惨遭放养的次子。/ “阳光能够照到的地方，并不一定有多温暖；阳光照不到的地方，也并不一定有多阴暗。太阳就像时间一样，从来都是最公平的，日夜交替，四季轮转。”
blueshadow,看过,推荐,2020-02-16 22:46:17,1,"节奏感很独特，通片慢，加速就那么几下，就够了。
混合也有意思，幽默而残酷。"
深夜声噎,看过,力荐,2020-01-30 06:47:46,1,【1080P 度 /s/10a_JqWt9XfZVM68FXBKt-A  码  ifa3  小王】
Macavity,看过,推荐,2019-12-02 03:08:06,6,菜头真是神级的反派，有他的镜头我全程心悬在嗓子眼……
小弟有只猫,看过,还行,2020-01-25 17:53:36,2,3.5 要表達的太多太滿，導致很散，許光漢那條線顯得多餘；割裂感比較重；巫建和眼神像年輕版的豆導。
老罗Lazzaro,看过,推荐,2020-02-15 01:21:48,0,整条线的故事是平静道出却又情感抓人的，围绕着一家人经受的困境与苦痛，“阳光”某方面代表着父亲的关注，最终“照”到了小儿子身上，也代表着不再有隐瞒的家庭与崭新的人生。许光汉的大儿子一角动机成谜交待不足，出狱之《花心》不错，沐浴阳光下的结尾配乐很神且温暖。“人生就像是一条路，只要握紧手中的方向盘，红灯该停就停，绿灯的时候慢慢起步，稳稳的开，人生的路就会平平安安”。
kulilin,看过,2020-01-27 20:39:11, ,0,春去春会来
cnniuge,看过,力荐,2020-01-26 14:27:08,1,很喜欢
幽灵不会哭,看过,推荐,2020-02-04 11:02:09,2,钟孟宏的故事有太多取巧的部分，一些突兀的转折和戏剧冲突让观众很难一以贯之地移情于电影这种，但镜头及表演等方面又能弥补剧作上的许多不足，在一个家庭的变迁、毁灭和重生之中，各种关系均被铺开呈现，但其中最让人印象深刻的还是父子关系，在台湾电影传统之中的父之意象本就是核心主题，对陌生父亲的抗争与理解其实也是新一代台湾人对自我身份的指认，《阳光普照》对父的形象也非常有趣，一方面的固执与死板，另一方面他也是最勇敢的人，而阳光与阴影的辩证法也反转了光明的正向表达，而是用阴影来暗示自我的存在，每个人都有一个躲在阴影中的自我，那个自我实际上更加倔强与珍贵，犹如这个社会，在国旗上的太阳背面是不是也蕴含着普通人的生命之生生不息呢
fire,看过,推荐,2020-02-18 15:32:41,0,阳光普照之处，也有阴影留存
十个斗的眼窝浅,看过,推荐,2020-02-14 18:33:16,0,"人生就是不断地「把握时间，掌握方向」，难过的事情总会过去，也会被遗忘，反正人生就是风风雨雨。
我一直觉得人生就像是一条路，只要握紧手中的方向盘，红灯该停就停，绿灯的时候慢慢起步，稳稳地开，人生的路就会平平安安。"
松野空松,看过,推荐,2020-01-26 01:08:00,1,8.0 当地久天长变成一个具有煎熬，生不如死的意像时，阳光普照也成了贬义词
生人回避,看过,推荐,2020-02-02 02:54:46,1,台湾电影一直以“慢节奏”叙事为著称，但近几年台湾电影尤其在犯罪题材将这一特征发扬光大，剧情犹如生活点滴，台词平铺直叙，用一些戏谑和闹剧作为点缀，但整体节奏缓缓流淌，代入感强烈，给人感觉不像在看一部电影，而是有个老友在你耳边轻声诉说着过往，最后你都很难弄明白，我听懂了什么，以及，为什么难过。
马达,看过,力荐,2020-02-09 23:41:39,3,有时候抓紧不了时间，有时候把握不了方向，有时候需要阴影躲藏，有时候更愿普照阳光。
RUNE,看过,推荐,2020-01-31 23:51:33,2,A Sun，A Son
Takki.,看过,推荐,2020-01-30 15:33:53,2,昨天发生过坏事 太阳还是同个姿势
变形的文科生,看过,推荐,2020-02-02 01:06:31,2,很“台湾”，很中国式父子关系。残酷中带着无奈，无奈中夹杂点滴温情。演员很厉害，尤其爸爸，举重若轻。其他演员也都相当不错，选角导演立大功。摄影跟配乐一流，剪辑的话后半段有些崩。大儿子的角色很有想法，但可以再给多一点，现在有点概念化了。
天马星,看过,还行,2020-01-26 12:50:41,2,《阳光普照》的开局非常生猛，但结尾非常无力。我大概能get到「每个人都会身处黑暗，但并不是每个人都能见到阳光」这一层，但影片所展现的所谓黑暗有些表面且生硬，即力度不够，让生猛的开局逐渐疲软下来，说起来有点可惜了。
U 兔,看过,推荐,2020-02-02 17:09:06,0,影片具备一种特有的节奏，表面上波澜不兴内里潜流暗涌。一开始觉得这种关系安排有些刻意，后来发现把各个人物都处理得很好，自然而内恰，每个人都有自己的行事动机，这才是每个普通个体的样子。这种家庭既有普适性，又有个别案例的典型。几个印象深刻的点：司马光的故事以及听这个故事时女孩脸的轮廓泛起绒毛的光，有关大儿子的梦和便利店的对话，爸爸去找菜头时的窘迫，小儿子在桥上跑起来……文艺片该有的样子在这个片子里都有了。关键是每个人物呈现得都比较饱满，这就挺考验功力，妈妈爸爸尤其丰富，两个儿子都很有看点，菜头更是邪魅，一定逼迫开豪车真是把他形象很好立住了，甚至毒贩都是帅的。有时也在想这样的悲剧应该是有根源或踪迹可逆溯的，只是像毛细血管一样太细密，让人很难说出主支脉在哪里，而描绘好这些毛细血管真很难。佩服了。
Khef,看过,还行,2020-01-25 01:37:12,1,格局与视野太窄，还是钟孟宏一贯的老问题。
滿洲里有象,看过,推荐,2020-01-26 01:17:51,2,真的很想给满分的作品，可惜差了口气。立意可以分为三幕戏：与己和解，与父和解，与世界和解，但剧情割裂感太强，整体看上去也太工整太直白。摄影很棒，几个俯拍镜头呈现出的台北太美，配乐很赞。
phoebe,看过,较差,2020-02-05 15:55:50,2,一部表面克制，其实内核是哭哭啼啼吵吵闹闹八点档的片。配乐太多太直白。结尾那场独白戏好尬，演员根本撑不起来。看完只觉得好怀念侯孝贤和蔡明亮（还有他的李康生顺便带上杨贵媚）。
俱往矣,看过,还行,2019-11-04 23:28:37,2,许多地景都实地走过哎，尤其是捷运附近那种临时过道还真被拍进去了。丧子，接踵而至的变故，迟到的和解，155分钟的片长都让人想起《地久天长》(11.8在台湾公映)，其实这部戏完全可以停在父亲站在坟地把菜头之死讲完后妻子的那种愕然表情上，而不是儿子在阳光普照下骑脚踏车载母亲复归岁月静好温情脉脉的主题升华。叙事节奏的拖沓与类型元素的混杂导致很强的间离感，情绪被卡在某个尴尬的位置，不上不下。看的是夜场，西门捷运附近还喧嚣着，形形色色的红男绿女看得我有几分恍惚了。
Shine,看过,还行,2020-02-12 00:49:25,0,最后的山顶自白有点无奈。
思路乐,看过,推荐,2020-01-28 15:03:32,1,【B】精致的摄影和林生祥的配乐无疑是本片最大的优点，但褪去这两点后，反而更加暴露自身“流水账”般的叙事乏味。摄影的作用更多只是拼凑出一种“高级”质感，在其余视听设计的薄弱下反而更像是遮羞布一般的存在。而林生祥的配乐也远不如《大佛普拉斯》那般灵性，从开场的声画反差就看出配乐在片中仅仅只是为了“迎合”氛围而非有意识的与画面共同去创造它，这就显得林生祥相当被动。剧作上最高级的地方还是在阿豪这个角色身上，仅三场重要戏份所展现出的深度，比其他所有人的两小时都更加值得。毛病一大堆，但想来想去，还是比《地久天长》要真诚的多。
lalacat,看过,2020-02-05 22:55:29, ,0,棒球英豪？优生哥哥，差生弟弟，且这个弟弟还爱打拳（打架）
小月,看过,推荐,2020-01-31 16:28:57,0,钟孟宏导演还是很有功力的，又是一部蛮好看的电影。其实这是一个蛮普通的家庭，对于老大老二的命运选择我是不太能理解的。阿豪品学兼优，日记说自己在阳光之下没有可以躲避的地方，是保持优秀太难了吗，压力来源于父亲吗？阿和说因为哥哥太优秀，自己破罐破摔，这个人物包括后来对菜头一贯的妥协，尚能理解。父亲就是父亲，尽管儿子不争气，父亲还是无法熟视无睹，虽然这样的解决办法太不完美，但实在想不出其他解决办法了呀！结尾偷车，妈妈没有制止我是有些诧异的。片中几处冷幽默真的挺逗的。ps：菜头很帅，阿豪女朋友很漂亮。
Eco,看过,还行,2020-01-26 21:46:20,1,三星半。整体不错，但剧本结构其实还可以调整，轻重缓急上给人一种轻的地方很轻，重的地方太重（哥哥跳楼部分突兀，父亲最后一段说辞戏剧性太强）有些地方过于戏剧性，有些表演没有收住。前半部分日式是枝裕和的温馨家庭伦理剧，加上后半部分改良版的台湾黑帮片，倒是应和了太阳一分两半的公平。
苗苗段,看过,推荐,2020-02-09 20:13:26,2,美术太好看了，尤其那几段阳光阴影交换的场景。
雪,看过,还行,2020-02-04 00:21:58,0,伟大的正午
草威,看过,推荐,2020-02-01 13:47:12,2,拍得很真挚，实在太会拍。但文本上就是高级琼瑶。
莫呼洛迦-屁股上的青春在歌唱,看过,推荐,2020-01-28 03:50:03,4,"「老師，你相信嗎？」我從未想過一個我們耳熟能詳的《司馬光砸缸》也可以被質疑、被另外一種視角解讀、有另一種理解的方式。當我聽到「陽光普照」的時候，與『陽光』相呼應的本能來講就是正面而溫暖的，但卻忘了在太陽下曬久了也會曬傷，也會中暑。那些被陽光照進的裂縫裡，有我們藏匿的痛苦和不堪，但好在「這個世界，最公平的是太陽。不論維度高低，每個地方一整年中，白天與黑夜的時間都各佔一半。」曝曬也好，黑暗也罷，終究會過去。

英雄和陽光都太正向了，容不得一絲的疲憊和軟弱。在我們獲取了英雄的救助和溫暖的陽光過後，誰來給他們喘息和陰影？"
心生,看过,还行,2020-01-27 20:41:07,1,三星半吧
泛柏舟,看过,力荐,2020-01-27 15:58:02,2,好电影，平稳的生活下有着巨大的张力，非常克制，怀念台北。
字母君,看过,较差,2020-02-10 20:07:04,2,"技术层面很精致，偶尔也有几个漂亮的段落，但这种明明匠气十足，却还要强装真诚（还拍这么长）的电影真是最烦人了……
大部分情节都靠台词讲，但偏偏台词又写得稀烂，我有被那个司马光的故事结结实实地尬到。最后一场重头戏近乎灾难，演员再会演都只能把它演成朗诵节目。细节也很做作，例如“一家人未同框”这种设计，剧本里就根本没让一家人齐整见过面，想让他们同框都难吧？"
Bittersweet🕯,看过,还行,2020-02-16 22:47:37,0,亲情，既伟大又可怖。
杀手皇太后,看过,推荐,2020-01-27 02:41:35,1,作为导演的钟孟宏，把似乎没有团聚过的一家人的故事，折现出了一系列的社会问题。阳光的哥哥，阴影的菜头，柳暗花明的阿和。作为摄影师的中岛长雄的摄影，对光的镜头展示得真好，音乐带着悲凉。
Paco,看过,还行,2020-02-01 22:06:15,2,3.5。遗憾是，最好的时刻都需要“断章”去保全，一旦细想，很难接受结尾高光最早是以最强行的方式（留住哥哥，开评论音轨得了）开始建立的。除了杀菜头外，后半程一直在走高；虽然利弊并存，但丰富语气还是可贵。
傻乐的猫,看过,2020-03-07 21:11:41, ,0,许光汉确实美，也适合演微笑抑郁。不过导演既往的阴森变态气氛没了，这部反而看得提不起劲。
Panda的阴影,看过,推荐,2020-01-29 16:45:44,0,1.天气终于在几日的阴霾后转晴，于是也趁着阳光明媚的时节观看了期待有些时日的《阳光普照》；2.第56届台湾电影金马奖获得最佳剧情长片、最佳导演、最佳男主角、最佳男配角、最佳剪辑以及观众票选最佳影片；3.观影时最常联想到《我们与恶的距离》（和《大佛普拉斯》），看到施名帅客串惊喜一下（林生祥的配乐依旧给力）；4.在种种现实因素作用下，有时会导致人做违法犯罪之事，但并不是所有罪犯都会受到法律的制裁。电影里如此，现实世界里亦是如此。最后“没有自首”的结局有加分，与电影开头刚好展示了两种不一致的情况；5.這個世界最公平的是太陽。不論緯度高低，每個地方一整年中白天與黑暗的時間都各佔一半。……我沒有水缸、沒有暗處，只有陽光，24小時從不間斷，明亮溫暖，“陽光普照”。
sacrifice,看过,推荐,2019-12-08 01:26:57,3,a sun OR a son. 太陽公平，卻永遠找不到陰影躲藏；失去陽光，陰影之下，家人才能真的（被迫）修補彼此的傷。劉冠廷的每一個鏡頭，就算僅僅是抽菸的背影，都讓人移不開目光。
发条大丑橘,看过,推荐,2020-02-04 18:35:05,1,很温暖。这届金马如果对阵《地久天长》，未必会对结果有太大影响。一些反套路的设置很惊喜。摄影好评，影片中用阳光被照到的地方和阴影处的地方来做表达，很有意思。然而在关键剧情展现和推进的时候，却过于依赖大段对白，软绵无力。
kiki204629,看过,推荐,2020-01-25 22:00:30,1,没有大雨倾盆，哪来阳光普照。
水水,看过,力荐,2020-01-28 14:16:34,0,钟孟宏一如既往的厉害，刘冠廷巫建和崭露头角，许光汉势不可挡啊
Love Scarlett,看过,较差,2020-02-14 05:00:52,0,本来应该是个好的悬疑片或者文艺片剧本，硬是拍成了电视剧的感觉。开了个好头，收了个烂尾。
GA,看过,还行,2020-02-09 17:09:26,0,节奏是蛮喜欢的 但是叙事幼儿化也是不必了
法棍老人,看过,力荐,2020-02-10 03:09:06,1,摄影美术都匠气十足，人物的塑造和情感的张力也可圈可点，配乐大赞。台湾电影这两年佳作频出，越来越成熟。把握时间，掌握方向。
Clarke,看过,还行,2020-02-22 01:03:07,0,大概是受日本文化影响，台湾电影既不讲自强不息，也不讲清净炼化，而是讲因果业报。直接换日本演员也没有违和感。
肥老醜·殘🐰,看过,力荐,2020-02-03 00:51:13,2,無庸置疑我也會為兒子暗自換命，即使用最笨拙的方式，父愛無疑是全片的詮釋中心，而除此之外各種家庭關係鋪開探討也各具特徵（但也失於淺嘗輒止），尤其是他們當中的每個人都是社會上無足輕重甚至進退失據的小人物，而同在一片陽光普照之下，有誰能躲在自己圈定的陰影中遁形或釋懷呢？——竟然有一絲存在主義哲學的意味！
丁一,看过,2020-02-09 23:40:35, ,2,"前面把握时间，时间无常，掌握方向，方向失控，黑夜又白昼，黑夜又白昼，一一拍下去，又是部《一一》。
后面把握失当，阳光普照缩成爱的曝光，家族之苦用爱发光，又走上了《步履不停》的老路"
錢庭寶,看过,较差,2019-11-05 00:13:06,2,1.5 半顆給劉冠廷好ㄌ
SingLesinger,看过,推荐,2020-01-26 22:01:09,0,尘世浮沉
Jucy,看过,推荐,2019-12-12 15:57:24,1,开篇叙事节奏稍慢，有点电视剧质感，但随着情节展开，情感充沛，细节上有许多关照。
zykmilan,看过,推荐,2019-11-28 10:24:16,7,#SGIFF2019#阳光是最公平的，然而阳光洒过的地方也必然留下阴影。看的过程有一点儿让人觉得彷佛微缩版台湾《活着》。唱《花心》那段真是让人瞬间鼻酸。结尾稍显拖沓，留在高架桥上的奔跑其实就已经很完整了，现在的结尾太直白，稍稍削弱了故事的力量。
潜意识,看过,推荐,2020-01-28 19:34:55,0,无论过去多少年，发生多少事，台湾电影还是这般有张力，有后劲。面对未来蹉跎，仍需踽踽前行。生祥乐队的配乐依旧出色。
西門·T+ ing,看过,力荐,2020-03-01 20:10:58,1,这应该是今年目前为止，我觉得最好看的电影了！平凡而深沉，悲情而阴冷，如此大的变故对于一个普通家庭来说早就崩塌了，可是他们却如此的冷静，其实现实中的家庭无论大事小事，摊上了就是百分之百的事儿，几乎都是选择无声的悲鸣。你永远不知道与你迎面走的那个人，正经历着什么，所以哪有什么感同身受！两个半小时，没有一句废话，没有一个无用镜头，细节斟酌得也超棒，光影语言也发挥到了极致，音乐点睛！A sun，A son，把握时间，掌握方向，哪有什么玩笑话，只有听的人才会觉得是玩笑吧，和太阳一样公平的还有时间！花谢花会开，人呢？
徐颂,看过,推荐,2020-02-07 00:48:37,1,太阳想找个阴影休息，决心躲进云层里，于是世界变得黑暗。在这儿和那里，“一个”儿子在寻找他的父亲，一个父亲同样没放弃寻找他的儿子，直到他顶着暴烈的阳光，摊开所有罪与罚，犹如酷刑的那一刻，太阳还是公平的，有多温柔就有多残酷。
峰峰峰峰,看过,还行,2020-01-27 20:28:48,0,世上有两样东西不可直视，一是太阳，二是人心。阳光踱入阴影…
爬行隧道,看过,推荐,2019-11-03 18:56:27,4,太难了……#香港亚洲电影节#
蚂蚁没问题,看过,推荐,2020-02-09 23:54:25,0,以为是一家人渡过难关的生活化故事，“春去春会来，花谢花会开”，没想到突然有这么奇情的走向，我是觉得有点别扭，跟氛围不是很搭。许光汉真好，司马光砸缸也能讲出恐怖故事效果，想在公车站一直跟他聊天，阳光普照下一起去逛动物园。
孤岛影者,看过,还行,2020-01-24 23:46:10,1,放宽些给个三星半。或是2020年唯一值得一看的春节档电影。单故事来看特别颁奖季向——欧洲有许多类似题材的文艺片——但钟孟宏用最朴实最生活的镜头来拍，以小家庭引起大众的共鸣。动物园的动物总有阴影可躲，即使“司马光”也有一口缸可藏，终于见到自行车后座的世界，感受到阳光普照的自在。父子关系用驾训班和洗车店进行对应，充满复杂性而又如此生活化的台词，让家庭变数与外来因素暗中隔离。关键几处转折和核心点题都来自“曾经那一个孩子”：这个世界最公平的是太阳，无论维度高低，每个地方一整年中，白天与黑暗的时间都各占一半——然而人的世界里有太多的不公与自私。和是枝裕和比较像的是人物与景别。可惜内容像是跳着拍或是硬着剪（尤其下半场），明明转场特别快还特别乱，依然能长达150多分钟。
451½°F™,看过,力荐,2020-02-21 20:46:16,0,不幸家庭各有各的不幸，而「原罪」与家庭间各个「角色」宿命般的隔阂与爱却是大抵相似的，于是悲剧被一代又一代的延续，而善良懦弱的人们只好用各自的渺小与隐忍营造一些呵护所爱之人的「阴影」，「阳光」在华语电影的语境中也拥有者不言而喻的残忍。
小A,看过,推荐,2020-01-26 17:41:58,0,许光汉长得像马龙。电影不错，创伤家庭随着时间推演从伤痛中走出的故事，故事有点狗血，还夹杂克制的喜剧桥段，需要导演有极强掌控力才能拍出真实感，交给娄烨可能会拍成《浮城谜事3》。林生祥音乐非常好。即便《疯狂的外星人》《地久天长》参展去年金马，本片拿金马最佳影片我觉得也没什么不妥。去年台湾电影水平还可以，本片和那个游戏改的卖座片都不错，不知道谢沛如《大饿》怎么样。台湾把“所向披靡”写成“所向批靡”吗？
西北化为乌有,看过,推荐,2020-01-25 01:43:14,1,剧作非常周密，为每个角色都设置了 阳光–阴影 的对照，出色的摄影加强了这层表达。阴影愈浓烈，阳光愈灿烂，背负苦涩的众人也只能在隔膜间假装和解。问题在于实在是煽过头，后半段太多情绪宣泄，有点疲劳。
仿真男孩哪吒,看过,推荐,2020-02-01 17:28:41,2,太阳底下虽阳光普照但并无新鲜事，阿和就像是茶余饭后搬弄是非时听过的任何不良少年，阿豪是教育大省地方头条新闻里被复读压垮的少年，菜头就像是从小就惹事生非却被接受贫困捐助的小学同学，最熟悉的父母间的冷漠和不和。人情世故拿捏的好，抓住中国底层的韧性，在悲悯地模仿杨德昌的同时，搬出一些不合时宜的轻松，后半部节奏不喜欢，90年代金曲在台湾影视作品中真的相得益彰。
荔枝超人,看过,推荐,2020-02-01 14:31:24,0,认真点沉住气，拍个友好的电影。
游坦,看过,推荐,2020-01-25 04:03:43,0,A son.后面结尾山顶自述剪掉会很好
梵目,看过,力荐,2020-02-12 02:08:51,0,幸福线背后的乌云；照常升起的太阳。
天生喜感,看过,推荐,2020-02-15 14:55:57,1,司马光也想成为司马暗
朴不程,看过,推荐,2020-01-30 00:47:17,1,考驾照容易，掌握自己的人生方向太难。有人找阳光普照，有人找阴影躲藏，无非都是在找自己。摄影一流。8.1
