用户,是否看过,评分,评论时间,有用数,评论
小鑫,看过,还行,2019-11-07 18:45:53,200,思追还是那个思追，温宁却不是那个温宁了，受剧版影响太深，总觉得温宁应该是那个不爱说话，小心翼翼的心思单纯的小可爱才是。两个人稍微有点扛不起剧情，想念魏公子和蓝忘机啊……
野蒜,看过,较差,2019-11-07 16:19:25,71,这个开头我以为在看廉价鬼片，其实制作比陈情令好一点，毕竟时长摆在这里。同人剧情也很符合墨香铜臭的写作口味，鬼将军与思追于小不夜天大战小薛洋。
山人阿苍苍,看过,较差,2019-11-07 23:29:57,88,就是一个义城篇重写，赵忆的人物原型就是薛洋，这么明显以为大家看不出吗，好鸡贼的创作偷懒方式啊。：）））
叫啥不重要,看过,很差,2019-10-30 11:57:28,100,过度消费
二许,看过,很差,2019-11-07 19:35:56,67,"1时间线混乱 （太乱了真的太乱了太乱了 我都不一一整理了）
2萧情死的时候演技太尴尬了，竟然还放了3遍
3前期镜头切换太硬了
4配音出戏
5温宁是死人 鬼将军   怎么会有嗅觉
6转折还行"
MolllllllloN,看过,推荐,2019-11-09 12:41:13,30,看见熟悉的温宁和阿苑真好 但是回忆部分的故事很一般 后期的团战太追求效果了 而没有了亮点 配乐也差了一些 全剧的主配色不够“红”
穆子衿,看过,较差,2019-11-10 20:59:15,44,"其实不叫番外，应该叫同人。但是吧，真的很想吐槽那个能够对思追进行连环怼真的有点毁人设啊。还有是因为剧组很穷吗，思追去夜猎怎么可能独自一人，他又不是金陵那个独行侠。
还有就是赵忆那个毫无逻辑的故事，温宁和思追都和没带脑子一样的就相信了？"
芦哲峰,看过,较差,2019-11-16 15:59:04,26,赵忆爱萧情不得，一念成魔，灭门夺魄；温宁过鬼城扶风，巧遇思追，联手擒凶。蹭热度之作，鉴定完毕。
清洛枕书,看过,很差,2019-11-07 23:10:35,42,嘴上说些后会无期，身体蹭热度也是很诚实啊，勉强一颗星，魏无羡有了个背影。（时间线混乱，故事尴尬，说教意味太浓，演技太差，不过那句“叔叔”还是好玩的。<嗯，我是看了才来评分>）
你们不懂无语,看过,很差,2019-11-07 15:41:27,54,这是什么？萧情萧忆是哪位？不是原著的番外别挂原著名好吗？后会无期了宁嘞。而且演技也不行啊
雨过终究天晴,看过,还行,2019-11-08 00:42:51,107,为了郑繁星来的。配乐和陈情令差了不止一点半点。剧情也还好。但是bgm用无羁真的好吗？最后还有师姐的影子？？不是纯原创吗？？xp要点脸？？？
蓝清凌,看过,还行,2019-11-07 19:02:37,49,有点尴尬，不过思追还是很可爱的……
百里苏苏,看过,还行,2019-11-09 09:57:31,12,故事还可以，思追还是那个思追，但温宁却已经不是那个温宁了。剧版里的温宁呆萌木讷又执拗，特点个性突出，而影版的人设却相当普通。温宁觉醒以后的发挥还不错，cue魏公子，不让叫叔叔，以及温宁最后除去心魔“魏公子的傀儡”是亮点。
十八号木木夕,看过,很差,2019-11-07 21:46:11,33,这什么乱七八糟ooc的同人啊，看吐了
御烟缥缈录,看过,还行,2019-11-09 20:40:10,8,请不起夷陵老祖，请来温宁也行，只是温宁还是傻傻呆呆的更可爱一些。
空無零,看过,较差,2019-11-07 23:30:49,29,两星给温宁和思追....
落红尘,看过,较差,2019-11-07 23:50:34,11,看完了仿佛没看过，到底在讲什么。。。
九命相柳,看过,较差,2019-11-08 21:03:48,10,一星给思追，一星给片头动画
不二幸村,看过,较差,2019-11-10 21:04:24,6,整个打光和廉价的鬼片差不多，剧情逻辑也很混乱。
命运释不尽的是,看过,很差,2019-11-07 20:47:41,25,繁星小哥哥对不起，你的演技还需要在磨练磨练，主演那个真的不适合演戏了，球球放过大家吧
安仔大kuma,看过,很差,2019-11-08 12:08:59,29,看完翻了个白眼，温宁简直ooc，再不喜欢被叫叔叔，他也不会叫阿苑为思追，赵忆不就是另一个戏精boy？编剧是不是温情令没过瘾这边又来秀智商了？我承认这个特效比陈情令本令的打斗好，但是你不能吸了忘羡的血来孵这个蛋吧？而且俩主演演技都一言难尽。|我宁可阿瑶和薛洋把恶友篇演了，应该能hold住。|另，有时候你和演技只差一个男主，但更多时候男主只会暴露你演技差。
火炉围拥两粒砂,看过,较差,2019-11-10 21:37:12,5,剧情中规中矩，体感是低配版的常氏案+义城，反派低配版的薛洋+聂导，不过特效做得比正片精细，开篇简直恐怖片。但温宁太OOC了，整个低配版魏婴，但他不是这个类型的啊！结果满场待我装逼带你飞的感觉，思追简直是用来捧哏喊666的吉祥物，剧情跟正篇时间线也对不上
颜浅,看过,很差,2019-11-07 16:13:39,18,剧情逻辑混乱，特效五毛
龙虾,看过,很差,2019-11-07 20:59:55,23,剧情弱 演技尬 特效五毛 可以衍生 但请先用点心
风,看过,力荐,2019-11-07 22:09:00,34,这是小天使，两个人第一次自己主演的电影必须好评。以示鼓励。尤其是后面有一段。我无限出来的，即使，我们知道那个不是肖战。我们也感觉到了很激动。
醒醒大白熊,看过,2019-11-23 17:21:28, ,8,鬼将军说世界上没有鬼？。。
梦思雨,看过,推荐,2019-11-09 19:46:48,18,这部电影大赞于斌的演技，把懦弱的温宁成熟了，可以独挡一面，故事不错，但情节还可以在细腻一点，郑繁星的思追也要有点进步吧，还是老样子！温宁的成熟转换，有点过快，剧场本影响太深，有点转不过来！对于演员演技来说，非常不错！加油↖(^ω^)↗加油！于斌郑繁星
Lunar C.,看过,还行,2019-11-26 03:17:31,2,制作和特效都算有，但演员演技还是可惜了一切。
Desenrascanço,看过,很差,2019-11-07 23:57:49,11,辣鸡 简直侮辱陈情令和温宁小天使
白無硯,看过,2020-03-07 00:05:31, ,0,叫前辈 叔叔 显老
马克西米利安,看过,很差,2019-11-10 00:18:16,5,太尴了，但凡换成景仪思追组合，听蓝怼怼吐槽，也能多一星。
幸运+++,看过,较差,2020-01-15 03:59:00,0,打着陈情令的旗号，温宁也太OOC了，故事也和主线很多不通啊，阴铁哪来的，手稿哪来的，温家照理应该没了啊，萧家怎么还在向温家供灯。打斗和特效有好一丢丢吧，故事很像义城篇的感觉，以至于我刚开始还猜反派是不是薛洋。
胡桃园咔嚓女王代表老柴咔了你,看过,较差,2019-11-13 02:40:47,1,画面很好，最后一场打斗竟然莫名搞得很热血，结束前各种反转再反转……= =这么长片其实讲的内容不算多（就是女主和某男配的相爱故事……）虽然思追和温宁还是蛮可爱的一对，但是……终局打那么辛苦仿佛圣斗士星魂锁链+火影配乐般的即视感（违和的热血电吉它音乐……）是怎么回事？然后你们的羡羡其实连头都没有出现哟，啊哈哈哈哈哈哈（RIP）这个片其实是为温宁思追CP粉设的。
灃湮。紀。南城,看过,2019-11-26 08:18:28, ,1,也就场景特效和片头动画是亮点
疯狂橙子,看过,很差,2019-11-08 16:56:58,4,尴尬啊 到底这讲了个啥
Santorini,看过,很差,2019-11-08 13:38:01,0,圈钱太明显了
Saber宝蓝,看过,较差,2019-11-11 12:25:00,2,非常套路的一部电影，到中期基本能猜到结尾，人物有薛洋、师姐和聂导的影子，没太大新意。
🐼🐰🔥⚓🔱,看过,还行,2019-11-09 21:09:03,5,番外篇与陈情令没有太大关系，剧情太简单，温宁突然变得好厉害，思追成了衬托和辅助，赵忆的表情演技还行，三五个人撑起来一部电影，实在不容易。特效比之前好点，但勉强凑合看的剧情有消费了陈情令的感觉。
你家贰哥,看过,较差,2019-11-07 22:31:54,6,对不起我真的想抱着客观的态度去看，但我尽力了……
草地滚狐,看过,很差,2019-11-09 20:35:53,4,有这时间拍拍原著番外不好吗哈哈哈。一星给思追小可爱。
静泽蕾拉,看过,很差,2019-11-07 22:01:25,4,滚
娟子*,看过,力荐,2019-11-07 19:11:04,22,我的温宁，我的思追，我的陈情令，必须五星。
柳千寻,看过,很差,2020-03-05 09:53:26,0,biss
熊能能脚不沾地,看过,较差,2019-11-26 10:13:34,0,我一头雾水
顔雪涯,看过,很差,2019-11-13 00:47:00,0,"“魏公子说：别叫叔叔，显老！”
……
妈耶！
你们这出义城篇翻版演的挺好吖
小可爱温宁也能把铁链玩儿出花儿来了
可是，为什么要拍这部电影呢？
白白砸了陈情令的招牌"
十七君Tanya,看过,较差,2020-02-28 15:12:48,0,要不是思追那张脸我真的看不下去
沫哥,看过,很差,2020-01-23 22:40:49,1,什么垃圾，啊啊！！
margaret,看过,较差,2019-11-10 10:48:02,4,多一星⭐是给思追的
Amon,看过,很差,2019-11-24 22:46:12,1,烂片有烂片的好处，适合做影视基础教材，作为反面案例。
大面,看过,很差,2020-01-10 01:37:52,0,？？
柠柠,看过,较差,2020-01-28 14:51:22,0,鬼片不像鬼片，恐怖片也不像恐怖片，时间线也和陈情令搭不上，唉，一言难尽
somebody,看过,很差,2019-11-08 12:32:13,3,名侦探温宁，一星给郑繁星
竹小息,看过,较差,2019-11-08 17:11:07,3,嗯……看完了，有点小阔怕，思追仍旧是呆萌小天使，温宁好像成长了，总之温宁不再是那么懵懵的了，毕竟没有魏公子了，温宁要独扛大旗，但他们俩的武力值有点弱呀，温宁是谁呀，温宁可是鬼将军啊，手狠话不多，现在就pk一个练邪术之人pk了八十分钟，总之，人设没有太立住，剧情……emmm很熟悉，没太大新意，就酱
jiangjie,看过,很差,2019-11-07 20:46:21,5,我为什么想不开要看这个
Ψ,看过,还行,2020-02-08 16:08:44,1,陈情令拍得太好，哪怕续集剧情单薄、特效五毛，两个配角也可撑起一台戏。思追太乖萌、认真可爱了…
云起,看过,很差,2020-03-01 15:44:50,0,剧情服化道摄制全都一言难尽。温宁像是突然偷了魏无羡的脑子，同样的两个演员，在陈情令里都演的挺好的，尤其是于斌，仿佛就是温宁本宁，可是在这部电影里演技尴尬台词生硬，思追更是完全就是来打酱油的，对温宁小天使八倍滤镜都没办法让我忍受这部电影，真真浪费了时间。
艽萳,看过,推荐,2019-11-11 02:12:30,23,现在反派都这么帅的嘛 思追和温宁俩小可爱啊化身小侦探了 本以为这种网络电影不会多好看 虽然几个地方挺尬 打戏的bgm有些违和 但是 就冲1:08:07羡羡的背影和无羁的bgm我多给一星！！！鬼知道为了这背影反复看了多少遍
明石学姐,看过,很差,2019-11-23 20:57:01,1,给思追小可爱留一星
harvey少校,看过,很差,2019-12-11 18:24:32,0,白衣服没存在感，景假的一塌糊涂
童熙,看过,较差,2019-12-15 18:02:40,0,跟风之作…为了看温宁小可爱。
骆驼样子,看过,很差,2019-11-11 13:47:53,2,这拍的个啥啊。。。xp打算一个ip致富世界五百强？
YLS,看过,还行,2020-02-24 15:43:56,1,剧情烂了点，有金光瑶和聂导在前，很容易猜出剧情了。重要的女主烧三遍。温宁小可爱成长了，思追小可爱还是傻愣愣。羡羡一个背影，还是路大配音，是温宁心里的羡羡。想看其他番外，不想从陈情坑里出去
Hollisin,看过,还行,2019-12-29 12:05:11,1,撇去番外的头衔，但就电影而言，开头的画面、音效、动画都很好，越往后越粗糙，打戏还是那么……不能看。“胆小鬼”这一句出，整个色调就不恐怖了，加上“魏公子说：叔叔，显老”，这也太可爱了。温宁、思追，从正剧到这里，都是一贯的好看，算是交代了温宁的去往。于斌唱的片尾蛮 OK。一个魏婴的背影，徒增了多少情怀。
蘑界智障大白田,看过,很差,2019-12-15 21:14:45,1,哈哈哈哈哈哈哈哈 给这部于斌个人单曲宣传片送一星吧 我可不是苛刻 我作为一个颜狗 我都可以忽视演技这种东西了 看陈情令我连那种三毛特效都自然而然视而不见了 但是 点开这个片吧 就还是感觉 大家都挺闲的
司宇珩蓦,看过,很差,2020-03-02 17:02:22,0,"可以他以腐出道，不许他人同？？？？XZ双标不能忍，装无辜不能忍"
laiyu,看过,推荐,2019-11-10 22:08:28,17,"温宁对战时搭配的电音，很有违和感呀😂
阴深深的氛围不错，有小说那种描绘的夜猎打怪的感觉"
中年少女王小虎,看过,很差,2019-11-15 17:14:59,2,看了20分钟实在看不下去了，魏前辈魏前辈的强行跟原作扯在一起着实尴尬。没有陈情还是陈情令吗？叫温宁令吧！
胡阿忧,看过,还行,2019-11-17 15:30:03,1,故事还算完整，有几个反转来的太快反而没有了推理的乐趣。鬼城很吓人，那知识小时候的事情。这个世界上只有一种鬼，那就是胆小鬼。看完就记住了这一句话，其他的还行吧，有一些剧情和故事，演绎的一般般。打发时间的话也可以看看。
做你的爸爸真好,看过,很差,2020-03-06 10:54:35,0,我就知道部分中国导演就喜欢炒一下热度
挽香,看过,推荐,2019-11-11 08:07:40,19,全剧由憨憨的温宁变聪明了和依旧可爱的思追搭档共同主导。另外花灯很漂亮，萧情在回忆里被火烧了三次，她在火里的舞蹈也看得尴尬症犯了笑了三次。最后对赵忆的处罚简直就是温宁腹黑的报复啊。哈哈
你不知道的事,看过,还行,2019-11-26 20:17:49,3,刚开始看到鬼将军的时候觉得有点怪怪的，后来才发现，原来刚开始的鬼将军是有意识，这是多么奇怪。直到识破赵忆的谎言，黑瞳鬼将军重新出现。这部应该叫做福尔摩斯温宁。这次居然是他和追思挑大梁组cp。后来反转的还不错。对了，赵忆练邪功，其实就是个养蜂人啊。这部剧就是吃陈情令的红利，居然还出现了魏无羡的背影……并不是谁都是阿羡好吗！！！
taka,看过,很差,2019-11-09 14:06:10,1,看我的！星云锁链！
权宁,看过,很差,2019-11-22 01:54:15,1,我滴天 求求国产网大了 放弃古装 妖怪 卖脸 假装有事儿的开头 假装大决战的拖沓特效 叨叨就认为自己推动了的剧情 特写就认为自己有悬疑了的氛围 嘛
septenary,看过,还行,2019-11-19 16:49:54,2,剧情是比较白痴，但是好多熟悉面孔呀，激动！
帝台之浆,看过,很差,2019-11-10 18:32:35,0,"果然是败好感。
制片人居然是一个人。"
重玖.,看过,2019-11-16 15:39:35, ,1,我看的是陈情令么……我是谁，为什么我要看䒑这个
西湖小丸子,看过,还行,2019-11-07 21:34:50,5,剧情简单了一些，是去看温宁和思追两个小天使的，温宁最终战胜了自己，以后的路要自己好好走
poo,看过,较差,2019-12-06 12:34:43,0,这么大部的电影，看着就像电影版番外篇一样，场景少，剧情简单潦草，结尾虽有个反转，大概也不过是完成任务走过场一样。总觉得演得还是不太走心，随便看看就完了记不住，至于姐弟恋这个梗也很无语，你不是仆人么？肖想当小公子还行，肖想了还是当个庶子，还想和大小姐来一段，还不如直接把自己带入周公子不是更好么？从心理上就逻辑不洽，总之脑洞不是一般偏，可能只是编剧为了猎奇或是为了和原著套关系所以这么设定吧。。。另外，大家会去因陈情令这个前缀去看，难道不是为了看魏婴蓝湛么？就像当年港版白发魔女2练霓裳卓一航结尾出来晃个3分钟大家也甘心，然后这次只能看到一只手？还有，最开始杀小孩那个场景真是挺无良恐怖的，小女孩明明这么可爱。。。所以要是当是个网剧看，那美工特效似乎还不错，不过上映的话就有点MMP了。。。
夏天快乐,看过,较差,2020-01-27 00:44:44,0,陈情令同人电影，温宁和思追；没啥亮点，想磕博君一肖的糖没有磕到啊。但是也蛮喜欢思追
甘木,看过,较差,2019-11-13 10:50:30,0,鬼将军与思追于小不夜天擒破小薛洋 #义城篇重写，不带这么偷懒的
大巧若拙,看过,较差,2020-01-15 10:49:10,0,拍番外也稍微诚意一点 只有思追和温宁 起码少年组凑全吧  景仪和金陵去哪了
msazhou,看过,较差,2019-12-26 21:30:06,1,还好没花钱，骗钱的。
aluuuuuuuuuuuu,看过,较差,2020-01-09 02:44:34,0,场景特效不错，其他的挺无趣
良家女子,看过,较差,2019-11-10 11:35:11,1,说实话，没有正剧好看，陈情令当初虽然因为粉丝骂人观感不太好，但本身质量挺好，四星妥的，这个电影。。。。。明目张胆割韭菜来的吧
小鲁胖子呀,看过,还行,2019-11-17 23:26:57,1,因为是陈情令，所以想看呀，但是并没有想象中那么好吧，觉得整体缺少重点，反转得也很生硬，没什么新奇的点，但是看到思追和温宁那一刻，还是觉得十分的舍不得，好想陈情令啊，以至于我看到那个背景和他们口中说着的魏公子、含光君都那么令人怀念。
༄馬ཽ࿆先࿆྇森࿆྇࿐,看过,还行,2019-11-12 23:06:16,1,冲着陈情和小天使来的，剧情有点Low，小天使的感觉也变了，思追还是那个思追。哈哈
夏河马,看过,较差,2020-02-04 11:24:45,0,就当这是思追和温宁小可爱两人的撒糖番外吧
十二,看过,较差,2019-11-15 11:28:29,1,嫌陈情令太火了给退粉的么
双城记,看过,还行,2019-11-24 20:43:17,2,抛开偏见，其实还可以，比很多网络电影都好。
猪晴天,看过,较差,2019-11-08 23:00:56,1,提问小青来来回回被烧了几次.我们是亲姐弟铺梗铺的不要太明显.冥顽不灵受死吧电吉他音乐出场在古装仙侠剧?变身食尸鬼
無鴉,看过,较差,2019-11-27 00:33:39,2,"害我真的很无聊了给温宁和思追个星星吧"
Neptune,看过,还行,2019-11-07 21:24:11,3,呃……怎么说呢，情怀是有的吧，不论人物关系还是情节，就是情节有些简单，而且人物性格变了好多，这部电影应该挺省钱的吧，就五名演员，景取得也不算太多，反正时间不长，看这部片子也是阿令属于情怀了吧
ikebukuro,看过,较差,2019-11-09 21:01:51,2,ooc
梦中吟,看过,较差,2019-12-28 18:52:03,0,"哈哈正如海报所示 五个人的电影好惨 开头的小女孩好可爱呀 
感觉就是小薛洋的故事 义城和常氏灭门的结合版"
平安喜乐,看过,较差,2019-11-17 16:58:27,0,"剧情不够，全靠回忆来凑，同一个人被回忆烧了三次也是醉醉哒哈哈哈哈哈

“”再有45天，20后就要出生了，20后看90后，就像90后看60后”，比如我看这部电影的时候，看到最后也没看出来肖战到底是谁，陈宁和思追又是什么鬼🙃"
kouskah,看过,较差,2019-11-10 16:51:36,1,就……背影与路老师的声音出来时有点感动。温宁还是不错的其实
蓝栗城,看过,力荐,2019-11-08 06:16:30,18,为了思追而来的！我想说的是为啥温宁个性变了，还有剧情是虾米鬼？温宁变鬼将军时候我以为我在看《火影忍者》叻。
蓝雨,看过,较差,2019-12-07 16:08:47,0,垃圾圈钱片。。。翻版薛洋。。。看恐怖场景的能力经此片又提高不少
今晚吃鸡,看过,较差,2019-11-07 22:33:58,1,smg
杨大玉,看过,力荐,2020-02-16 20:24:19,1,分数这么低～来个五星，至少又看到了温宁和思追。
彼岸,看过,较差,2019-11-07 23:41:59,0,故事有点简单了，应该可以更好的。
无水月零,看过,较差,2019-11-16 18:51:58,0,特效满分，但是对不起我笑死在了弹幕里。如同数码宝贝进化一样的电音摇滚配乐，加上温宁使用了从圣斗士借来的星云锁链……整个电影除了群演，大概差不多就四个人。剧情也比较弱。
viennawong,看过,还行,2019-11-24 22:23:57,0,故事站不住脚，拍得不错
Jolizz,看过,还行,2019-11-23 17:39:09,0,没有两博君一肖客串的正脸，差评！
shenqingiris,看过,很差,2020-02-11 05:20:50,0,宣传片已是电影全部精华，挂名而已，和电视剧无关联。
交换舞伴,看过,很差,2019-11-09 23:35:52,2,这是陈情令，说笑吧。
昸暖夏凉,看过,力荐,2019-11-11 18:34:01,14,番外系列多来几部吧，坐等
落入人间的彩虹,看过,较差,2020-02-27 23:07:46,0,不应该好奇看的，烂
白白白💪.,看过,较差,2019-12-10 18:11:56,0,不为工作不会看
发芽逗,看过,还行,2020-02-03 13:03:55,0,昨天看了生魂和囧妈，竟然是生魂好看。至少有故事性，有跌宕和起伏。演技也还行，不尬。画面看着挺舒服的。
Star.,看过,较差,2019-11-25 11:28:31,0,well
–负几厘米的爱,看过,较差,2019-12-28 11:18:03,0,其实吧不算差，只是故事套路感太明显，而且这种故事可以看到原作的影子，说着食之无味，弃之可惜，而且用情怀用热度有些可怕，这剧火了不代表出什么都会被待见，之所以会火，靠的是两个流量的糖，重点在人，辅助在于好文，然后是时机和运气，再是营销……
联邦议长,看过,推荐,2019-11-18 16:16:55,0,建议二倍速 1:07-1:08 那是路老师出来了吗 对于广播剧番外来说可以给4星 陈情令有点不完整影响观感
祈愿,看过,很差,2019-12-28 08:08:37,1,既然披着陈情令番外的皮人设就不能ooc，要么就不要叫这个名自成一体也没什么。总之太失望了
昨夜的风,看过,推荐,2019-11-16 16:07:52,1,无意看到这个剧，感觉挺不错就去看了电视剧陈情令
如若,看过,还行,2019-11-15 00:25:55,0,有点小剧情反转！
墨鱼罐头,看过,较差,2019-11-30 16:39:37,0,呵呵。
Eric,看过,还行,2019-11-09 18:11:16,0,还行
嘛哩嘛哩呗呗塔,看过,较差,2019-11-18 14:52:02,1,1h23m爱奇艺，跟陈情令其实没什么太大关系，只有温宁和蓝思追是原来的两个人，其他人都是不认识的，故事也并不好看。
麦子,看过,较差,2019-11-11 08:45:58,0,还能看，演绎制作还算有诚意
米果,看过,力荐,2019-11-18 10:22:02,2,整体制作上真的已经算好的了～不要一上来就瞎喷，是可看的
华华,看过,较差,2020-03-07 20:55:22,0,只能用烂来形容了吧
teekee,看过,还行,2019-11-12 04:44:54,2,特效有进步，但温宁是不是太聪明了
哔-,看过,较差,2019-11-18 08:35:40,0,尴尬
ck,看过,还行,2019-11-09 20:07:35,0,如果名字只叫生魂会更好一些 为什么我觉得每一个角色的故事都好让人心疼呀
青岚之末,看过,较差,2019-11-24 18:24:29,0,希望同系列番外作品不要随意改动人设和时间线
夢,看过,较差,2020-01-05 19:35:50,0,温宁和蓝思追的单独探险 家仆爱上大小姐求而不得怒杀主人全家将大小姐男票制成傀儡 却还给来探险的二人编了一个故事 故事里他是大小姐的弟弟 男票是个偷学邪术的坏人 最后在男票被杀之后福尔摩温宁 发现故事有诈揭露阴谋
lingna,看过,很差,2019-11-09 13:44:29,1,太不好看了吧 跟陈情令的质量落差也太大了 从剧本到画面到立意 都没法相提并论 只有无羁音乐响起和路之行声音响起的时候 稍微激动了一下下 一颗星给这个画面
五六,看过,较差,2019-11-19 20:16:31,0,竟然是鬼将军番外 喜欢温宁这个人物
vradica,看过,还行,2019-12-19 14:35:06,2,前面还行，后面……一言难尽
hellogo,看过,还行,2020-03-07 19:30:58,0,剧情挺老套的
苹果熟烂了,看过,还行,2019-12-27 19:39:12,0,不要叫叔叔！要叫前辈！！叔叔显老！。。。。。可可爱爱的温宁终于不傻了。
南舒,看过,2019-11-08 22:40:41, ,0,什么鬼
山海外传,看过,还行,2019-11-27 09:16:45,1,作为一个番外，除了吃老本以外，并没有什么新奇的东西。当然，有些台词还是值得回味的。比如温宁心魔的那段，魏无羡所说的那一段话（我忘记了）
过客匆匆502,看过,很差,2020-02-15 21:18:47,0,垃圾 难看
卡瓦利耶,看过,较差,2020-03-01 10:17:56,0,拍什么无聊又难看的番外？
卡啦卡洛,看过,还行,2019-11-10 08:01:51,1,就是突然间天使宁正经了，不习惯。
误入歧途的青年,看过,较差,2019-11-22 13:23:37,0,虽是番外篇，剧情有点不够啊
末,看过,2019-11-08 18:46:29, ,0,好像看了某电视剧的其中一集，这也能算是电影？
珞珈梧桐,看过,较差,2019-11-08 21:53:25,1,也不知道自己看了什么....
(●—●),看过,较差,2019-12-30 17:43:54,0,温宁不是温宁，思追还是思追
慕白,看过,很差,2019-11-18 09:05:05,1,就这一个破ip，准备压榨到啥时候？非得到人人喊打的时候吗？过街老鼠，恶心的不行
Be a laity,看过,较差,2019-11-09 12:17:10,0,比一些恐怖片好看
你不认识慌哥？,看过,较差,2019-11-25 22:31:31,0,妈耶，演技最佳片头小女孩。我觉得特效还可
zzzzlalalla,看过,较差,2019-12-01 14:05:21,0,我尽力了对8⃣️起，这个反转也是很生硬，但是思追还是很可爱哈
恋.闲,看过,较差,2020-01-12 02:35:05,0,没有主演的陈情令！
珍稀宇,看过,较差,2019-11-23 08:02:37,1,没有肖战的陈情令不是陈情令
KID箫瑶君子,看过,较差,2020-03-03 00:56:09,1,额，这个剧情。。
