用户,是否看过,评分,评论时间,有用数,评论
a夏天的星星,看过,较差,2019-11-16 14:34:33,0,我想看的是《香炉》番外篇
纵,看过,较差,2019-11-12 22:26:30,0,为了凑剧情时长硬是扯到了一个多小时
JRL雾原仁,看过,很差,2020-01-11 23:20:35,0,别再消费魔道了
Lokihyh,看过,很差,2019-12-08 16:32:43,1,晕了，也太无聊了，开头把爷吓死了
芥末好呛,看过,较差,2019-11-09 13:08:58,1,就一开始有点看头。阿姐被烧了三次，hhhh，还烧了那么久的那种。鬼将军从呆呆的样子变成一幅很机智的样子，有点感觉不是他了。最后还暴走出了日漫风。坏人伪装的也都很假，还有很多说不通的，跟着热度蹭，就这样吧。。。
YoShIrLeY,看过,还行,2019-11-09 22:36:10,1,就这么一直拍下去吧，陈情永远不要结束。
肚子饿不是病,看过,还行,2019-11-09 21:22:30,0,真的是情怀分。。。哈哈哈
人生若只如初见,看过,还行,2019-11-09 00:04:48,1,其实，说实话，剧情方面真的还不错，但是整体的质感差了一些。
蜗牛,看过,很差,2019-11-07 22:26:18,0,穗禾的演技怎么这么尬，可怕
糖泥小宝,看过,很差,2019-11-18 14:40:34,1,吗的笑死我了哈哈哈哈哈女主重复烧三次，决斗BGM是日系动画片，笑疯了
烟灰黯然跌落,看过,很差,2019-12-21 21:42:26,1,吐啦什么烂片
Miss.潘达,看过,较差,2019-11-13 22:12:15,1,羡羡的背影救了这个电影
Violet,看过,较差,2019-11-11 17:26:18,0,还以为能看到肖战
兔兔,看过,还行,2019-11-07 23:48:49,0,剧情过于单薄，好在演员表现不错，新人还有很大空间…有一些很戳心的点看过陈情令就能秒get，比如我年纪也不大、捂领口、我说的、还有惩罚反派的方式… 永生不死，到底是幸还是不幸…
εїз毒蘑菇εїз,看过,还行,2019-11-20 22:22:14,1,2019.11.17-20 爱奇艺会员
Toro,看过,较差,2019-11-11 11:49:16,1,对不起我后悔了，两星给我羡羡的背影，其余一切差评
唯有奋斗,看过,较差,2019-11-15 22:06:53,0,问世间情是何物
刘流,看过,还行,2020-01-28 16:17:15,0,唉，剧情还是可以的，但是，唉。
栾小肉,看过,很差,2019-12-21 01:54:38,0,说好的后会无期呢！？今天出个大电影！明天贴金林海老师出专辑的！后儿个又来个团综少年听学！紧接着又要出超长剪辑陈情令！这可真是活脱的一出又当又立戏码！
Phoenix5146,看过,很差,2019-11-08 07:53:34,3,没有忘羡的陈情令 不是陈情令 没有了魂
入看無,看过,较差,2020-02-15 16:02:20,0,？
K.Z,看过,较差,2019-11-17 13:48:45,0,作为剧场版还凑合
三皮虎,看过,很差,2019-11-14 20:56:56,0,没有看过 这个电视剧  但单从电影来说 这个逻辑与叙事前后实在有太大的问题了  能看这样的电影是需要勇气的…
jollyrainy,看过,还行,2020-02-21 13:32:58,0,还行吧，但是前半部像鬼片后半部跟个圣斗士星矢一样的感觉是个什么鬼。思追还是那个思追，温宁突然智商飙升太不习惯了。羡羡背影出镜算小惊喜了，路老师的声音真是声入人心啊！
逆行千里又何妨,看过,较差,2019-11-08 14:48:23,0,中规中矩的网络电影  有优点有缺点  优点 服化道不错 演技在线 剧情完整 缺点  故事套路 没有亮点  最后加上粉丝和淑芬滤镜  让本人感动的只有这几句台词  思追:宁叔叔，吧啦吧啦....  温宁:叫前辈。魏无羡的话，你不是傀儡，活出自我，不要妄自菲薄。结尾，温宁：受诅咒的不是阴铁，是人的私心和欲望。思追：这也是魏前辈说的？温宁:不，我说的。表现了温宁的成长，让人看到了温宁终于担得上前辈一词。思追和温宁的互动就是我的笑点和感动点。其他角色演技在线，妆画的好 开头小女孩和萧情长得好看。姐弟俩名字让我想到萧忆情，有点出戏，其他没啥亮点了。
风客云心,看过,较差,2019-11-08 21:49:23,1,这剧情反转的也是非常老套了，中规中矩吧。被火烧了捂耳朵也是很舞蹈的操作了
阿蓝,看过,还行,2020-01-22 22:36:37,1,哈哈哈哈哈
清羽,看过,很差,2019-11-07 18:45:46,1,emmmm跟正文也没什么关系 有必要非挂着陈情令的名号嘛
C.,看过,很差,2020-02-15 23:43:37,0,烂的突破我认识了
mr.gin,看过,较差,2019-11-21 22:17:27,2,可怕……是导演的问题吗？温宁不是陈情令的温宁，思追也不是原来那个思追了。一切都尴尬得可怕。全程唯一值得看的是替身演的魏婴背影你敢相信?
無靈魂游走,看过,很差,2019-11-30 20:37:31,1,在我心里这不叫番外，原著作者写出来的那些才叫番外！这只不过是导演自己编的同人而已。所以我不喜欢。我喜欢那些按原著拍的电视剧。就像陈情令！
Lemon酱,看过,力荐,2020-01-22 17:54:19,1,敢情演萧情这个是香蜜里的穗禾啊……
已注销,看过,较差,2019-12-23 12:14:05,1,这不是翻版薛洋的故事吗…有这个时间能不能好好拍一下义城，打戏和特效倒是比电视剧好了不少
木尧舟,看过,较差,2019-11-16 22:52:41,0,网大水平，跟忘羡没有关系。
belongtol,看过,很差,2019-11-13 22:41:51,1,什么玩意…人物性格都变了…
陌晓寒。,看过,较差,2019-12-15 14:34:16,1,跟原剧差距太大🙃🙃🙃
M君,看过,很差,2019-11-08 10:45:20,2,浪费时间之作
中二老少女,看过,还行,2019-11-10 21:32:14,0,基本上听完了整部片子，网络电影，只是挂了个陈情令的番外而已，打发时间吧。
赵王,看过,还行,2019-11-09 22:57:36,0,马马虎虎吧
Smile许小仙,看过,较差,2019-11-10 23:43:00,0,温宁的感觉不太像了，最后变身配上背景音乐像是数码宝贝超级进化🧬
毛桑多多,看过,力荐,2020-02-11 19:24:30,1,我觉得还挺好看的呀？！
朗尼先生,看过,较差,2020-01-02 23:25:59,0,没有看过小说，真的不能理解电影在拍些什么东西。
莹小宝,看过,很差,2020-01-22 23:38:29,1,没有忘羡的也配叫陈情令？！呵呵
壹半叁,看过,推荐,2019-11-08 09:39:39,16,"特效不错，剧情进度太快了，部分演员演技有点尴尬。
片尾曲和羡羡背影，一本正经的鬼将军和思追，共四分。"
bubu,看过,还行,2019-11-15 01:42:34,1,果然，没有原著的加持，故事不精彩。而且温宁变化有点大，说好的小天使呢。如果说跟《魔道祖师》和《陈情令》没关系，还是可以看看的，那个周子殊的气场好夷陵老祖。
桃子🍑,看过,较差,2019-11-08 20:27:34,1,给陈情令思追和温宁的两星 不知所云
天小翼TZ,看过,较差,2019-11-15 10:57:58,1,也是醉了，温宁思追化身侦探么。看完跟没看一样。。。所以不要挂上陈情令的名字，好么！！！
花瑟,看过,很差,2020-01-31 18:22:50,0,什么玩意喜欢看鬼片 自绝于人类好吗
D普拉丝,看过,较差,2019-11-12 19:39:11,0,我的温宁小可爱被改编成什么样了！幸好思追还是那个思追…全片走的就是和网大的套路，谜题探案解谜破案，最后发现全是自己救的那个人做的…呵，套个魔道的壳子也掩盖不了你是一破网大的事实
Leann,看过,较差,2020-02-07 20:26:15,0,思追儿好可爱，但是温宁就和陈情令上的不是一个设定，看起来好奇怪
大巴叔叔,看过,很差,2019-11-26 16:02:44,1,？？？？特效分点给正片就好了
一代,看过,还行,2019-11-07 23:32:36,0,前面一点点画面有点吓到宝宝～
