用户,是否看过,评分,评论时间,有用数,评论
楚翰彻,看过,还行,2019-11-15 21:43:59,1,剧作的智商水平大概一直处于小鸡电影的氛围里，但似乎班克斯的本意也正是如此，除了开头一场达到常规水平的追车战斗之外，动作和谍战元素基本都是过场戏，繁复的正邪反转也只是照本宣科。不过当整部电影不断用自我调侃消解这种不思进取时，看起来是真得很欢乐......
Devlali Number,看过,还行,2019-11-15 12:34:46,0,"这片子我连预告都没完整看完一遍，0期待，虽然搞出一吨反转还是没有逃出过时特工电影的路数（这剧本年代感跟《双子杀手》差不多），但娱乐性还算说得过去，本情怀狗看到彩蛋都给到了也算满意。主要是，还有小K这颜值在这儿撑着啊！

就是疯狂砸时尚感的配乐该用的时候出现，不该用的时候也在拗存在感，任务失败狼狈转移，居然还要按照主任务转场的拍法搞，就很奇怪，一看又是一个主题先行的冗余设计。老反派到最后还真就得来一句莫名其妙的“战狼式问候”，不过相比黑凤凰那些个脑残处理，这部算不错了。

乔纳森·塔克可以啊，杀手里最欣赏这类人狠话不多的了，不知道是我错觉还是怎样，有人感觉这就是人类版T-1000吗？太神似了"
Yves的自信,看过,还行,2019-11-17 20:14:31,3,"好怀念克里斯汀·斯图尔特
在《白雪公主与猎人》时的“飘飘长发”，多美啊！"
陆喜乐天天学习,看过,较差,2020-03-03 15:37:06,0,无聊爽片，伦敦口音黑妹真好看啊，我要是实验室那个傻直男我肯定也和他一个反应。犯懒的时候就想想黑妹的身材 #太好看了#
pandora刀刀,看过,还行,2019-11-19 22:30:36,0,达到了爆米花电影的效果 够爽～查理的天使传承顺利 IP继续 KS可以 本色啊 A爆又百变 酷 压倒一片 行了 爽过
AZWayne,看过,还行,2019-11-21 12:06:08,2,里约热内卢，洛杉矶，汉堡，柏林，巴黎，伊斯坦布尔，环游世界追反派抓内奸的剧本今年在银幕上就看了好几遍了，只不过这次换成了女性。男性全部倒下，女性全部站着，才2019年我就有些厌倦女性电影了。
forfaen,看过,较差,2019-11-21 16:11:12,1,嚯，小K和Ella有点美啊，尤其是Ella
alpacalypse!,看过,还行,2019-11-16 15:10:53,1,打开ao3徐徐搜起姑娘们的ff
咸鱼曳尾于涂,看过,较差,2019-11-16 13:38:10,2,保持权力结构不变，只是将男女的性别角色调个个儿，恐怕并没比它那些为人诟病的早期版本离女性主义更近多少。不过也是，压根没有“人”只有工具的爆米花里，任何稍微有点意义的话题最多也就是卖的噱头吧……剧情生硬—尤其女博斯利中途跑路那段，台词尴尬，衣品没救……
心之所往,看过,较差,2020-02-15 19:16:13,0,"啊啊啊啊啊啊啊啊啊
埃拉小姐姐好好看啊
肤色身材性感又可爱我爱了
撩那个小哥的片段我最喜翻
剧情嘛 真的麻麻地"
道臣岚,看过,较差,2020-02-18 23:31:22,0,…倍速+快进…也太难看了我天…
Clefairy,看过,还行,2020-02-16 22:09:44,0,本来看到片头N连小女孩的镜头，感觉这片子能在现在的环境下好好讲讲平权，甚至有冲动要去看第二性。是我想多了。很一般的商业片。Kristen我以前还是很喜欢她的颜和腿的，现在几乎被硬拗的T人设劝退了。倒是英国长腿妹妹天生尤物，大巴扎里包着头发也阻挡不了她散发的迷人气息。茉莉公主不自觉噘起的嘴真的超想抽她两巴掌。导演阿姨尽力了，某些镜头下眼睛蓝得好看。←所以，最终能够表现、记住的还是只有女人的美貌。当然有总比没有好╮(╯▽╰)╭ 1.5倍速下的追车枪战场景不错~
Morning,看过,还行,2019-11-17 22:56:19,0,两星半，班克斯还是有一些通俗流行的触觉的，没有把电影拉入一个死气沉沉的境地，影片徘徊在“小时代”和“闺蜜”般的流光溢彩间，在尝试做出了另一种小妞电影的思路，新时代的女性认为不为家国和男人牺牲，是为了能够让更多的女性团结在一起，不过要当真正的天使，演员能力上必须比这三个都要更强。
~skyyy~,看过,还行,2020-02-26 16:51:31,0,爆米花电影，内鬼的内鬼稍有反转，没啥深度。
一品,看过,较差,2020-02-15 15:41:39,0,完全记不住的脸庞，还有生硬的打斗。
奥斯卡最佳歌手,看过,很差,2020-02-22 21:06:04,0,简直就是对前作的极大不尊重，我完全找不出这部电影的亮点，除了长发的暮光女真的好好看啊，尤其最后那场派对造型，真是个朝气十足的美少女。整部电影里的梗也太难笑了，甚至有点垃圾，剧情的反转还有细节真的是太无脑了，感觉像个智障片。白瞎了霹雳娇娃这个IP
lostmore,看过,较差,2020-02-29 19:49:42,0,本来很期待的但很失望，故事低弱，选角失败，莫名其妙。女黑那么高以为是变装人，女3那么矮还在泥路穿高根鞋，女主一直在要酷。开头女主执行任务抓住一人，天使的老管理退休并离开。男管理和女2见面时被人袭击，在追车时被打下水死去，女2救下他，车自爆阻止了追他。原来新产品要发布但发现里面有bug容易引起产生中风死去，同时决定去公司找回几个产品，偷了公司的卡进去3人打扮一样去找发现早已经被人拿走，拿走的人是另一男员工。并一起去赛马发现杀手和男交易，在上方开枪打偏，骑马仍定位找到在采矿厂，与几人搏斗，但发现开始的抓的人并没有进监狱，而女助理这时离开被当成怀疑对象。在回来时屋里爆炸，被前男老板救下女2离开。原来他就是幕后指使并说工作这么多年没有油水并决定单干，将管理权限给他，最终屋子里面全是天使并他们团灭
光头,看过,较差,2020-02-29 09:37:07,0,这其实就是一部二流好莱影片，动作戏能看，几处反转生硬，综合一下就是害行，而它是由女导演执导的，平庸不分男女，此乃真正的男女平等~
剑气凌厉的江南,看过,还行,2019-11-16 22:42:08,0,"黑人妹子178居然是1996年的，貌似之前没啥作品，阿拉丁妹子完全还是迪士尼美国傻白甜的感觉十分出戏，暮光女自从成了t，嗯真是酷帅狂霸拽。。。可怜x教授居然是个反派最后还挨了一拳好惨。主题曲Don't Call Me Angel棒棒哒Ariana Grande,Miley CyrusandLana Del Rey"
左眼看电影,看过,还行,2020-02-18 12:18:32,0,女导演真喜欢给自己加戏
19431818,看过,还行,2019-11-16 18:03:55,1,没想到居然是班克斯自己编导参与演出的！难怪这个剧情走向哈哈哈！开头其实挺不错的，又飒又美，音乐也带劲，可惜很快就泄力了，就从茉莉公主出场开始的吧，虽然各种肤色各种性格都涵盖了，这部的女性主义（就连查理都与时俱进为女士了）我也买单，但故事真的乱七八糟到一塌糊涂，一起看的基友完全不买帐一直嚷嚷着烂片烂片哈哈哈
安大帅,看过,推荐,2020-02-15 11:18:26,0,我才不管剧情怎么怎么样，Kris美就够了，我爱你我爱你我爱你~~~最后一段天使聚集、男士倒地的场景倒还过瘾，每位女士都是天使。
水帘洞一姐,看过,还行,2020-03-02 22:48:01,0,漂亮长腿小姐姐打人还是很有观赏性的。
素人冯,看过,还行,2020-02-16 14:22:02,0,哈哈感觉挺烂
